"really love this cream , it really works. After using this cream over 3 weeks ,I can say that this cream is the best thing happened to me in 2016 ,I do noticed a difference in my skin look ,the fine lines is much better than before,my face look brighter &healthy than ever ,I love it . (This review was collected as part of a promotion.)"
"I work as a welder so I work in very harsh conditions and I'm exposed to a lot of UV, so I was very excited to try this product. I'm also about to turn 36 and would like to get a jump on the skin care regimen to avoid wrinkles. I really like the Olay total effect moisturizer. It is thick and rich and creamy. It took a while to learn not to pump too much out, but that's really the only downside. I haven't noticed more youthful skin, but I definitely feel protected with the SPF 30 (This review was collected as part of a promotion.)"
"I found that this cream felt a little heavier in comparison to the Olay total effects without sunscreen(which I have tried before). This cream smells like unscented sunscreen to me, nothing overpowering, and the scent dissipates quickly. I was a little worried that it may make my skin greasy over the day (especially during the summer months), but it seemed to absorb nicely. (This review was collected as part of a promotion.)"
"I think the cream really does deliver what it says it would. I have been using it for 3 weeks, twice a day, and I can definitely see a different. My skin is tighter and my face more luminous. The pores are also less visible. It is a rich cream so not a lot is needed and so lasts for a pretty long time I would say. It also has a pleasant smell and feels luxurious. The packaging is appealing and the cream is easy to ""access"". I would definitely recommend it. (This review was collected as part of a promotion.)"
"I absolutely love this moisturizer! It leaves my skin feeling healthier and softer, without the greasy feeling you get from some moisturizers. Its easy to apply and blends in smoothly. I will definitely keep using this! (This review was collected as part of a promotion.)"
"So after using this cream for awhile now I've learnt a few things, it is a very moisturizing cream but a very heavy cream. So I found this cream is more of a night cream for me I found it a bit heavy for day time wearing. I did notice that it has made my skin look more alive though so that's a super big bonus! I will keep using this cream at night because it does make my skin feel fantastic after my morning face wash! (This review was collected as part of a promotion.)"
I was so amazed by how much hydration this Olay Total Effects Anti-Aging Moisturizer with SPF 30 has! I live in the ever so lovely dry area Canada and this has helped my skin tremendously. I love how high of an SPF it has so even when the sun will reflect off the snow in the winter I'll know I'm protected. It does go on a bit thick because of the SPF but I love it! Thanks Olay for making such a great product! (This review was collected as part of a promotion.)
"Hard to say if the Olay anti-aging is working. What I can say is that the feel of the crream is good, it do not stay greasy. The smell is another thing. There is no good perfume, the product only smell like sun screen. (This review was collected as part of a promotion.)"
"I received this product free of charge in exchange for my honest review. I was very excited to try the product. As it has a lot of great reviews and benefits. Unfortunately, it's too rich for my liking. It left my skin with shiny film and I didnt like how greasy my skin felt. It would definitely work better for someone with very dry skin or more mature skin. I will pass it to my mom and will see how she finds it. I'm little over 30 and didn't find this product to be suitable for me. (This review was collected as part of a promotion.)"
I tried a sample of the total effects that I used at night and I loved it! At that time I was thinking if they had it with SPF! now my dream came true! I love the texture when I put it on. and it smells good too! It made my skin look clearer and felt softer. I would definitely buy this when I'm finished with this bottle! (This review was collected as part of a promotion.)
"It took a moment to get used to, but I love this product. I noticed my skin looks better, it is protected, and my makeup stays on perfectly. This is anti-aging and protects from the sun. This product is a must have. I will be purchasing in the future. (This review was collected as part of a promotion.)"
"I'm a big Olay fan so when I tried the Total Effects Anti-Aging Moisturizer with SPF30, I was hugely let down. It was really thick going on and had a stickiness to it as though I was applying straight sunscreen to my skin. After it's absorbed into the skin, it feels fine, but the application process made me want to go back to my normal Olay moisturizer. I'll be passing this one by on my next shopping trip. (This review was collected as part of a promotion.)"
I wanted to try this product for a while before i commented and it was worth it !!! Received great comments asking what product i was using as my face seemed radiant ! When i told them that i was using Olay Total Effects Anti-Aging Moisturizer and it even had an SPF30 they were impressed and said they were going to try it !! My skin looks great and i don't need to worry about applying sunscreen to my face which is a great thing when you are a busy mom ! (This review was collected as part of a promotion.)
This little bottle will surely last awhile if you don't use the full pump. I found that less is best. First try o used a full pump of the product- skin felt greasy and face was shiny. Second use I used only half a pump and it worked better on my face and neck. Blended in perfectly. Love the fact that sunscreen is in the product. Will definetly purchase in the future. (This review was collected as part of a promotion.)
"I am super happy with this product - it smells great, it's easy to use and it doesn't clog my pores! Perfect addition to a skin care routine (and great base underneath makeup!). I would definitely recommend to others (This review was collected as part of a promotion.)"
"I received this product for free to give my honest opinion. I liked how it felt, it's awesome that there's SPF30 in it. I'm terrible to remember sunscreen. I'm a bit young still to use anti aging, but it was nice feeling to it. (This review was collected as part of a promotion.)"
"I loved that this moisturizer had a great scent and didn't leave my face greasy or shiny like other moisturizers. It didn't even feel like sunscreen and it was really refreshing and hydrating. I didn't notice a change with the fine lines or dark marks on my face that I had anticipated, or any aid on the circles under my eyes but the sunscreen aspect has been more pleasurable than other sunscreens directed for the face. (This review was collected as part of a promotion.)"
"I like how lightweight the product feels on my face. It is an effective moisturizer. I received the product and used it over the summer. It moisturizes my face, and doesn't make it oily. The bottle is also very light and I'm able to pack it in my bag to bring on-the-go. (This review was collected as part of a promotion.)"
"I think this product is great. It left my skin feeling amazing, went on easily and was light. I really liked how it has spf 30 and was nice knowing that I was protected from the sun with my morning routine. The bottle itself is easy to use and I like that it is a pump to get the product versus others that you use your fingers to get it out which can be unhealthy. (This review was collected as part of a promotion.)"
I live this product! I use it every day in the morning and before bed with my face cleansing routine. I have always been a fan of the Olay brand and I find this cream works extremely well. It's light scented and the cream is not heavy not does it clog my pores. I find it keeps my skin looking fresh and lively all day long. I haven't noticed any major wrinkle improvements but I do notice a subtle tightening around the eyes and cheeks. I would definitely recommend this (This review was collected as part of a promotion.)
"I have been using the Olay Total Effects Anti-Aging Moisturizer for a few weeks now. I really love it on my neck/decolletage area. It seemed to be just the right amount of richness. However, when I use it on my face, it makes my skin break out with pimples. I think it is just too rich for my face skin as I tend to be acne prone. (This review was collected as part of a promotion.)"
I usually use an expensive brand of moisturizer that does not have SPF in it. I never would have thought about trying a drug store brand well boy was I wrong! Within days of using the Olay Total Effects Anti Aging Moisturizer my skin felt smoother and was WAY more hydrated and the added SPF you can't go wrong! This high end brand loyal customer is no longer! (This review was collected as part of a promotion.)
It's a great moisturizer. I can see many trips to the beauty section of the drugstore as the size is a bit small for using daily. I have noticed a radiant look to my skin. On my face Aswell as my hands. Definitely a pleasing product. (This review was collected as part of a promotion.)
"I feel as a moisturizer it does a very good job. My skin feels rejuvenated and smooth after a week of using it. I don't feel it necessary though to have the spf in it as I usually moisturize overnight. To use during the day, I find it makes my skin very shiny. I usually wear liquid foundation and that would not work over the moisturizer. But strictly as a moisturizer I am more than happy with it. (This review was collected as part of a promotion.)"
My skin looks and feels younger ever since using this cream. I'm protecting my skin from the sun while reducing the fine lines. I wish I knew how much more improved my skin would be years ago so I wouldn't have to try and work harder to reduce the fine lines. (This review was collected as part of a promotion.)
"This product is great for aging skin! My skin has never felt softer or looked younger! I was so afraid to try this sample because I often have allergic reactions, but nothing yet and I've been using the product daily for 2 weeks now! I love it and will replace my current moisturizer with this one! for sure!!! The rich thick texture is deceiving! It spreads on thin and light and does not feel greasy at all! (This review was collected as part of a promotion.)"
"I would recommend the Olay Total Effects Anti-Aging Moisturizer with Sunscreen to those looking for a moisturizer with great protection. It makes your skin feel refreshed and protected and although the cream is a little thicker than some I have tried, I must say I was very impressed overall. (This review was collected as part of a promotion.)"
I think this anti aging moisturizer is amazing. I feel so young when wearing this. It is easy to smooth over and feels amazing. I have been using this for over a week and can feel and see i huge difference. My foundation glides on over it and makes the morning get ready for work faster. ! #bzzagent #gotitfree (This review was collected as part of a promotion.)
"This creme has a thicker consistency. Nicely scented, not too strong. It absorbs well into the skin even though it is thicker consistency. Noticed my face is appearing brighter since I have started using it. Good quality product. #igotitfree thanks to Bzzagent and olay for the chance to try out new products!! (This review was collected as part of a promotion.)"
"Excellent product, I felt the effects from the first week and my surroundings made me noticed that I look younger. The product is easy to apply and quickly absorbed and well moisturizes the skin without leaving a heavy or oily feeling. As SPF 30, I could protect my skin from the effects of the sun this summer. I have sensitive skin so it is very important to me. (This review was collected as part of a promotion.)"
"I love Olay, tried tested and true! Olay never lets me down....this really works wonderful. I had a few age spots starting on my cheek and after less than a week of using Olay they are 90% gone. It moisturizes my skin well with a nice scent too. No greasiness or clumping! (This review was collected as part of a promotion.)"
"It feels good on my skin and I love the scent. The SPF 30 protection is a must for me as I have fair skin and need to have sun protection every day. I see a difference in my skin, it looks smoother. (This review was collected as part of a promotion.)"
"After using this product I can see that the little lines by my eyes have been reduced a great deal and people have noticed the fine lines on my forehead are reduced as well. its easy to use and easy to find in store , with a fair price. It has not scent i find and its light weight. (This review was collected as part of a promotion.)"
"I like that the moisturizer has SPF in it and it's not awful, I just don't think it's the right product for me. It leaves my face really greasy and I don't like the smell. I think it would be a great product for someone with normal skin but because my skin is oily, it's not a product that I would buy. (This review was collected as part of a promotion.)"
"I love how light this product goes on. I normally don't like skin cream because it is too cakey. This goes on smooth and absorbs nicely. The scent is nice as well. It is so nice to have sun protection as that is very important to me. My skin feels softer, and is better looking than it has been in a long time! (This review was collected as part of a promotion.)"
"I am a little sceptical about Anti-Aging lotions. I do love Olay products and this one is no different. The lotion is thick so a little goes a long way. As a moisturizer I thought it worked very well. My skin was left feeling soft and smooth after each use. A couple times I did use a little too much and my skin looked a little greasy, but that was because of the user not the cream. I would definitely recommend this product for anyone looking for a moisturizer. (This review was collected as part of a promotion.)"
"This is a great cream. It rubs into my skin easily, has SPF30 and makes my dry skin feel so soft. I am really happy with it. At 25, my skin hasn't shown signs of aging yet but I am hoping this moisturizer helps prevent any! I have recommended it to many others already. It is a great product. (This review was collected as part of a promotion.)"
"I can't say this product is a 5 because all the characteristics aren't met when it comes to my skin. I am lucky enough to not have any wrinkles that could use some fortifying so I can't judge that aspect of the product. However, this product makes my skin so soft & smooth! It also worked wonders at protecting me from getting a facial sunburn even while in the sun for a full weekend! This product also has such a nice light scent! (This review was collected as part of a promotion.)"
"I have been using this moisturizer for a couple weeks and am quite impressed. At first I didn't know if I would like it, it seems a bit thicker than moisturizers I'm use to, however it runs in very Easily and doesn't leave my skin to oily. I also like that it is 30spf, which worked out great with the sunshine we had been having. Overall I do feel like my skin seems more refreshed. I have already recommended to my mom and friends as a great everyday moisturizer. (This review was collected as part of a promotion.)"
I have so many skin allergies so I was really hesitant to try something new on my face. But....5 days in and nothing! No itchiness! No hives! No pimples! Wow! And the bonus....??? My skin feels so soft and the wrinkles are minimized! I will keep using...but so far I'm loving this product!!! (This review was collected as part of a promotion.)
I love this product!! i have skin that's prone to breakouts when i use moisturizers and I've always stuck with the same one. this might be my new fave. i have to give it a little more time to absorb before i use foundation but i think it's worth it. The SPF is an added bonus as my current moisturizer has no SPF in it. the texture takes a little getting used to but overall 5 stars. (This review was collected as part of a promotion.)
I love this product it works wonders for me make my morning easy and fast this product help me because i only have one thing to do in the morning i love it because i only need one product instead of two products (This review was collected as part of a promotion.)
I love this so far how it feels on my skin already starting to see the difference in my lines by my eyes I will continue to buy this when I done And reviving it free to try out even better thank u buzz agent !! (This review was collected as part of a promotion.)
I love that this has a SPF of 30. I often find it had to find a good one that is over 15. I loved that it is not greasy and smelly great. I like the pump but find it hard to know when you are running out until you are out. I received the product as part of a promotion from the brand but would buy again and recommend it to a friend. (This review was collected as part of a promotion.)
"I have been using Olay Total Effects Anti-Aging Moisturizer, SPF30 for a couple of weeks now and I love the way my skin feels. It has a very nice texture that absorbs quickly into my skin and leaves me feeling so soft! I also love that it is SPF30. Most creams I have used were only SPF15 and I really like having the extra protection from the sun. (This review was collected as part of a promotion.)"
After using Olay Regenerist Multi Sculpting Cream SPF 30 for two weeks I have now started to see a difference in my skin tone. It looks more even toned and healthier. I'm happy with the results so far and will continue to use the cream with the hope of even better results with time. (This review was collected as part of a promotion.)
"Thanks to Olay and Bzz Agent, I received a full sample of the Olay Total Effects Anti-Aging Moisturizer, SPF30. The Olay Total Effects 7 in one anti-aging moisturizer smells great and leaves my skin silky soft! And it has sunscreen in it so 2 steps in 1 is fantastic and time saving! Love how it makes my skin feel! You will not be disappointed - a must try! (This review was collected as part of a promotion.)"
"I don't use a lot of products on my face because of sensitive skin and, let's face it, an extreme aversion to all thing goopy and greasy. I hate wearing sunscreen. When I first saw the bottle i immediately assumed it would be a thick, pasty texture. I was so excited to find a white, light lotion! For some reason I was expecting it to be tinted; it was not. It was the perfect solution to moisturize and protect in one step before a long walk today. (This review was collected as part of a promotion.)"
I love this product!! It makes my complexion soft and I have noticed a big difference in my wrinkles fading. I have to amid I was kind of sceptical at the beginning because you all the time about company saying that it will diminish the look of your wrinkles but unbelievably it does. It has made my skin softer in a lot brighter. (This review was collected as part of a promotion.)
Turning 40 I noticed a few unwanted lines and general discoloration on my face.. Since being able to try Olay Total Effects my face feels and looks much younger.. It gives your face the protection from the harmful rays from the sun and really helps with earsing the fine lines. A must have for any women in 30s and older.. (This review was collected as part of a promotion.)
"I'm finding my face feel a bit greasy and when I've been sweating its been running into my eyes and stinging....I can't wear this when its hot outside which to me defeats the purpose as it has SPF in it. Don't know if I will purchase this one. #StrongIsBeautiful, @Pantene, #Ageless, @OlaySkin and #GotItFree (This review was collected as part of a promotion.)"
"I don't know how I feel about this product for its benefits with helping fine lines because I found the texture to be too thick and greasy for my skin. It caused me to break out and made my skin extremely greasy. I would recommend for people with dry skin, (This review was collected as part of a promotion.)"
"I've never been someone to use skin care products on my face. I wash with bar soap, and remove my makeup with my 2yo's wipes. But this moisturizer is great so far. It's a little thicker than I expected, but if you use a 1/2 pump you'll have plenty without wasting too much. I love that it's 30 SPF. I always remember the kids sunscreen but never my own so it's killing 2 birds with 1 stone. Thanks Olay! (This review was collected as part of a promotion.)"
I was so excited when I received this product to try. I have been using it every day since I got it and the results speak for themselves. My skin is noticeably younger looking and I love that it has spf in it. It goes on light and non greasy and leaves my skin soft and smooth. The price is very reasonable and I would highly recommend it to anyone. (This review was collected as part of a promotion.)
"So far, it's very light to aply. Wears well under my makeup and does not seem oily thought the day. And I have oily skin... so one up there! So far, it seams to start me off with a brighter completion and doesn't clog my poor like other moisturizers. (This review was collected as part of a promotion.)"
"This product has its pros and cons. I'm a huge fan for its pump applicatior, its uv protection, and that it helps fight against anti-aging. I've used it for about a week now. I've found that it is thick and greasy when applied and clogs my pores. I've seen slight reduction in fine lines, although I don't have much to begin with, mainly on the forehead. I will keep using and hope it works better. Would be better if there is a matte version. (This review was collected as part of a promotion.)"
"I tried out the Olay Total Effects Anti-Aging Moisturizer, it is great. Easy to apply and moisturizer my skin. It is not sticky like some other anti-aging cream so it doesn't cause break out. Note that I received free Olay Total Effects Anti-Aging Moisturizer to try out by Bzz Agent. (This review was collected as part of a promotion.)"
I wasn't crazy about the smell seems like it's very oily I can't use it much as well the smell I can't stand but also I broke out after using but I will say my face is very wired and I can only use some things on it (This review was collected as part of a promotion.)
"I've been using this amazing moisturizer every day for the past two weeks and my skin has been so happy! My skin is so soft and hydrated & the SPF30 means that I don't need to layer many products to get the sun protection I need. Big plus, smells so good and absorbs so well. (This review was collected as part of a promotion.)"
I loved this product! It's light and not oily however the coverage is incredible! My skin is significantly softer and visibly smoother looking! I will definitely be purchasing this as a regular product from now on! (This review was collected as part of a promotion.)
"I loved the pump, the scent of the product and the cream is thick and silky. I have to admit that the cream takes a long time to penetrate the skin so you can't apply your foundation afer. It also leave my skin oily. It would be a good cream to apply before bed but this way , fps 30 sunscreen is a waste. I guess it would be a nice product for someone with a really dry skin. If you have this skin problem, give it a try! (This review was collected as part of a promotion.)"
"Olay Total Effects Anti-Aging Moisturizer was great for keeping me protected during a weekend away in very hot sunny weather. But after a couple days of wearing the product I began to break out. This product goes on like a very thick sunscreen, quite oily. If you have a sensitivity to regular sunscreen then I would not recommend this product. (This review was collected as part of a promotion.)"
This Olay moisturizer is a must have for women 30 plus . It gives smooth finishes and protects from harmful sun rays leaving you beautiful and confident. I told my friends about it and they are trying it and loving it . (This review was collected as part of a promotion.)
I absolutely love this product. I've been using it for days and love the way it makes my face looks and feels. I have super sensitive skin and it is so hard to find a moisturizer my skin agrees with and this one work perfectly! (This review was collected as part of a promotion.)
"I have mostly been using this product in place of my normal day cream and it's a good product for those who have non-oily or ""normal"" skin type. As my regular day time moisturizer is a very light water based cream, this felt a bit too heavy for me. The texture and absorbance felt more like a sunscreen than a moisturizer for me. I only ended up using about half of one pump with each use as a full pump gave me too much cream. (This review was collected as part of a promotion.)"
"I am totally loving the Olay Total Effects Anti-Aging Moisturizer, SPF30. I have been searching all summer for a great moisturiser with sufficient SPF. I have finally found it. It keeps my skin feeling moisturised and radiant most of the day. I believe with continued use that it will make my skin altogether healthier. I now feel like i never have to worry again about sun damage on my face. (This review was collected as part of a promotion.)"
Such amazing products that really work well for me :) Ive always been a fan of olay and how it actually compliments my skin. I have no problems at all. And Pantene hairspray is very light to use and my hair loves it! (This review was collected as part of a promotion.)
