4.4,"['423', '146', '56', '25', '13']"
"I recently underwent open heart surgery. I am allergic to adhesive. The barrier had adhesive on it. My neck was dry ""alligator skin "". Itchy, red and swollen. All I had to trust putting on my neck was Olay Total Effects. In two days time, the ""alligator skin "" was gone and the itching had stopped. I am so amazed that I will not have scarring on my neck. I have used this product for years and hard telling what might have happened. Thanks to you, I feel so much better."
"I have used Olay Total Effects for at least 20 years. I always choose one with sunscreen. I put it on my face, neck and down to my chest every morning. My husband says I should send you my picture. I only use eyeliner, rouge, and lipstick, never face make up. I am an R..N. And know that the sun can be our worst enemy. So, Olay Total Effects helps to keep my skin moist and prevents skin damage from the sun. It's been great for me. I will be 70 years old this month. I thank you for a great product."
"I have used olay products for 15 years and get complments on my skin and is often asked what do I use and I proudly reply ""everything. Olay""."
"This moisturizer is perfect for my aging skin. It is thick, creamy and has a SPF of 30!! I have been looking for a good quality but affordable day moisturizer with at least SPF 30, and Olay Total Effects is perfect! [This review was collected as part of a promotion.]"
I have been using this for prevention for a long time. It doesn't make me break out (I have awful chin hormonal acne) and gives your skin a glowing refreshed feeling! Try it!
Been trying to find an affordable light cream with sunblock that does not get me to break out. This really is a nice cream that leaves my skin without a thick sticky coat - instead a nice glow and no breakouts. I have not used it long enough to see any difference with actually repairing sun spots or wrinkles but will write an update once i know. So far thumbs up.
None [This review was collected as part of a promotion.]
My skin is very dry in the winter and wrinkles a lot without Olay 7 in 1. During the summer my skin is very oily but Olay doesn't make it worse. Yet at the same time it smooths out my skins texture.
I bought this because of the SPF 30 and thought this would be great to wear when I don't wear makeup outside but it smells strongly like suntan lotion. I would have been better off just using suntan lotion.
I use several Olay items and was excited to find a moisturizer with SPF 30. I have used it 2 times now and it seems to be very thick and is not a nice feeling on my face. I would not use this with makeup.
I love this moisturizer. It feels so good on my skin.
Great product for great price! Always buy at Walmart for the best price. I've used for over 15 years with wonderful results!
"I could not find the brand I had been using for years, and the woman at the store recommended this, I went ahead and bought it and oh my gosh! in a week I saw a change in my skin, my neck and decided I was going to stick with the product. Very pleased with it. [This review was collected as part of a promotion.]"
I like this product very much. Had never used it before but I like the feel of it on my skin.
This stuff burns and tingles when applied. Waisted twenty dollars
I love the fact that's it's not greasy . A little goes a long way.
I would recommend this to all men and women
I have not had any results as of yet. Too soon to rate.
"Very thick and heavy, don't really care for it, only good thing is the spf 30"
"I am impressed by the product; but, did get in my eye and stung terribly bad!"
I love using
great product will take years of your face
I fully enjoy this product it helps my face and gives me the moisture that I need.
Loved the way my skin felt using it. I need something for wrinkles on my neck and affordable I can't afford Olay right now.
"Not greasy, but very moisturizing - they've come a long way since the very thick cream my mom used to put on her face! Love this product."
I have been using this product for 2 years and it has amazingly toned my skin and made is soft and supple. Will continue to use olay..
I am very impressed of this product it does really works on my skin. My skin feels so soft and moisturize and I've seen improvement or changes of my skin. Thank you Olay for this great products and to Walmart for selling.
I have been using this product for over a month. Each day my skin feels soft and it so smooth. I will buy this product again. [This review was collected as part of a promotion.]
"Suffering really dry face due to weather and hard water. Tried multiple products for men specifically and they did not work. I decided to give this a try on the recommendation of my wife. It was wonderful. My face was no longer flaky and dry after one use. Plus after a couple days, I felt as if my skin looked brighter and as silly as it sounds, a bit younger, or at least more full of moisture. I would highly recommend this, and I am thinking of getting the night cream and go full in."
"So grateful that I tried this product. I have tried several others to help my skin get back to my youthful years, and this is doing it. My tone and texture of my skin is changing. This is a keeper. Thanks for the great skin care. [This review was collected as part of a promotion.]"
"I have oily skin and I'm outside a lot, especially since its summer, so I was super excited about the ""oil free"" and ""fast absorbing non-greasy formula"" statement on the box. The first day I used it, I noticed how instantly greasy it felt on my skin, but I wanted to remain optimistic. However, day 2 kinda sealed the deal about how much I don't like it: my skin is so greasy, it actually feels more oily (I've had it on for about 6 hours now and it feels like I just put it on)."
"Love this, a little goes a long way,has little to no scent,glides on smoothly and really improves the look of your skin almost instantly not greasy and is ok in high humidity doesn't feel like it clogs up your pores Has become the one I will use forever"
I have used Olay products for many years and they have always been at the cutting edge of new anti aging ingredients which I love.This moisturiser feels light but full cover and has 30spf which is amazing for year round base protection.I would buy this for a friend! [This review was collected as part of a promotion.]
"I'm a physician so I'm usually skeptical of all these skin care products and their claims (such as that something with a melon extract or some other stuff has some sort of magical anti-aging properties, etc.). This product actually works and made my skin look better than more expensive department-store skin creams. I like it because it doesn't feel heavy and it provides sun protection."
"I got my hopes up for this product because of the great reviews and the price. After first using the product it left a very greasy feeling on my face, almost like it was just siting on my skin. It left my face shiny with a gross feeling. I used it for 2 months before I got a new moisturizer. It did not even have a very nice scent, it was almost chalky smelling. It did however have a good spf that did keep my face from getting burnt"
I love this product and it's a go to for my daily routine. The price point works in my budget although I wish I could pay more for a larger bottle at a time. I'm a face addict so I go through about a bottle every 4-6 weeks. #contest #olayatwalmart @influenster
"I do like this product quite a bit. It's got nice smoothness to it, leaves my skin feeling hydrated and supple, however I feel that it has too much fragrance in it for my sensitive skin, and makes me a bit red and irritated. Would love a fragrance free option"
"Yes, I am surprised...it actually works. I like the fact that it soaks into my skin and doesn't feel greasy or sticky. Smells nice, not overpowering. Only used for a couple of weeks and can see improvement. [This review was collected as part of a promotion.]"
"The best moisturizer I have ever used! I used it about 4 years ago and stopped because they are way too expensive in my country, I have tried many along the way but finally I am back to Olay as my skin regimen and loving it. I love it because it evened out my skin and much more. started using it again 3 days ago and so far so good."
"I am really impressed with Olay's Total Effects 7 in One anti-aging moisturizer. I love the fact it has 30 SPF sunscreen it, yet it still goes on really light and doesn't feel sticky like Most SPF products do. I also think it's great that it helps combat the seven signs of ageing all in one little bottle. I think it's just perfect to take travelling as you can just carry the one item and have the benefits of seven!! I really can't wait to continue using it and see what the long-term results will be! (This review was collected as part of a promotion.)"
When I first received my Olay Total Effects Anti Aging Moisturizer I was cautiously optimistic. I have tried Olay products in the past that were very heavy on the scent. I was happy that this product was very light on the scent and didn't bother my sensitive skin. I used it faithfully every day and quite like it. It is a heavier than most moisturizers but I think that is based solely on the sunscreen additive. I am very happy with this product and would definitely purchase it in the future! (This review was collected as part of a promotion.)
"I really like this moisturizer. It feels great on my skin and it is non greasy. It smells okay too. I'm had a dry forehead this year, but I also have combination skin. It is nice to use a moisturizer that doesn't upset the balance and works to correct it. I'm not sure I have noticed any anti-aging effects, but I still love it as a moisturizer. (This review was collected as part of a promotion.)"
This product has little to no fragrance which is what I like. It is a medium to light consistency so it doesn't feel too heavy on my face. It also make my face feel smoother and look a little brighter. (This review was collected as part of a promotion.)
Olay is a well known name among family and friends. I was really happy and fortunate to be given the opportunity to try out Olay Total Effects SPF 30 moisturizer. My skin feels a lot brighter and firmer. I have been receiving a lot of compliments on how I don't look my age. Felling simply #Ageless using Olay Total Effects SPF 30 moisturizer. (This review was collected as part of a promotion.)
"I tried out the Olay Total Effects Anti-Aging Moisturizer with SPF30 and was pleased by the results. The lightweight cream didn't feel too heavy on my congestion-prone skin and was absorbed almost immediately. The added benefit of SPF30 is a nice bonus, and so I used this cream as a daycream. This moisturizer did reduce the redness I have across my cheeks. Gentle and effective. (This review was collected as part of a promotion.)"
"I think, look there is a million creams to choose from these days. Some of them have worked some of them have made me break out and done nothing. I didn't breakout from this skin cream and I actually did notice a difference after using it for a month my skin texture is smoother. I like the spf level of protection as well. #bzzagent (This review was collected as part of a promotion.)"
I was so excited to receive this Olay Anti-Aging Moisturizer. What female wouldn't be excited to receive beauty products? I am disappointed to say that I used this lotion for about 2 weeks and my face broke out in several small pimples. I took a break for about 2 weeks and then will try again. (This review was collected as part of a promotion.)
"Out of all the 7 benefits, the only one I can really vouch for is that it is very moisturizing which is great if you have dry skin, but I have naturally oily skin so it left me looking oily slick by the end of the day. Aside from that, it smells nice, feels great and offers a good amount of sun protection. Would be a lot better if they came out with a version for oily skinned ladies like myself. (This review was collected as part of a promotion.)"
I'm not really that old so showing signs of aging has not really begun for me yet so I can't really tell if this cream has stopped those effects. However I love that it has SPF in it and my face definitely needs a moisturizer and this doubles as a sunscreen so love that! (This review was collected as part of a promotion.)
"The cream is very thick, very similar to sunscreen (and smells like sunscreen too). It doesn't feel too oily after it drys on your skin though, which I like, since oily skin really annoys me. Since there is SPF 30 included, that makes it better since I'm the laziest when it comes to applying sunscreen. Two-in-one! (This review was collected as part of a promotion.)"
"I really like this anti aging moisturizer. It makes anti-aging easy. This is perfect for someone who is new to anti-- agining products. It does not make your skin greasy and it did not break me out. I like how this includes spf, but it is not the greatest to wear if you are taking pictures. (This review was collected as part of a promotion.)"
"The Olay Total Effects moisturizer with sunscreen was just as I expected, another quality Olay product. It is very similar to the original Olay day cream/moisturizer in texture. The scent is very light and with just 2 pumps, I've covered my whole face for the day. I was impressed that my skin didn't break out after use since I have oily skin and the sunscreen would make it more oily. It was a great base for makeup, powder, your regular routine. (This review was collected as part of a promotion.)"
Very good product and it compliments my skin. It has been my go to moisturizer and i never felt more soft on my face. It makes my skin glow and and pores not visible. It is a must try skin care product. Worth every penny (This review was collected as part of a promotion.)
"I think I've found my new facial moisturizer. Olay Total Effects Anti-Aging Moisturizer, SPF30 is everything I've been looking for in a moisturizer, then some. I typically have combination oily/dry skin and this moisturizer works well to look after both of my skin concerns. Goes on smooth and covers well. Does not leave my face feeling heavy or weighed down. Oil of Olay continues to be dependable. (This review was collected as part of a promotion.)"
I've used Olay products before and this one didn't disappoint. I LOVE a moisturiser with a good SPF and appreciate the 30 of this one. I find that often moisturisers over SPF15 can get a bit heavy and cause me to break out. This moisturiser did not cause any breakouts and did not irritate my sensitive skin in any other way. The only thing I would have preferred is if it were a bit more mattifying. (This review was collected as part of a promotion.)
"I think that my skin is rather sensitive as I had a reaction to this product the first time I used it. Moments after applying my face started to feel a burning sensation, and I had to wash it off. I would not recommend this product to any sensitive skinned people. (This review was collected as part of a promotion.)"
"The Olay Total Effects 7 in One Anti-Aging Moisturizer works great as a daytime moisturizer. It doubles up as sunscreen too - with SPF 30 added to this formula. It felt smooth and silky to apply and very light. I quite enjoy this product and will definitely use it. Overall, I recommend this! (This review was collected as part of a promotion.)"
"Still lovin the Total Effects Anti-aging moisturizer, bzzing with the girls at work, recommend it to both of them after telling them that I got it from Olay and Bzzagent for free to test out. Explained that I put it on in the morning before work, and that after its on, I don't have to worry about the damage the suns harmful rays will do to my face, and they have commented that the lines by my eyes have gotten much lighter. Definitely going to be one of my purchases (This review was collected as part of a promotion.)"
"This product kept my hair looking clean and styled after 23 hours of labour! If that isn't an endurance test, I don't know what is! Definitely recommend this to my friends. Doesn't make hair crunchy like other hair sprays, nor weigh it down. (This review was collected as part of a promotion.)"
I think that this product is pretty good. Left my skin feeling soft and fresh. I use is almost every day before I leave for work. It is thick but easy to spread and seems to apply evenly. It smells ok. And the container makes for great ease of access to the product. (This review was collected as part of a promotion.)
I really liked this moisturizer. It had a light sent that wasn't to strong. The cream itself did not feel heavy on my skin and did moisture my dry skin. I rearly liked how it was SPF 30 to protect my skin from the sun. I did not notice any anti-aging effects. It may take a bit longer and more uses then what I used. Overall I would recommend this product to anyone who needs ano anti aging moisturizer. (This review was collected as part of a promotion.)
"I've used Olay cream for years, but this is my first time trying total effects. The packaging is nice, it uses a pump, not too much comes out at once. I liked how my face felt moisturized all day. But, I found it felt quite heavy going on. I'm a fan of sunscreen in face creams but this one smells very strongly of sunscreen. Overall, it's a good cream for the price, but I'll stick to my current face cream. (This review was collected as part of a promotion.)"
I find this product is something that may help be preventative for lines and wrinkles if you keep using it. I currently don't have much to worry about now but it will eventually happen. I will keep using this moisturizer because it felt good on my skin and I feel like it keeps my skin properly moisturized. I can't speak for the anti aging effects but it is an overall good moisturizer. (This review was collected as part of a promotion.)
I have tested this product for 3 weeks and have seen a great improvement in my skin. Its smoother and no dry spots. One thing i dont like is it doesnt soak into my skin very fast.. So i put it on at night only. (This review was collected as part of a promotion.)
"I'm not much on beauty regiments and nightly rituals, but I have to say I am sold on Total Effects. I put it on in the morning after I brush my teeth and it gives me just the right amount of moisturizer without feeling heavy and oily. In the month since I started using it, it has definitely won me over. I have never had particularly bad skin, so I can't really see the difference, but I can definitely feel the difference. The one dry spot on my forehead is gone :) (This review was collected as part of a promotion.)"
"This product was great. As a fair skinned person, I always ensure I use a daily moisturizer with spf as part of my routine to protect my skin from the sun. I have previously used Olay Moisturizers and like the way they make my skin feel and the protection it provides. I would recommend this product for anyone looking to provide themselves with some sun safety everyday (This review was collected as part of a promotion.)"
"I received the opportunity to review a real gem of a product. For one week, I used Olay Total Effects 7 in One Anti-Aging Moisturizer with Sunscreen Broad Spectrum SPF 30 and the results are terrific. My usually combination skin has no dry patches, is softer and actually has a glow. The before and after photos are attached. (This review was collected as part of a promotion.)"
"I'm loving the Olay Total Effects Anti-Aging Moisturizer. It makes my skin feel hydrated and soft. I love that it has SPF 30 in it, as I hate having to put sunscreen and moisturizer on. It smells great and the consistency of the lotion isn't to thick, it goes on very smooth. I would buy this again. (This review was collected as part of a promotion.)"
I didn't like the texture of this face cream. I thought one pump was way to much and is very thick. It makes your face white if not blended in properly. I will continue to use it to see the end results. (This review was collected as part of a promotion.)
I love the Olay Total Effects anti aging moisturizer. I am mid 30's and was noticing some changed in my skin and thought i would try this product out through BZZZagent. I love the product and how it feels on my skin. It has now replaced my lotion routine and goes under my makeup. It also makes my face less dry and not too oily as the day goes on. (This review was collected as part of a promotion.)
"I would probably buy it again. Enjoyed this product a lot, but I wouldn't say it's the best out there. The smell is nice and the texture is great, not thick and not greasy. It does what it's supposed to do, but didn't wow me. I'll probably keep looking for something as well. (This review was collected as part of a promotion.)"
I tried the Olay cream and was sadly disappointed. I felt the cream was too heavy for my face and I did not like the way it felt.I like a light cream that glides on my face and I can just forget about.Sorry Olay fans;I wanted to wash this off within 15 min.I did like the 30 spf protection.I did encourage a few friends to try it.I did not notice any difference in my fine lines.I really wanted to promote this product but after using it I know it is not for me. (This review was collected as part of a promotion.)
"I have been using Olay total effects Anti-Aging moisturizer and sun screen and found it worked really well. It went on more like a sunscreen, heavy feeling would have liked it to feel more like a lotion but my face did not burn all summer which is great as I spend a great deal of time working outside. I liked how it was an Spf of 30, but did not notice a younger looking face. (This review was collected as part of a promotion.)"
I have noticed I have softer smoother skin. The SPF has kept my skin from receiving any more sun damage or burn. I have even noticed some of my wrinkles are softer and not as defined. I will definitely continue to use this product after my free sample bottle is gone! Great product (This review was collected as part of a promotion.)
I love this cream! Olays total effects is my go to after every shower or face wash. It makes my skin feel smooth and moisturizer. After only 4 weeks I'm very happy. Looking forward to feeling and seeing the results of continued use! (This review was collected as part of a promotion.)
I currently use total effects anti aging and absolutely love it. I was curious to try this because I would like to have some sun protection but the addition of the sunscreen seems to have made this cream a little too thick for me. Don't get me wrong it's still very fluffy and mousse-y but my face is very sensitive to creams so this didn't work for me. I have a dry face that gets pretty oily as the day goes. I'm going to stick to the total effects without sunscreen for now (This review was collected as part of a promotion.)
"The lotion glides on smooth and does not feel heavy, which is nice. I love that it has an SPF30! Unfortunately, applying foundation/cover up over top of the lotion results in some cakiness. My makeup sort of off the way an eraser crumbles. Odd. Overall it's a great moisturizer if you are not looking to wear makeup over top. (This review was collected as part of a promotion.)"
"This moisturizer is amazing! Not only does it go on smooth and non oily, my skin stays soft all day long. It takes very little product to cover and I love that it has sun protection at the same time. (This review was collected as part of a promotion.)"
"This product worked as well as I thought it would. Olay usually always puts out good products. And this one didn't disappoint. Leaves skin soft and smooth. Wrinkles start disappearing almost right away. Makes skin seem younger, lighter and brighter. You look refreshed. I will buy in the near future. (This review was collected as part of a promotion.)"
This is a great moisturizer. I found it to be really lightweight with a non-greasy feel to the touch. The sunscreen is an added bonus for sure. It made my skin feel really light and extremely soft. Would recommend it to anyone. (This review was collected as part of a promotion.)
"Initially the moisturizer is thick when applying, but it soaks in and my skin feels hydrated and healthy. I like that this little moisturizer works hard behind the scenes as a sunscreen, enhancing my skin brightness and minimizing the appearance of pores. My skin doesn't get greasy or oily or feel cakey, even after applying makeup over my moisturizer. Would recommend to a friend! (This review was collected as part of a promotion.)"
"I found this moisturizer to be perfect for my skin type. I have somewhat sensitive skin and need to use high quality products. It didn't leave any residue, left my skin soft and blemish free. It is a light moisturizer which is much better than those heavy ones that don't allow your skin to breath. I would definitely recommend this to my family and friends. (This review was collected as part of a promotion.)"
"I was really wanting to like this product, however I found it too heavy to be worn under makeup. Almost felt like it should be a night cream. It also made me massively breakout. I do appreciate the SPF 30, love the pump, and the instant glow it gave me upon application. (This review was collected as part of a promotion.)"
"4 out of 5 stars simply because one day while caught in the rain the moisterizer got in my eyes and it stung! Otherwise, great product. Leaves my skin feeling soft, and isn't so thick that it makes me breakout. Would definitely recommend! (This review was collected as part of a promotion.)"
