"I really like the Olay Total Effects Moisturizer, although I found it left a bit of an oily feeling on the skin... It had nice smell, and texture. the Olay Total Effects Moisturizer made my skin feel moisturized, for sure.... Just I found it left a small film of greasiness on my skin that I did not enjoy. (This review was collected as part of a promotion.)"
I couldn't wait to try this when I received it. It felt thick at first but didn't feel heavy on my face. Didn't leave my face feeling like I was wearing a mask like some lotions do. Smells great. However I unfortunately ended up having an allergic reaction to this product but if I didn't I would recommend it to my friends and family (This review was collected as part of a promotion.)
The Olay Total Effects Anti-Aging Moisturizer pumps out thick and creamy but rubs easily on the skin. It doesn't leave the skin oily or sticky which is so common with a lot of the other sunscreens. (This review was collected as part of a promotion.)
"I think this product is amazing. I only had to use one pump amount on my face after my morning shower and again before bed! I love the smell and the feel of my face after putting the product on, there is no greasy feeling after. I have very sensitive skin to other moisturizer's but this one will be added to my routine as i had no problems! (This review was collected as part of a promotion.)"
"I really enjoyed this trial I received. I had been searching for a quality moisterizer that also offered a spf protection. This formula is non greasy, light and has a fresh scent, This will be my go to face moisterizer! (This review was collected as part of a promotion.)"
"I am trying out the Olay total effects anti-aging moisturizer, I noticed a difference in my skin within the first few days! My skin seems very soft and supple to the touch, my skin tone is much more even and my wrinkles seem less viseable as well. I will tell you one thing though.......do not get this stuff in your eyes.....it burns like a bugger.....#MyOwnFault (This review was collected as part of a promotion.)"
"I loved this moisturizer. I have dry, sensitive skin and the Olay Total Effects with SPF 30 provided enough moisture for my dry skin and was mild enough to not irritate. To top it off it has spf 30! This will be my new daily moisturizer! (This review was collected as part of a promotion.)"
"Olay has been a favorite pf mine for many years but the Olay Anti-Aging Moisturizer with SPF 30 is my favorite! I wear it everyday especially in the summer and this will be by go to for soft, ageless skin. Someone even said to me after using it for a few days that she doesn't believe I have a 22 year old! Thanks Olay and BzzAgent! (This review was collected as part of a promotion.)"
I've used this product before. I was giving a smaller sample but this time around got bigger sample which I though was awesome. More days to try it out. Olay Total Effects Anti-Aging is great product makes my skin feel soft and protects me when I'm in the sun. I will continue using this product. (This review was collected as part of a promotion.)
As someone who doesn't use sunscreen or moisturizer my mother worries I will turn into an Apple doll since I get lots of Sun. With Olay 7-1 anti aging moisturizer with sunscreen I find that it's keeping my skin soft as well as shrinking my pours which my lovely twin sister has pointed out many times are huge and gross. Easy to apply. Not greasy and the smell doesn't effect my scent sensitivity. I give this 4 thumbs up (This review was collected as part of a promotion.)
"This product left my skin feeling soft and supple. The few little wrinkles I could see eased a little and aren't so prominent.also wearing It out in the sun I didn't have the red skin around my nose and cheeks like I do when I'm out without it, no one wants a sunburn on their face! (This review was collected as part of a promotion.)"
"I tried Olay Total Effects Anti-Aging Moisturizer, SPF30. It went on super smooth. I was nice and light, you did not even know you were wearing it. I love the fact that while moisturizing I was also applying spf 30. (This review was collected as part of a promotion.)"
I was so happy to try my sample of Olay Total Edfects AntiAging lotion I got from #BzzAgent. The first time I used it I noticed how good my face felt. I liked that it didn't have an overpowering scent. It has definitely become a new addition to my everyday beauty routine. (This review was collected as part of a promotion.)
"This product does not disappoint you! Just as known as its fame, the anti-aging moisturizer is very soft and absorbing in texture, does not leave any greasiness or sticky feeling while effectively provides my skin with the anti-aging effect. I use this cream at least twice, day and night now to give me an even and complete result! (This review was collected as part of a promotion.)"
"The product is satisfactory as a moisturizer, but after about 2 weeks of use now, I do not see any of the results it claims to do, such as enhancing brightness to my skin, minimizing pores, or reducing any dark spots, which are sometimes left behind from occasional breakouts. Overall, the lotion goes on smoothly, however don't expect miracles. (This review was collected as part of a promotion.)"
"Although very soft on my sensitive skin, this cream was just too much for me. Probably better for for mature and dry skin. It felt like I was putting on a very thick sunscreen and not a day cream. Did not enjoy the texture at all but the fragrance was nice. (This review was collected as part of a promotion.)"
Cream goes on smoothly and has a nice feel to it. A little bit goes a long way and it smells good. Great coverage for sun exposure. I've got oily skin so I'm particular about face creams. This doesn't leave my face feeling any more oily even with the great coverage. Still waiting to notice the better looking more useful skin. It's been just about a week Haven't tried the hair spray just yet but super excited to give it a shot this weekend (This review was collected as part of a promotion.)
"This moisturizer is very hydrating, I think this would make a better winter then summer moisturizer for me - it took a very long time to absorb in. It actually felt a lot like my night cream. My makeup applied nicely over it though and seems to be holding on well! (This review was collected as part of a promotion.)"
I was very excited to try the Olay Total Effects Anti-Aging Moisturizer and started the very next day after getting it. Cream went on nice and left my face feeling fresh and smooth. Though after about an hour I noticed my face was itchy and bumps breaking out. I had this happen 4 days in a row. The moisturizer was just not for me due to the irritation. (This review was collected as part of a promotion.)
"I have very dry skin but this moisturizer makes me look greasy. The cream is thick to apply. Sweating on a hot day caused it to get into my eye and sting. I tried again but the product still irritated my eyes just from being on my face. I have the Total Effects SPF15 and it is much better: thinner, and non irritating. (This review was collected as part of a promotion.)"
"I had been neglecting my skin and then received Olay Total Effects Anti-Aging Moisturizer SPF 30 in my BuzzKit! After my first application I could feel the difference as my skin became hydrated again. Love that it has an SPF and that a little goes a long way!! My skin is glowing, soft, and healthy! (This review was collected as part of a promotion.)"
Before trying Olay Total Effects Anti-aging moisterizer SPF 30 my face was dry and i had brown age spots. I have been using it for a couple of days and i have noticed my face is soft and not as dry. I love this product. I would recommend it. I love the idea it has SPF 30 in it. (This review was collected as part of a promotion.)
The bottle with the cream is straight forward about what it is and how to use it. I liked how it had this small thing that you had to pull of in order for the cream to come out. When the cream comes out its early white and it goes as pearly white on the skin. I like how a little goes a long way and it keeps skin hydrated for the whole day as well as protection from the sun. (This review was collected as part of a promotion.)
Olay Total Effects Anti-Aging Moisturizer is a great product. I have been using it for the past few days during extreme humidity and it did not make my face oily at all. The sun protection is a good SPF for the summer. Definitely recommend this product as it makes your skin feel more fresh! (This review was collected as part of a promotion.)
"While I do like the way Olay Regenerist SPF 30 made my skin feel, there's something in it that made my pores scream! Whether it be a fragrance or oil, I'm not sure. If the ingredient that is causing my sensitive skin's redness/irritation was removed, this would be a prefect product. I love the SPF factor especially! (This review was collected as part of a promotion.)"
I love this product. It goes on so smooth and makes your face feel great. It also has a spf 30 so you do not have to use another sunscreen on your face. I just use daily to keep my skin mesmerized. [This review was collected as part of a promotion.]
I have been using this and I love the way my skin feels. Soft and younger looking. The best thing of this is that not only does it moisturize it has a sunscreen in it. This to me makes a huge difference now that Summer is here! [This review was collected as part of a promotion.]
I am fictitious.and in need of skin products to revitalize my skin fragrance free is a must I am going to try more of your products and I expect I Will not be disappointed!!!!!!!!!!!!!!!!!!!!!!!!!!!!!!!! [This review was collected as part of a promotion.]
I bought this for my mom and she loves how it transforms her skin to be more soft and supple. She has dark pigmentation from sun exposure and this product lessen it! She always go back to Olay moisturizer. [This review was collected as part of a promotion.]
Total effects Daily Moisturizer is a complete moisturizer Not only does it help against signs of aging skin but also protects against harmful effects of sun exposure with spf 30 I use it every morning and am most pleased with the texture and appearance of my skin [This review was collected as part of a promotion.]
I have been using Olay Total Effects 7 in one moisturizer for about two years. I have tried both with and without sunscreen and find them both to be a great moisturizer. A small amount does a great job of keeping my skin hydrated for several hours. [This review was collected as part of a promotion.]
"I've tried probably 5 different kinds of moisturizers the last year, some were terrible and some were okay, but this one is great! It's not thick, or smelly, and doesn't make my face itch like others I've tried. Goes on great before makeup. Only con is it's kind of expensive, but a little does go along way! [This review was collected as part of a promotion.]"
"I have been using total 7 for over 6 years I believe and no matter what other product I venture, I always return to this one. It dries immediately so I can put my foundation on and believe me there is a difference you feel and see if you forget the 7. I am always tempted to try the other moisturizers by Olay and I have them and use but I still faithfully use the &. I cant go without it daily even if I stay home makeup free. I need the 7 on my skin. [This review was collected as part of a promotion.]"
"I have used Olay products for most of my adult life and have loved them. Even when I have tried other products, I always come back to Olay. I love the lightweight feel, the soft fragrance, and the fact that there is SPF in the products. The total effects products are no different, LOVE! [This review was collected as part of a promotion.]"
"I love the look of my skin using this product. It evens out my skin tone while providing much needed moisturizer. Also, I chose this product because it comes with SPF 30 protection. I am outside a lot of the day and appreciate the added protection this product provides. I recommend it to all my friends. [This review was collected as part of a promotion.]"
"The first time I got know Olay products is more than 30 years ago when I was in China in graduate school. My mentor, who was 45 years old, looked like only 30 years old. She told me she used Olay which her friend bought from US. When I came to US more than 20 years ago, I started to use Olay. It works well and save me a lot of money too. Especially the Anti-Aging Daily Moisturizer SPF 30 works best for me. [This review was collected as part of a promotion.]"
"I've been using total effects moisturizer for a very long time. When I first started using it, it was only SPF 15, now they have SPF 30 which I now use. It makes my skin feel great and use it everyday. I've had skin cancer so I have to keep SPF product on my face all of the time, whether I put on make up or not. It's the only product I use. Thank you for now making it with SPF 30. [This review was collected as part of a promotion.]"
"I have been using Total Effects for some 30 to 35 years. I use no other moisturizing products. Sometime when I can't find T.E. I purchase Olay Complete until I am able to purchase TE and have had many others ask what I use, because I don't look my age. [This review was collected as part of a promotion.]"
"Prior to using this moisturizer , I used one that was very expensive but it would irritate my eyes when I sweat. It also didn't have sunscreen which is very important living in Florida . A commercial came on for this product and I thought what do I have to lose. That was 5 years ago and I have never looked back. I love this product . [This review was collected as part of a promotion.]"
"What can I say? This moisturizer is one of the few out there with an spf of 30! Wow! It moisturizes all day without feeling greasy. Plus it keeps me looking my best! I'm 44 and no one can ever guess my real age! Thank you, Olay! [This review was collected as part of a promotion.]"
"Great moisturizer & sunscreen protection, all in one! At my age, moisturizer & sunscreen are daily rituals so being able to save time by using one product is a big help. Plus, the coverage stays on throughout the day. I highly recommend! Who wants to multi-task when it's not necessary? Thanks, Olay! [This review was collected as part of a promotion.]"
"I am really picky with what I put on my face. I do not break out with this product at all and it isn't greasy feeling which I do not like. What is really amazing is, this is the only product I use for sunscreen. I have tried other sunscreens but this one is the best when I travel to the Caribbean. My husband will even use it. [This review was collected as part of a promotion.]"
"I've used Total Effects Anti-Aging Daily moisturizer with SPF 30 for years. I've tried many other brands and types but always come back to this one. I love that it feels lightweight and silky on my skin plus protects from UV rays. From now on, I'm sticking with what has always worked for me!! [This review was collected as part of a promotion.]"
The creaminess of this product with the added plus of 30 spf in it fulfills my facial needs 100%. It feels so good and succulent when applying. It keeps me young looking and am mistaken for someone 15 years younger. [This review was collected as part of a promotion.]
I have been using Total Effects for years. I work in a movie theater and customers everyday will say I look younger than my age (which is 60). I also use this as my sunscreen on the beach etc. I will never stop using Olay. [This review was collected as part of a promotion.]
I have a very dry dry skin because of the my skin looks dull .i tried the sample that I received and was surprised it was moisturizing but not greasy . Lightweight absorbs quickly to my skin.its my every moisturizer it works well. Have repurchased . I absolutely love it and would definitely recommend [This review was collected as part of a promotion.]
"I decided to step up my skincare routine from basic cleansing, moisturizing and sunscreen. I chose Olay Total Effects, and I'm so glad that I did! I bought almost the whole line! Within just a few days, my skin looked healthier and felt smoother. I love the SPF 30 in this moisturizer because I am very fair, and it protects my skin so well. I am so impressed with this line, and I know I will be using it for a long time."
I was shocked at the things this product does It actually works all the stuff it tells you it does is true all summer long I had beautiful healthy looking skin and it was protected from all those nasty RVA rayes I was truly happy [This review was collected as part of a promotion.]
"Olay Total Effects 7 in 1 moisturizer is AWESOME! I have fairly sensitive skin, and have recently noticed a few fine lines, and uneven skin tone, oh and some pretty serious bags under my eyes. I tried several different products, from the cheap to the way-to-much-to-be-spending-on-a-jar-of-moisturizer, and didn't think I'd ever find one that satisfied all my needs....Untill I found this. I seriously would recommend this to anyone looking for an all around affordable moisturizer that actually works!"
"Olay!!!What a wonderful beauty creams.Mom always,have.Olay,in the bathroom ,and in her bethroom.I grow up,look at.her,everytime she use the Olay,and soap,all the products are excellent,she still.use,the old one,moistorising cream and the antiage soap.And I start.using,when I was a teen.I know.,I used,this totall effects 7,the soap,cleanser,if you want to keep your.face.looking.young.use.,this totally effects 7,is amazing."
I always use Oil of Olay daily moisturizer. During summer months I change to using the one that includes sunscreen. It is a great way to get full coverage for your day outside. I do find that the ones that contain sunscreen tend to burn my eyes if I get any in my eye.
"This is a great product. Your skin feels moisturized without feeling oily. I have used other Oil of Olay products, but this is the first time I have used this one. I am always being complimented on how young I look and I feel Oil of Olay is a major part of that. [This review was collected as part of a promotion.]"
"Ladies this product does it all! It protects your skin from the sun but also evens out skin tone, makes wrinkles less noticeable, makes it softer and more dewy looking, moisturizes and since you only have to purchase one product it's so economical! [This review was collected as part of a promotion.]"
I have been using Olay products for 30+ years. It started in college when I tried a sample and I have been using it ever since! I have serious allergies so my skin can be affected. I have never had a reaction to Olay products which has kept me coming back. The cost and availability of the product is fantastic. I just wished you offered travel sizes.
"This is a great moisturizer! It absorbs quickly and makes your skin very soft. I have ""expression line wrinkles"" and concentrated on this area. There was a noticeable difference within a few weeks. Skin dries out in all seasons and this moisturizer replenished my skin in a way I never expected."
"I am over 50 years old and I find that most products do not deliver for my age group. I tried Total Effects 7 and within days my skin felt firmer, had a healthy glow and felt younger. It is now my go to product! Thanks! [This review was collected as part of a promotion.]"
"I have been using this moisturizer for a few years now. I am in my late 40's and have only a few fine lines. I love how this product feels on myskin. Not grease, soft plump dewy on my skin . I dont like thick paste products.this is nothing like that. My skin soaks it in nicely. [This review was collected as part of a promotion.]"
"I have really irritated, dry and tired looking skin :/'a Good friend recommended this cream applied as instructed and two weeks was a huge diffrence!Now im a huge fan of olays total effect anti aging moisture and Would love to try some of their other products ^o^ [This review was collected as part of a promotion.]"
I have used other products but I always come back to Olay. It just seems to help with the look and feel of my skin. It makes my skin feel soft like a babies. I don't know why I just don't stay what seems to work. It also makes my face a little more tighter after I use it [This review was collected as part of a promotion.]
Hate to say it but I needed more help and found it with this product. Works all day giving me the moisture and protection I need for my days outdoors (and indoors) Absorbs quickly and I can feel and see the difference in my complexion...love this product. If you feel that your skin is lacking in luminosity and elasticity this is the moisturizer for you!!!!! [This review was collected as part of a promotion.]
"I have tried so many products, and this is by far my favorite. I use it every morning and every night. It keeps my skin looking young, and has helped reduce my wrinkles. I use the body wash and the lotion daily. I absolutely love this product. It really works. [This review was collected as part of a promotion.]"
"results are amazing, even in the winter. Light weight and leaves skin feeling soft, not full of heavy stuff. I have been looking for a product that will do its job at a sensible price, I have gotten complements on how refreshed I looked since using this cream. [This review was collected as part of a promotion.]"
My face would be so dry after washing it. I would have dry spots around my nose and my forehead. I tried different types of moisturizers but after 30min. my dry spots would reappear. I decided to use this Anti-Aging Daily Moisturizer from Olay and I fell in love with it. It was amazing this product lasted all day. [This review was collected as part of a promotion.]
I love this product as it makes me feel and look younger. I don't have to use any other products after using this. I've seen my friends and family using this product too. And now we all look great. Thanks for making this happen. [This review was collected as part of a promotion.]
"I've been using this product for years, in the morning I use it under my foundation and also at night before bed. It goes on smooth and makes my makeup glide on easily.It has improved the condition of my skin and has greatly diminished my lines and wrinkles which is very important to any woman. [This review was collected as part of a promotion.]"
"I love this moisturizer. It is light yet effective. Whether alone or under make-up, it gives your skin a youthful glow. In fact, I've received compliments on my skin...people ask what make-up I use...even when I am mot wearing any! [This review was collected as part of a promotion.]"
"My sister-in-law asked me to purchase Olay Total Effects Anti-Aging for her since she lives in assisted living - she said after trying many products this was the best! Since then I have purchased many, many times and found it to be great for my aging skin, especially in the dry winter months as well as for dryness from the summer sun. Everyone tells me I look 20 years younger! [This review was collected as part of a promotion.]"
"I love Olay product and this moisturizer tops them all. It absorbs really well into your skin without making your skin all greasy. It softens your skin and makes it feel smooth and silky. Over time you see the wonderful difference, less wrinkles and less lines. Look younger and have great skin with this moisturizer. [This review was collected as part of a promotion.]"
"I have tried samples of a few other products and always come back to my Olay 7. It felt like the other moisturizers were melting off my face and even running into my eyes making them tear up. Olay helps my skin look wonderful, stays put and is never greasy feeling. I have been using Olay for many years and I LOVE it. [This review was collected as part of a promotion.]"
Since I started using this moisturizer I have been getting compliments on how much younger and rejuvenated my face has become. My 21 year old daughter tells me I'm looking younger now than I did when she was 10 years old. I owe it all to Olay! [This review was collected as part of a promotion.]
"This product easy to apply, great dispenser, conditions my skin. lessens the fine lines, it is not greasy, but it is smooth, clean and silky. My skin feels smooth and silky and my skin's appearance. is glowing! I use this product morning and evening. [This review was collected as part of a promotion.]"
"I've used Total Effects blemish control salicylic acid acnes cleanser and Total Effects Anti-Angie Daily Moisturizer for about 5 years. My skin is smooth and clear. I've tried other, more expensive products without the same effects. The reason I did not give 5 stars, I would like a version of the Anti-Aging Daily Moisturizer with salicylic acid to reinforce the benefits of the cleanser. [This review was collected as part of a promotion.]"
I would not go without it .It Imakes my face fell so good. I use it after I shower and my face isn't tight feeling or dry.My face feels so smooth People ask me what I use because my face looks so nice and smooth you can hardly see any of my wrinkles.i always tell them I use Olay tolal effect Icould not go without it .It is the only product I would trust to buy on my body. [This review was collected as part of a promotion.]
