"It was good experience with L'Oréal renewal cream. I always like to experiment different age creams. Results always vary. And it's not because of their price. This time I tried age night cream and was very satisfied. My face was fresh in the morning like after good weekends. My skin looked very rested and was soft, it seemed like I never had wrinkles before. Hope that everybody tried it had the same result. [This review was collected as part of a promotion.]"
"This renewal night cream leaves my skin feeling soft and healthy and revitalized. As with any facial cream or moisturizer, I was worried that this might clog my pores resulting in blemishes and to my delight it did not do this at all even though it is nice and rich. Aside from how fresh it makes my skin look and feel, my favorite thing about this night cream is the delightful scent. [This review was collected as part of a promotion.]"
"I absolutely love this product. I love everything about it. I have always had to be very careful what to use on my face, as I always had some sort of reaction. No problems at all with this. I love the way it feels, smells and works on my face. After using for a few weeks, I can actually tell that it is working. Small lines have disappeared and my skin is soft and smooth. I definitely recommend this product. I know that I will buying it in the future. Thank you L'Oreal!! [This review was collected as part of a promotion.]"
"This product seemed a bit heavy or thick. I thought wow this is really going to get to my wrinkles, but it didn't do any better than the product I was using before. I don't think I'd pay more for this. [This review was collected as part of a promotion.]"
"I was looking forward to trying the night cream hoping it would moisturize and renew my skin, but alas, it did not. It claims that one can see instant results in 1 month, but that didn't happen for me. I did like the texture and the smell was pleasant. I'm disappointed that it didn't work for me but maybe it would work for others. [This review was collected as part of a promotion.]"
I think this is a great product. I've been using L'Oreal Paris Age Perfect Night Cream for a few weeks and can tell it has helped my dry skin around my forhead and chin. I would totally recommend this product. [This review was collected as part of a promotion.]
"Just like the day cream, this one feels and smells excellent. I can definitely feel the immediate moisturizing of my skin. When I wake up, I can definitely feel my softer skin and the product still doing its job [This review was collected as part of a promotion.]"
"I loved the luxurious feel of this cream. It was a little thick to put around the eyes, but I'd recommend the eye cream of the same product line for that. This cream felt nourishing without being too heavy, I felt I was doing something very healthy for my skin. I didn't notice an improvement in skin texture. [This review was collected as part of a promotion.]"
"I really liked the softness of my skin after using this night cream. It was not too heavy on my skin, but felt very soothing. The night cream also did make my laugh line and eye wrinkles seem less noticeable. I will continue using this product. [This review was collected as part of a promotion.]"
"This is a very moisturizing night cream, with a dense but easily spreadable texture. I wish it came in an unscented version, as the fragrance was too much for my skin. I also wish this was in a pump and not in a jar. For someone very dry and not sensitive, this is probably a great night cream, just not for my skin. [This review was collected as part of a promotion.]"
"I've been using L'Oreal Paris Perfect Cell Renewal Night Cream for just over 2 weeks. It's been great with my sensitive skin - no rash or break-outs! I can't believe that my skin is so well hydrated and soft when I wake up - the moisturizer lasts all night! My skin has been softer, smoother, hydrated, and, I believe, fewer fine lines! 54 isn't so bad, thanks to L'Oreal! [This review was collected as part of a promotion.]"
In the morning when I go to wash my face I noticed that my face looked fresh and bright after washing it. The night cream definitely did what is suppose to do while sleeping. It is very thick so you have to rub it in very well. The scent was nice and it absorbed quickly. [This review was collected as part of a promotion.]
"Wow! One would think you'd know about skin creams! This night cream not only smells good it's not greasy, feels soft on the skin and you wake up looking refreshed. Use with the day cream. Wrinkles, soft lines, brighter complexion, completely refreshed. A definite must have! [This review was collected as part of a promotion.]"
"This is a nice moisturizer for normal to dry skin, wouldn't recommend it for combination to oily skin that I have, it made my pores lager and that's a no no! But it was good for my décolletage area, it helped with some vertical wrinkles that started developing. [This review was collected as part of a promotion.]"
"My skin is so much smoother and softer since using this product! I love all products that I have tried! The eye cream, the day cream and the night cream. I would definitely recommend this to anyone and everyone looking for smoother, softer and healthier looking skin. I love th way my makeup looks. I have found I need less foundation and the coverage is flawless. [This review was collected as part of a promotion.]"
"I would recommend this to everyone I talk to , I've been using this for almost four week's now and I can tell the difference in my skin on my face and neck, i don't have any negative thing to say about this product [This review was collected as part of a promotion.]"
"I think L'Oreal Paris Age Perfect Cell Renewal Night Cream is a great product. It leaves my skin feeling nicely moisturized without feeling greasy. It also has a nice light scent. The best part of this product is the results. My skin feels and looks more supple. I did not notice immediate results as stated on the box, but the long term results are great. I would recommend it to anyone. [This review was collected as part of a promotion.]"
"I love this night cream. The first night I tried the L'Oreal Paris Age Perfect Cell Renewal Night Cream, I thought ""this is way too thick"". Boy, was I surprised when it absorbed quickly and was not greasy. I love the feel and my skin is soft and smooth. The fragrance is also very nice and light. I will definitely use this again. Great product! [This review was collected as part of a promotion.]"
I have hesitated to try a night cream because I did not want to feel greasy all night. I see the white mask on others and think NOT ME. This Cream is light but really keeps my face feeling moist and relaxed all night. No more waking with a tight face. I can see the difference in my skins elasticity and it feels great. I am sooo happy I took a chance!! [This review was collected as part of a promotion.]
"Due to me not washing my face at night on a constant basis, I wasn't able to fully enjoy the product. It has a delightful smell that is refreshing when applied. The cream is lightweight and rubs in very easily. I only applied a small amount (a small pea size amount) on my checks, forehead, and chin which provided enough coverage for my face. I have very sensitive skin. However, I did not break out from using it. It is a great cream to use before going to bed. [This review was collected as part of a promotion.]"
"I've used this faithfully since receiving it, along with the day cream and eye cream. This is a wonderful night cream - one of the best I've used, and I've used many high-end products. It has added moisture without making my skin oilier. it is non irritating. I find my skin has plumped up since using it which diminishes the look of lines and wrinkles. I really like this product and will recommend it to friends and family! [This review was collected as part of a promotion.]"
"I think this cream is silky and smooth when it goes on the skin, it gives the skin moisture without the oiliness of other night creams. Still waiting a few more days to see if it makes a bigger improvement on my skin. [This review was collected as part of a promotion.]"
"This is a wonderful night cream. It smells very nice, left my skin nice and smooth the next day, and I could tell a real difference after a couple weeks. I've never tried face products like this before, but I think I will continue using it. [This review was collected as part of a promotion.]"
"I was so excited to try this product, as the other products in this line are great. Unforunately, I was disappointed. Being night cream, you would think it would be more moisturizing than the day cream; not so. I felt this product had a dry, almost sticky feel during application. And it had a strong perfume-like smell. Nothing terrible, just too much scent. [This review was collected as part of a promotion.]"
"Love the loreal night cream! Its Very simple to apply, leaves your skin feeling moisturized but not greasy at all, and smells amazing! My complexion changed for the better with this product and i will continue to use it! [This review was collected as part of a promotion.]"
"I was not impressed with this night cream at all. First of all, it does not go on very smooth at all. It is very thick and hard to blend into skin. Second, for some reason it tended to break me out along the outer edges of my face so I have stopped using it. [This review was collected as part of a promotion.]"
This cream was great at keeping my skin nourished at night but never had a problem with it getting to oily. I would use it on my neck as well and noticed a difference in the tightness of my skin. I will continue to use it on a daily basis. [This review was collected as part of a promotion.]
This L'Oréal night moisturizer is not heavy and smells really nice. I did find that it does bother my sensitive skin at times. If you don't have sensitive skin I think this moisturizer would be great. [This review was collected as part of a promotion.]
"AS SKIN AGE CELL RENEW DECREASED DRAMATICALLY AND YOU SKIN BECAME DRY AND DULL, THERE IS WHEN L'OREAL PARIS AGE PERFECT CELL RENEWAL COMES TO THE RESCUE, THIS IS THE MOST WONDERFUL CREAM I EVER USE, L'OREAL PARIS AGE PERFECT CELL RENEWAL NIGHT CREAM IT IS WONDERFUL, DO NOT LET THEY FOOL YOU WITH ANY OTHER BRAND, L'OREAL PARIS AGE PERFECT CELL RENEWAL NIGHT CREAM IS THE BEST [This review was collected as part of a promotion.]"
This is a great night cream. It's a thick cream you apply it by using small circular motions on your face and neck. It's by L'Oreal so you know it's a good product. The smell is wonderful. I've been using it for a short period of time but I already see a difference. [This review was collected as part of a promotion.]
I think the L'Oreal Night Cream is amazing! I love the way it makes my face feel as soon as I put it on. It smells great. I have been using for at least 2 weeks and I can already see changes in my skin. It looks healthier and not as dull. The wrinkles seem to be getting smaller as well. I'm loving it and I will definitely be buying as soon as mine runs out. [This review was collected as part of a promotion.]
"I've never really tried an overnight cream before. I'm now a total convert!! It only takes an extra minute before bed every night, but the payoff has been huge! I seriously look like I've never missed a minute of sleep in my life. My skin has a gorgeous glow straight out of bed every morning. I will never go without a night cream again! [This review was collected as part of a promotion.]"
"This was a bit more sticky on my skin than I anticipated. It did however, deliver a lot of over night hydration to my face. I will continue to use a an over night moisturizer, as I was my face in the morning anyways. [This review was collected as part of a promotion.]"
First I love that is only a Night and Morning Cream. I'm a busy Mom and I don't have a lot of time on my hands. I also like that not only did I see results after a week you feel firm right away. I also liked that VERY faint smell. I don't like heavy perfumes. Its not too thick not to thin. The Jar will last a really long time as well. I didn't need to use a lot to cover my entire neck and face. [This review was collected as part of a promotion.]
My skin was dying for hydration that wasn't greasy or heavy. The night cream went on almost like whipped Butter but no greasy remnants. My face felt moist and supple. The texture of my skin has improved and I hardly look my 45 years... [This review was collected as part of a promotion.]
"I liked the product OK, but it was a little to heavy for my skin. I ended up using the day cream for day and night. It did reduce the fine lines of aging and I noticed a marked difference in the texture of my skin after two weeks of use. The eye cream was good too and I definitely noticed a difference in the lines around the eyes. [This review was collected as part of a promotion.]"
"Every morning since using this product, I can wake up in the mornings and actually see the difference in my skin! The little lines are becoming less noticable and my skin is so much smoother! My mother asked what I was using and went out and bought this product the same day! Amazing product! [This review was collected as part of a promotion.]"
This cream is much thicker than the day cream but still goes a long way. I can't tell immediate effects but I'd say the long run is what matters. With that said I'd be willing to pay a little extra as those things are what matters to me. The cream is not greasy and has a nice smell. The jar is heavy and should be able to be reused by a crafter for something. I recommend this cream. [This review was collected as part of a promotion.]
I was very excited to try the L'Oréal Paris Age Perfect Cell Renewal Night Cream. And after trying it I couldn't have been more pleased! It went on very smoothly and left my skin feeling soft. It was not at all greasy. And it also has a sunscreen which is a real bonus. I was very happy to be introduced to this product. [This review was collected as part of a promotion.]
"As a moisturizer, this works great. You don't have to use a lot and it goes on with no mess. My complaint is the fragrance. It's not an unpleasant fragrance, but a little too strong for my liking. [This review was collected as part of a promotion.]"
Tje age perfect Cell Renewal Night cream has an amazing scent that even my husband commented on. It is thicker than the day cream which is to be expected for any night cream. After a week of use I could feel the difference in my skin from the texture to firmness. I absolutely love this night cream and will not be going back to my old brand. Way to go loreal you nailed this one. [This review was collected as part of a promotion.]
After 3 weeks with this product I've noticed a decrease in pore size and fine lines. After baby # 2 I felt like 1 looked 10 years older and these products have turned the clock back! I'm very happy with the results [This review was collected as part of a promotion.]
"I think this product is good because I have very dry skin and it kept my skin moisturized throughout the night. When I woke up it was still there in the morning. It also has a great smell, not to strong. [This review was collected as part of a promotion.]"
"I am in my early 30's with combination skin and a history of acne. L'Oreal's night cream was easy to put on and absorbed easily. It has a light flowery fragrance. It is a bit thick. So, while it's okay for wintertime or in air conditioned rooms, I wouldn't recommend it for warmer situations. While it is a good moisturizer, I haven't noticed any difference in my skin compared to my usual lotions. I have been using it for about 2 weeks. [This review was collected as part of a promotion.]"
Everymorning when I wake up my face feels and looks amazing since I started using this product. I apply it before bed every night. It goes on silky smooth and you only need a little bit. It smells amazing too! I would deffinitly reccomend this product to family and fiends! [This review was collected as part of a promotion.]
I noticed a change immediately using the eye cream . I also love the day and nite cream . It has done wonders to my skin. It feels good on my face and neck . No greasy heavy feeling . I have told my friends about this. Definitely recommend! [This review was collected as part of a promotion.]
"I think L'Oreal Night Cream is a wonderful product. I have been using the cream for 2 weeks and I have noticed fine lines diminished and pores seem to be smaller. In addition, I have noticed softer and more hydrated skin. I love this product.. [This review was collected as part of a promotion.]"
"This product is wonderful! It smells nice and smooths on so nicely. My skin is soft and glowing. I have oily skin so when I apply this product on my face, it doesn't feel greasy at all. In the morning, my skins looks great and moisturized. [This review was collected as part of a promotion.]"
"I really like the feel of the night cream on my face before and after sleep, but I find it leaves my T-zone somewhat oily. This is fine in winter when my skin is drier, but I don't know how it would perform on my skin in summer months. [This review was collected as part of a promotion.]"
"I expected to see a little bit more results from the night renewal cream. After using it for almost 2 weeks straight I can't really see a big difference. It's soft, not greasy and smells great but just didn't seem different or better than other night creams. [This review was collected as part of a promotion.]"
"I tried this the first night I got it. The smell gave me a headache and in combination with the eye cream, I smelled like an 70 year old with toi much perfume on. It made it hard to go to sleep. The next day I could scrap the lotion off my skin still so i either didnt rub it in enough or it never absorbed. I honestly have zero desire to find out if it works by the smell alone. [This review was collected as part of a promotion.]"
I've tried a ton of these types of products but never liked one as much as this one!you only need a small amount to cover your entire face and neck!my face felt so moisturized!i would recommend this product to all my friends! [This review was collected as part of a promotion.]
"I think that this night cream is quite strong smelling for something I am going to sleep in. Like the day cream it has a strong scent, I can handle it during the day but at night it tended to bother me much more. I loved how smooth the application was though and it was absorbed quickly so not sticky/wet pillowcases! [This review was collected as part of a promotion.]"
Tried this night cream for the past few weeks and already noticed a difference! Not greasy and soaks in quickly. Would love an unscented version as I am very sensitive to scents and perfume but this may not be an issue for most people [This review was collected as part of a promotion.]
I think that to a product is perfect for anyone who needs moisturized skin on their face. I loved this product. My face felt rejuvenated and full of the nourishment that it has been lacking. I would recommend this product to everyone. [This review was collected as part of a promotion.]
I was a little concerned when I first started using the night cream because it is very thick and heavy feeling. I have oily skin so I have a tendency to breakout with heavy creams. But I have been pleasantly surprised. No breakouts and I can see a positive change in the firmness of my skin. It also has a really nice fragrance. I would definitely recommend this product for older woman concerned about having firmer looking skin. [This review was collected as part of a promotion.]
I love the age perfect cell renewal night cream leaves my face soft even after I wake up the next morning my face is still soft. I will continue to use this product in the future love the way it makes my face feel. [This review was collected as part of a promotion.]
"A night cream is so important for a dry and itching skin like mine. This night cream is awesome: it spreads easily , so I only have to use a tiny bit ( so it will last longer), it is not greasy, and makes my skin smooth and soft! This cream compliments very well the day cream from the same line! The only thing that I don't like is that the fragrance is a little bit too strong. [This review was collected as part of a promotion.]"
"I have sensitive combination skin. I would wash my face and apply the cream nightly. The cream itself is thick and once applied feels very heavy. I initially thought it would just absorb into my skin and hydrate it well. When I would wake in the morning, my face just felt very oily. For me, the night cream is just too heavy and only adds to oils in all the wrong places. Additionally, the scent is very perfumey. It was off-putting. [This review was collected as part of a promotion.]"
"The L'Oreal Paris products are excellent! My facial skin was smoother and softer, and my neck became smoother. I love what this product has done for my neck. So smooth! The eye creme is wonderful. My skin looks better and feels softer. And I love the way the skin on my neck feels now. So soft, and it was ""lizard skin"". Yuk! Yeah, it Was! Not anymore! [This review was collected as part of a promotion.]"
I received all 3 products at the same time. The Night Cream is my favorite -you can apply as much Cream as you want and it does not feel padded. It's light on the face and smells wonderful. This is the only product I apply to my neck and the uglylines is slowly going away. I have only used this for 3 weeks and it is working better than expected. [This review was collected as part of a promotion.]
This product smells fantastic. It is easy to apply and a little goes a long way. If there is one thing I could be critical on is that it felt a bit oily for me. This could have just been me. The results were fast and my skin feels fantastic. I am a customer for sure. [This review was collected as part of a promotion.]
I have been using this product for about two weeks and have noticed changes. My face seems much shinier and not so dull. It seems to look younger as well. Not sure if it was only this product or the combination that I have been using. I have been using the L'Oreal Day Crème and Night Crème and the renewal eye cream. Either way my face looks great. [This review was collected as part of a promotion.]
"This cream was very thick and moisturizing which was great. It was also heavy feeling though which for me was a negative. I didn't like that it had a slight scent; I prefer moisturizing creams to be unscented. My skin was already dry, and it burned my skin. I didn't notice an immediate change in the appearance of my skin other than it not being dry. [This review was collected as part of a promotion.]"
"This product added a lot of moisture to my face when using it at night. It is thick and creamy but did not make my skin feel greasy. As far as giving my skin a more youthful look, I could not tell whether it was working. I would recommend it for the moisture it provided [This review was collected as part of a promotion.]"
That this is a great product. In the short time I have been using it I really feel like it has made a difference. I have told friends about it and have had people ask me if I was doing anything different [This review was collected as part of a promotion.]
I don't usually use night creme but I decided to try it & see if it improved my skin care regimen. Was I surprised. My skin feels & looks fantastic. Fine lines are diminishing. No longer does my skin look tired & worn. Looks radiant & bright. I'm so pleased with it. My skin hasn't looked so good in a long time [This review was collected as part of a promotion.]
I enjoyed the night cream a little more than the day cream simply because of the lower fragrance in the product. I have sensitive skin and can have bad reactions to fragrances but this product worked really well with my skin. I noticed that in the morning I didn't feel like my skin was thirsting for moisture and wasn't oily like with other products. I highly enjoy this product. [This review was collected as part of a promotion.]
I think that L'Oréal's Age Perfect Cell Renew Night Cream is a great product. I used it last night for the second time. It really is gives my skin a glow. It has a light texture and I do not have to use very much of it. It is not sticky and heavy on my skin. I like the scent of the cream because it does not smell medicated. I would recommend this product to my family and friends. [This review was collected as part of a promotion.]
The consistency of this product is buttery soft. It glides on my face and it easy to apply. It doesn't feel greasy or oily. The smell is subtle and doesn't bother my nose. While some fragrances bother me in skincare products - this is not one of them. I recommend wearing this at night! [This review was collected as part of a promotion.]
"L'Oreal Paris Age Perfect Cell Renewal Night Cream does a nice job of skin repair as I sleep. The thicker formula (from the Day Renewal cream) glides smoothly over my skin. It is unfragranced, which I always enjoy. I'm on my way to fresher, more vibrant skin! (Photo at two weeks of use) [This review was collected as part of a promotion.]"
"I was given the opportunity to try this product as well. Again, it was packaged nicely. Love the fragrance. I have dehydrated skin due to the cold weather, this night cream has really worked well for my skin...and a little goes a long way. My face is much smoother and nourished. [This review was collected as part of a promotion.]"
