4.4,"['519', '228', '85', '23', '14']"
I got this because I needed a good moisturizer. I normally don't prefer the feel of creams but I really needed one. This one is light and comfortable. Smells good too!
"With the cold weather hitting New England, I decided I finally needed to start using moisturizer. I'm 50 and haven't used facial moisturizer before because my skin was always oily. Now, I know I should have been using moisturizer all along. I picked up Age Perfect Cell Renewal Night Cream and Age Perfect Cell Renewal Day Cream at CVS the other day. After one use, my skin was soothed, soft and the roughness is smoother. I can't believe how healthy my skin looks after just a few days."
My first use of this product and it does a wonderful job. Also the eye cream is so easy to use and it got rid of all the dryness around my eyes.
My favorite nighttime cream. The perfect consistency for my maturing skin.
"I like this line from L'Oréal, but this one is a little thick for my skin. Would probably work for someone with extremely dry skin."
Moisturizes and has helped control my oily skin. Very thick and smells great.
"The cream is thicker than most creams I used buy hey, it moisturizes my skin...The smell don't bother me either.. [This review was collected as part of a promotion.]"
"I liked the non-greasy texture and felt like it penetrated the skin but my goodness, the strong cheap perfume fragrance is just too much."
This is so perfumed that I cannot use it..tried two times...even my husband complained!
I bought this a month ago and it is a good product.
I've tried many night creams and consider this one to be a serious contender. It helps to normalize dry or aging skin and absorbs nicely.
"I applied the product before bedtime and within an hour had to wash my face. I couldn't handle the perfume smell, it was a bit much for me. On top of that it made my skin burn. I would not recommended this product if you have a sensitivity to perfumes at all. [This review was collected as part of a promotion.]"
I think it has been working very well for me. I have been using it since I received it in the mail from bzzagent for my honest review. I had a few fine lines around my eyes and laugh lines are fine also and have noticed improvement since starting to try it out. I noticed results in a few days nights if use. Thank you bzzagent for the great opportunity to try out these products for my honest unbiased review in exchange [This review was collected as part of a promotion.]
"This night cream has a yummy light scent and rich moisture. After 2 weeks of use, my skin is very happy! Winter heating reeks havoc on my skin during the night, and this cream not only combats the dryness but actually ""plumps"" my skin so that it is younger and healthier looking in the morning. Who doesn't like to wake up looking refreshed and younger?!? [This review was collected as part of a promotion.]"
My Bzzz Mission with L'Oreal age perfect day and night cream was a huge success!!! I received a free trial of the age perfect cell renewal night and day cream along with the eye renewal. I tried the creams and found they left my skin soft and supple. The creams were not greasy had a very pleasant smell and left my skin so soft. It absorbs quickly leaving no greasy residue. I would highly recommend it [This review was collected as part of a promotion.]
"I really like this night cream. It smells good, goes on nice and smooth. My skin feels great right away. It says cell renewal so I was hoping for my dark spots to lighten, but over a month of use may not be long enough but I haven't seen a change. [This review was collected as part of a promotion.]"
"i have not uses a night cream before. so this is my fiest experience. i liked how it did not have a crispy dry feeling, like i assumed a night cream would have.i have sensitive skin also so i am very impressed that i did not break out from it. [This review was collected as part of a promotion.]"
"I think this L'Oréal cell renewal Night time cream moisturizer is a little thick than I like, I don't like to put on thick creams before going to bed, it does seem to absorb pretty well but my skin feels like it has a little too much on, it smells great, and I still plan on using it to see if I love the results after a month of using, I have only used it for 10 days, it might feel better for someone who has very dry skin. [This review was collected as part of a promotion.]"
It did not absorb into skin and felt thick and heavy in the morning and kind of sticky to touch. It was very fragrant. I did not feel a difference but maybe after prolong use it would have a better effect overall. [This review was collected as part of a promotion.]
"This cream comes in a beautiful gold colored bottle and is heavy, so it makes it feel luxurious. It has a sweet smell, which can be a positive or a negative depending on your preference. The cream has a thick texture but it absorbs so well into my face. I have to agree that this cream makes my skin look nourished and I am very pleased with the results so far. It may just be my new favorite night face cream. [This review was collected as part of a promotion.]"
"After three weeks of using L'Oreal Age Perfect Cell Renewal Night Cream I find I am quite pleased with the results so far. The texture of the cream is lovely, it is thick and buttery. The cream left my skin feeling dewy soft and well-hydrated. I think this is a wonderful night cream for dry skin but in the end it was too heavy for my combination complexion. [This review was collected as part of a promotion.]"
"I guess my skin just wasn't thirsty enough for this regimen. I used the day cream, night cream, and eye cream for 3 days, and my poor skin is suffering with clogged pores and angry blackheads. I have sensitive skin, so the fragrance in the product may have irritated my skin as well. [This review was collected as part of a promotion.]"
"smells and feels expensive!, i've been using the eye, day and night cream together and the result is amazing, this product is definitely worth it, right after applying my skin feels fresh and smells delicious, after a few hours feels hydrated at first I thought oily but if you touch it not at all, something that i really like [This review was collected as part of a promotion.]"
"I think this stuff is amazing! I'm currently using the day cream, night cream and eye cream and at first I wasn't very good at remembering to use the products. Once I started to notice the difference it was making in the clarity of my skin it was easier to remember because I can't wait for the appearance of my skin to be smoother and younger! I would definitely recommend this product to anyone interested in younger looking skin! [This review was collected as part of a promotion.]"
I used this night cream along with the eye renewal cream. I found it very refreshing and moisturizing. It left my skin feeling soft and renewed. It has a very soft cool scent that i personally liked! [This review was collected as part of a promotion.]
I just love the that the L'Oreal Paris Age Perfect cell renewal Night cream is light and not heavy like other brand night creams. I can actually see a difference in my skin now that I have tried the Night cream along with using the day cream. The smell is wonderful sometimes I only wear the cream on my face so to smell the cream instead of perfume. I would definitely recommend this product to anyone with my dry skin with lines. [This review was collected as part of a promotion.]
This cream has a pleasant scent to it and is quite thick. It was great for the time of year I was using it but I couldn't imagine putting it on during the summer. It's a pretty thick cream that didn't mix well with face sweat. Definitely left my skin feeling well moisturizers and looking fresh in the morning though. [This review was collected as part of a promotion.]
"This is by far my favorite night cream I've ever used. I love the scent and how well it absorbed into my skin. It was creamy but not oily. My face feels so soft after I use it. I even it used it a few times for day cream because I loved it so much. You only need to use a tiny bit of the cream, so it should last you quite awhile. It is well worth price! [This review was collected as part of a promotion.]"
"I woke up his morning and did a double take at my reflection. Gone are the dark circles and bags under my eyes. Say goodbye to the red, chapped cheeks that the desert winds batter. Say hello to a face that have smooth and supple skin, skin that is bright and refreshed, and eyes that sparkle. Thanks to L'Oreal Paris Age Perfect Cell Renewal Night Cream I laugh in the face of the dry desert heat and whipping winds. [This review was collected as part of a promotion.]"
I absolutely love being able to wash my face at the end of a stressful day and put this night cream on my face. It just smooths my skin so much. And even found with the cold air makes my skin more sensitive but with this cream it helps the irritation go away and my skin is more firm. [This review was collected as part of a promotion.]
I liked Loreal Age Perfect Night Cream. When you use it prior to bed as directed you wake up with your face feeling refreshed and reinvigorated. I highly recommend this product. Noticeable results after 2-3 weeks of use! [This review was collected as part of a promotion.]
"I am almost 50 years old and have normal to dry skin. Lately my skin has been more on the dry side and a little rough so I was very happy to receive this product. I've used this cream for about 3.5 weeks, every night, and I have been very pleased with the results. It has left my skin feeling baby soft and smooth. Even when I wasn't able to use it for a few days when I went out of town and left my make up bag, the effects lasted. I definitely recommend this product! [This review was collected as part of a promotion.]"
I've been using this night cream for a few weeks. It smells nicely and works well. I removed a star because it's more of a serum and feels think but dries on face right away so you don't need a bunch but I feel like I do. It's the middle of winter in the northeast while I'm using this and my skin has no dryness whatsoever and my skin feels smooth [This review was collected as part of a promotion.]
"This night cream is good stuff! It's not too thick or greasy feeling, which is a big deal to me. I can put it on before bed and not feel like I'm oily and need to immediately wash my face in the morning. It doesn't break me out, either. After using it for about 3 weeks, I feel like my skintone is more even and my skin looks brighter and rejuvenated. The fine lines/wrinkles I'm starting to develop are still there, however. [This review was collected as part of a promotion.]"
I recently starting using L'Oreal Paris Age Perfect Cell Renewal Night Cream and I am in love with it. It moisturizes your face without feeling oily. My skin feels so dewy and soft that I don't even want to wash it off in the morning! The fine lines around my eyes and mouth are disappearing. I'm a fan for life! [This review was collected as part of a promotion.]
"L'Oreal's Age Perfect Cell Renewal Night Cream is my new favorite! After just a few weeks of nightly use, I wake up with brighter, smoother, more refreshed skin. And all the magic happens while I'm asleep. I honestly look forward to my nightly dose of facial cell renewing! It brings new meaning to the term ""beauty sleep"". [This review was collected as part of a promotion.]"
"This is a great product. I have extremely sensitive skin and was hesitant at first to use this product. But, this product worked wonders. My skin started looking better right away. Very noticeable changes after a week. [This review was collected as part of a promotion.]"
"This product smells luxurious and has a really thick and absorbent texture. I noticed the difference right away. After the first night, I woke up with a visibly brighter complexion, more supple and bouncy skin with no dry patches. It left my skin with a sheen that feels like dead skin but washable with facewash. My skin felt so soft and healthy! I will definitely continue to use this cream, expecially in winter. [This review was collected as part of a promotion.]"
"L'Oreal Paris Age Perfect Cell Renewal Night Cream is by far the best i have tried! You can feel it working after just one use. My skin felt firmer, healthier and not at all greasy. It didn't rub off or leave any marks on my pillowcase, which has been a problem with other brands products. I Would definitely recommend this product! [This review was collected as part of a promotion.]"
"It is a wonderful product, the night cream and day cream are so great, theymake my face so soft and smooth. The eye cream makes the skin around my eyes firmer and diminishes the dark circles under my eyes. I will continue to purchase all three items. [This review was collected as part of a promotion.]"
"I used the L'Oreal Paris age perfect cell renewal night cream before going to bed every night, first thing I noticed was the creaminess of the product and easy application! Second, it had an amazing refreshing smell that I loved drifting off to sleep. My face felt so great in the morning and really felt moisturized! Definitely recommend this product! [This review was collected as part of a promotion.]"
I never realized how dry my skin was until I used this product. I truly loved how it felt on my face after being applied. It was not greasy or heavy which was a plus. I did have a breakout a few times after using this. It may have been due to using a scrub on my face beforehand. I really liked it and will continue to use it. One of the best I've used so far. [This review was collected as part of a promotion.]
I have been using this night cream for almost a month now. I can truly say that I have seen a difference since using it. I am in my 30's with combination skin. My cheeks have been dry especially as the seasons change. The L'Oréal cell renewal night cream makes my skin feel hydrated. It doesn't feel oily and has a pleasant scent. I will definitely purchase this product again. [This review was collected as part of a promotion.]
I've used all kinds of night creams and this is definitely one of my favorites! I've been using it for about two weeks and my skin is so soft and moisturized! The only thing that I don't like is that there is a very slight gritty feel but it is insignificant and would not stop me from purchasing again. The Night Cream absorbs into my skin very quickly and there is absolutely no greasy feel. You won't regret buying this product! [This review was collected as part of a promotion.]
"I wish I would have known that along with the L'oreal Paris Age Perfect Renewal night cream I could have used the L'oreal Paris Age Perfect Renewal Day cream as a combination. I am just in love with this product, I cant believe how smooth and firm my skin has become. Even my complexion has evened out, I am amazed at the results. [This review was collected as part of a promotion.]"
"I really like Loreal Age Perfect night cream. I have been applying each evening after I wash my face before bed. I like that this cream is light and not greasy feeling. It absorbs quickly and my face still feels clean after I put it on. It does not make my face feel tight or tingly, a big plus in my opinion. It makes my skin feel really soft, and my skin still fells hydrated when I wake up in the morning. [This review was collected as part of a promotion.]"
This product is so amazing.After a long day it is so great to be able to wash my face and use this.It completely replenished my skin without drying it out.It left my skin feeling wonderful.i love this [This review was collected as part of a promotion.]
I used it for 2 weeks. It worked well as a moisturizer and didn't leave my skin feeling greasy. I noticed a difference in my skins overall look and feel after daily use. My skin seemed healthier and I looked less tired. I do wish it came in a squeezeable tube or pump style bottle to make application easier. This product would be good for someone looking for an affordable product that lives up to its promises. [This review was collected as part of a promotion.]
"The older we get the more we loose moisture. This night cream is wonderful. Its thicker then all others I have tried and you only need a dab. I put dots all over my face because it gets absorbed so quickly , otherwise it would get into just one area. The results have been terrific, my skin in not chapped or dry in the morning. I even put it on my lips. Smells terrific as well Very nice product, and much better then the more expensive ones out in the market. [This review was collected as part of a promotion.]"
"I think it gets the skin looking supple and a bit younger looking, but it is too perfumey for me. I can do without the fragrance. Also, looks wax like in the jar like a pomade so was not really wanting to put in on my face at first. Did though and went on okay, but I would had wished a little bit more creamy. [This review was collected as part of a promotion.]"
"I have been using this night Cream for almost two weeks now. I use it after I wash my face at night and then apply it. My face is normally a combination of dry and oily. I've noticed that my skin is very hydrated and moisturized all over. When I wake up in the morning where before my skin would just be blah and dry, it is now smooth and soft. [This review was collected as part of a promotion.]"
"works well. cream (so not a lotion) but not greasy. moisturizes your skin throughout the night and you wake up w/ supple skin. i would prefer something without a fragrance, however, the fragrance was not too over powering. [This review was collected as part of a promotion.]"
"First of all the small of this cream is so omg is the best ever...I've been looking actively for a night cream that didn't make my face feel overly greasy and I have found it in this night cream, the dry spots i had are now a thing of the past. I really do love the smell of it..even the BF liked it.... [This review was collected as part of a promotion.]"
This has a great consistency for a night cream. It is thicker and feels good on. I wake up with my skin soft. The scent is also not as heavy as the day cream which is nice. I would definitely purchase in the future. [This review was collected as part of a promotion.]
Just before I close my eyes for the day I put on L'oreal Night Cream. It feels so fresh clean and soft. Feels like I am doing something good for my skin. In the morning my skins looks great. After a few weeks my skin is looking more vibrant and smooth. This is my new night time ritual. [This review was collected as part of a promotion.]
A little thicker than I would have thought. Had to message my face really good. Using it with the other products was satisfying . My skin feels smoother and softer. I have a dry skin especially during winter time and cream is helping a lot. [This review was collected as part of a promotion.]
"This smells so sweet, like a tropical spa treatment. It even tastes sweet, I accidentally licked the side of my mouth right after applying. It's so thick, like a butter, but absorbs quickly. It leaves my skin feeling soft. I haven't been using a night cream steadily, but I'm considering continuing to use this. I've been using it for 2 weeks and the jar still has plenty. [This review was collected as part of a promotion.]"
I used this product for almost 4 weeks and have seen a dramatic improvement in my skin. When I wake up my skin feels soft and supple. It looks refreshed and firmer with a healthy glow. Definitely a permanent part of my skin regimen!! [This review was collected as part of a promotion.]
"I love L'Oreal Paris Age Perfect Cell Renewal Night Cream! After 3 weeks I saw a visible difference. The lines on my upper lip are less noticeable and my face has a dewey, healthy glow! I have very sensitive skin and had no problems with this product. Thank-You L'Oreal! [This review was collected as part of a promotion.]"
"I had high hopes for this night cream. But after a week use, my face got broken out and felt a bit unclean. I do have combination skin so that could be part of it! I also would like to say that it has a strong scent that I would wake up smelling randomly! Nothing major but if someone is sensitive to scents, this product is not for you. I discontinued use after the week of using it and my skin cleared right back up. [This review was collected as part of a promotion.]"
"I really liked it as a moisturizer, this works great for me and my skin. You don't need to use a lot, a little bit and and it goes smoothly on. I like it because the next morning your skin is feeling great and relaxed like after a spa Day. [This review was collected as part of a promotion.]"
"Absolutely Love this L'Oréal night cream. It has made a great difference in my skin and dealing with the elements of the cold winter weather and moving to a different part of the country. Thank you, finally I'm looking forward to getting up and pretty myself for the day! [This review was collected as part of a promotion.]"
"I think it felt great on my skin and restore Resilience, Radiance, Vitality, Stimulates surface skin renewal, creamy texture comforts, nourishes skin. I didn't felt any discomofort or stinging in the eyearea and mostly I have really sensetive skin. [This review was collected as part of a promotion.]"
I have been using the L'Oreal night cream for about 2 weeks now. I love the consistency of it and the smell. The product I was using prior did not have a separate day/night cream. I really like that L'Oreal age perfect has a day & night cream. I have some rough/dry areas around my mouth and lower cheeks. I have already noticed that these problem areas are improving. [This review was collected as part of a promotion.]
"I recently started using L'Oreal Paris Age Perfect Cell Renewal Night Cream. It has a very minimal scent, no sticky residue, no greasy feeling and it makes me look and feel great. I am very happy with the results so far and while I've been only using it a short time, people HAVE noticed. I have been asked if i have been going to a spa or getting anti aging treatments or work done on my face. I'm very proud to state it is due to L'Oreal! [This review was collected as part of a promotion.]"
"Generally not a cream moisturizer person, I go for gel or very light moisturizers, because of my sensitive skin. It did not break me out which i was afraid of, but was a little heavy, but in my opinion a lot of night creams are. But I will not be repurchasing. [This review was collected as part of a promotion.]"
"One night after using L'Oreal Paris Age Perfect Cell Renewal I was loving the feel of my face. It was so soft and smooth I couldn't wait to tell my two sisters. But I waited a week so they could really see the difference, which they did. Revitalizing the cells of my face sure does make me sleep a lot happier now! [This review was collected as part of a promotion.]"
"This product is something I will definitely add to my nighttime beauty ritual. It is non-greasy yet effectively moisturing; there is no oily residue in my pillow in the morning, just a refreshING look in the morning. [This review was collected as part of a promotion.]"
"I think this product is a great find. The packaging is beautiful and very pratical. The smell and consistency is perfect and the products claims and uses are clearly labeled. I would defintely try this product for longterm use to see the long term affects. The smell isn't very overwheling and the moisture it provides when waking up is perfect, not too oily. Overall its a great product and I would recommend it to others if they were looking for a night cream. [This review was collected as part of a promotion.]"
"I am a fan of L'Oreal products so I was excited to try this product. I found it to be a soft, perfectly thick and rich enough to help my skin without being greasy. I have used it for a couple weeks and love the way my skin feels. A great moisturizer that can be used without the worry of skin break outs. [This review was collected as part of a promotion.]"
I loved this product! My skin became so much softer and brighter looking. My fine lines began to disappear and were less noticeable. It was very easy to apply and rubbed in easily. I have very sensitive skin and many products feel like they are burning my skin. This did not happen with any of these products. I definitely recommend these products to anyone who wants to help rejuvenate their skin care. [This review was collected as part of a promotion.]
"This night cream felt nice, very thick and moisturizing, especially during these dry winter months. I'm not sure how long it takes to notice the effects, so in retrospect I could have taken a ""before"" photo to document changes along the way. [This review was collected as part of a promotion.]"
"With all due respect to Loreal, this product was not a match for my skin type. Since having very sensitive skin, it caused severe breakouts and burning. Also very greasy to me. Nothing against Loreal products as I do purchase them, but just not this specific product as I do have very sensitive skin. [This review was collected as part of a promotion.]"
I'm giving this product a 5 stars just because I love the day cream but can't tell which one is helping my face the most or if their working together so I stopped the day cream 2 days ago and will test the night cream for a week or so to see how well it is working I see wonderful results already [This review was collected as part of a promotion.]
