"I have been using the night cream product consistently since receiving it. I love the texture of the product. Nice and rich feeling and non-greasy. It is a thick cream, but it goes on smoothly and absorbs nicely into the skin. I have noticed that my skin feels very soft in the mornings after using it. I would definitely purchase this product in the future. [This review was collected as part of a promotion.]"
"This product is like butter! It feels like butter, but doesn't make your face greasy like butter. My skin feels sooo soft and supple. My skin gets a little dry in the winter, but hasn't felt or looked dry since I started using this product. Highly recommend. [This review was collected as part of a promotion.]"
I have been using The L'Oréal Paris age perfect cell renewal night creme for a week and I already notice a difference on my neck and eye area. It is not oily and it only takes a little bit to provide z lot of coverage. [This review was collected as part of a promotion.]
Wow this is absolutely a treat to use.The light fragrance night cream was a great part of a night time cleansing ritual.It went on smooth and absorbs quickly. The product seemed a little thick but After using it left my skin glowing Just right size to use every night [This review was collected as part of a promotion.]
I like how it makes my face feel so soft I have used it every night since I got it and will continue to use it forever now I was worried about it smelling bad but it didn't I plan to start using the other two products along with it [This review was collected as part of a promotion.]
I think I'm starting to see a more even skin tone and my sister in law said my skin looked good. ... hadn't seen her in a year! Should've taken before and after pics but I'm new to this so maybe next time! [This review was collected as part of a promotion.]
"I love the elegant look of the packaging - it looks great on my vanity! The night cream is thick and a little goes a long way which is a $$$ saver! The night cream had a light flowery scent, which was surprising but it was not overpowering. I liked the feeling of my face when I woke up in the morning as it felt soft and hydrated. [This review was collected as part of a promotion.]"
"This is a really unique item to me. It has a moisturizing feel to it but it absorbs really well into the skin. No oily feeling at all. I was concerned it might clog my pores but after trying it for 2 weeks, I am satisfied that it is not clogging my pores. My skin feels really soft when I wake in the morning . [This review was collected as part of a promotion.]"
"Used night creams before that just left my face feeling greasy. This night cream won't leave your face feeling greasy. It smells good and makes my face feel soft. Next morning my face feels refreshed and my skin looks brighter!! I having been using all 3 creams in this collection and my face,skin and eyes have never looked so bright and soft as they do now. Definitely purchase this item!! You will love it!! I do! [This review was collected as part of a promotion.]"
"I trully love this nightcare.I been using it for almost a month now.Let me tell you this.My skin is renewed,refreshed and brightened.I suffer from dry skin.I do not have to suffer anymore.I wake up and soft and has moisture in it.The fine lines and smoothened out and not noticeable like it was.Great product!I am buying it soon! [This review was collected as part of a promotion.]"
Maybe I was thinking it would take a bit longer but I can already see fewer neck lines. I've faithfully used my L'Oreal Paris Age Perfect Cell Renewal Night Cream for a week and the results so far are noticeable. I am very pleased. [This review was collected as part of a promotion.]
I am loving this product..I have had 4 different people tell me how much softer my face looks.... it smells amazing and doesn't go on really thick...i have adult acne and most products i cant use because of this it works wonderfully [This review was collected as part of a promotion.]
I love the night cream! I live in New England and the harsh winter dries out my skin. It was looking very dull and dried out. The day after using this cream my face so was soft and hydrated! I highly recommend this cream. I am in my thirties and was looking for the right anti aging solution. I definitely found it and will continue to buy this product. [This review was collected as part of a promotion.]
"I love this night cream paired with the day cream. The smell is very good, not to over powering. Day and night cream combination makes my skin plumper, soft, and smooth feeling. Make up mixes well with both. Night cream is perfect texture to not make my face greasy when I wake up. Skin feels refreshed and soft in the morning. Would highly recommend this lotion. [This review was collected as part of a promotion.]"
"The night cream left my skin like an oil slick the very first time I tried it and the heavy perfume smell was hard to take. I tried it a couple more times, but same result each time. Rather than toss it, I decided to use it as a ""body butter"" on my lower legs, knees, and elbows - it did soften these areas up without making them oily and the smell was far enough from my face that I could breathe. [This review was collected as part of a promotion.]"
I have used this product for about 2 weeks. I haven't noticed any extreme difference. The scent reminds me of putting sunscreen on. It absorbs into the skin and doesn't leave any greasiness which I like.I will continue using it and see if I notice any difference. [This review was collected as part of a promotion.]
"I have dry and sensitive skin. This product was amazing. It's a very thick cream, but it doesn't feel heavy on your face at all. It was so moisturizing to my skin as soon as I applied it. After about 10 days of using the product, my face feels better and looks better even with dealing with winter weather. It's soft and feels refreshed. [This review was collected as part of a promotion.]"
L'Oreal Paris Age Perfect Cell Renewal Facial Night Cream SPF 15 is the absolute best aging product.There is no strong scent on this product which I love! The cream is Makes your skin feel so sooth and it's light you don't even feel it oh your face. This product made me glow! By far the best Aging product Definately recommending to family and friends! [This review was collected as part of a promotion.]
I really like this night cream. I have been using it in this winter and it really make a difference to my face. I always wake up with a supple and dewy face since I started this product. There is no more dry patches on my cheek! [This review was collected as part of a promotion.]
I started using the night cream about 2 weeks ago and I love love love it!! I wake up with smooth and rejuvenated skin. I use this with the eye cream every night. My fine lines seems to have lessened and my skin feels soft and younger. I would recommend this product to everyone. It will speak for itself if you try it. [This review was collected as part of a promotion.]
I think the night cream works well. It blends into skin quickly and has a nice texture and color. The scent is a little too strong like a perfume. I don't like the lid and how it has to screw on just right. I would prefer a pump style. [This review was collected as part of a promotion.]
I think the night cream has a very pleasant light scent. I liked the smooth creamy texture. I found the cream easy to apply and it was quickly absorbed. I touch my face and it feels soft and smooth. I really like this product. [This review was collected as part of a promotion.]
"This product is thicker than the day cream, a little more greasy, but seems to work wonders. My face is healthier looking in the morning, and my skin is so soft now. I had very dry skin on my neck and face, and after only a few days of use.....it looks so much better. I may even look a little younger because my face has a healthier glow. [This review was collected as part of a promotion.]"
Been using a week and everyday after the 1st day I have gotten a pimple somewhere spearotic on my face. Haven't had a pimple in for ever. The day cream it light. And I can seen my skin is no where near as dry. I'll up date more in couple more days. [This review was collected as part of a promotion.]
"This product delivers awesome results, I have used this for a week and have seen a difference in the texture of my skin already, it has that nice ""dewy, youthful glow "" I feel like I'm applying one of those expensive sleeping masks every night, it's so luxurious ! [This review was collected as part of a promotion.]"
At first I thought this would be to heavy for my skin because it's a thick cream but it actually is just what it needed with the dry winter air! I haven't used it long enough to actually see much change though I do think my skin seems to have a more even tone. [This review was collected as part of a promotion.]
"I think this product is wonderful! Non greasy, smells wonderful and really made my skin softer, more supple. My skin feels firmer and looks radiant! Before you buy this product know that it is very gentle ands totally works! I love it! [This review was collected as part of a promotion.]"
"When used along with the Day Cream, L'Oreal Paris Age Perfect Renewal Night Cream creates a 24 hour protective plan for the skin of mature woman. It continues everything that the Day Cream began to keep skin moist and plump so wrinkles and skin become less noticeable. A small amount is all that is needed. Pat it lightly all over the face and neck to create a nighttime barrier to keep skin moisturized and protected. [This review was collected as part of a promotion.]"
I think that this is a pretty good product. I have been using L'Oreal Paris Cell Renewal Night Cream every night for the past two weeks. This cream smells good and does not irritate my skin! I have recommended this night cream to my sister and she also loves it! [This review was collected as part of a promotion.]
"I think this Cell renewal Night cream is the perfect cream. It goes on very smooth and doesn't feel greasy after it has soak in to your skin. I have been using this cream for about two weeks. I can already tell a difference in the way my skin looks and feels. Some of the lines on my face are not so disincentive. I would recommend this night cream to anyone, wanting to have younger looking skin. [This review was collected as part of a promotion.]"
"L'Oreal Age Perfect Cell Renewal Night Cream is great. The first time I put it on it stung a little but that did not happen again. The product is thick like creamy butter, which is what I want in a night cream. It's not greasy and has not clogged my pores. My skin has been super dry from running the heater all winter. This cream definitely moisturizers all night and leaves my skin feeling great in the morning. [This review was collected as part of a promotion.]"
"OK! YA'LL, I have been using the L'Oreal Paris Age perfect Cell Renewal system for a week straight and my skin feels and looks amazing! MY face is softer, glowing, more supple. It looks amazing! My face feels better in this one week than it has my entire life!! I am HOOKED on this and I will continue using it in my daily skin care regimen!! [This review was collected as part of a promotion.]"
I think this #L'Oreal Paris Age Perfect Cell Renewal night creme every night for a week. My fine lines and uneven textured skin is smooth and radiant I feel as though I look ten years younger than my current age of 38 see pic below [This review was collected as part of a promotion.]
"this cream is really great! it has a thick, luxurious texture and absorbs easily into my skin. it makes my face feel moisturized without feeling greasy. It also has a pleasant fragrance which causes my husband to tell me my face smells good. :) [This review was collected as part of a promotion.]"
"I think this product is amazing! You definitely can tell a difference in your after using it. I would recommend this to all women! Great stuff at an affordable price. You'll love it, so go ahead and give it a try! [This review was collected as part of a promotion.]"
Love the night creme you can feel not only feel how soft this is making your skin but you can also feel the exfoliating effect. Not too greasy just the right amount of mositurizing . This is a great product I will continue to buy this product. My face is already showing less lines and looking more youthful. [This review was collected as part of a promotion.]
I tried this product and love it. I put it on at night before bed and it has made my skin very smooth. My daughter who is having really bad acne has even tried it and loved it. She also agreed how smooth it made her skin feel. I also loved the smell of it too. [This review was collected as part of a promotion.]
"I felt like my skin was really refreshed and clean going to bed, especially in combination with the eye cream. I felt that after only a few days my skin felt firmer and it really helped with the bags under your eyes. Great product! [This review was collected as part of a promotion.]"
"The Age Perfect Cell Renewal Facial Night Cream is thick, and luxurious. The smell is amazing as well, without breaking out my sensitive skin. In one week of use I'm noticing no dryness or flaking, and smaller pores. My skin is now showing the first signs of aging, and this cream has helped the fine lines, dull appearance, and dryness associated. I was running for more before the first jar was empty. [This review was collected as part of a promotion.]"
"After I wash my face at night, I apply the night cream. My face doesn't itch during the night and it doesn't feel dry in the morning when I wake up. My face feels smoother and healthy since I have been using the product. [This review was collected as part of a promotion.]"
I was pleasantly surprised by this product. It did not irritate my skin and did not seem to clog my pores. However I was previously using a moisturizer for sensitive skin and noticed very little difference between this line and my other moisturizers. Also I would not recommend this product for sensitive skin because it is pretty heavily fragranced. [This review was collected as part of a promotion.]
"The Loreal age perfect cell renewal night cream is rich and creamy, but not greasy on my face. My mother in law is staying with us for the holidays, and she has been using it as well! She loves it so much, I'm sure it will find it's way into her bag when she goes home! [This review was collected as part of a promotion.]"
I was very happy with this Night Cream. Definitely a bit thicker and heavier on my face than the Day Cream but I think most people want the heavy duty stuff at night while tucked away in bed. And voila you wake up in the morning with a thoroughly moisturized face! [This review was collected as part of a promotion.]
"I liked the night cream much better than the day cream. I didn't quite like the smell of it, but prefered the texture of the night cream over the day cream. I have been using it for several days and it has helped with hydration. [This review was collected as part of a promotion.]"
"Before I started using L'Oreal face creams, my face felt dry and dull. The first day I started using my face easily absorbed the creams and felt moisturized. My face felt really good. A few days later you could see the difference my face looked bright and my smaller wrinkles looked minimized. I would recommend this product to my friends and family. [This review was collected as part of a promotion.]"
I have been using the product for just about a week now. So far I like the product it's not greasy I am also taking weekly photos to see how much of a change it will make with my skin. I'm excited to find out if I just ran out of the product I was using. [This review was collected as part of a promotion.]
"This super creamy formula is perfect for night! It's not too heavy or light. I would love to use this on my entire body because it is so smooth! It leaves my skin feeling soft and silky. It does have a nice fragrance, but I would prefer it to be fragrance free for my sensitive nose. Overall Big THUMBS UP! [This review was collected as part of a promotion.]"
I like that this is part of a two step program. Who needs more then that!? I also like that it is not to thick and not too thin. It absorbs well and has a pleasant very faint scent. You don't need a lot so I think the jar will last a long time. [This review was collected as part of a promotion.]
This face cream is awesome! The consistency is great BUT the fragrance was way too strong for me. It gave me a headache trying to go sleep with it on. My skin does look better though and feels so soft. I was worried about breakouts since my skin is combo oily/dry (mostly dry) and that was not an issue. [This review was collected as part of a promotion.]
"I have oily, acne-prone skin, so the L'Oréal Night Cream leaves my skin feeling too dewy and sticky. It does absorb fairly quickly, but I've been using it a week now and I feel like it's making my skin even more oily than normal. I'm going to keep trying it for the remaining 3 weeks, but haven't seen any positive difference in my skin so far. I'm an optimist, though, so we shall see! [This review was collected as part of a promotion.]"
"This product has caused my face to breakout like crazy! I am not acne prone at all, but after 3 days of this product, my face had pimples all over and is really oily! I initially loved the feel and smell of the cream, but this is unacceptable! [This review was collected as part of a promotion.]"
"After only using this product one time, I have already noticed a pretty large difference. Upon waking this morning, my skin felt completely different. I have always used moisturizing products on my face for the past 20 + years and I can definitely feel a difference with these products. In particular, using such a luxurious product before bed creates a relaxing ritual that made me feel good about what I was doing for myself as well created fantastic results. [This review was collected as part of a promotion.]"
"The night cream is a thicker cream which I thought would take a while to soak into the skin, but it goes on very smoothly and no stickiness. It has a pleasant smell. I wake up refreshed and my skin definitely feels smoother and looks more refined [This review was collected as part of a promotion.]"
"After using this product for a week I have noticed that my skin is smooth and soft. My fiancé has also noticed the change and says we will be buying this product for a long time. Friends have noticed and asked ""What are you doing different?"" so I explain to them about the product I am trying out and now they all want to know where to get it. I am very amazed and happy with the results. Thank you for allowing me to try this product. [This review was collected as part of a promotion.]"
Great fragrance! Usually after washing my face it feels very dry and tight. After applying Loreal night cream my face felt very soft and smooth. It created the perfect smooth palet to apply my makeup. So far Im' really liking this night cream. [This review was collected as part of a promotion.]
"I am loving my L'Oreal Paris night cream. My face feels soft and firmer. It has such a lovely glow. I've been using it for almost a week now and my face looks and feels great. This time of year I usually get such dry skin, but it looks and feels moisturized! Loving this!! [This review was collected as part of a promotion.]"
"Have you ever put on a night cream and wake up with your Face print on your Pillow cases ?? You won't have that with This L'Oreal night cream . Soaks right into your skin . No greasy after feel , just pure silky feeling skin . I woke up & my Face feels so Soft . Thank you L'Oreal !! [This review was collected as part of a promotion.]"
"Unlike the eye cream and the day cream I. this line the Cell Renewal Night Cream did not work out so great which is a bummer, because the day cream and eye cream in this line are fantastic and I highly recommend them both. The night Cream is found to be much more heavily scented and for me the scent did not disappear for a while after application. I also found the night Cream to be very heavy and thick on the skin. [This review was collected as part of a promotion.]"
"I have been using the night cream for about 1 week. My face feels nice and moisturized, even in the morning. The night cream does not leave my face feeling greasy. My complexion seems to be evening out. [This review was collected as part of a promotion.]"
"After only three nights using this product, my skin feels so much softer and looks amazing. I have already had comments from people! I would recommend this to everyone! My skin is much smoother and I even though I didn't have a lot of wrinkles, I do notice a difference. My face is firmer and age spots seem to be vanishing. This night cream smells great and leaves my skin super soft. Thank you so much!! [This review was collected as part of a promotion.]"
Well I have been using the night cream for a week now. My face broke out really bad after about three days. I liked the smell of the product but it did leave my face feeling a little greasy. I've stopped using it for now until my face clears up. I do plan on giving it another try though. [This review was collected as part of a promotion.]
"I think this product is great, a little goes a long way, which means I get a lot for my money. My skin is starting to feel smooth and soft. Also I use to have dry skin, but now that I am using age perfect I do not have dry skin at night anymore. Thanks so much for this wonderful night cream. [This review was collected as part of a promotion.]"
I found this cream to be as smooth as velvet and it smells wonderful. In just a few days I have noticed a huge difference in the moisture and texture of my skin. I am very surprised at the difference. Many of the moisturizers I have tried left my skin feeling oily but not so with this product. It quickly absorbs and leaves your skin soft and velvety. Wow I love it ! [This review was collected as part of a promotion.]
"I actually like the creaminessof the night cream better than the day cream. Love how it makes my skin feel and look...even after a good nights sleep! The smell is also great and doesnt take much to cover face, neck, chest and then I still have some for the top of my hands! [This review was collected as part of a promotion.]"
I think it's great to put a product on at night so you don't have to worry about any make up or it coming off in the rain/weather. The Age Perfect Cell Renewal night cream feels great on my face and makes it feel soft. [This review was collected as part of a promotion.]
"Loved this product...its rich creamy and went on smoothly on skin. I have combination acne prone skin so initially i was fearing that this product might cause breakout, but wow..it left my skin very smooth and its very hydrating.It didn't cause me any breakout. Its a perfect night cream for dry winter weather. I would definetely recommend this product and would buy it. [This review was collected as part of a promotion.]"
"I received this product approximately 10 days ago. I love everything about it. The smell, texture and how it makes my skin feel. I have always been very sensitive to facial creams and lotions. I have not experienced any negative side effects with this product. I will definitely buy this product again. [This review was collected as part of a promotion.]"
"Being completely honest, I have never been so dedicated to my moisturizing ritual as I have been, since try L'Oreal Age Perfect Night Cream. I love the silky, smooth feeling my face has after using this product. Before going to bed, I look forward to washing my face, and using this moisturizer.My skin has a natural glow, like I have never seen before!! [This review was collected as part of a promotion.]"
I have enjoyed using the L'Oreal Paris Age Perfect Cell Renewal Night Cream! During the winter my face tends to get very dry and flaky but this has helped reduce the flakes. It is easy to apply and I also like the way it smells which is a big deal for me! It takes me just minutes before bed to put it on. I have already recommended it to a few friends and will continue using it. [This review was collected as part of a promotion.]
"This night cream is wonderful, goes on smooth, absorbs fast and leaves my face very soft. It smells nice but it does leave a residue on my pillow if I lay down too soon after applying. I put it on nightly before bed and I can still feel it working in the morning. It is gentle enough for me to use every night and doesn't cause me to break out. I think this is my new go to nightly moisturizer. [This review was collected as part of a promotion.]"
I'm used to night creams being thick but this product goers to a whole new level and the smell is so fresh! A little goes a long way and my face was not left greasy. This is one of my favorite ever! [This review was collected as part of a promotion.]
"I usually use products that are not heavy creams or fragrances. I feel these are a bit heavy on both. I have sensitive skin, so I'm curious to see how it does. Only a few days in and it does make my skin feel smoother. More interested to see how eye cream does. [This review was collected as part of a promotion.]"
I think this night cream is great. In just one night My face was softer and very much healthier looking. The only draw back on this product is that it takes a few minutes to dry but the outcome is well worth it. This is a must have for anyone [This review was collected as part of a promotion.]
