4.1,"['512', '366', '156', '54', '30']"
"Best 'drug store' brand I have found yet. I have worked many years as a beauty specialist in big box stores and used the high end brands, like Visionnaire ( Lancome) and Miracle Worker (Philosophy), as well as some by Estee Lauder and Dior, this one worked just as well! My skin had plumpness, clarity and smoothness. A real winner!"
"I have moisturized every day since I was a teenager , it makes a huge difference especially when you use quality products like this one. It smells beautiful and I noticed that overnight it maintains skins softness and feels fully moisturized in the morning. I love it two thumbs up !!"
I have been using Revitalift for many years. It is not greasy and does not clog my pores. It has kept my complexion fresh with fewer lines and wrinkles than you would expect for a 68 year old woman. I have gotten compliments on my complexion from friends and strangers. I use it twice a day. Thank you for a great product.
I received these for free and I must say that I wish I had discovered this sooner. It really does make a difference. I want to let everyone know that if you plan on earing makeup after applying wait at least 15 mins and don't apply much. A little really does go a long way. Your skin will be left smooth and plump. It feels amazing on the skin! It is very moistering ao if you like more of a gel feel then this may not be for you. Love this product! [This review was collected as part of a promotion.]
"This smelled good. I used it as a night cream mostly and it was fairly hydrating. It left the skin with an almost light, rubbery feel that I think is associated with silicon based products. I liked this but also thought if was a little strange. I would possibly buy this again to use as a night cream and it got me interested in other products in this line. [This review was collected as part of a promotion.]"
"I received this product as a sample. I applied it to my face, it looked nice. My skin felt really slippery and matte. BUT the product doesn't even absorb into the skin. If I touched it, it started to just come off. White little rolls of this stuff. Disgusting and had to rub my face with a towel just to get it off. Worst product. [This review was collected as part of a promotion.]"
"Not a big fan of this product. I think it's too heavy and smells a lot like perfume. I prefer a cream that is more lightweight without a fragrance or scent. My products don't need to smell good, they just need to work. For the price I would not buy this product in the future. Its nothing special. I did receive this product for free in order to review it. [This review was collected as part of a promotion.]"
"I have serious problems in my forehead, big dented lines I look older, but now everything change thanks to this cream , the only thing is hard to find it , is this going to be discontinued???"
"I bought the eye cream, serum, and moisturizer in this Revitalift Volume line. After almost 2 months of religious day and night treatments, my skin looked dull and waxy. Completely lifeless. Would not buy this again. Would not recommend it."
"I bought this product, a couple of years ago. I am sorry to say, I loved the texture . But I was not pleased with the length of time it stayed on. Kindaof smears easily."
"I am so happy I bought this. I was looking for a good affordable but effective face cream. This did the trick. The results on my face have wonderful. My skin looks smoother, healthier, less wrinkled. VERY HAPPY I TRIED IT!"
"It has a nice, decent smell."
This is the best moisturizer I have ever used. Makes my skin feel so soft.
It was very fast and easy to do. There was no line no problems no worries.
"I recently received this product in a VoxBox from Influenster.Is very different from any moisturizer I've used , non-greasy and absorbs well . The ingredients are incredible. The finish is a smooth and the benefits amazing. [This review was collected as part of a promotion.]"
I'm usually not the biggest fan of day creams because I have oily skin but this one is a winner. It feels weightless and very comparable to higher end products. I will definitely be repurchasing it. I received this item for free for review purposes and am really glad I did! Found a new go to day cream! [This review was collected as part of a promotion.]
"While this felt nice on the skin, I did not feel it did a very good job of moisturizing. My cheeks still felt dry after it had sunk in. The rest of my face which is normal/oily felt fine. I would recommend this for use in summertime for light moisturizing or for people with normal/ oily skin. If you have dry skin you will need something else. I received this product for free in exchange for writing a review. [This review was collected as part of a promotion.]"
"Not a fan of this product. I think it's too heavy and smells a lot like perfume. I prefer a cream that is more lightweight without a fragrance or scent. My products don't need to smell good, they just need to work. I did receive this product for free in order to review it. [This review was collected as part of a promotion.]"
I received this product in exchange for an honest review. I honestly love it. It has made my skin much more smooth and has erased many fine lines. No breakouts. Light fresh scent. Feels like velvet. Amount lasts a long time. I've been using it for about a month and I've only used about half of the container. [This review was collected as part of a promotion.]
The product was ok but goes fast and is not a miracle worker. I prefer a water based moisturizer and this just seems so/so. I received this product for free from Influenster and L'Oreal for my opinion. For the price I would go with the Neutrogena Water Based moisturizer. Lasts longer and feels great on your skin. [This review was collected as part of a promotion.]
"I got this for testing and reviewing purposes and love the formula however did not care for the smell of this at all. it is highly fragranced so if you do not like your facial lotions to smell, I would stay away. I also reduced another star because even though it feels like it is very smooth it does feel a little heavy and does take time to soak into the skin. (making me wait longer to put my make up on) I do have sensitive skin and did not break out. [This review was collected as part of a promotion.]"
I was very pleased with the product results I would definitely buy it again [This review was collected as part of a promotion.]
I would buy again and would recommend to a friend. [This review was collected as part of a promotion.]
I received this product for testing purposes from influenster. I love love this cream! I have extremely dry skin and this cream is very moisturizing with out being greasey. It also smells great! [This review was collected as part of a promotion.]
The moisturizer works great and is true to it's name! Definitely moisturizes just the right amount and after a few weeks you can tell a difference when used with the other products in the line. **I received this product complimentary for review. [This review was collected as part of a promotion.]
"I tested the L'Oreal products that I received for free in my Influenster Vox box. This product had a nice smell and went on smooth. I would have to say that this product is better than using nothing at all. I usually use Olay product. Now that I'm almost done, the only thing holding me back from trying this product again is the price. [This review was collected as part of a promotion.]"
"I received this in a set for my opinion of the product in a VoxBox, through Influenster. That being said. This is my 2nd favorite product I received. I love how soft my skin is after applying, and I only have to use a dot to cover my face and neck. I also really like the light fragrance it has, it's very relaxing. [This review was collected as part of a promotion.]"
"Thank you L'Oréal and @influenster for allowing me to test and awesome product. This went on smoothly, non-reactive and non-performing smell. I instantly had softer looking and feeling skin. With most products in would experience break-outs, not with this."
"I liked this product, good smell, husband is sensitive to smells.  He didn't complain so that's always a good sign, once I had to take a 2nd shower to wash off a new body wash (hence the product went into the trash). Non irritating, skin feels nice and smooth with it on. I received this product free for my honest opinion. [This review was collected as part of a promotion.]"
"have terrible experience with moisturizers that don't actually moisturize, feel heavy and seem to sit on top of my skin. Thankfully this Revitalift moisturizer is nothing like that. My skin actually felt moisturized. And I didn't feel the need to reapply multiple times. Combined with the other Revitalift volume filler line, I saw a noticeable difference in my makeup application and appearance. I received this product in the Loreal Influenster Voxbox. [This review was collected as part of a promotion.]"
I received this as a free product tester for Influenster. I couldn't be happier with this product. My face feels ao smootha nd soft after using. The product is light and fluffy and has a great smell. I see visible difference is n about three weeks. Highly recommend. [This review was collected as part of a promotion.]
"This product definitely smoothed over a lot of blemishes, fine lines and discolorations I had. I've been using it for over a month and although I dislike the smell, the texture is comfortable and the effects are worth the money. Note: I received this product free for review. [This review was collected as part of a promotion.]"
"I really like this moisturizer. I love the smell, the consistency, moisturizing feel on my face and how it made my face feel all day. It did make my face tingle and my cheeks red all day. But I over all liked it. [This review was collected as part of a promotion.]"
"Now that I have started using this product for several weeks I cannot go without it in my daily routine. This product helps to restore moisture to my dry skin, makes my skin extremely soft, and I do not feel the lines and wrinkles on my face the way I used to. I received this product free for testing purposes via Influenster. #AskSkinExpert [This review was collected as part of a promotion.]"
"I received the L'oreal Paris Revitalift Daily Volumizing Moisturizer for Free to try & review from Influester. The Volume Filler retains skin moisture, helps with fine lines and wrinkles, & makes your skin look younger. [This review was collected as part of a promotion.]"
"This works very well, it's also strongly scented. I wish it was unscented as it would then be perfect! I have very oily skin and this was a very thick product. It sat on my skin if I applied normally. What I did, was pat my face dry after washing and used half the amount I normally would. This method worked very well! Highly recommend! [This review was collected as part of a promotion.]"
I really loved the smell of this moisturizer. A lot of times moisturizers that are supposed to work well don't have a very good smell but I had to problem with this scent. My only issue was that sometimes it didn't work well with my foundation and it kinda peeled off of my face which wasn't very attractive. I received this product for free to test from influenster. [This review was collected as part of a promotion.]
I love this stuff! It has improved the fine lines on my forehead in a short period of time. The cream feels amazing on my skin and does not leave a greasy feeling. I received this product complimentary but plan on purchasing again when I run out! [This review was collected as part of a promotion.]
"I received this for reviewing purposes, I've been wanting to try it for a long time but let's face it, it's pricey for anti aging products. This stuff is amazing , leaves your face soft smooth and healthy looking! [This review was collected as part of a promotion.]"
"I received the RevitaLift Volume Filler for free from Influenster to try out and review. I liked the Daily Moisterizer alright but found it to be a little to heavy for my face, I have oily/combination skin and this made my face feel extra oily, however I did notice a little difference with my fine lines! [This review was collected as part of a promotion.]"
"This didn't work terribly well for me, but it may just be my skin. It can be sensitive. I noticed a few other reviews that said their skin looked dull or waxy. In my case those might no be the perfect words, but it was certainly a bit duller than usual. Influenster sent me this line to review. So far the eye treatment gets a hearty endorsement. The rest I have a more mediocre feeling about. [This review was collected as part of a promotion.]"
I received this product from Influenster free for testing purposes and I am on my 3rd week of using it. I love it. My fine lines are disappearing and my crows feet have all but flown away. This is a miracle product. My cheeks look fuller and my face looks less hollowed out. I just love this product. [This review was collected as part of a promotion.]
"I got this product complimentary for review purpose. Having said that, I am not a huge fan of this cream. It does nothing to skin. It is an okay product. As a day cream, I feel it should have some SPF. I would have preferred something with SPF 15. The cream is just right. It is neither thick or runny. It goes on great and is absorbed quickly. It does have fragrance and since I am sensitive to smell, it feels a bit too much. Other than that it is an okay product. [This review was collected as part of a promotion.]"
"I bought this 3 days ago and I'm so disappointed, my skin looks more dry."
"What a waste of my money!! When this product dries, it begins to turn into a white powdery film on your face. I have to get a wet washcloth and patted on my face to set it. It eventually starts to become powdery again and then I just wipe it off."
"I received the samples to try. I like how the product works, i noticed a changes in my skin. It's nice and easy to use you skin feels nice and soft afterwards. [This review was collected as part of a promotion.]"
Oh my goodness this day cream is to die for I have used it every day for four weeks and I'm in love !!! I recommend this to everyone I'm 46 years old and couldn't be happier [This review was collected as part of a promotion.]
I love this product. I received this compliments of Influenster to try and review. This is an excellent moisturizer. Leaves skin very soft feeling.I will continue to use. [This review was collected as part of a promotion.]
"I love this product, makes the skin look healthy, radiant and feels soft. Minimizes the appereance of wrinkles. [This review was collected as part of a promotion.]"
This product came free from #influenster. Not sure I was going to like it because it is so thick but I ended up loving it! It absorbs nicely into my skin and I feel hydrated all day. [This review was collected as part of a promotion.]
"I received this to try and review. i love it's smell and the way that it leaves my skin feeling. it says that you can also use it in the morning, so i do wish that it had spf in it. [This review was collected as part of a promotion.]"
"This moisturizer is fabulous! It's very hydrating without being greasy and compared to much higher priced eye treatments, it doesn't break the bank. I would definitely recommend! [This review was collected as part of a promotion.]"
"I received a 14 day sample. I'm on day 4 and have noticed a huge difference. It seems to even minimize my pores. I love the scent and the way it makes my face feel. It's so much softer, smoother and my skin tone is more even. I highly recommend this product!! [This review was collected as part of a promotion.]"
I received this complimentary from Influenster for testing purposes. This was soooo thick it feels more like a night cream. I had to wait forever for it to set before I could put on primer otherwise it would leave residue pieces all over my face. [This review was collected as part of a promotion.]
"I really like this moisturizer it replenished my skin fullness and it did help smooth out my fine lines and wrinkles, it said I could see results within hours although I did not. I did however see results within about two weeks of using it my skin was more plump and more from. I did see a reduction in my forehead wrinkles they seemed significantly reduced as well as my crow's feet. I did receive this product for free but my opinions are my own [This review was collected as part of a promotion.]"
"After using this cream in conjunction of other products from the same line, my skin feels smoother with a glow and the elasticity of my skin feels better. I have combination skin and this cream does not feel greasy with this moisturizer. I receive this product free of charge to test in exchange of my honest review. [This review was collected as part of a promotion.]"
This day cream made my face look very greasy with and without the facial serum that was recommended. This might be good for those with dry/normal skin but I'd definitely do not recommend this product to those with oily skin. I also wish this was packaged in a tube form. I did get this product from Influenster to review. [This review was collected as part of a promotion.]
"Great product! My favorite part about this product is that when applied and smoothed into the skin, it gives a nice satin finish. Nothing shiny appears on my face and it does not make me look greasy! BONUS! The packaging is nice, but its not hygienic to continually stick your fingers in a jar to get the moisturizer out. I appreciate a pump or a squeezy tube more. I received this product for free and have given my honest review on it. [This review was collected as part of a promotion.]"
I really like this product. I used it for 30 days before reviewing and can honestly say that I have noticed a reduction in the irritating lines I have around my eyes and mouth. I would definitely purchase it again and am very happy that I had the chance to sample it for free. [This review was collected as part of a promotion.]
"I tried this product with high hopes. I was disappointed. It left my skin feeling very heavy and greasy. Thanks to Influenster for sending this to me for free. I enjoyed the other products in the line, just not this one. [This review was collected as part of a promotion.]"
"It has a light floral scent, if you are sensitive to scent it may not be for you. It is very moisturizing, and leaves a soft velvet feel. The only con is that when I layer it with my other skincare, it balls up. Like you are peeling from a sunburn. The other problem that it's in a jar. I'd rather have it in a pump, but that's just personal preference. I think it would be great for low maintenance days, or if you're in a hurry. ** I received this item from Influenster for a review. ** [This review was collected as part of a promotion.]"
"I have noticed the most improvement in my skin texture by using this product every day for the past month. I've tried the full Revitalift line, and I feel like this product worked the most on my skin to plump, moisturize, and smooth the texture of my skin. It works incredibly well when applied right before your makeup! I received this product for free to test out in my home. [This review was collected as part of a promotion.]"
"I like how rich and moisturizing this product is, I am combo oily skin type so i mostly used this at night. and its great for that. It has a very pleasant scent I didn't notice drastic changes in my skin. I think if you have Dry or Normal skin you will enjoy this product. I received this products complementary from Influenster for testing and review purposes ... thoughts and opinions are my own. [This review was collected as part of a promotion.]"
"I like this product but it is not a miracle worker. I am 42 years old, and my main ""issues"" are fine lines and big pores. After wearing this product for 8 weeks, my skin feels smoother, and the elasticity of my skin feels better. It does not feel greasy on my oily skin. The scent is ok. It's not overwhelming. I wish that it has SPF. Overall, the product is not bad for its price. I received this product compliments from Influenster, in exchange for my honest reviews."
"I love this day cream! It does a great job moisturizing without being greasy, and my makeup goes on really well on top of it. My skin can get very patchy and dry throughout the day, and after using this for a month I've notice a decrease in the patchiness and an evening of my skin. Love it! I was given this product for free to try. [This review was collected as part of a promotion.]"
"I am new to all this skin treatment, but this whole set has to be the best thing for a newbie like me. I don't nee to do much researching...or mix match combos, everything is worth its money and actually works. I need help with that dry skin and keep firm skin. I like the texture of this serum and the way it feels on my skin. I love the light fragrance, which is comforting helps me fall asleep! I LOVE THIS. this was free as I was a tester and I would buy again!!! the entire set...its neat [This review was collected as part of a promotion.]"
This has become my new moisturizer. I love the supple feel of my skin. It absorbs into my skin well and has improved the look of my skin. I have really noticed a change in the texture as well. I highly recommend this product to all skin types including sensitive skin like mine. [This review was collected as part of a promotion.]
"This volume filler is really great of filling in fine lines and shallow wrinkles. It applies quickly and absorbs really well. Please make sure to wear sunscreen because either can make your skin sensitive to sunlight. This works best with the rest of the revitalist line. The smell is moderate, but not distracting from the good quality of it. Full disclosure, I received this for free in exchange for my honest review from influenster. [This review was collected as part of a promotion.]"
I received this product from Influenster to try for free!!! This is a fantastic day cream!...I am 42 and have come to admit that my wrinkles are catching up with me. I have been using this underneath my makeup as an added moisturizer. I also have a deeper crease in my forehead and fine lines around my eyes and mouth. I have noticed an incredible difference. The formula is light and feels refreshing. [This review was collected as part of a promotion.]
"I loved this so much! It was fluffy, went on well, and I did not wake up feeling like I slid across my pillow all night. I absolutely loved this product! The texture was light and disappeared, and it did not leave a tacky feeling like other products. I received this as a complementary trial for testing purposes, but the results were on par with expensive salon products I have previously used. I will most certainly buy this again in the future. [This review was collected as part of a promotion.]"
This is my favorite product in the whole line. Very versatile. Use under makeup or over serum treatments. Really helps fill in lines so that your makeup goes on smooth. Love it for that. Great every day product that has really helped reduce the look of fine lines. Thank you L'Oreal and Influenster for letting me sample for free #askskinexpert [This review was collected as part of a promotion.]
"I started using this product right after i delivered my baby, its been 4 weeks and i do see a lot of good improvements in my skin.. my skin was tired, dull and lacked fullness from all the delivery process. Nd this cream has been a saver.. its a staple for me evry morning in my skin care routine I did receive this product for no cost on exchange of an honest opinion [This review was collected as part of a promotion.]"
"This was a pretty good moisturizer. I'm basing my review mostly on the results from my mother, as I have very oily skin and anything that's not gel based makes me break out and even MORE oily. It has a really nice smell, and my mom did notice firmer skin after a few weeks of use. She's gotten a couple friends to buy it as well as my sister, and they all love it as much as she does. I received this product complimentary for testing purposes. [This review was collected as part of a promotion.]"
"I honestly just could not get past the smell of this. Also, it was very thick and my skin started tingling upon application. Usually that's a sign that something is ""working,"" but then my neck started turning red. Not for me. I received these products complimentary for testing purposes. [This review was collected as part of a promotion.]"
I liked how this cream went onto my face nice and smooth. I am only 31 with small minor visible lines and wrinkles. this did not leave my face greasy or oily and did not break me out. I must say a lot of anti aging products I tried I don't know if they really work or do they? only due to the fact I don't have visible wrinkles yet and than again I think my mind is playing tricks on me if it isn't working. I did receive this as complimentary testing from Influenster. [This review was collected as part of a promotion.]
Nice creamy everyday face cream. Doesn't feel heavy on the face or greasy. It absorbs nicely into the skin allowing foundation to go on smoothly and not look cakey. There is a fragrance to the cream but I didn't feel it was overwhelming as some have said I thought it was a nice clean fragrance. All in all its a good everyday face cream for all skin types. ** I received this product in return for my honest opinion. [This review was collected as part of a promotion.]
