"I was excited to try this product to see the result. Although it was a nice product, I was not very impressed with the results. The serum moisturize your skin and feels smooth after application, however, I did not get visible difference after applying for 30 days. The box claims ""cheekbone fullness [This review was collected as part of a promotion.]"
"The container it comes in is gorgeous, I love seeing it on my sink each day--it looks so chic and expensive. The scent is so pretty, like a beautiful rose. It feels so silky on my fingers and my face. But do I see a big difference in smoothing out my lines? Not necessarily. My skin feels soft and moisturized so far but I feel I should use it for a couple more weeks for the full effect. Overall a great product from L'Oreal and I would recommend. [This review was collected as part of a promotion.]"
"Very moisturizing. Since I started incorporating prescription strength Retin-A into my nightly skincare, my skin has been flaking in spots. This moisturizer is perfect to combat the dryness that my Retin-A use is causing. [This review was collected as part of a promotion.]"
I did notice a difference near my laugh lines and the hydrating feel of it on my skin when I applied it. I'm very particular about what I put on my face and this is a product I plan to purchase in the near future as a part of my skin care regimen. [This review was collected as part of a promotion.]
"The Loreal Revitalift made my skin feel silky and absorbed quickly without leaving a greasy feeling. When I applied my makeup, it did not clog my pores and made my fine lines less noticeable. I have been using it for about 3 weeks and will continue using it. [This review was collected as part of a promotion.]"
"Revitalift Daily Volume filler works so well that it actually replenishes my skin to make it look younger and more natural. It is very easy to apply on my face in the morning and in the evening. All I need is a couple drops to make my skin look more full and natural. After using this product my skin is more natural, hydrated smoother and fine lines are less visible. This is a great product and I love using it everyday! [This review was collected as part of a promotion.]"
"This L'Oreal Paris Revitaliftt® Daily Volumizing Moisturizer went on smooth with a light fragrance smell. I loved that it worked wonders in all different weather elements and kept that non-greasy silky feel. I have seen a slight improvement over a few weeks, [This review was collected as part of a promotion.]"
"This is the only Loreal product that I was using before this assignment came along so I can give a review for about 6 months worth of use. In general, I like the product and definitely think that it is good for the money. I use it under my eyes and where my dimple creases are every morning. It does a good job of relieving the fine lines by adding moisture. I like the packaging, very cheeky to make it look like a hypodermic. [This review was collected as part of a promotion.]"
"Love the product! It makes my skin so smooth, and it stays moisturized all day without feeling at all greasy. I haven't noticed much improvement with the fine lines, but I still really like the product as simply a moisturizer. I would continue to purchase this. [This review was collected as part of a promotion.]"
L'Oreal Paris Revitalift® Daily Volumizing Moisturizer Got it free ty She Speaks for giving me the opportunity to review this Product I simply loved it. Makes my skin feel smooth. I've seen results sense I started using L'Oreal Paris Revitalift® Daily Volumizing Moisturizer LOVE IT! [This review was collected as part of a promotion.]
I like the feel of it when I put it on . I also like the fragrance of it. It went on smoothly. It also gave me a cooling feeling on my skin. I have not seen any difference in the fine lines on my face but it seems to make my skin feel softer. [This review was collected as part of a promotion.]
"I enjoyed using this cream, it felt lightweight on my skin and not greasy when I applied my makeup. The fragrance was not overpowering and light. I can't say that I notice much improvement on my fine lines although I think it moisturized nicely. Will continue to use this product. [This review was collected as part of a promotion.]"
"After using this morning and night I have to say that while my face seemed more hydrated I didn't notice much change in the fine lines around my eyes. I'd like to have tried this with the matching moisturizer, maybe I would be seeing better results. I love the dispenser, just the right amount delivered for each use. The scent is pleasantly light to me. I plan to continue use while adding the moisturizer to my AM / PM skin care routines. [This review was collected as part of a promotion.]"
"Fast absorbing but very silky on the skin with no strong scent. I applied it morning and night, the applicator made is mess free and easy to store. I did see a mild difference on those thin lines I have around the eyes so I will continue using this product with my daily skin care routine. Great product [This review was collected as part of a promotion.]"
"This product was great. It went on so smooth. The only part I didn't like was how sticky my hands were after applying it. As far as improvements in my skin, I would say that my skin was smoother and more supple. I really liked the product. [This review was collected as part of a promotion.]"
"I tend to have dry skin, but sometimes it can get oily in the summer months. The Revitalift Daily Volumizing Moisturizer is a nice light weight moisturizer that absorbs into the skin fast without leaving it feeling greasy. A small amount goes a long way. [This review was collected as part of a promotion.]"
"I liked the way it felt on my skin. It wasn't greasy at all and, miraculously, didn't make me break out. I can see a small difference in the fine lines. The smell was pleasent, but too strong for my liking. [This review was collected as part of a promotion.]"
I really love L'Orel product and l this would be something I could use in my everyday routine. This product had a nice creamy constancy with a very nice light scent which I very much liked. I tried it for approximately 2 weeks both morning and evening. I did notice that it left my face feeling very hydrated [This review was collected as part of a promotion.]
"This isn't the best moisturizer I've tried, and it's far from the worst. It's much more fragrant than my normal product, which took some getting used too. I liked the thick consistency of the product. It did a great job hydrating, but I didn't see a ton of difference in my fine lines. I think for me, this will be a better product once the weather turns cold and harsh. [This review was collected as part of a promotion.]"
"I was very diligent with this product. I enjoyed the applicator and application. While I did not see any real change or improvement....I would consider trying it again, along with another of the products in the line. Not certain it should be sampled as a stand alone product. Thank you for allowing me to participate. LDS10 [This review was collected as part of a promotion.]"
This product is amazing! It is so silky smooth like silk! My skin loved it...i used it as directed every morning and evening and i noticed results in as little as two weeks! My skin is so soft and brighter than it was. I will definitely continue to use this product and probably more in this line! Thank you so much for an excellent product!! [This review was collected as part of a promotion.]
"I did like this product very much.It did absorb very quickly.After few weeks of using it I can see small improvement in my skin,wrinkles are little softer.Skin feels more moisturized and softer.Only one small complaint is the scent,it""s little too strong,but it's great product. [This review was collected as part of a promotion.]"
Excellent moisturizer! I actually saw a decrease in wrinkles. Especially around my nose and mouth. My marionette lines are much less noticeable . My skin is soft and supple. I would definitely recommend this! [This review was collected as part of a promotion.]
"This product absorbs quickly and has a light, pleasant fragrance. I love that it doesn't make your face look oily. After using this for 4 weeks I've noticed my skin looks smoother, firmer and more hydrated. [This review was collected as part of a promotion.]"
"L'Oreal Paris Revitalift filler is a product I enjoy using. It does make my face feel more hydrated, however I haven't been using it for very long. I stopped using all products for a little while because my seasonal allergies were bugging me so bad that my eyelids were swelling up. I am trying to use it more often now and hope to try the other products in this line. [This review was collected as part of a promotion.]"
"This moisturizer did not work for me. It caused me to break out, so I had to discontinue using it. I also did not care for the smell. Unfortunately, I was not able to use it long enough to judge its effectiveness. [This review was collected as part of a promotion.]"
"After 2 weeks of use, my skin was much softer and definitely more hydrated. After 4 weeks I could notice a difference in my fine lines, but not really the deeper ones. I think if I had started using this when I was younger, the improvement would have been more dramatic ( I am 53). Very good product with a thick consistency that absorbs quickly. I would recommend this product for keeping the skin hydrated and improving the finer lines you may have. [This review was collected as part of a promotion.]"
I loved this product and would recommend it. I love the way the serum is dispensed and the way it made my skin feel so soft and smooth. I did not notice any change in my wrinkles yet but I am going to continue to use this product [This review was collected as part of a promotion.]
This product is a little hydrating and my skin absorbed it right away. I did notice a difference in my skin. It looks smooth and glowing but my little fine lines are still there. I am hoping that I will notice more changes the more I use the serum. Overall I am happy with it and I loved the smell and the ease of use of the product. [This review was collected as part of a promotion.]
"I enjoyed the texture of this cream and felt it absorbed well. The results on my skin were subtle but I did feel there was an overall improvement to my wrinkles. IMHO, the biggest drawback was the strong, and overwhelmingly floral scent. I would much prefer a fragrance-free option. [This review was collected as part of a promotion.]"
This item was great in making my skin very nice and smooth. My skin was very soft to the touch. Unfortunately I found his item to be a bit too greasy and it did cause me to get acne and large bumps in places that was undesireable. I could only rate it 3 stars as a result of the acne side effect. Overall it is a great product excluding that result. [This review was collected as part of a promotion.]
For a product available in the mass marketplace I think this product is awesome. I have used it twice a day for 14 days and really believe I see an improvement in my smile lines. For the price and these results I will try other products in the Revitalift line. [This review was collected as part of a promotion.]
I liked the thickness and the rich feeling of the cream. I liked how quickly it absorbed and I felt that my skin was hydrated. I do feel that it does smooth out wrinkles but I do not think that it is a true volume filler. I think if you use it for a moisturizer it is good. But if you are expecting this product to fill and lift your skin then you will be disappointed. [This review was collected as part of a promotion.]
The cream is thick but once applied does not feel heavy at all. My skin definitely is much softer after a few weeks of using this product and I love that. I am not sure that I have noticed any line disappearance but as long as it keeps my skin feeling soft I am a fan. Plus the scent is nice and light. [This review was collected as part of a promotion.]
I tried loreal revitalift for 28 days and did notice that my skin was getting fuller around my eyes and cheeks. ..it didn't irritate my skin. It absorbed quickly and wasnt sticky or messy...I liked the tube it came in made it easy to use. Was a great product but did realize it stopped at that little lift. ..skin was a little fuller but never went beyond that. .. [This review was collected as part of a promotion.]
I was really glad to have been chosen to receive the full sized L'Oreal Paris Revitalift Daily Volumizing Moisturizer to use and review. I've been using it morning and night like I was supposed to. I haven't noticed a significant change in my lines or wrinkles but my skin is much softer and the cream absorbs quickly. The scent is very pleasant but was very cautious using this around my eyes especially with as hot as it is I was afraid of it running in my eyes and causing irritation. [This review was collected as part of a promotion.]
"After using this product day and night, I'm not sure I have noticed any difference as far a lines go. Perhaps it may be because I am not using the recommended serum prior to putting the cream on. I do like the cream, though it is a bit thick, so a little goes a long way. My face does look and feel more hydrated and soft. I will keep using it day and night in hopes of a more noticeable result. [This review was collected as part of a promotion.]"
"I have been using L'Oreal rivitalift faithfully for 3 weeks I saw a small difference was hoping it was like a mini lift without the surgery.lol but my face feels smooth, my light wrinkles are fading my face looks more alive. I will continue to use as I see and feel a difference. I like the thickness of the cream went on smooth no greasy feeling, the scent was a little strong for me. Over all I like my face as it is looking better everyday [This review was collected as part of a promotion.]"
I have been using this product consistently for the past month and fine lines around my eyes are disappearing. I haven't seen any improvement underneath my eyes. I am pleased with the results so far. [This review was collected as part of a promotion.]
I'm loving this serum! I've been using it for a couple weeks and it makes my skin glow. My skin does look fuller and it feels great. The applicator is so awesome and unique. I'll definitely continue using this product. [This review was collected as part of a promotion.]
I like the texture and fragrance. My skin felt soft and smooth. I did not notice any change in my wrinkles. I did not notice any increased fullness. I do like the container and the way the product is dispensed. I will continue to use the product until it is empty. [This review was collected as part of a promotion.]
I was a bit skeptic but from the day I tried to the last 3 weeks I have noticed a difference in my skin. Now I am 46 years old with sensitive skin that tends to still get acne. So I use this product as part of my night time routine. But it has not caused any reaction or acne. I notice my skin is more supple and my lines less defined. I will continue to use this product once I run out. [This review was collected as part of a promotion.]
I really like the ease of dispensing of the serum. The smell was not overwhelming and it seemed to absorb quickly without a sticky feel afterwards. I did not notice any visible improvements in my skin or wrinkles. [This review was collected as part of a promotion.]
"This was a decent serum to use, but I did not see any effects from it. I liked the container and the consistency of the product...it was fast absorbing and pleasant. However, I do not see a diminishing in any lines or wrinkles so I am hopeful that my use of the product is at least preventing future wrinkles. [This review was collected as part of a promotion.]"
"I love this brand, the cream goes on smooth and feels great on my skin, the scent is great too. I love the technology that goes behind the products in this line. My skin feels soft and smooth and the cream is so rich and thick, a little goes a long way. [This review was collected as part of a promotion.]"
I really liked this cream. It spreads evenly however a bit thick for the summertime. After two weeks I notice smoother skin and some lines fading. I will purchase this item however would use during the fall/winter months. [This review was collected as part of a promotion.]
This is now one of my favorite serum. I wash my face then I use toner and I put on my Revitalift volume filler serum and I am loving the way my skin feel and look. It just sinks into my skin with ease filling in those pesky pores and fine lines for a more radiant complexion. I use it with and without makeup according to what kind of day I'm having. looking forward to trying the whole line. [This review was collected as part of a promotion.]
"I have never used a serum before and was excited to receive the Revitalift Volume Filler. I kept my expectations low and so was not disappointed. After 4 weeks I cannot tell that anything was accomplished. Hope does spring eternal and maybe someday a product will come along that really does result in fuller cheeks and less hollowed eye area. As for wrinkles, the fight continues! Thank you for the opportunity to try this product SheSpeaks!! [This review was collected as part of a promotion.]"
I was interested in this serum because I am always trying out new things to help with my wrinkles and skin. I was pleasantly surprised! After 4 weeks I noticed a different in my skin and my wrinkles. They are less noticeable and my skin feels softer. I will be buying this L'Oréal Paris Revitalift Daily Volumizing Concentrated Serum. I have told so many of my friends about this product too. Thanks L'Oreal [This review was collected as part of a promotion.]
"This product was sent to me for my honest review. I thought it would be greasy and make my face oily. However after using for a period of four weeks, my skin was satiny smooth and I did notice lighter wrinkles around my eyes. The smell was nice and not overbearing. Overall this was a great L'Oreal product. [This review was collected as part of a promotion.]"
I love how this made my feel soft and did not leave me with a greasy feeling. It was creamy causing me to have great coverage. It helped with coverage of the fine lines that I know have since I am in my 40's. If you are looking for a moisturizer that will fill fine lines/wrinkles and keep you skin feeling soft and subtle then this is the product for you. It would have been a 5 stars if it contained a SPF. [This review was collected as part of a promotion.]
This stuff is amazing! The dark circles are gone and my face just looks more youthful. I have already given a bottle to my sister who equally loves it! I will absolutely buy this again and again and I have already ordered another product from the same line! [This review was collected as part of a promotion.]
Using a serum is new to me and with a brush to target even newer so I have to say I LOVE this stuff! I could see it working on fine lines after the first week and I love the scent. It is so easy to use. Trying it taught me that serum should be an integral part of my facial care routine. [This review was collected as part of a promotion.]
I was pleasantly surprised how well this worked for me. I specifically compared it to the Clinique All About Eyes which is my go to for around my eyes. The serum formula absorbed very well into my skin and I got the same results as the Clinique lotion/serum. This is a great product! So glad I tried it! [This review was collected as part of a promotion.]
"This treatment feels clean and fresh when applying. It leaves your skin feeling moisturized and not sticky. I really would like to try this with the recommended products to see the full effects. I do absolutely love the container, very premium looking and easy to dispense exactly what you need without dipping your fingers into a jar. [This review was collected as part of a promotion.]"
I loved this creamy formula. It went on so smooth and immediately blended my flaky skin in. I did notice less wrinkles even over this short time. It even seemed to take some of the red out of my skin as well as give it a glow. [This review was collected as part of a promotion.]
"I actually received REVITALIFT VOLUME FILLER to try . . . I LOVE IT! After just a few applications, my skin looked and felt softer and more youthful! I have used many L'OREAL products for years and have always been amazed at how wonderful the products are at such great bargains! Thank you, L'OREAL, for continuing to produce quality products at reasonable prices! [This review was collected as part of a promotion.]"
"I found it very easy to use. I liked that you can use a very small amount to do numerous areas. The results are minimal, but i will continue to use until its gone to see if I get what Im looking for. [This review was collected as part of a promotion.]"
"Received a nice sample to test out. The texture is in between gel and cream; the fragrance is just right , slightly similar to lancome tresor; skin looks slightly fuller following application but requires continual usage. No dramatic change in fine wrinkles though. It works as a effective summer moisturizer. [This review was collected as part of a promotion.]"
"This moisturizer gave me plump ""cushiony"" baby skin. I just love the improved texture. My foundation looks so much better now. I have stopped buying a high end moisturizer, which was triple the price, because I like the L'Oreal moisturizer so much better! [This review was collected as part of a promotion.]"
"Got this as a full sized free product for which i am grateful.This is a thick rich cream which is good for night time use.I could not use it during the day as it was too thick and oily.Have not seen much change in elasticity, volume or wrinkles.The fragrance is soft and subtle, not overwhelming [This review was collected as part of a promotion.]"
"I love Loreal products and use them all the time in many forms, skin care, cosmetics, and hair care. I found this serum to not make any noticeable difference in filling in lines around my nose, mouth, or eyes. I have in the past used Youth Code by Loreal, serum, and liked its consistency better, however, I have yet to find a product such as this, that really works as a filler or a firmer. I only hope they can come up with one. [This review was collected as part of a promotion.]"
I liked the pleasant smell and how it was light and absorbed quickly. A little went a long way. I do see a little difference and I am sure with continued use I will see more. Over all a good product. [This review was collected as part of a promotion.]
"I like the mild scent of L Oreal Revitalift serum, its so light and absorbs really well and its not sticky or greasy and leaves no residue on face after usage. Very ease to dispense, my skin feels smooth but so far i didn't notice much change in my fine lines. Over all its a good product and i would definitely recommend this product to my friends and family. [This review was collected as part of a promotion.]"
I really liked the Revitalift Volume Filler. It is a light serum that absorbs quickly. It has a pleasant scent and does not leave a film or a feeling of stickiness on your face. After using it for 4 weeks I did notice that some of my fine lines were less noticeable and my skin looked a but plumber. [This review was collected as part of a promotion.]
"I really enjoyed the packaging , first of all. Very clever. The product itself had a wonderful scent.. and went on very smoothly. It absorbed on impact. So, it sure never felt like I had to kill time before I applied my moisturizer. BONUS ! I would definitely recommend to a friend and re-purchase. [This review was collected as part of a promotion.]"
"I found this product so helpful for me, it helped with my wrinkles around my mouth, sagging in my eyes and wrinkles. I wish I had a smartphone to upload a before and after picture. It did wonders I went out and even got a new haircut and change now I look ten years younger, thanks so much LoReal Revitalift volume filler, you definitely have a future purchaser. [This review was collected as part of a promotion.]"
"I tried this product when I received a free sample to review it. I used it twice a day at morning and night. The smell is not super strong which is what I like. It is not too oily either. As far as relifting or reducing the lines I have not seen any noticeable difference. Pros: Nice smell, not too oily, good moistrizer Cons: Does not reduce lines noticeably which is what the product's main purpose is [This review was collected as part of a promotion.]"
"I have really enjoyed testing out this moisturizer! I didn't notice any reduction in fine lines, but the moisturizer did leave my skin feeling super soft and refreshed. The fragrance is also very nice. Some may find it a little strong, but it is not overwhelming and does not last long enough to bother anyone. [This review was collected as part of a promotion.]"
"After trying this product for 4 weeks, I noticed some small lines fading away. My deeper ones are a little better, but still there. Regardless, I love how my skin feels. It's very soft and looks healthy. I also like how the serum absorbs into my skin, right away, with a very natural feel, to the touch. There is a slight scent to the product, which is not overwhelming and dissipates within a short time. [This review was collected as part of a promotion.]"
