"I've been using this for about 3 weeks now. I think it makes my skin feel softer and smoother. The scent isn't too strong like some lotions. I also like that it hasn't made me break out, my skin can be sensitive to some products. I don't know if it really helps with fine lines or not, maybe I need to use it longer to find out. Over all I like that it makes my skin feel smoother and not so dry. I received this product free to test from influenster and all opinions are my own. [This review was collected as part of a promotion.]"
"Unfortunately, this product irritates my skin. I'm not sure if it's the strong fragrance or one of the ingredients but I started breaking out in small bumps all over my cheeks after using this for a few days. I tried giving my skin a break and only using this a few times a week. However, even that didn't help. Every time I would use this, I'd end up with bumps. I received this product for free in exchange for an unbiased review"
I received this product free from Influenster to try and review. I was reluctant as I have very oily yet aging skin. I was happily surprised to find that it wasn't overly heavy and did not cause any breakouts! It actually made my skin smoother and seemed to lessen some scars and wrinkles [This review was collected as part of a promotion.]
I really love this product before using I had really dry dull skin I can feel that I was losing volume to my skin it felt rugged now my skin seems bright and fresh I feel the softness almost like baby skin I have a tightness to my face again and it helped with my dull complexion I highly reccomand this product for anyone looking for fresh younger looking skin [This review was collected as part of a promotion.]
"I've been using L'Oreal Revitalift Volume Filler for about a month. It's a pretty good moisturizer, but it has a very strong perfume smell. I will not be purchasing this product. I received this product complimentary from Influenster for testing purposes. #AskSkinExpert, #Influenster [This review was collected as part of a promotion.]"
I received this for free to sample. I have fairly dry skin or at least it can get there quickly without a good moisturizer. While I do really like this product it is maybe a little too light for me. The fragrance is nice and not over powering. It absorbs nicely and doesn't leave you skin greasy. Would purchase as it is a nice product. [This review was collected as part of a promotion.]
A little goes a long way! Absolutely love the way this moisturizer feels. Smooth and silky. I am seeing results now being using this for approx 2 1/2 weeks. I received this free for testing purposes. Thanks L'Oreal and Influenster [This review was collected as part of a promotion.]
"What a great, creamy, moisturizing daily moisturizer! I absolutely love how this lotion feels on my face! It moisturizes completely, no dry spots where I need to reapply. It releases the tightness I feel in several facial areas - lips, eyes, forehead. I have to say this entire volume filler line is working together to help smooth out my skin and keep it hydrated! I received this product complimentary in exchange for using it and providing my honest review. [This review was collected as part of a promotion.]"
"I LOVE THIS PRODUCT! I use this, in conjunction with the other Revitalift products, and have seen a noticeable difference in the softness and firmness of my skin. I have been using it morning and night for about 3 weeks. It smells sooooooo great. The container that it comes in is of a very high quality. I received this product for free as part of a reviewing campaign. [This review was collected as part of a promotion.]"
"I love l'oreal products. I started using the volume filler moisturizer (two weeks ago) what I like the most is that the cream penetrates pretty quick into my skin, leaving it soft, it doesn't irritate my skin, I gave four stars because the scent is too strong for me. [This review was collected as part of a promotion.]"
"I really love this day cream! I have acne and those treatments tend to really dry my skin out which is not good for makeup because you get flaky! This cream is just heavy enough to battle the flakiness, keep me moisturized, but it does not make me oily! I received this product free from Influenster for testing purposes. [This review was collected as part of a promotion.]"
"I have been using this product for a couple of weeks now. I really like this moisturizer a lot! It hasa slight scent that i do not mind & leaves my skin soft, smooth, and vibrant. It does not leave my skin feeling greasy or oily. I have seen a noticeable difference in the fine lines around my eyes and forehead. I would definitely recommend this product. I received this product free in exchange for testing and my honest review. [This review was collected as part of a promotion.]"
I received the Revitalift collection for free to review from Influenster and any opinion given is that of my own. I love the packaging. I didn't think it did anything to my fine line and wrinkles but it did give my face a glow and my face feels firmer. The moisturizer was amazing. I loved applying this and bought more. I put it on before my makeup and it helps keep my fave feeling fresh. [This review was collected as part of a promotion.]
"I am using four of the products from this line right now and this is my least favorite. It isn't awful, but it doesn't really do much to improve tone, and seems to clog my pores. I love love love the night cream, but I think I'll go back to Belif for day time. It takes awhile to absorb and feels a bit tacky for longer than I prefer. * I received this product for free via Influenster. They have not paid me or influenced my review. * [This review was collected as part of a promotion.]"
"I've been using this day cream for a few weeks now and I really like it. It's very moisturizing and makeup ties on just fine without a primer. I have not noticed any difference in lines, wrinkles, contours, etc, but I will use it again just for the moisturizing properties. As fir the scent: I like the smell...I can be sensitive to some scents, but this one smells fine and doesn't give me a headache like more perfumey creams. I was sent this product for free to provide an honest review. [This review was collected as part of a promotion.]"
"I received this complementary for testing purposes along with three other Revitalift products. I have sensitive skin so I started using them in a sequential order in case I had a reaction (which thankfully, didn't happen). I saw notable results from using the eye and face serums, however I didn't see any specific improvement that I can attribute to this product. I like it but it is a little too thick for daily use and I don't plan on buying more. [This review was collected as part of a promotion.]"
"I just turned 31 this week and thought that I needed to take better care of my skin. I this this product to try and I have to tell you that it works. I really like this product because it makes my skin very soft and hydrated. I feel that after using it for a week it has improved my skin, making it feel more reinvigorated and young. The only pro for me is the smell which I think is too strong. I received this product for free in exchange for an unbiased review. [This review was collected as part of a promotion.]"
"Pros: I have been using the daily volumizing moisturizer for three weeks now. I do notice that my skin is much more moisturized and smooth. A little bit goes a VERY long way. Cons: No SPF. For the product to be relatively thick, I don't want to apply anything else with it, so I was worried about sun protection. I received this product for free to test and provide feedback to the manufacturer. [This review was collected as part of a promotion.]"
The L'ORÉAL Revitalift Volume Filler Moisturizer is a white cream that smells clean & absorbs quickly. I am not a fan of this day cream since it is in a jar format & dries to a texture that feels powdery even though it initially feels like a thicker cream. This is just not hydrating enough for the winter months where I live. This is my least favorite L'ORÉAL Revitalift product I have tried thus far. *I received these products complimentary from Influenster for testing purposes.
"During the day, my skin has a tendency of getting really dry, however, since I been using the Revitalift Daily moisturizer, it has not happen. My skin feels hydrated through the day and soft. The smell is very soothing and my skin doesn't get irritated at all. I wear first the serum of the same line, then this moisturizer and last but not least, sunscreen. I received this item from @Influenster free of charge for testing purposes."
I have been using this product for about 2 weeks now and I have noticed a difference In my skin. It appears and feels more hydrated & the product smells amazing ! I received this full size product for free through influenster and I absolutely love it ! [This review was collected as part of a promotion.]
"I am always hesitant to try new face moisturizers but I am so glad I tried this one! Great scent, light feel after it is applied, keeps my skin feeling soft, full and moisturized. A little goes a long way when using this product. I am so glad I received this product free from Influenster. [This review was collected as part of a promotion.]"
I received this product for FREE from IINFLUENSTER and I never realized how dry my skin was until using this.....it definitely made my face smoother and softer to the touch. I paired the volume filler moisturizer up in the morning with the concentrated serum and the results after a week were very obvious! [This review was collected as part of a promotion.]
I received this producg L'Oréal daily volumizing moisturizer and I truely loved the product frommthe first day I used it. It wasn't greasy or had a strong scent. I really notice a difference in my skin after just a few dyas my skinf2lt better and younger. Imhave teied other brqnds and this one is true to it word. I will be using this product for a long time. [This review was collected as part of a promotion.]
"I received a sample of this product to test and try from Influenster. I love this product! It works wonderfully with my daily beauty regime. I use in conjunction with the daily serum. It leaves my skin feeling softer, smoother and looking fuller. It blends well and doesn't leave my skin feeling greasy or oily. I works well under my daily make-up. I am a fan and will continue to use. [This review was collected as part of a promotion.]"
"This product acts like a moisturizing primer. It goes on and feels soft and light and leaves your skin feeling very soft & make up ready. It has a pleasant scent that I appreciate. As for the volume filler qualities, I can't really speak to them as my skin is fairly voluminous as it is. I think for a $20-ish cream, this is worth it's cost. I received this product complimentary for testing purposes, however all opinions are my own, unbiased review. [This review was collected as part of a promotion.]"
"It is just okay. I am not overly impressed with it. Since I received it to try for my review, I am not disappointed that I got to try it but I will not be purchasing again. I received this product complimentary for my unbiased review. [This review was collected as part of a promotion.]"
"This is a good moisturizer, but the smell is a little overwhelming and too floral for my liking. I also wish it would have spf in it, as this is supposed to be for daytime wear. Other than that, it keeps the skin moist, but isn't over oily. And I did see an improvement in my developing crows feet when using the whole regimen. I wouldn't purchase it again, only because the smell is too overwhelming for me. DISCLAIMER: I received this product free of charge, for testing purooses. [This review was collected as part of a promotion.]"
I received this product from Influenster free in exchange for my honest review. I find that this cream is very thick and easily absorbs. It leaves my face feeling very soft and moisturized. I need very little to cover my face so it should last a long time. [This review was collected as part of a promotion.]
I have a very sensitive sense of smell so this does have an overpowering smell to me. This cream is thick and absorbs well. I enjoy the matte finish as I do not have to use a primer afterwards. Disclaimer: I received this product free or deeply discounted in exchange for a fair and honest review. All thoughts and opinions are my own. [This review was collected as part of a promotion.]
"Daily Moisturizer is amazing, my skin is softer and firmer, can tell difference above eyes and around. Will continue longer, because I know wrinkles didn't appear on my face in a week, so it will obviously take longer to firm all of them. So happy I got picked to try and review this product and can't stop bragging to my friends and family. #AskSkinExpert [This review was collected as part of a promotion.]"
"Before using this moisturizer my face was very dry especially my forehead. I have been applying it as recommended, it's been two weeks and I already can see the difference. My face always is moistures without feeling greasy or oily. The small lines on my forehead are less visible and I look well rested. I was given the line of Revitalift to test for free and will be purchasing 3 of the 4 creams that were complimentary. [This review was collected as part of a promotion.]"
I like this product. I received it complimentary for testing and was greatly surprised by it. I usually buy mostly higher end products. This keeps my skin moisturizers throughout the day. It also sits under makeup well. [This review was collected as part of a promotion.]
"I am very impressed by this product. I can already tell a difference in the appearance of my wrinkles after about two weeks. The fine lines around my eyes and mouth are much less noticeable. My skin looks hydrated, firm and shiny. I highly recommend this product. I received this products complimentary from Influenster for testing purposes. [This review was collected as part of a promotion.]"
"I usedon't several high end moisture all none of them preformed the way this product did. I have dry dark spotside around my chin area. When applying make over the area would only make it worse. But by using this product I noticed softer, smoother, brighter,firmer, moisturize skin. [This review was collected as part of a promotion.]"
What I like most about this moisterizer is that it has a more serum/primer/silky feel rather than the creamy consistency of most moisturizers. It doesn't take long to sink in and leaves my skin looking matte. It has definitely helped my dryness and has softened some of my wrinkles. **I received these products complimentary from Influenster for testing purposes. [This review was collected as part of a promotion.]
"This is a great product that provides the essential moisture and volume needed for healthy young looking skin, simply apply every morning after the eye and volume serum. this moisturizer has a lite pleasant scent and doesn't leave you feeling greasy. I received this product free in exchange for my 100% honest opinion. [This review was collected as part of a promotion.]"
"I've been using the entire L'Oreal Paris Revitalift Skincare line every morning and night for three weeks now. After just a few applications, I noticed a huge difference in my skin's texture, fullness, and overall appearance. I adore this moisturizer, and the scent is absolutely amazing! [This review was collected as part of a promotion.]"
"This is a really, really heavy moisturizer and has a very white, conditioner-like consistency. I needed a very, very small amount to apply to my face. It has a very strong scent. I would be wary of using too much as I think it's so heavy it almost feels like frosting! [This review was collected as part of a promotion.]"
after using this for around 10 days I have noticed a difference on my face! I use it every morning with the serum and eye cream and It has made my skin look much healthier and beautiful. Love this product..I received this as a complimentary product from influenster for testing purposes and I am glad I received it as I m in love with this line! [This review was collected as part of a promotion.]
I received this as a sample from influenster. I was thrilled with this product. It smells amazing and makes my skin feel great. I notice a big difference on my forehead wrinkles! I love this product! [This review was collected as part of a promotion.]
"I received this product compliments of @influenster to try this day cream. I like the consistency of the lotion, to apply all you need is a fingertip of lotion to cover your whole face and the scent smells great. I do not believe this day moisturizer has spf protection though. I have seen a difference in my face by using everyday. My skin seems much smoother and my makeup seems easier to apply. The moisturizer definitely helps in the harsh elements of winter. [This review was collected as part of a promotion.]"
I received this as a sample from Influenster and I like the product. The smell is great and the feel as well. My skin is looking great. My only issue is that I have oily skin and this does not help in that area. I wish there was an oil free version. [This review was collected as part of a promotion.]
This is a great facial moisturizer and filler. My skin looks so much better after just a few weeks of using this. I received this product for free for me review. I love it and will buy it in the future. My skin looks and feels younger! [This review was collected as part of a promotion.]
I received this product for free for purpose of review. These thoughts are my own. I have only been using this product for less than 2 weeks and I must say I am surprised! My once deep wrinkles are getting more minimal daily! Goes on so smoothly and really makes my skin feel so soft and supple. I am loving this product! Can't wait to see the overall difference after using it for a month!! I highly recommend trying this! [This review was collected as part of a promotion.]
"I like the product and it does make the skin look fuller and more youthful, but I can't get over the way it balls up and peels. It did this to me when I used it at night and during the day. Not a good look, especially under makeup. I received this as a free sample to try and review. [This review was collected as part of a promotion.]"
"My skin is so bipolar, its dry then its not. I am happy this product keeps moisture in my skin (unlike many other products I have tried) but isnt too greasy. Other products usually dont hold moisture very long. [This review was collected as part of a promotion.]"
"This daily moisturizer is great! When I first opened the jar, it was very heavy, with super-nice packaging. Then, I opened it up and fell in love with the smell! Then, in using this moisturizer, I put quite a bit on my face and neck because it is so thick and creamy. But, it doesn't feel greasy or oily and absorbs very quickly. I have noticed a major decrease in my dry skin and a small reduction in my wrinkles. I did receive this product free for testing purposes. [This review was collected as part of a promotion.]"
"I didn't care for this product because it rolls up on my face and looked like my face was peeling. I really wish I could have used this everyday, but it was embarrassing to walk around with all those white fakes on my skin, and it fell all over my shirt as well making me look like I had severe dandruff. I received these products complimentary for testing purposes. [This review was collected as part of a promotion.]"
"This is definitely going to be my go to day moisturizer. I notices results after first use. My skin was noticeably softer and smoother. This lasts throughout the day. After about a week of use, I'm noticing my fine lines are less visible. The skin under my eyes is formed and less dark. I love the Revitalift products! Influenster sent me this product complimentary to test and review. [This review was collected as part of a promotion.]"
This moisturizer makes your skin feel fresh and amazing. I received this free from influenster and I use it everyday and sometimes at night. It leaves my skin feeling clean and fresh and not dry. Definitely a must have! [This review was collected as part of a promotion.]
I got these products complimentary for testing purposes. I'm surprises that the quality is so similar to Lancome brand. It smells nice and the package looks fancy like a high end product but you just pay drug store price. You see results the next day. I'm very satisfied with this product. #AskSkinExpert [This review was collected as part of a promotion.]
"I have always used the products of L'Oréal skin care, I must say that this line is the best of all, using it I can really see how the skin becomes firmer and smooth, I love it. I must to say that I have received this product complimentary to test [This review was collected as part of a promotion.]"
"Goes on kinda of dull, but brightens as the day goes on. Its also goes on well under makeup. Its not too heavy. I received this product free for testing purposes. I will purchase it again in the future. [This review was collected as part of a promotion.]"
"My face feels amazing! My skin is softer, I haven't had any of the slight acne breakouts I had before. The fine lines have diminished. I have been using this for a couple of weeks and the results are definately noticeable. It is a product I will have to keep on hand. I received this product free to test from Influenster. [This review was collected as part of a promotion.]"
"I tend to have issues with face creams. If they are too greasy I break out, not moisturizing enough and I get dry patches. So far this has bee wonderful! Just the right amount of moisture without being to greasy and causing breakouts! In combination with other Revitalift products, I really feel like my skin is looking so much better! I hope to continue to see even more improvement over time. I received this product free, to try. [This review was collected as part of a promotion.]"
"this product is wonderful! It is thick, not running, and goes on smooth, making my skin very soft and silky. After using for just 2 weeks I have a noticeable difference to my facial appearance, less puffiness and more smooth. I received this product complementary from Influenster. [This review was collected as part of a promotion.]"
"I have been using this daily under my makeup and after the Revitalift Serum and I love it! It has a silky formula that does not leave my skin feeling sticky or oily, yet moisturized! I received this free from Influenster and I will be adding this to my beauty /skin routine! [This review was collected as part of a promotion.]"
Not heavy or oily. I was actually able to use this without my foundation running off my face. This cream was literally like putting silk on my face and so hydrating. My skin has never looked better. [This review was collected as part of a promotion.]
"I cannot say enough good things about this product! I have very oily skin & am so scared to try new skin products but this one is amazing! It does not leave my greasy at all! It dries on the skin smoothly & gives my skin such a smooth, silky quality. It smells awesome too! I am so thrilled that I got to try this for free in my VoxBox & I will definitely be buying this again!! [This review was collected as part of a promotion.]"
"I like that this is thin enough on my skin that it doesn't feel like a goopy extra on my skin throughout the day. It firms up my skin, but I by no means think it'd do much for major lines. Thankfully I don't have to worry about those yet. I received this product for testing and unbiased evaluation. [This review was collected as part of a promotion.]"
I notice as I have gotten older my skin was starting to look dull and dry. This product adds moisture and life to my skin and makes those fine lines more tolerable by reducing their visibility. I received a sample to review and I love it. The moisturizer isn't greasy. It is hydrating and I really like that. [This review was collected as part of a promotion.]
"I received a trial via Influenster, and I have been using this for a couple of weeks. I have noticed increased firmness and decreased puffiness of my face. My lines seem diminished and I am quite happy with the results. It has a very nice scent and the product doesn't go on too thick when applying. I plan to make this a normal part of my skin routine. [This review was collected as part of a promotion.]"
I've been using this twice a day morning and night all over my face and love my results. My face becomes so hydrated once I apply this daily volumizing moisturizer that my skin look plump and feels so soft and smooth. Yet my skin does not feel or look greasy at all. I can wear this under my makeup with no problem. My skin texture has improved and it has brought back my skins resilience. (Received free sample for reviewing purposes. This is my honest opinion) [This review was collected as part of a promotion.]
"I did receive this product for free. However, I do love it and feel that it is working for me. I have used the revitaift products before and love the way they make my skin look and feel. I would definitely recommend this product and all the revitalift products. [This review was collected as part of a promotion.]"
"This is a lovely day cream. In general, moisturizers shouldn't be in jars because they lose their effectiveness. But I've been using about 2.5 weeks and appears to be effective. I received this day cream to review from Influenster but all opinions are my own. One star removed because this brand is not cruelty-free. [This review was collected as part of a promotion.]"
