"The RoC multi correxion 5 in 1 chest, neck and face cream in very smooth, it never makes my skin feel oily or greasy. I smooths the skin and gives me a fresh renewed look while smoothing out fine lines and wrinkles. [This review was collected as part of a promotion.]"
Since recieving my Roc Multi Correxuon 5 in 1 Chest neck and face cream i have seen a great deal in inprovement in my chest neck area. I had a few dark spots that are way less visisble since using on my chest area.On my face my dark spots are fadeing to. my skin looks ore healthy oo.. i willl continue to use this product. I never thought about my neck and chest area before getting this. Thank you [This review was collected as part of a promotion.]
I love the feel of this cream. I feel as if it really helped with the fine lines and wrinkles that I am getting with age. The cream is very smooth and light. I did not feel overly moisturized nor did my T zone get oily. Highly recommend this product! [This review was collected as part of a promotion.]
it was so smooth an soaked in to my skin so great and gave me such a glow knowing that im taking better care of my skin thanks to roc and my new beauty regime and this will be used every day to fight off elements that break my skin down [This review was collected as part of a promotion.]
"I was excited about trying this. I got it and tried it after my shower I loved the feeling of my skin after using it. I love love its for you face, neck and chest I don't know of any other product having that when they should. I loved it and when I run out I plan on buying it and have told my friends and sisters about it there all going to try it too. [This review was collected as part of a promotion.]"
"I have only just started using RoC Multi Correction cream, and I already love it! It makes my skin feel soft and smooth. It also gives it a nice glow, but not greasy. This will become part of my daily beauty care! [This review was collected as part of a promotion.]"
This is my first time using the 501 Rock and it makes my skin feel very soft and smooth I'm used to use another stuff like oil of olay I've been using it for about 3 days now and I really like it I think by the bottle is gone I'm going to buy more this is a very good brand [This review was collected as part of a promotion.]
I can tell the difference already in two days my skin is smooth! I can't wait to see the difference after a week and a month. I have terribly dry skin and this is making a tremendous difference! I was skeptical but now I am a believer! [This review was collected as part of a promotion.]
"I have never used RoC products before since I couldn't afford the hefty price tag but I got a free sample from @Crowdtap for testing purposes only and fell in love with this. I am at the age where I need to start taking care of ageing skin and all the signs that go along with it (wrinkles, fine lines, skin blemishes, etc...). Finally a product that delivers the goods ! [This review was collected as part of a promotion.]"
"I love anything that is a multi purpose product and actually works. This #Roc cream goes on smoothly blends into skin instantly and hydrates plus it has SPF 30 too. Made my skin feel soft and diminished fine lines. Excellent product, and takes the place of at least 3 others [This review was collected as part of a promotion.]"
I have try so many face creams that promise great younger skin but I can truly say RoC has been great to my skin. My face looks and feels amazing. Doesn't leave my skin oily or get breakouts. And did I mention it smells amazing. I also use it for my hands. [This review was collected as part of a promotion.]
"I began using this in the last week and it really feels and smells great,it is nice to know I'm doing something to benefit my face,neck and chest with this Roc cream,I am very pleased with it and will be using it daily and loving it and the SPF 30 is great in it for sun. [This review was collected as part of a promotion.]"
"This RoC's® MULTI CORREXION® 5 in 1 Chest, Neck and Face Cream was amazing for me to try out. It was so light to put on I did not feel weighed down by it like most other creams. I applied it int he morning and at night to get the full benefits and I was able to see a difference in my skin in just a few days. I also noticed the skin damage that my statin medicine caused faded so I was happy about that and will continue to use this so I can get rid of this staining. [This review was collected as part of a promotion.]"
"I love Roc multi correxion 5 in 1 chest, neck ,and face cream. It smells really good and leaves my skin feeling silky smooth. I am allready seeing results. My skin tone doesn't look dull, it's giving my shin like a glow to it. [This review was collected as part of a promotion.]"
I only used this once because I found the fragrance too overwhelming.
"I used this one time, and got a rash almost immediately. The rash lasted for a week."
"This product and actually a few other ROC products I have tried are too Harsh on my skin, I am 58 and have dry skin. This seemed to make it worse!"
"Didn't really see or feel any difference in the feel or texture of my neck and chest area. Sorry, I wanted it to work."
"This makes my skin look and feel younger, I would definitely recommend it for those fine lines that creep up as we age."
"The sample was really small, so I really can't give you a truthful review. It soaked in really fast, but I still had some dry patches after I thought I was done applying."
I like facial moisturizers that aren't too think or too think and contain a sunscreen. This is similar to Olay but Olay might be less expensive; have to find ROC on sale
there was not enough product to determine if it correct but I did like it and would buy it in the future because it was light and did not make me break out
"This is very good for dry skin. It says for use on chest, neck & face, but I only used it for my neck & chest, since I don't have extremely dry skin on my face. It is not at all greasy. Definitely would recommend."
I love the scent of this cream. It smells light and fresh! It is a small sample so I can't say yet whether it will have great firming effects on my neck and face. But no complaints so far.
This product feels good to your skin. A little tingling lets you know it is working. I have been using it for a month. I can see improvements in my skin's texture and lightening of discoloration.
I appreciate the combination of spf and face cream. The extra moisture barrier with sun protection is a plus for these summer suns. I used this ROC product sample from Walmart on my trip to Arizona. It worked so well under my makeup.
This has officially become my permanent moisturizer . I had been searching for a summer moisturizer with SPF that did not make my face greasy . And this one is perfect not greasy at all and moisturizing.
"My skin has lifted and brighten with combination of different products, since I'm using this I have noticed a huge difference in my skincare and skin. It looks healthier."
Easy to apply. I have sensitive skin and it did not aggravate it. Lightweight. Pleasant smell. Sample lasted 2 weeks for me. Did show signs of improvement in fine lines.
This lotion went on well. It's nice and smooth a little smelly but not bad. No greasy feeling and not thick when put on. Really helped with my dry rough skin.
"This is a good cream to be used on dryer complexions or as a under the eye wrinkle cream. I use this product on areas that need extra protection. The Roc Multi Correction 5 in 1 Anti-Aging Chest, Neck & Face Cream is a good product."
I am 62 and this is the best moisturizer I have ever used. It absorbs quickly and never feels greasy. It does diminish some lines and wrinkles. I would highly recommend this.
"This cream Is silky and smooth. My husband is sensitive to smells and has no problem with this product. Have not been using long enough to see much results, but feel it will work well.an"
"It really works. It smells great, feels good going on, and I can tell a difference in my face after only a few days. I went out and bought a full size after using every bit of this sample."
I have not used this product. I don't go out in sun. I already have too many brown spots from when I was younger and being out in sun all day long. I am sure the product is good though. A trusted name
Love this stuff. I just wish I could afford to spend the money on it. I am on a strict budget. I have to pay for my kid's required school items first.
this was a very nice cream. I liked the smell and the coverage was great.
it automatically has a spf in the cream so one less routine to bypass in
getting myself together in am. highly recommend this product.
"I really liked that i can use this on both my face and neck. Other than i thought it really made my face feel oily. . I have oily skin as itbus, so i dont need any extra oil there"
"Roc Multi Correxion 5 In 1 Anti-Aging Chest, Neck & Face Cream With spf 30, 1.7 Oz., I love this stuff I've tried so many different things and Roc is the best. No turning back for me"
I actually bought this product after using the sample.
Very affordable and works really well on the wrinkles on my upper chest.
Very pleased with this product.
I had never purchased ROC before. This sample changed my life completely. I love the smell. It keeps my face moisturized all day. Has a good feel to it. Its the best face product ever.
"I only got a small sample of this in my Wal-Mart Beauty Box, so I can't comment on how well it works after using it long term. But I can say its a nice cream, easy to spread, and has a nice fragrance."
"I like the feel of this lotion on my face, not sticky at all! I may have to buy this one as most anti-aging lotions for the face leave a horrible feel on my face! Would love to know the long-term results for me as at my age, anything helps!"
I love this product but could not find it at my local walmart!!! Its great for under make up. I went to buy it and could not find it. I will continue to check for it.
"This is so very creamy...not greasy at all. The scent is too good to be true!! Only negative on this, for me, is the cost. It's priced a bit higher than I would like to pay."
"Got this in a Classic Walmart Beauty Box. Sample size was a bit small but this is the second sample of this that I've gotten and they were both the same small size. Although this is a good product, I just can't see spending that much on it."
This has been one of the best moisturizers I have ever found for face and neck. It is not sticky and does not cause me to sweat. It allows my skin to breath. I will purchase this item in the near future.
Thank you!
"I love anything made by Roc. It makes my skin feel rejuvenated and I see positive results. I would buy it over and over, if I could afford it. Excellent product."
"I have been using face cream on my neck and chest for a while, and have noticed good results -- smoother skin tone and no wrinkles. This is a good cream and I love that it has spf 30 also. I just wish there was more of it!"
I've recently started using this & it's so smooth. It's not heavy or greasy. Love the lightness on my skin & knowing it also protects me from to much sun.
"My daughter actually got a hold of this one, she loves the little packages and thinks they are meant for her. She used it as a regular lotion, but I have to say it did relive her eczema flair up so I call that a win."
"I like that the cream isn't greasy and feels nice on your face. However, it has a very heavily fragrance. I don't care for that. You smell it all day and night as a result."
I liked the fact that a little goes a long way. It left my skin feeling soft and supple. It abssorbed quickly. And it is a sun block. It has a pleasent scent
I dont use this kind of stuff. Theres so much out hwre of this stuff that i think its ridiculous plus its expensive. I would tell people about this though evdn though its just not for me.
"Great product. My face felt so silky smooth afterwards. I didn't give it a 5 star because of the cost, but I will consider purchasing this because of my silky skin."
"I loved this moisturizer! It was light enough to wear in the summer and under make-up... and for the price, I would highly recommend it! Worked awesome!"
will be buying this product--so glad i got to try it---otherwise i probably would not have bought a full size on my own--but now I will---thanks so much for these beauty kits
I have since purchased this product and use daily since I received the sample. The product does not live my skin greasy and I stopped using foundation daily since I started using this.
"Really enjoyed this product. Nice fragrance and liked have the 30 spf factor. Diminished a little of the dark spots, but probably have to use more to see a dramatic difference."
"My favorite product of all is this pampering neck, chest and face cream with spf! A rich cream to moisturizer delicate neck and chest skin too. A queens must have! [This review was collected as part of a promotion.]"
I received free product in exchange for my honest review.
"I never used cream on my neck before, it really is making a difference. [This review was collected as part of a promotion.]"
"This product glides on, has a nice creamy texture, and my skin is softer from using it. I will buy again! [This review was collected as part of a promotion.]"
I liked the feel of this on my skin. It absorbed really fast. It light on the skin and didn't cause a break out. [This review was collected as part of a promotion.]
This is a perfect day cream and it has sunscreen. Feels very lightweight when you put it on-no harsh smells. [This review was collected as part of a promotion.]
My neck and the top of my chest are feeling so smooth and can't wait to get some sun using this so I won't burn my skin is lookig good!!!! [This review was collected as part of a promotion.]
I can see a visible difference in my skin. My pores are almost invisible and chest and neck looks younger. I am very pleased with this product! [This review was collected as part of a promotion.]
"Love, love love this cream. Definitely does the job well, and makes my face softer and more lovely! [This review was collected as part of a promotion.]"
"I also tried this one only during the party. Will certainly use it in summer, with its SPF, and it's working tgether with the others received. [This review was collected as part of a promotion.]"
I got this product to try for free. I use it daily. It is a good sunscreen and is very effective. [This review was collected as part of a promotion.]
"RoC® MULTI CORREXION® 5-in-1 Chest, Neck & Face Cream with Broad Spectrum SPF is a very mild cream that I would definitely use every day. I like that it has SPF 30 coverage! [This review was collected as part of a promotion.]"
"This cream is about the same as any other face cream I have used. I haven't seen any dramatic results, it just seems to be a cream to use under my regular makeup. [This review was collected as part of a promotion.]"
it smells so good. it left my skin moisturized but not greasy.
i enjoyed the free products. i will keep using them all. [This review was collected as part of a promotion.]
Very hydrating to the skin which is necessary for skin replishment. Thanks for adding in the SPF. [This review was collected as part of a promotion.]
I put my trust in RoC and I am happy! My neck area seems softer and my face looks refreshed. I am sold on RoC [This review was collected as part of a promotion.]
MY NECK HAS BEVER FELT SO FIRM AND YOUG LOOKIMG MY FRIENDS AND FAMILY ARE SO AMASWD AT HOW I LOOKED [This review was collected as part of a promotion.]
"RoC MULTI CORREXION 5-in-1 Chest, Neck & Face Cream with Broad Spectrum SPF 30 is light weight and absorbs well. It works great under make up. I received this product for free and it works great. [This review was collected as part of a promotion.]"
"Goes on nicely and doesn't irritate my skin - haven't seen a big difference yet, but looking forward to smoother skin! [This review was collected as part of a promotion.]"
I'm so thankful I was able to participate in the program. I had never used Rock Products before but now I am believer in them. They work miracles on your skin and make it feel so soft and silky! [This review was collected as part of a promotion.]
Yes!!! Love getting the retinol treatment I love from RoC in the same jar as my a.m. moisturizer & SPF!! Great product! [This review was collected as part of a promotion.]
I don't think I can live without this stuff now. It is amazing and every women over the age of 50 minimum needs to invest in the entire line. [This review was collected as part of a promotion.]
Love the spy protection that this moisturizer gives me I received a free party pack to try this product [This review was collected as part of a promotion.]
"I like this 5 in 1 chest, face, and neck cream. I started using it before bedtime, and I really love it. It makes my skin smooth, and I wake up with a fresher complexion. [This review was collected as part of a promotion.]"
It's unfortunate that I have to rate this product before I have had time to use it for the required amount of time. All I can tell you is that it has done nothing so far. [This review was collected as part of a promotion.]
I received this Roc multi correxion as a fre samole from House Party in exchange for my honest opinion. I can honestly say it leaves my skin feeling tighter and smooth. It also has a nice scent. [This review was collected as part of a promotion.]
I like the feel of this. I hope the sunblock aspect works well. It's winter so I'm not seeing a lot of sun lately. [This review was collected as part of a promotion.]
I am in love with the 5-1 RoC neck and face cream. I've never tried anything that goes on smooth and silk as it. ❤❤ [This review was collected as part of a promotion.]
"I really like this product!!! I've taken a pictures for before and after and I like the fact that this product is made for chest, face and neck!!! I wish more products were made this way!!! [This review was collected as part of a promotion.]"
This is a great product to use for more than your face as it can be used for the neck and chest area as well and it did work on me and made my skin more smoother than it has been in a long time [This review was collected as part of a promotion.]
My sagging neck and sun-ruined skin really need this. I am please with the SPF 30 to prevent any further damage. [This review was collected as part of a promotion.]
"RoC's Multi Correxion 5-in-1 Chest, Neck and Face Cream is rich and creamy, and it has SPF 30. I received this product free for my honest opinion. [This review was collected as part of a promotion.]"
Excited to be using this product. Hope to see results with in time. Smells good and not greasy at all. [This review was collected as part of a promotion.]
Loved this product for battling those pesky wrinkles on the neck and chest. Thank you RoC and House Party for the great party pack!! [This review was collected as part of a promotion.]
"Wow! I am flabbergasted at how much my skin just drinks this stuff in. I almost have a soft glow. The moisture lasts all day, without feeling greasy, and my lines seem less noticeable. [This review was collected as part of a promotion.]"
"I love the feel of this cream and the fact that it has sunscreen in it. I did receive it for free. I am not crazy about the smell, I think it could have a better fragrance. [This review was collected as part of a promotion.]"
I will for ever purchased this product because it works I really feel the difference when I put it on my skin I feel it right away and I see it right away which is very important to me I love ROC [This review was collected as part of a promotion.]
This is amazeing. I used it on my neck an chest. An i saw improvement skin texture. Was tighter. An more raidant [This review was collected as part of a promotion.]
I like the fact the cream has 30 SPF. I used this during the day. All in all my skin does look better and my wrinkles are less noticeable. Would recommend to my family and friends! [This review was collected as part of a promotion.]
daily routine now includes this after I apply my face oil I like that it highlights the neck and chest areas that I have neglected . [This review was collected as part of a promotion.]
"Received a sample of this cream in my Beauty Box. A very nice, odorless cream. Not runny, it had a nice consistency. I used this on my Throat area at night. Not greasy. I give it 4 stars. I would buy it."
"I would never have bought this. I was leary. BUT after trying it, I really liked it. It left my skin smooth and the wrinkles appeared to disappear. I will be purchasing this soon."
"I like trying new products thats why I love getting the beauty boxes this cream I have wanted to try for awhile an I really liked it wasn't greasy and no powerful scent and no breakouts. and again good size for traveling, or weekend getaway."
I have very sensitive skin and was nervous to try this. Even as a sample I got several days of use from this and never broke out once. It was too short a time though to actually see if it helps in any other way.
It is lightweight & doesn't clog my pores. I love the way it smells and would TOTALLY recommend it to anyone. I have super sensitive skin & I used it everyday right after my shower and its amazing!
"i've been using this sample everyday since i got my box. i LOVE it. absorbs nicely, never greasy. feels good under my makeup. will definitely be buying this."
"I had been wanting to try it and am so glad a sample was included in my #WalmartBeautyBox. Unfortunately, I am not able to say whether or not it works. The scent is too strong for me so I stopped using it."
Ive used this product in the past. I was so glad to see this be a part of the Wal Mart box. I never thought of a moisturizer would work for both face and neck but it really works. Amazing product.
I just love putting this all over my face and neck a couple times a day. It has made my face radiant and also has improved my over all skin tone. I will be buying the full size of this product. Thank you ROC.
"It works really well, & covers up a lot of the splotches on my skin. And, it doesn't take a lot of the product to work either. I definitely plan on buying some in the near future."
"This cream smells really great, I had no sensitivity to it at all so this works for sensitive skin. Made my skin feel smooth, and I plan on continuing on using this to see more results."
"It was alright. I've heard wonderful things about this product and was eager to try it. Not sure it was the best for my skin. Nothing bad to say, also nothing extraordinary to say about it."
"This cream is Great! Used it morning & night; light, smooth & applies nicely. I truly noticed a difference on my face/skin -- fewer lines, smoother skin."
I've always been curious about Roc products. I loved my 5 in 1 cream sample from my beauty box. I have dry/combo skin that loved this hydrating yet non greasy formula. it has a subtle refreshing scent too! love
"I've always wanted to try the RoC products but they are a little pricey and I have sensitive skin. But thanks to this sample I can try it out. However, I do wish it was a little larger sample to see if it really works as it claims."
I loved the smell. My face felt and smelt refreshed. I noticed that the deep pores on my face didn't seem as deep after a week of using it. I will definitely be purchasing this product..
"The RoC Multi Correxion 5 in 1 Chest, Neck and Face Cream was nonirritating and absorbed well into my skin. It didn't leave a greasy or sticky film. I could easily apply make up over it."
This is the first time I have used an RoC product and I love it! It has a great fragrance and it does not leave my face feeling greasy or oily. I have oily/combination skin and it works perfect.
"this worked great on my neck area, i have lost some weight and the skin there was kinda loose and it helped firm it up and helped my face with dryness also."
Love cthe way it made my neck feel. It was as if it was tightening it up. At 43 I am starting to sag because of weight loss and age. I wish I could afford it in my budget but most beauty products are not in my budget.
"I really liked this face cream. It came in a sample box, and I'm so glad it did! I probably would not have selected it off the shelf, but I will certainly purchase it now. I like that it has SPF 30 in it, and it's not greasy at all."
I'm still not sure on this product. I don't believe there is enough of a sample to be able to make a decision either way. I will keep trying this product for another week and go from there.
Product absorbed fast and left skin feeling refreshed and replenished. it's a little pricey but the way my skin felt after even a few applications may make it worth the purchase.
"I enjoy all of Roc products, and this cream is a must. It goes on smooth, absorbs and is not greasy. After using the small sample I saw a difference in the lines on my face. Will definitely buy. Thanks"
"after hitting my 40's, I could see a difference in the skin on my neck - this is a really good product, after a few nights use, my skin looks smoother and younger"
"It's a very smooth cream that feels amazing! Not oily. What I didn't care for at all was the fragrance. It smelled like I was applying a sun screen that stayed. For that reason, I probably wouldn't buy it."
"I have never purchased RoC products, I haven't felt the need, but I did like this sample of nightcream...great smell, went on smoothly and non greasy. I would purchase this product."
"With just a sample to use, it is hard to make any real judgement calls on the direct impact that this product has on your skin. It felt creamy and absorbed well."
