"I received a generous sized sample of RoC® MULTI CORREXION® 5 in 1 Chest, Neck and Face Cream. It truly is an amazing product starting with the very pleasant fragrance, and beautiful gold lidded jar. The cream goes on smoothly and absorbs easily, leaving no greasy or slimy feeling. It has helped to diminish the small wrinkles on my neck. [This review was collected as part of a promotion.]"
"I was lucky enough to be chosen to try this Roc Multi Correxion 5 in 1, Neck and Face Cream. I never paid much attention to my chest area, but after discovering this fabulous cream, I am so happy. It is really smooth, easy to apply, great smell, and the results are amazing. I am over the moon happy that Crowdtap introduced me to this amazing product. Definitely will buy it in the future. [This review was collected as part of a promotion.]"
"I loved trying out this creamy rich non greasy cream on my face, neck and chest every night. It was light and weightless. I thought every night I applied it to my skin in smooth upward strokes, it left my skin feeling soft, smooth and noticeably lessened the appearance of wrinkles and imperfections. [This review was collected as part of a promotion.]"
"RoC multi correxion 5 in 1 chest,neck and face cream is a amazing product that has really improve my skin in a short amount of time. I would highly recommend the product to friends and family,who want to reduce fine line on the chest,neck and face without using a lot of different products. [This review was collected as part of a promotion.]"
"Love the feel of the product as I put it on my face. The ease in which it was removed with water only was awesome. My skin fills clean and smooth. And so refreshed, like clean air circulating around my face and neck. [This review was collected as part of a promotion.]"
"Thanks to Crowdtap I had an incredible opportunity to test Roc Multi Correxion 5 in 1 Chest, Neck and Face Cream.Its a complete anti aging routine all in one. I was able to use it on my face, neck and chest there is no need for anything else. My skin was left feeling soft and looking great. It never dawned on me that I should be using something on my neck and chest. Im so greatfull for having the opportunity to try this product. I will make this a part of my regular routine. [This review was collected as part of a promotion.]"
This did a ewal good job of exfoliating my skin. I couldn't be happier. My complexion is the best it's ever been. I found the product to give my skin a fresh clean feel and look. I actually felt a disserence adter the first time of using the product. I highly recommend this product. [This review was collected as part of a promotion.]
"RoC's® MULTI CORREXION® 5 in 1 Chest, Neck and Face Cream is great, it has a nice fragrance, it's not greasy, it absorbs quickly, and your skin is nice and glowy after using it. I tried using it on half my face for a month and the side I used it on was definitely softer, more radiant, and my crows feet were reduced. [This review was collected as part of a promotion.]"
"I absolutely love RoC® MULTI CORREXION® 5 in 1 Chest, Neck and Face Cream - and my neck and chest are grateful because they finally have a product that reminds me to apply it to those neglected areas. I like that the cream is thick and rich - just what those areas need...and its scent does not compete with my perfume! The cream is fast absorbing and non-greasy! [This review was collected as part of a promotion.]"
I am not a big fan of moisturizes when you sent me the ROC 3in1 I was very skeptical but after about a week and a half I started noticing that this product was different it stays with you 5 hours later your skin still felt as good as when you first put it on and it just kept improving I would recommend this product to women around the world my family my friends this product is definitely worth it thank you for choosing me to review it [This review was collected as part of a promotion.]
"RoC® MULTI CORREXION® 5 in 1 Chest, Neck and Face Cream! is awesome I have used it now for 2 weeks the fine lines under my eyes are starting to disappear my neck actually looks better and my skin is so much smoother and brighter. It goes on smooth and doesn't clog my pores. I also don't have any issues with skin irratation overall I think this is a great product! [This review was collected as part of a promotion.]"
"i used so many creams before,but after i tried Roc i am so happy with results,it reduced wrinkles and lines on my face,this cream is so easy to apply and my skin as sating so soft,i would highly recommend this cream,this is the brand that i trust [This review was collected as part of a promotion.]"
"I recently tried MULTI CORREXION® 5 in 1 Chest, Neck and Face Cream and I absolutely love the product! It goes on super smooth - smells great and does not leave my skin feeling greasy or oily at all. I love the SPF factor in it - as I can use it on my face, neck and chest and know that this area is protected from the sun. Definitely a must have from here on out in my beauty routine! [This review was collected as part of a promotion.]"
"As I've gotten older I've noticed small signs of aging on my neck and chest: hyperpigmentation issues and some lines. With Roc 5 in 1 Chest, not only am I seeing results, I don't have to sacrifice more time in my skincare schedule. I use this moisturizer for chest neck and face after my serums. It's not sticky, my skin absorbs it quickly and most importantly IT WORKS!!! [This review was collected as part of a promotion.]"
"I like the idea of one cream for your face and neck. As I am getting older i noticed a lot of fine lines and wrinkles even on my upper chest. After using RoC's® MULTI CORREXION® 5 in 1 Chest, Neck and Face Cream for a little more than a week...I have noticed a slight difference in my face and neck. I love the creamy texture and it smells amazing. My skin feels so soft and silky. I will continue to use this product, Made a believer out of me. #sponsered #crowdtap [This review was collected as part of a promotion.]"
"I liked the texture of the face, chest and neck cream and I do think it made my skin look better. I just wish I didn't have the skin tags on my neck to still detract - but at least RoC is doing its job but if it had something in there for this too, I'd love it! My skin felt softer too. [This review was collected as part of a promotion.]"
"RoC MULTI CORREXION 5 IN 1 Chest, Neck nd Face Cream. made a dramatic change in my appearance instantly. My family and friends started asking my what i had done to apper younger. i had to tell them. i was so excited about it. It feels really good on my skin and absorbs instantly leaving smoother more radiant, younger looking skin. I am thrilled to have found out about it. [This review was collected as part of a promotion.]"
"I used RoC MULTI CORREXION 5 in 1 Chest, Neck and Face Cream for 10 days straight. I had a noticeable improvement in the look of my skin. Lines were softened and they felt softened. My skin seemed healthier, moisturized, and youthful. I was very impressed with this product and plan to continue using it. I believe that this is one of the best skin products that I have ever used. [This review was collected as part of a promotion.]"
"RoC Multi Correxion 5 in 1 Chest, Neck, & Face Cream made my skin look moisturized and a little younger-looking.. It smooth the fine lines on my chest and neck. It help restore elasticity and firmness. This is perfect product for my routine. This specially formulated product moisturized my chest and neck area and made my skin radiant. I would recommend this product. [This review was collected as part of a promotion.]"
"RoC® MULTI CORREXION® 5 in 1 Chest, Neck and Face Cream is now my favorite cream. I have a renewed confidence in how my neck and chest look. I had to tell my sister that I like it better than something she sells and I will now be buying RoC instead. Just give RoC a month you won't regret it. [This review was collected as part of a promotion.]"
"I love the feel of this product. It is thick but not greasy. It feels luxurious and rich. It makes my skin smooth and soft all day after I put it on. It really made so much of a difference that my husband asked what I had done to my skin! That is the best endorsement for me. There is only a slight scent and that is great too. I really love this product! The price fits in my budget as well! Happy me, Happy Husband, Happy pocket book ! I couldn't ask for more! [This review was collected as part of a promotion.]"
"I was a lucky enough to be chosen as a reviewer by crowdtap, so I didn't have to buy this product before trying. I have extremely dry skin and have the beginning signs of brown spots. My pores seemed to always be enlarged, no matter what product I used, and I have premature wrinkles, due to prolonged periods [This review was collected as part of a promotion.]"
"I wasn't really expecting much from this product. I figured it would pretty much be like others I have tried. But I have to say that I'm impressed. After only a couple of weeks, the dark spots on my face are noticeably lighter! I will continue to use Roc Multi Correxion 5 in 1 Chest, Neck and Face cream and I can't wait to see the results!! [This review was collected as part of a promotion.]"
"I had always seen ROC in the stores, but for some reason, I was reluctant to try it. But I am so glad I did. I could tell a difference after using a couple of days. My face seemed softer and the fine wrinkles less pronounced. I am now a loyal ROC user and it will definitely be part of my daily facial routine. When I tell people I'm 61, I am continuously asked.. ""Are you sure??"" lol. [This review was collected as part of a promotion.]"
"I received a free sample of RoC® MULTI CORREXION® 5 in 1 Chest, Neck and Face Cream to try and really liked it. The cream was easy to apply and rubbed in quickly. It also helped my face, neck, and chest feel smooth. [This review was collected as part of a promotion.]"
#Roc is an amazing product get you to gaim back your confidence i showing your beautyfull neck without having to worry about how it lok cause #Roc nourish and pamper your face and neck so you can stop wearing turtle neck and wear on your v neck dress or shirth [This review was collected as part of a promotion.]
"RoC Multi Correxion 5 in 1 Chest, Neck and Face Cream is amazing! The cream goes on easily, gives a luxurious silky feel to your skin, and gives you reassurance with a SPF 30. The soft scent is very pleasant and makes this product even more enjoyable to use. I was pleasantly surprised to experience softer skin where ever I applied it. I would highly recommend this high quality product! [This review was collected as part of a promotion.]"
"I LOVE RoC® MULTI CORREXION® 5 in 1 Chest, Neck and Face Cream ITS A WONDERFUL MOISTURIZER NOT ONLY FOR MY FACE BUT ALSO FOR MY NECK TOO. I APPLIED EVERY DAY AND IN A COUPLE OF DAYS I COULD SEE THE DIFFERENCE IN MY NECK ! ITS JUST A WONDERFUL PRODUCT . [This review was collected as part of a promotion.]"
"RoC's® MULTI CORREXION® 5 in 1 Chest, Neck and Face Cream is the ultimate multi-tasker! My skin just drank in this delicate moisturizer that made it feel pampered, refreshed and revitalized. I think the skin on the neck and chest area is often forgotten in a beauty regimen and the fact that one product covers all these areas is not only cost saving but not a regimen at all! It's a pleasure and one that gives me the confidence to face the day! [This review was collected as part of a promotion.]"
I used Roc Multi correction cream for over a week and could see the difference in my skin . I liked the feel of the cream and that it left my skin feeling soft and not greasy . It is now part of my daily skincare routine. I will be recommending this cream to all my friends and family. [This review was collected as part of a promotion.]
"I have been using RoC Multi correxion 5 in 1 chest, neck and face cream. for about 4 weeks now. I have noticed less noticeable wrinkles around my eyes, neck, chest and smile lines. I will continue using the product fro further results. I will recommend it to my family and friends. [This review was collected as part of a promotion.]"
"I love theROC Multi Correxion 5 in 1 Chest, Neck, and Face Cream! It is easy to put on, not thick and greasy. When I use it at night my face is so soft when I wake up. I use it twice a day and my skin stays soft all day. I truly can say it makes my skin look so much better. I have already recommended this product to my daughter and some friends. I always get compliments on my face and this is why. I like other ROC products as well. [This review was collected as part of a promotion.]"
"#WomenWhoRoC #sponsored 5 stars for RoC Multi Correction 5 in 1 Chest, Neck and Face Cream with broad spectrum SPF 30 sunscreen! After only 1 week of use, I noticed an increase in the softness and firmness of my chest, neck and face skin. With future use of RoC 5 in 1 I know my skin will continue to improve while also protecting from sun damage. [This review was collected as part of a promotion.]"
"I admit it....our bodies need to be moisturized. The neck and chest area are frequently neglected. After receiving and applying RoC's Multi Correxion 5 in 1 Chest, Neck and Face Cream daily, I must say these areas won't be ignored again. This luxurious cream went on silky-smooth, and left my skin feeling wonderfully hydrated. On top of that, its also SPF 30, making it a natural choice for every day use. [This review was collected as part of a promotion.]"
"I am so glad to have received Roc Multi Correction 5 in one neck, chest and face cream. I could tell a difference after the first week and after 2 1/2 weeks a major difference. My skin was so much smoother and I felt like it glowed. It looked much more youthful and I look forward to wearing my 2 new V necks I bought just because my neck looked better. [This review was collected as part of a promotion.]"
"RoC® MULTI CORREXION® 5 in 1 Chest, Neck and Face Cream smells amazing. It's very easy to apply and doesn't leave and weird after feeling. My skin absorbed it right away. I haven't been using it for long but I really like the way my skin feels after I apply it. It alswo comes in a beautiful container. [This review was collected as part of a promotion.]"
"I loved the,way my face and neck started to feel after 2 weeks of using ROC multi correxion 5 in 1. Chest neck and face cream. I. Am thankful for. Crowdtap giving me a chance to try and review this product I will continue usimg,it [This review was collected as part of a promotion.]"
"Roc Multi Correction 5 in 1 Chest , neck and face cream rocks. It goes on smooth and just in the short time I've used it I can see results . My neck looks tighter and I feel like I look a little younger . I love that I can use it on my face, neck and chest it saves me money . I also love that it has sunscreen in it one less thing I have to worry about . I'm loving this product . [This review was collected as part of a promotion.]"
"I was really excited to try RoC Multi Correxion Chest, Neck and Face cream. I love how after using this product it left my skin soft and smooth. After using this product I did see a difference in my chest, neck and face. I also liked that it had SPF 30 and the fragrance was very pleasant. [This review was collected as part of a promotion.]"
"I loved the way RoC® MULTI CORREXION® 5 in 1 Chest, Neck and Face Cream made my neck, chest and face feel so soft and smooth. I could feel the difference in the tightness and texture of my skin. Now I can wear my low cut clothes with confidence. Thanks Roc. [This review was collected as part of a promotion.]"
"The RoC® MULTI CORREXION 5 in 1 Chest, Neck and Face Cream is wonderful! My skin feels so soft. I noticed a different in the skin on my chest within just a few days. No greasy feeling like some creams. Thank you RoC for making a great product! [This review was collected as part of a promotion.]"
"I love RoC Multi Correxion 5 in 1 Chest, Neck and Face Cream. After using for just a few days, I noticed a change in my complexion and firmness of my skin. I loved the confidence it gave me to wear a blouse to show of my neck and chest also. Everyone should give this a try! [This review was collected as part of a promotion.]"
"I received this product roc from Crowdtap for free for my opinion after using it a month. I can honestly say my skin is softer and has less wrinkles. I like the smell of it and the great feeling of smoothness on my neck, chest, and face. I feel more confident wearing v neck shirts now. [This review was collected as part of a promotion.]"
"I recieved this Roc Multi Correxion 5in 1, as a sample-share sponsored by Crowtap and i must say i love it! Fine lines & wrinkles are fading away. It's not greasy at all, great smell, just a Really Good product! [This review was collected as part of a promotion.]"
"RoC® MULTI CORREXION® 5 in 1 Chest, Neck and Face Cream has really made a difference in my neck and chest area. I have been using it for about 3 weeks and my neck is very smooth and the skin tone on my chest has evened out. [This review was collected as part of a promotion.]"
"I like the way my skin feels after applying the RoC Multi Correxion 5 in 1. It doesn't feel greasy or oily. I cannot say that I am seeing any super results yet, but I do think I am starting to see some results. [This review was collected as part of a promotion.]"
This is the first RoC product I have ever used and I'm in love. My skin feels so soft. My fine lines have diminished and the fact that it works on the chest and neck area is absolutely wonderful because I've never thought of needing to use a product on that area. [This review was collected as part of a promotion.]
I had red blotchy skin on my chest before using this product. I used Roc Multi Correxion and now my skin on my chest matches my neck and face. I am really impressed with this product and will be buying it again!! [This review was collected as part of a promotion.]
I think it is really great that we are finally able to focus on our chest and neck areas now with a product specifically made for those areas as well as faces. This cream is smooth and soft and goes on so nicely. It absorbs immediately and I do not have to worry about residue on my clothing. Not only do I notice fine lines on my neck getting less noticeable but I love how this product is also a sunscreen that I do not mind applying at all. [This review was collected as part of a promotion.]
"I enjoyed using ROC Chest, Neck & Face Cream. It has a light clean scent and applies smoothly and absorbs quickly. In about a week I noticed my skin appeared more hydrated and soft also my lines looked smoother. My dark spots seemed to be fading giving my skin a more even tone. [This review was collected as part of a promotion.]"
I received Roc 5in1 Chest Neck and Face Cream to try and i feel it works really well. I never really noticed how dry and wrinkled my neck and chest were becoming until using this. Now my skin feels totally different and my hands glide across my skin like silk. This has made a difference in the look and feel of my chest especially and given me a new found confidence! [This review was collected as part of a promotion.]
"I'm really happy with my Roc Muti Correxion 5 in 1 check, neck and face cream. I have seen some great results in this past month. My neck doesn't look so crepe like and my face loves how it leaves my skin feeling moisturized and I've seen some reduction in the fine lines.It's a great addition to my skin care routine. [This review was collected as part of a promotion.]"
"I was very skeptical. I have tried pretty much everything on the market. After just a week, what a difference!! I love the way it makes my skin feel. Not greasy at all. Just soft, smooth, younger looking skin. You have a customer for life, and have already recommended it to all my friends and family [This review was collected as part of a promotion.]"
"Worth it! RoC® MULTI CORREXION® 5 in 1 Chest, Neck and Face Cream is firming, not greasy, and absorbs quickly show results in just 14 days! If you are looking for an all over your face, neck, and chest cream that helps corrected damage, this is the way to go. Doesn't take much to cover all those areas. I was given a full sample of this product for free to test and give my honest opinion of the product. [This review was collected as part of a promotion.]"
"I am a HUGE fan of RoC® MULTI CORREXION® 5 in 1 Chest, Neck and Face Cream! I have had several friends tell me their experience with RoC® and it almost sounded too good to be true until I got to experience for myself. I LOVE it! I noticed a dramatic difference and am telling all my close family and friends that they need to try this fabulous product. [This review was collected as part of a promotion.]"
"RoC's® MULTI CORREXION® 5 in 1 Chest, Neck and Face Cream is a great product that actually delivers what it says it will. It helps reduce wrinkles and protects against aging. I love this product and will be buying it from now on. [This review was collected as part of a promotion.]"
"After using RoC® MULTI CORREXION® 5 in 1 Chest, Neck and Face Cream. I feel more confident wearing clothes with lower neck lines because my skin looks healthier. My fine lines are smoother and less noticeable. My skin feels hydrated and I like that it has sunscreen. It works great under my makeup. I also like that I get to use one product instead of three for my face, chest and neck. [This review was collected as part of a promotion.]"
RoC is better than any high-end product that I've ever used. I have used products that can't be bought off the shelf and can be more than $100. RoC is my certain go-to product now. I have noticed some improvement to my face and neck since using it. I didn't get my product but 2 weeks ago and find it remarkable. [This review was collected as part of a promotion.]
I can not get over how in a matter of days I could see such a difference in my neck and chest! I love the mild scent and how it is not heavy and thick on your skin. I will from here on out be using Roc in my daily routine! [This review was collected as part of a promotion.]
"I have received a FREE sample of RoC® MULTI CORREXION® 5 in 1 Chest, Neck and Face Cream through crowdtap and I have really enjoyed using this product! After a few weeks I can definitely tell an improvement in my face, neck, and chest skin appearance. My skin is smoother, softer, and more appealing overall. I am happy with my results and I will keep using this product in the future. It is easy to use and works well for me! [This review was collected as part of a promotion.]"
"I absolutely love the ROC Multi Correxion cream! I have been faithfully using the cream for 2 weeks and see a difference in my find lines around my eyes and chest. After one application my skin felt smooth, I've had multiple compliments on my skin. Coworkers have asked what am I doing different in my beauty regimen, because my skin looks great. I would highly recommend this product to anyone who is concerned with fighting the signs of aging. [This review was collected as part of a promotion.]"
"I am really pleased with RoC's® MULTI CORREXION® 5 in 1 Chest, Neck and Face Cream. It does not take a lot to apply to my face and neck. It is silky smooth feeling and goes on very nicely. After using for awhile I have noticed a difference in my face and neck so much for the better. It is giving me the confidence to show off my neck and not keeping it hid. Roc's skin care line is wonderful and actually works if you use as directed. [This review was collected as part of a promotion.]"
"The roc multi correxion 5in 1chest, neck and face cream has helped correct the fine lines I was experiencing. The cream helps keep my skin moisturized and it is only applied once a day. It's a non greasy formula and only takes a small amount. It is very effective and works well with my problem areas. *received free for review purposes [This review was collected as part of a promotion.]"
"This 5 in 1 Chest, Neck and Face Cream really helps to revive your skin to a better younger looking you. It leaves your skin hydrated and feeling silky smooth while trying to reduce the appearance of fine lines and wrinkles on your face and neck. It has a light scent but not too strong or overpowering. [This review was collected as part of a promotion.]"
"Love the RoC Multi Correxion 5 in 1 Chest, Neck and Face Cream . after four weeks of use my neck is much smoother and the wrinkles less noticeable. It was a nice consistency and had a pleasant smell. I would highly recommend this product to anyone wanting their neck area to look younger. I am a member of Crowdtap WOMM and was given this product to sample. [This review was collected as part of a promotion.]"
"Great product that doesn't have a smell to it and works as it says it will. I have tried many products that claim to help my skin look and feel better, but Roc really does the trick. After just a week of using this product I noticed a difference in the texture of my skin and it was starting to firm up with some elasticity to it. When I put it on at night you can almost feel it working. Wonderful stuff that I have recommended to many and will continue to do so. [This review was collected as part of a promotion.]"
"I'm so pleased with RoC® MULTI CORREXION® 5 in 1 Chest, Neck and Face Cream! I've been using it now for just over a month. I like the smooth, silky way it feels when I put it on my neck and chest -- and I love the results: smoother, healthier-looking skin. My neck and chest really do look 'younger' to me! There's a healthy glow and youthful smoothness that I was missing before. Thanks RoC! [This review was collected as part of a promotion.]"
