4.5,"['777', '202', '60', '24', '26']"
I noticed an increased radiance to my skin. My friends and colleagues also remarked that my skin seemed to be glowing. I did notice some firming.
I HAVE TIRED LOTSOF FACE CREAMS OVER THE YEAR AND WAS DISAPPOINTED IN THEM BUT THIS PRODUCT DOES JUST WHAT IT SAYS IT WILL DO WILL BE USING THIS FROM NOW ON!!
This is a wonderful product and has removed several wrinkles and starting to correct the double chin. My problem is it works only on light wrinkles and not the deeper ones. But I like it very much.
It's made a big difference in the texture of skin on my neck. It's so much smoother. Didn't expect it to take all the wrinkles away but it's done a much better job than I expected!
"I started using the multi correxion five in one chest neck and face cream And could immediately tell a noticeable difference. It was nice to know I could use it in the morning and have protection from the Florida sun. Are usually reapplied after lunchtime and feel confident that I'm not getting more wrinkles. The lotion doesn't feel greasy and although I have sensitive skin, I haven't had any reaction other than my skin looking fabulous!"
"I used ROC Retinol for about a year and loved the results! I ran out and thought I would try the 5-in-1 cream. Used it one day and woke to my face being tight, and red with an itchy chin and neck. My eyes are swollen too. So sorry to read others are having the same issue and that I must be having an allergic reaction!"
"I tried the 5-1 night cream as well the 5-1 eye treatment. I woke up the next morning with a swollen, red, inflamed face that got more itchy as the day went on. I'm on day 2 and the swelling around the eyes have gotten worse as well as the itching. I've been doing cold compresses, ibuprofen and an anti-histamine to help me. This is a terrible product and should come with a clearly written, easily visible warning about side effects. If I had the option, these products would have no stars at all."
Broke out in irritated rash on neck where product was applied. Rash dEcreased in severity five days after stopped using product
"Love this Roc 5-in-1 day cream. I have seen good results after using for the past two weeks. I use the night cream as well. It really does make my skin look more radiant. I'm a 67 year old woman that was a sun worshiper when I was younger. I use the cream on my face, neck and chest daily along with the night cream. My face looks more radiant. I have received compliments since I started using. I highly recommend."
"I was not sure to purchase this cream...but decided what do I have to loose..just might as well try it, long story short..I was super happy with this cream. It's not greasy, glides on comfortably, it honestly leaves my neck, chest and face smooth and feeling non greasy...which I hate to feel like that when I put on a cream. I highly recommend and it does make my fine lines and wrinkles seem less visible. Which is a huge plus for me, and also well moisturized. I really liked this cream. [This review was collected as part of a promotion.]"
"Unfortunately, I used this product once and ended up with an itchy, red neck which lasted a couple of days even though I washed off my neck. Returning this product today."
"This has been my daily morning go-to for years. It smooths and tightens the delicate décolletage, and has a 30 SPF, which is key to keeping your neck and upper chest protected and youthful. It's light, smells nice, and is worth every penny."
I use this cream everyday after bathing. Best neck cream on the market. Use consistently and you will see results. Not greasy but softens skins and diminishes the lines in the neck area. I love this cream and will use it forever. A plus is that it has a great but subtle scent that does not interfere with your perfume and it has sunscreen. You cannot go wrong with this cream. Fantastic product and well priced.
I bought this with high hopes but I can't get passed the smell. It has a very strong smell and I can't wear it long. I had to wash it off. I wish it came unscented because I would really like to try it since the Roc products always get such good reviews.
"I've been using this for 5 days and I now have a red rash around my chin and it has dried out my skin. I typically don't purchase much for myself and while the product is affordable it was still somewhat of a “splurge” for me. Needless to say I am disappointed. I do like the way it smells and it doesn't feel thick but the rash almost feels like a burn. Therefore, I will not be able to continue using it."
"My 50-something face really disliked this product! I used it for only a few days before I had to stop. I applied it at night before bedtime. In the morning I discovered my face was red and blotchy. And the cream clogged my pores causing breakouts. I always try new products for a few days to give my skin a chance to adjust to them. But after a few days, I simply couldn't stand the discomfort and irritation this product caused."
"I love all of the Roc products. This one is great if you're starting to have issues with creping in your decolletage. But the price makes it difficult to justify the purchase on a regular basis. A normal sized container lasts about one month because you really need to use it twice daily. If you stop using it, you can expect to see aging signs start to return after about two weeks of non-use."
"I've been looking for a neck/chest cream for awhile now because those areas show your age before your face does. I was so pleased to see this cream on the shelf. Allure Beauty recommended the cream so I knew it was good. It's not too thick and it does smell of the 30 SPF that it has in it, but I don't mind the smell. It absorbs after a few minutes, then you're good to go."
"This has really helped my dry skin. It makes it feel very soft and smooth as well. What I really hate is the strong scent. (The reason for docking it one star) Please, please remove the scent! I left the lid off for awhile in hopes that some of the smell dissipated. I think it helped some. I think the scent did cause some bumps on my face initially, but this has gotten better."
You can actually see the difference within days of using this. I had received a sample and ended up buying the full size which I very rarely do. Best decision ever! Couple years later and I'm still using it. Plus it leaves my skin soft... [This review was collected as part of a promotion.]
"I've been using this for some time and notice some reduction in fine lines. The scent of the cream is nice and I feel like it firms my face and neck up nicely prior to applying make-up. And the price is great compared to other more expensive face creams, and I don't notice any difference between the more expensive creams and the ROC cream. [This review was collected as part of a promotion.]"
I noticed softer skin and less noticeable lines in just a few days [This review was collected as part of a promotion.]
"It seems to be a nice cream, not sure how well its working on my wrinkles, but Roc is always a good product. Good price as well."
ROC has one of the best skin creams and serums on the market at an affordable price. Use them and your skin will thank you.
"Woke up in the morning with my face all red and rough.Used it just once. Did not feel anything right away.,until the morning.Face is red and very hot.Never have I had a reaction like this."
I really love this cream help me for my wrinkles and my face looks shine clean I will buy this cream
"When it became time to replenish my ROC skincare , I opted to try out the Chest, Neck & Face Cream. I love how it makes my skin feel! I've been using the 5 in 1 Multi Correction line for for a couple years and love the results!"
"I have tried several products.....and these are simply THE BEST in my opinion. I used Roc years ago and will NEVER change again!! What a tremendous difference in feel, quality and results!!"
"I purchased the NEW Multi Correxion 5 in 1, but see after active ingredients the Purpose is Sunscreen. I already use sunscreen every day, so would like an opinion about keeping and using this."
i LOVED this tiny sample!! and i ran to get a proper sized one because it has been incredibly hydrating and softening! i LOVE this product and recommended it already to others!!
"I had been wanting to try this product & was excited to get to sample it. I only used it for about 3 days, it burned my face too bad. I have sensitive skin but I usually don't experience burning like I did with this."
I wanted a rich cream with Shea butter and sunscreen and without retinol for use during the day as my skin is very dry. This has worked great so far. Leaves my skin very soft and moisturized. What I don't like is the strong scent. Wish they would just leave it out or make it much less intense and maybe more light and citrusy-not so flowery smelling. Scent eventually subsides and I can put up with it for the good benefits.
"Feels nice on skin, really like it on my old neck"
"ROC MULTI CORREXION 5 IN 1 CHEST, NECK & FACE CREAM I WOULD RECCOMMEND TO SOME PEOPLE, BUT NOT ALL PEOPLE. THIS FRENCH BRAND IS PRESTIGIOUS AND THE CREAM IS OF GOOD QUALITY. HOWEVER, SOME OF THE WOMEN IN MY FAMILY HAD A PROBLEM WITH IRRITATION ON THE FACE FROM IT."
"I've used Roc products before, and this didn't disappoint. Although I would have liked a bit more to sample than the minute sample that was provided. It's hard to really see if a product make a difference unless you have a few applications worth. But the lotion absorbed well and had a light scent. Not greasy at all. Love it"
"Saw ad in magazine. Purchased on a whim, fantastic results in 1 week. I noticed and my husband who had been out of town noticed. I love it!"
This product helped to improve the appearance of my skin and helped on the areas of dry skin. Reduced the look and feel of the skin.
Third day of use and my cheeks and chin have a rash and are very itchy. Wasted my money on this product. So disappointing.
"Received this as a sample. Applied one night, woke with itchy and hot rash covering much of neck and chest. Tossing this product!"
I have been using Roc products for the past 10 years and have always been told I look much younger than my age. I rate this cream right up there with the others.
That it doesn't have a lot of oils. I got a small amount in my beauty box from Walmart and tried what was sent and like it a lot. Works great for the time I used it will look into more of this brand. Had never used anything from this line.
ONE THING I KNOW IS THAT ROC IS NOT FOR EVERYBODY. MY SISTER & MY MOTHER TRIED USING IT AND HAD PROBLEMS WITH BREAKOUTS ON THEIR FACES. THEY SAID THEY WILL NOT USE ROC ANY LONGER. SO I'M RELUCTANT TO USE THIS PRODUCT.
I tried the sample size and did not feel that it was a large enough sample to truthfully make an honest judgment.
I did like the way it felt when putting it on. Not to greasy.
I discontinued use of this product as it smelled horrible. I wish it smelled better as I wanted to see how well the anti-wrinkle abilities turned out.
So nice to have one cream that does it all. I just apply it to my face down to my chest. I think it works as well as more expensive creams I have used.
This formula is smooth and non greasy. It absorbs quickly into the skin and has a pleasant smell. You can feel it working on your face. I have sensitive skin and this did not irritate it.
"I have used several Roc products, due to the good reviews. Unfortunately, I can NOT use them long enough to tell if they actually work, because the scent is way too strong! PLEASE, for the love of all beauty products, make this unscented!"
"This is a great product, with a multi- purpose use. It targets your face, neck, and chest, and has a nice silky texture. No cream is perfect, but this does a good job with moisturizing and softening wrinkles.."
Love all Roc products.
Great producy
"This cream is versatile for using on the face, neck and chest. I like how creamy it is and smooths on nicely and absorbs quickly. My skin felt nice after using it and I like that it is spf 30. It did improve the feel and appearance of my skin, but I only tried it a short time with the sample I ordered, so I don't know how it will be long term. I love the scent! My only criticism is that it could moisturize a little better."
"I tried ROC 5 in 1 cream. I felt like it sat on the skin and didn't penitrate. I don't tend to have a problem with dry skin, maybe it would work better. I prefer to use a product that actually goes into the skin instead of sitting on it and then washing it off at the end of the day/night."
"I rec'd a very small sample in my Walmart Beauty Box, very small. I was only able to use it a couple of times but it is not greasy and felt good on the skin. If I had a larger sample and could use it for a couple of weeks I could give a better review."
Excellent moisturizer
I love it
Exceed my expectations
Recommended products for anybody younger looking skinis
"Like feel of product, but smell is over powering and gave me a headache have to return"
This gave me a bad headache because of the strong smell
I wish it came in unscented.
Smelled heavenly and felt so good on
I've also use this product for 2 1/2 years. It's great. Thank You.
"Makes your skin smooth. is SPF 30, and very reasonably priced. Have only been using it for a week, but can see it's making a difference."
Worked wonderful on my aged & dried skin. Would love to try more products from RoC in the future. The RoC product rocks!
"Used this on my neck -within about 8 hours my skin was itching, broke out and did not get better for over a week"
"This product goes on soft and light on your skin, not greasy, just moisturizing. Great for neck and chest, areas which sometimes we neglect."
"I've used this product for a week or two and have not noticed a difference. Maybe it takes longer than that; I don't know. As of right now, I would not purchase it."
"I received the ROC Multi Correxion 5 in 1 in my Fall beauty box. The little bit that was in the tube was nice. Goes on smooth and creamy, non-greasy and best of all you can use it all over face, neck and chest. I love that it has an SPF 30 rating. The only disappointing factor is that the amount provided was so minuscule I didn't have enough to use over a longer time to be able to make an educated decision about how well it worked for me. Therefore, I did not purchase the full-sized product."
"I have used a few creams on my face and because I have oily skin, I can't just use any product as I break out instantly. What I noticed 1st was the great smell, the thickness and non oily. The sample was very small, but it was enough to want to use it again."
"I got two in my box. I have used them both. But I really am not sure what is so exciting about it. There are plenty of other sunscreens that work just as well but do not cost as much as this one does. I found that when I was working in the sun and sweat, it ran in to my eyes and burned like heck!"
"Such a tiny sample. Used to use ROC products when I lived in Montreal. I loved their Gel for puffy eyes. This cream is nice - feels nice, makes skin looks nice and smells nice (barely no smell) I am very sensitive to smells, they trigger my allergies and asthma, so this one is a winner for me."
"ROC is the best line of anti-aging skin care that is actually affordable. I literally saw a difference in 2 days. I have been using the pump moisturizer for years, but this one is even better. I have already noticed that my brown spots are less visible and my turkey neck (from weight loss) looks smaller. PLUS, this one can also be used as an eye cream which saves me $15 (I use the ROC version for that too). This stuff is great. I'm ordering more when I get halfway to be sure I won't ever have to go without it."
I recently received a sample of this product in a beauty box. I tried this product during the summer months and it was thick and made my face greasy. It might be better in the winter when my skin is super dry. If you have very dry skin then this would be a great face cream for you. I would recommend this to my friends with really dry skin but not to ones with normal or oily skin.
I love ROC products. I have received the ROC serum in a previous beauty box and it has become one of my favorite products. I was happy to try this since I am needing to make some changes in some of my moisturizers as my age increases. I used this with the serum and love it! This cream is light weight and has a very mild fragrance. Thank you Walmart Beauty Box for finding me another fantastic product
I was looking forward to trying this product from ROC. I am 58 and continue to look for good skin care products that I can also afford. This sample was enough for a week if use on the face alone. I used this each morning and evening after washing my face. It moisturized lightly but that is all it did. I have seen better results from lower priced products. Everyone is different but this product is a no go for me.
The Roc Multi Correxion 5 in 1 cream is really good! I think it has such a nice scent and it works very well to hydrate my dry skin. My face and neck feel noticeably firmer right away after using and feels very smooth as well. I also love that it has spf 30!
#WalmartBeautyBox
"Since using this cream, I have seen visible results. I started a regimen of nightly use as an experiment, not expecting any results, but boy was I surprised! Where once the skin was dry and saggy, I began to see a softening firmness on my neck. Yes the product is a little pricey, BUT what is good skin worth? I've decided.... I'm definitely worth it! Highly recommend."
"ROC Multi Correction cream did what it said it would do, which amazed me!!!!. It's not greasy... Your skin drinks it up quickly, which is what you want to happen, when you apply moisturizer. It doesn't just sit on your skin... It melts those small wrinkles away ;). I highly recommend this moisture. It's not expensive and it works... however, it can be difficult to find."
"I received my wonderful sample of Roc Multi Correxion 5 In 1 Anti-Aging Chest,Neck & face Cream with spf in my Wal-Mart Beauty Box and I am in LOVE with this product.So glad I was given a nice sized sample to try.I put it on my freshly cleansed face,neck,chest and my skin feels so hydrated and healthy.I love how my skin feels after each use."
"I had been looking for a replacement for my current anti-aging moisturizer when I received the Roc Multi Correxion 5 in 1 Anti Aging chest, neck and face cream. After the second day of using it I was hooked! I could tell a difference in my skin texture that quick. I have a new favorite!"
Ive been using this for a long time. I'm almost 44 and this has helped me feel fresh and young. The key is regular every day use. I truly believe it helps reduce fine lines around the eyes and my neck still looks like it did when I was in my late twenties. So I'll keep using this.
"The scent of this is too perfume-y, especially since it is a facial product. The SPF coverage is nice. It leaves skin slightly greasy feeling, which may not be an issue for dry skin types. I doubt I'd buy this again, however, since I didn't notice any results whe I was through with it."
"I love a product that has multiple uses and it still looks beautiful. I hosted a ROC your age party and I was given a wonderful assortment of ROC products free for my guest and myself.The Multi Correxion 5-in-1 works to smooth out the skin on chest,face&neck and it has SPF 30 spectrum.Protection from the sun is a beautiful thing! It feels light going on and leaves skin smooth on the Chest, Neck &Faceis serious skin care that leaves me feeling lovely! [This review was collected as part of a promotion.]"
I have been using this product for the last four weeks. I am diligent about putting it on before bed and when I remember I use it in the morning as well. I can see a difference in some of the fine lines that I had around my chest area. I will continue to use it and see if I see continue improvement. The texture is wonderful. So creamy and I feel it really sinks into the skin! [This review was collected as part of a promotion.]
I have been using RoC Multi-Correxion Face Neck and Chest Cream for a few weeks after receiving a free sample through House Party. I had noticed a difference in my skin especially my neck area. After a recent 4 day trip where I forgot to take my 5-in1 cream.... I noticed a huge difference in the appearance of my skin without the 5-in-1.... I will never travel without my cream! [This review was collected as part of a promotion.]
I have been using this product for a month. I received this product for free through House Party. I would give my honest review even if I paid full price. This stuff is amazing. My skin feels amazing and looks younger. Love that it has an spf in it too!! [This review was collected as part of a promotion.]
"This product is one of my favorites because I have dry/discolored neck and chest. I use it every morning on my neck and chest for added SPF as well as it makes my skin color more even. I'm literally obsessed with this product, I will definitely buy this one when mine runs out, it's so SILKY! [This review was collected as part of a promotion.]"
"I definitely saw a difference after a week of using RoC chest, neck & face cream!! I'm 47 and have starting of wrinkles and loose skin on neck and chest!! But this cream helped significantly!! Thank you RoC!! [This review was collected as part of a promotion.]"
"Thnks To the House party I got this product RoC for free and I am lucky enough to use Cream with Broad Spectrum SPF30, specially in Arizona we need to protect our skin against the sun, and as a first time mom my skin change and I was able to stop the spots in my cheeks the KS to ROC multi correction. [This review was collected as part of a promotion.]"
"This Roc product is just so versatile! I love that it can be used on so many areas - chest, neck, and face. I also love that it contains SPF 30 because I need it on more than just my face. So often I've forgotten about my neck and chest area and gotten too much sun there. [This review was collected as part of a promotion.]"
"It has only been about five weeks since I started using the RoC Multi Correction but I already feel like my skin, especially under my chim, feels better. The skins uneven tones are slowly becoming less noticeable. I received a sample to try, and these are my thought! [This review was collected as part of a promotion.]"
"You know, first I thought this was just for my neck and decolletage, Then I did a little bit more research and this is my final step in my morning and night time routine. I love the way it feels on my skin, silky, soaks right in makes me feel look very hydrated period I am now in love with the ROC skin care line [This review was collected as part of a promotion.]"
"I never thought about my neck and chest until I got this product to try. Then I honestly looked at my neck and chest to see if I really needed a product. Boy was I surprised, I was starting to get a turkey type wattle, and my chest was definitely showing sun damage and my age. So I tried this product. Within 3 weeks my neck tightened back up and my chest smoothed out. I actually look 5 years younger or so because of the difference. I'm thrilled! [This review was collected as part of a promotion.]"
I'm all in for saving time and this is truly a great multi purpose product. The cream has a great texture and doesn't irritate my face or neck at all. My only problem is the SPF; it's definitely a necessity but the scent is a trigger for my migraines. I'm sure it's a winner for most. ** I received this product for free but my opinion is my own ** [This review was collected as part of a promotion.]
This cream feels very moisturizing. The SPF is a wonderful addition and this product does not have that sunscreen smell that so many others do. It just smells like a cream. Skin feels moisturized for many hours after applying without being greasy.
I received this product to try for free and this is my honest opinion. [This review was collected as part of a promotion.]
"I liked using this product while I was on vacation in Mexico. Such a difference than the Pacific Northwest winter I was experiencing. I knew I needed a different product to protect my skin. This worked very well, although I would only use this during the summer months here not all year round. [This review was collected as part of a promotion.]"
I would highly recommend this product! I was able to notice a difference in my skin after a few weeks of using it. I love the fact it included SPF which in turn equals one less product I have to apply during my morning routine. Another GREAT product from ROC! [This review was collected as part of a promotion.]
My neck has always been a trouble area for me - showing my age way more than my face does - so i was super excited to get a chance to sample this item for free. It worked better than i even imagined it could! my neck looks so smooth and the age spots on my chest are definitely diminished. This is my favorite new skin care product! [This review was collected as part of a promotion.]
Prior to receiving my free product I was not really acquainted with Multi Correction 5in1 Chest Neck and Face Cream with Broad Spectrum SPF 30. I admit I was a bit skeptical as how could one product do so many things. I am a skeptic no more. It truly works and works well. I love what it has done for my skin and having SPF is an added bonus. [This review was collected as part of a promotion.]
