4,"['150', '51', '17', '22', '34']"
I have tried this product for 2 weeks now and I love it!!! It helped with my dark circles and was very hydrating under the eyes! I would definitely recommend this product to all my clients and friends.. Plus the packaging is so pretty and light! This product comes packaged great and has a great deal of product inside...
"I am now on my third jar of this eye cream. I absolutely cannot do without it. My dark circles under my eyes are almost gone, and the puffiness is better as well. This also has a thinner texture, that works well for me as I can develop milia if I use too thick a cream under my eyes. I normally apply this when I apply a serum that I want to give time to sink in, like my retinol product. If my eyes seem especially dry, I will apply my face cream under my eyes as well. This product has a permanent place in my skincare regime!"
I have been using this for a month now sometimes twice a day sometimes once and I have seen a significant change I use to have really dark under eye area and it has gotten lighter way better than before. I had really bad wrinkles as well under my eye and those have gotten way better as well almost gone actually so I am very satisfied with this product . Thank you elf
"This, with the elf eye roller, are my STAPLES for my eyes in the morning. Between these two products and some eye drops, my eyes go from sleepy and red and puffy to pretty awesome.. fast. I love this and hope they never discontinue it. For the price it's totally a great product."
Been using this for some time now. Use it every morning and night. Eyes feel hydrated and less tired. Refreshed and cooling feeling. One jar lasted about 8-10 months.
Not very happy to open a brand new eye cream and see very little product inside. So much empty space! I really hope mine just happened to be a bad batch and not all of them look like this. Don't think I'll get much use out it.
I Bought this Product around two weeks ago and barely started to use it one week ago and the first couple of days I noticed what other high end creams could not achieve; reduce my dark circles. Also my wrinkles around my dark circles started to fade away and reduce in size. I always thought that buying expensive us creams would make a difference and only to find out my remedy was just a few blocks at target. I love elf and thank you for making my skin better without going broke.
"I brought this and used up the entire container, and I really saw no difference in the dark circles under my eyes. Admittedly, I'm extremely pale, and those circles are pretty extreme. It did treat the dryness around my eyes quite well, but I could have done that with any lotion. However, if I got in my eye it burned really badly. Which, is a bit upsetting with an eye cream. As you can imagine it did happen from time to time."
Use this product every morning. This definitely helps with the bags under my eyes :)
"So, I have been using this for a few months with my nightly routine and... I LOVE IT! I really do see such a difference in the appearance of my eyes. They are much firmer, brighter and I see almost no lines or black circles and over all they feel smoother! And for as long as I have been using this, I still haven't made a dent in the cream. A little goes a LONG way. Will buy again."
"I bought this eye cream about 2 months ago and was super excited about it, but after using it for a couple of weeks, I got a pimple under my eye! I stopped using it for a few weeks, and then tried again, and the same thing happened. It might just be that my skin is super sensitive there, but do use caution."
"Honestly, even without the breakouts, I didn't see that it made much difference."
"I bought this cream approximatively two weeks ago, since I suffer with dark brown under eyes due to the fact that I am naturally tan and let me tell you that this cream helped brightening up my dark circles! It did not help with the size of the bags under my eyes though. Still an amazing product! I LOVE IT!"
I bought this 4 days ago and have used it morning and night and am very happy with the results already. It hasn't diminished my circles completely just yet but i definitely notice a difference and can't wait to see a month from now.
I purchased this a couple of months ago and used it religiously...I really got no results for using it twice a day EVERY day I thought I'd see something. But for Elf's prices you can't go wrong trying out products.
"amazing product, it actually works. I see a difference when I need to treat puffy eyes. However, I bought it at Walmart and noticed they changed the container. I liked the old one better (shown in the picture)"
"I really enjoy the way this cream feels on the skin under my eyes and after 2 weeks I can feel the skin in that area becoming more plump. I just wish it had a more pleasant smell. It's odorless when applied to the skin but if you smell it in the jar, it kind of smells like glue. Don't know if it's the cream or the plastic of the container."
A little goes a long way! Great at night and under daily make up. Helps so much with fine lines and dark circles.
I love this it makes my undereyes feel amazing! recommend 100%
"my eye area is very sensitive and have tried many, I was so happy to find this one. It doesn't burn and works great, and what a fantastic price!"
"It works very well, I didn't notice how well it worked until I stopped using it for about a week. My skin feels tight and firm but I give it 4 stars because it doesn't quite minimize my under eye dark circles. Other than that it works great!"
It is cooling so gentle this product it awesome my eyes love it usually I swell or something with others this is the best stuff I will continue to use this from now on out and it last long time too cheap price great product
"I don't notice any help under eyes, but it's great for the lids, under eyebrow, and the fine lines between the eyes and hairline, especially after removing makeup."
"I loved the Origins ginzing refreshing eye cream, but its absolutely expensive. I wanted to give this a try, more affordable product. I love how it feels, very moisturizing, & feels great when applied cool. Doesn't irritate or dry out my lids. A little goes a very long way."
I use this right before my concealer; this allows my very dry under eyes necessary moisture so that my concealer doesn't cake up.
I've tried this and it doesn't really help with anything. It also gave me very dry and flaking skin around my eye and eyelid. I'm not allergic to any skincare ingredients so I'm not sure what caused this.
"I've only been using this for a few days but I must say, I see a difference. I use it day and night as instructed and have notice that even when i am lacking sleep and have to run out the house without my concealer I still look rested and awake. This is only the beginning so I am excited to see the results after weeks of use."
"I've been using this eye cream for about a month and the most i can say is, WOW! I'm 44, caucasian, combination skin with virtually no wrinkles. I DID HAVE the beginnings of crows feet at the outter corner of my eyes but after about 4 weeks using this eye cream, i have no sign of crows feet at all. The crepe skin under my eyes is there when i smile big but my eyes are smooth otherwise. Also, my under eye skin is very sensitive and with most other eye creams I've tried will swell, with this eye cream i have no, ZERO, swelling."
"FYI: the jar is MUCH tinier than it appears, with the product cavity being only a tiny portion of the container. The actual product is effective as a nice, light moisturizer, but I didn't see any improvement with dark circles, firmness, etc. In conjunction with cost / quantity, I really felt like I just paid for the plastic jar. I understand they are trying to make a more upper-end appearing packaging, but IMHO, the packaging felt really wasteful."
"I had my doubts about this product but after only a few nights of using it, it really made my under eye darkness disappear! I use it under my eyes, on the outer corners, and my entire eyelid. My skin feels so hydrated and looks refreshed! No more darkness around my eyes, I was so surprised. And you really only need a very small amount. Great value and well worth the money!"
First time user. I like the creaminess and lightweight cream but i have very sensitive skin around my eyes in it tingled almost to burning sensation with first use. I don't know if my skin is just irritated today and it just made it worse. I will try again tomorrow and for the next few days and see how it goes.
I have terrible eczema that would get so dry at night and be flaky and red in the morning no matter how much I moisturized the night before. I have been using this product for a month and I loved it since first use. It is velvety and extremely lightweight. Remarkably moisturing. My face hadn't been this smooth in morning for at least 2 years.
"The packaging is very deceiving, there is a miniscule amount of product compared to the container it is in. It honestly feels just like regular old lotion, nothing special about it for the eye or ""illuminating"" in any way. I notice zero difference from when I use this and when I don't. super disappointed."
On a whim I decided to try this out because other eye creams are so expensive. I got it in the mail and tried it out. INSTANTLY my puffy eyes were a lot smaller and my eyes felt hydrated. I have oily skin and it felt a little greasy. (I pat before applying makeup) But I was so impressed I had to write a review!
I have purchased eye creams that were 5 times more expensive and my last one made my eyes red in the morning. I simply can not believe hoe great this ELF eye cream is. Brightening and moisturizing without being greasy. I was so impressed with the eye cream that I just ordered the serum and night cream. I am 66 years old and I will never purchase an expensive eye cream again!!!
"Tones down early morning puffy bags. Love the new skin care line! My skin hasn't felt this soft EVER. I read a review from a previous submission regarding the products (specifically the night moisturizer) have a bad smell??? I have a 4 products and there is literally no scent. I am sensitive to smells, and I smell nothing. I will purchase again for myself and friends/family as gifts. Thank you ELF!"
"I got this a couple of days ago, but have just now had a chance to review. Like the others, it'll take about a month to see results; but I already love the basics: scent, texture, ingredients, etc. effective moisturising (that is usually an immediate effect) and leaves a nice canvass for makeup, etc. After a bit, I'll come back with a ""results"" review!! :) Meanwhile, love, Love, LOVE the packaging & the price!!!"
I've been using this eye cream for a few months morning and night to help my dark circles and haven't seen any improvement. The eye cream kind of stings at time and it isn't the most hydrating. I've noticed my undereyes would be drier and the dryness would be noticeable especially when wearing foundation or concealer. A little goes a long way though. I use this twice a day and have been doing so for a few months and I still have a long way to go before finishing the jar.
"I've been using this product once a day (the directions say to use it twice) for about 3 weeks now and I can tell in my magnified light up mirror that my under eyes have gotten significantly less puffy and more even in color, love the product, easy to use and you get a very large amount for the price."
"Let me start off by saying that I have chronic back pain and every morning I wake up unrefreshed, I have that tired eye look. This product has succeeded in helping me hide it. I only have to use a little bit everyday in the mornings, so this product is lasting me a long time. A little goes a long way."
"I bought this a while ago, used a little, and then forgot about it, but I unearthed it from my bucket and I used it on my undereye bags, I have had some real nasty bags lately due to working so much, and it improved the colour of them for the most part, like you can still see that I have bags, but it's not as noticeable now. The scent is pleasing and it's ice and creamy on the face. I like the product for the value. Great buy."
"I received a free sample of this eye cream in my most recent order. I've always had dark circles and puffy under-eyes, even pricier eye creams didn't help. After only two days my under eyes were less puffy! My mother even commented on how well rested I looked. That was all the convincing I needed to go to the store and purchase the full size version."
I ordered this online anf it came in a few days ago. It's been two days since I have been usjng this and..my eyes have brightened soo much!! My dad thought that I was wearng concealer. I have horrible dark and puffy undereyes and this works wonders!!
"I bought this a month or so ago, and it's slowly lightening my dark circles and making them appear less puffy. My dark circles are genetic, so I don't expect this product to make them disappear, but it's definitely making them lighter. It's also making my eyelashes grow? Not sure if it's supposed to, but it is (totally not complaining). The only reason I'm rating it four stars is because I wish it were in pump, I personally just feel like that is more sanitary. But anyways, I definitely recommend buying this!"
"Just in less than one jar of this, this almost 62 yr old felt a lot younger since my eyes had smoothed and didn't feel quite as heavy as they used too. Dark circles had lightened and make up would go on much smoother. I have allergies and wasn't hindered by this product...yea! Thanks I would recommend to everyone. NLH"
"I bought this about a month ago, and I was super excited to find an eye cream that was affordable and had great reviews. To say I was dissapointed is an understatement. The cream was silky, went on easily, and was not greasy under my makeup. However, this cream burned!!!! It hurt to the point of brining tears to my eyes."
"First, the packaging is excellent on this product. Second, this eye cream is quite hydrating and smooth. I put this on after my eye primer and before moisturizing. I've tried other, very expensive creams and this one ranks right up there! Thanks, E.L.F. for providing great products and amazing prices!"
"I bought this product to help with my dark circles caused by school... upon applying this product the first time I noticed it felt very uncomfortable on my skin, but the feeling faded as I went on my day. About a week of applying, I got little bumps underneath my eyes where this product was being placed and it felt more sensitive than usual. I've never had any issues with other e.l.f products in the past but this, I wouldn't recommend."
"I bought this since I'm trying to take a lot better care of my skin without spending tons of money. As soon as I put this on I could already see a difference. My one eyes is significantly better with fewer bags and my dark circles are brightening up. The other eye is being a slacker and while showing improvement, it is slowly working."
i have cryonic insomnia ad as a result get bags under my eye's.
i have tried many different things to help with this & after falling in love with e.l.f's make-up products i jumped to try there skin care items. & have loved all of them so fare. this is no exception it brought life back to the skin under my eyes. leaving them to feel hydrated and less purple looking. it didn't sting or cause irritation.
I got this on Friday and have been using it all weekend (it is Tuesday today). I have noticed a decrease in the fine lines around my eyes already!!! Even my coworkers commented on it (and I was lazy today and did not wear makeup). I will be buying this again for sure
"I bought this with mute intentions, not sure what would happen since I had some pretty dark circles and have had them around my eyes most of my life. So far it has lessened the darkenss around them which is shocking. I am very impressed and hope it gets better the more I use it."
"I was so excited to finally get this in the mail and I started using it right away. Over the past three weeks I have added it to my nightly skin care regimen and have seen amazing results! I have genetic dark circles under my eyes, and they are fading! NO scent, NO sticky residue, ALL results."
"I would definitely recommend this product I use this as part of my daily Beauty routine every night my under-eye area my eye area is smooth lines are less visible and dark circles have diminished. I've been using Illuminating eye cream for about a month now and I've seen the difference under my eye area, you must use it consistently on a daily baisess."
"After using it, it did brighten my eyes but after multiple uses all it did was make my eyes appear swollen...and it would be sooo hard to wake up after putting it on overnight. the price is a little high for the amount of product u get but overall it's ok. I stopped using it tho"
"I love this eye cream. I often have eye creams that although they are under the eyes, they still irritate my eyes. This ELF product does not irritate at all and I swear I can see a brightening effect as soon as I apply it. I can not do without this."
I got a tiny sample of this with my last e.l.f. Purchase in the mail and I wasn't expecting it to really do much for me but thought what the heck? It was free may as well try it! When I finished the sample I went and bought a full size because it's great it's hydrating and really helped with my under eye darkness and as a person with chronic insomnia caused by anxiety there's usually quite a bit of dark circle lol
"The ONLY reason I'm not giving this 5 stars is because I'm still testing this product out a little longer. I've used this product for about 2 weeks now and I absolutely love it! It doesn't smell, its creamy and feels good under my eyes. I actually have noticed a big difference in my under eyes as well! When I used to apply concealer under my eyes, my skin felt dry and hard but after using this, it's a lot softer and more alive looking! It makes my makeup look a whole lot better. I definitely recommend this to everyone :)"
"I have tried so many eye creams all promising to hydrate and smooth wrinkles, and have always been disappointed. But finally, finally, I have found my match for dry and thirsty skin. If you're tired of trying every product on the market, put your roots here and watch your expectations grow. It works!"
I have used other good eye creams. Unfortunately they were oily or greasy and during the night I would rub them into my eyes.... yuk ! This illuminating cream is wonderful... absorbs into the skin with no greasy residue. Leave skin hydrated and it does lighten dark areas over time. LOVE IT !!!!!
This eye cream is nice. It works better than any I've tried in the past.. My range being about 5 different eye creams. I've been using this for almost a month and I notice the dehydration lines underneath my eyes aren't as prominent when wearing makeup. Will definitely continue to use and repurchase!
"I wasn't really expecting much, but to be honest, I wasn't really LOOKING for much. Just a little moisturizing without any thick, greasy residue or irritation. I got what I wanted and more. It really does brighten and adds a great glow. I use it morning and night, and I love it!"
"I wanted to give it some time before I wrote a review so I could see how the product performs. It works very well. I only use it at night, but it has done good things for my eye area. It has taken away the puffiness that I get over night. It has also helped my dark circles to be less noticeable. It has also improved the beginnings of my crow's feet. Oh, and if you are ever in a jam and need an all over facial moisturizer this will do the trick."
I bought this product and gave it a shot but when i would apply it i would feel a stinging sensation which was weird but I ignored it since I thought it was what it was supposed to do. Well i started to notice white patches u der my eyes and my eyes also looking puffy and red like if i had allergies i would put this cream and another on top to see if it will help with the dryness. It didnt still had the dry spots my under eyes look worse than what they did before
Makes my face really soft and less swollen. Also I have very sensitive skin and this does not irritate my skin.
"While this feels very nice on the skin, it hasn't actually done anything for my dark circles or puffiness after 2 weeks of using it, twice a day."
I received that as a gift And the pot was empty.. thats bad because i wanted to try this out.. really disapointed about it..w
"I like this product. It has some great benefits: reducing my puffy eyes, brighter eyes, feels nice, smoothing. I will buy it again."
I bought this a few weeks ago and use it nightly. My under eyes are much brighter and more moisturized. Great product especially at this price.
"I have medium-dark circles under my eyes and I have to say that this cream - which I've used morning and night for a week now - has really reduced the dark color under my eyes. I think for the price and the results, this is an excellent product."
I have only been using it for a couple of nights but I notice my dark circles are a little lighter! It is not greasy and a little goes a long way. I really like it.
I have been using this morning and night for about a month. It has reduced the appearance of those nasty little lines that had sprung up beneath my eyes. This is a great product!
"I received this eye cream for Christmas and I've already noticed a big difference, my dark circles have lightening so much, I can't believe it! I use twice day and will be repurchasing!"
"I bought this a month ago, and took a picture of myself at that time. 1 month later, after using product twice a day, absolutely NO CHANGE. My coconut oil was just as good, if not better."
That's right. Just what the title said. The product was nice. Goes on slightly watery but dries quickly. The packaging looks very nice but it falsely gives the impression you are getting way more product than you actually do.
I bought this about a month ago and it was a great purchase! I am a side sleeper and had started getting wrinkles around my eye on the side I sleep on. This really tightens everything and eliminated bags as well!
I love this product but I feel as if my pot was pretty much empty :( It really helps my under eyes but again I feel like there isn't much and won't last long!
I used this cream and when I got up the next morning holy wow. My eyes were all red and swollen and looked horrible. Has anyone else had a reaction like this?
"I've only been using this for a week, and I can already say that this makes my eyes look a lot less tired. No more heavy concealer to try and hide the dark circles under my eyes!"
"i have bought this and it really compares to some of my high end eye creams, it does it's job but i do not think it goes above and beyond, for the price though it is great"
"I use at night dab a little under my eyes, I've been using for a month now and I see the difference under eye area, my skin is hydrated and smooth, plus my make goes on much smoother i really love this product."
"I had my doubts when I purchased this, but it really works. I put it on every night that I'm not gonna get 8 hours of sleep, and my eyes look and feel great in the morning. So glad I invested in it."
"I can't use 99.99% of the eye creams out there...they sting, and I have to take them off. This is nice and light, doesn't cause any breakouts, and...no sting!"
"Very good product for the eyes -- & nourishing, too. It is great for the sensitive skin around the eyes & pairs well with the night cream & daily moisturizer. Wonderful cruelty-free product!"
Love this! Great texture and smell and have noticed its effects in only a weeks use. Doesn't make my lids greasy and makeup still stays put. Wish there was a bit more product in the jar.
"When I opened the bottle, the half of the contents was on the cap. Besides that issue, the product is overall very good. Already see some good change on my dark circles"
"This is a really good eye cream. I am 58, allergies, puffy eyes . . . this eye cream is illuminating and has good moisture. Going to start taking with me and applying during the day."
I love this eye cream! It feels nice & cool going on and hydrates nicely. Would highly recommend and will repurchase. It beats all of the high end products and I have dry/sensitive skin. No allergies or breakouts!
"Lightweight. Spreads easilY. Hydrates well (the dry feeling doesn't come back throughout the day) works well under makeup. Doesn't irritate my (very sensitive eyes) .I would totally repurchase. Also, packaging feels and looks High en. :)"
Just bought my first jar and ordered 4 more during the 50% off sale. Definitely makes my eyes brighter and smoother. I use it daily and absolutely love it!!!
"The container is huge compared to the actual amount of product you receive. I've used just about all of it and am not that impressed. I won't buy it again, I'm looking for something else."
I like this product. it's good for a light hydration under the eye. I didnt notice anything else change while using the product. But maybe I have not used it enough.
"Without causing any of the skin around or under my eyes to get red. peel, itch, burn, etc. I can tell this will last a long time too. Been using this for several weeks and I really like it. My skin is so temperamental to retinol I just use any eye creams with that in them. This eye cream is gentle on my skin and it hydrates so well."
I used it for several weeks and did not see any improvement.
