"This eye cream makes my eyes feel so supple and nourished and awake. The jar is huge and you barely need to use any product! It isnt super thick, pretty thin liquidy cream but it works for me."
"I received a sample of this, and upon using it on my undereye area, it made my skin burn. I do not have overly sensitive skin, so I was surprised and disappointed. I did not have any skin damage, but this stuff is too strong for an eye cream."
I bought this product on a whim. I have dark circles under my eyes and fine lines. This is very light and hydrating. I use this twice a day as recommended. I feel like this is helping with dark circles. Recommended
Most eye creams irritate my eyes and they look worse in the morning! The first day using it I woke up to less puffiness and no irritation! Can't go wrong with this under eye cream!
I have a terrible time with puffiness and darkness under my eyes. Using this product religiously has decreased both significantly and I look younger. I am happy with the outcome of using this product.
"I have been using the eye cream for a full week, and my eyes haven't looked better. I reduced dramatically the dark circles under my eyes. I even got my dad one and he loves it!"
"It is very easy to apply, it is evry lightweight and you can really feel your eyes moisturized. The only disappointment, is that the bottle comes almost half empty!!"
"Nope, do not try this if your skin is sensitive. I tried the sample they gave me the night before a big event and woke up to red puffy eyes that were weirdly crusted and even my eyes lids had a rash on them. My eyes were burning, red and felt heavy, they were not illuminated and less puffy. I will absolutely never use this again, I want my money back even if I didn't actually pay for it. Free isn't even worth it!"
This product is a really good value because a little goes a long way. It does really moisturize and my skin absorbs the product easily. My concealer still creases even after using this product (I realize this product doesn't claim to help that). I have some small eye wrinkles and have noticed no difference in those. I also don't notice that my dark circles are any less noticeable or that my skin looks brighter. It also burns the heck out of my under eyes most of the time given I have sensitive skin. quite a bummer.
"I bought this recently, and was using it twice daily as directed for a couple of weeks. It makes my under eye area very puffy and does not seem to reduce dark circles or brighten. I do have sensitive skin so maybe that is why the puffiness happened? The cream is also very heavy feeling. I hate to throw it away for the price but don't want to keep using it either. Disappointed. Might give it another try but not sure."
"I normally love every e.l.f. product and it's kind of rare that there's one that I don't like but this one unfortunately is not for me. I've tried using it several times and each time I used it, it caused red rashy spots under my eyes. I have very sensitive skin and have never had an e.l.f. product cause a skin problem but every time I used this it caused a breakout. It feels soothing to apply but when I woke up in the morning I had spots. I also didn't notice any ""illumination"" or reduction in puffiness or fine lines. Sigh..."
"I was happy with the product. The price is great especially because it is formulated with no parabens, sulfates, and phthalates. I like the texture. It really didn't have a strong scent. My only negative comment about this product was that I really didn't see any difference in the look of my skin."
Ive been using this for the last 3 nights and i get a burning sensation the next in my eyes...
This is a go to eye cream. Great for my sensitive skin and a little goes a long way
Feels great and cooling going on. Makeup glides on smoothly
"I bought this product a couple days ago and this product is amazing. I feel so young, fresh, and happy. No stressing about dark circles after this!"
"This has been great for my ""mature"" eyes! I needed some extra moisture, especially under the eye and this cream really does the trick!!"
"I am on my second jar of this cream. Will continue to re-purchase this forever.....just a solid, no frills eye cream that works!"
I have terrible dark circles underneath my eyes and this product has truly been a blessing. I will be buying this again!
This felt amazing on my eyes. It feels good on the eyes after a long day at work. It cools and brightens.
"I use this all the time! More than other expensive ones I've bought in the past. I really like how it feels. And, it already seems to be working!"
This was sent to me by Influenster and elf and I'm so happy they did. I love this mask. It makes my skin so soft and flawless. Thank you and I definitely will be buying this now!
love everything from your skin care lines but this one burned my under eyes and caused irritation and what looked like micro white heads under my eyes
I have been using is for a few weeks and my eyes do look less puffy and purple. I use it both morning and night. It's not amazing but a little goes a long way and you can see a difference. Good for the price.
"I had high hopes for this product however, I didnt see any improvement"
I used this once four days ago and I broke out in hives and my eyes are itchy. not for me.
I got this a couple weeks ago and I love it. It has helped alot with under my eyes.
It says dab it on the brow bone and below the lower lid. Should I put this on the eyelid itself?
My dark circles are getting smaller and lighter in just a week!
I've been using this product for 2 weeks and didn't see a difference.
Really silky and moisturizing eye cream! im so happy with the results!
This is not moisturizing at all! It feels super watery/too light to even recommend to someone who wants a light eye cream. Waste of money for sure!
My undereyes no longer make me look constantly tired. It started working where it was a noticeable difference in about 6 days which is amazing
"It seems to be working great, but the tiny amount i received was a bit off putting seeing how i bought it and didnt receive it as a sample..."
"ive been using this for about 2.5 months, and still have dark circles under and around my eyes.."
I apply under my eyes and then 20 minutes later my eyes was swallowing and my eye was red
I got this in a beauty bundle. I don't really feel like it did anything wonderful.
"I bough this eye cream a few weeks ago, while traveling."
At first my eyes would burn but I don't experience that anymore and I really like using it.
I love this product. It definitely reduced my dark circles. I recommend if you have dark circle.
