"I used this product along with the Nourishing Night Cream for approximately one week. The whole time my skin felt dry. Thankfully, my sensitive skin wasn't irritated, but I didn't feel or see any other positive aspects of this products. The circles under my eyes did not appear to improve at all. I stopped using it."
"I was so excited when i first got his eye cream. I only used a little the first time i tried it. The next day I had gotten a stye on my left eye. I waited a week for the stye to completely heal so i could try it again. The next day i had styes in both my eyes!!! And two pimples by my left eye. The studff is so greasy and oily. But hey, it got rid of my dark circles for a day."
I just happened to find this at a Wal mart while on vacation in Myrtle Beach. Started using it right away and within a week I noticed my eye area was brighter. It's now been around a month and I only use it once a day and I still notice brightness around my eyes and even working night shift I still look rested when I get up thanks to this product. Definitely going to try some others from the skin care line.
"I bought this a couple months ago and have recently really started using it, I absolutely love it. It is a very light moisturizer and doesn't irritate my eyes at all. The skin under my eyes is a lot softer as well as brighter and my eye bags don't look to be as puffy!"
I use this as a daytime eyecream because it is so lightweight. It absorbs quickly and sits nicely under makeup. I am over fourty and starting to notice some mild crepiness under my eyes and need something with much stronger anti-aging ingredients than this has for nighttime. This is a great eye cream for young people who aren't yet dealing with aging skin and just need some hydration and prevention.
"I received a sample of this with my last order, and I was so excited about it! It was extremely cooling, which I thoroughly enjoyed, but after the second day of use, I woke up to red puffy eyes. My left under eye area even feels bruised because it's so irritated."
This is the first eye cream I've used that actually gets rid of puffy eyes & dark circles. I've tried other pricier products that did absolutely nothing. I'm sold on this for life...I've even started using it on my neck & face which has made my skin smooth & soft...thank you e.l.f.
"I've tried some more expensive prestige brands and this one beats some of them, it's lightweight and cooling and it actually starts working after the first use. it helps with wrinkles, puffiness and dark circles. The only negative I have to say about it is I wish it came in a little squeeze tube applicator"
"I received a sample of this product with one of my recent purchases, so far I like it. I like how it feels under my eye and how it hydrates my under eye. I was using the one from clinique but I am going to give a try this product buying the full size and see how it goes. So far so good"
"Really nice! This cream is very moisturizing and velvety feeling. It dries quickly (which is perfect for oily skin!) and is a great way to prime around your eyes. The only thing I noticed is that it makes my skin a little itchy (I have very sensitive skin) Regardless, I think its a very nice product."
"This eye cream is very very hydrating for me, which is what i look for in skin care/makeup. My whole face is extremely dry and especially under my eyes into my cheek areas... As soon as i put this on under my eyes after doing my skin care routine, i see a difference in texture, appearance, the feel, everything. you only need the tiniest amount, as alittle goes a very long way. my makeup goes on smoothly and i just really love this product!"
"I've been using this for about a month now, and I have noticed that the circles under my eyes are much lighter. This cream feels so silky when I apply it, and it takes so very little to get coverage on both eyes that this container is going to last me for so long. My eyes are also no longer flaky and dry, and it has just made my eye area feel so soft and smooth."
"I bought this cream with the kit and I am thrilled with it! It works better than the more expensive creams out there, has evened out the sin under my eyes and brightened them. I don't use concealer as much as before. I'll use this forever! Please please keep it around!!!"
"I bought this about 3 weeks ago, and have been using it as part of my eye treatment regimen. It does appear to be reducing the darkish areas under my eyes, but I don't have really dark circles. I do wish that it was also anti-aging and worked on fine lines. For that, I use a different cream."
"This eye cream is basically just a good moisturizer. It doesn't provide the tightening, brightening anti aging benefits of eye creams I'm used to. However for the price and decent ingredients it's not at all bad. In fact I purchased this for a girls sweet sixteen gift (I've been using eye cream since sixteen and will always recommend to girls, a penny of prevention is worth a pound of cure). This product is great at a basic level but not so great if you want to battle the fine lines."
"Have had it for two weeks and I use it twice a day. You don't need more than a pinprick to satisfy your eyes, under, over, and brow bone. The cream soothes and reduces puffiness and darkness, feels like its re-tightening my skin too, but not in an uncomfortable way. No scent, no irritation, no hate! I love this. Will definitely buy once this one's done."
"I received this eye creme about a month ago and I love it! The product is smooth and soft to the touch, no burning sensation as you touch the dry, sensitive skin near the eye. My circles around the eye have lightened and look totally refreshed. Definitely will continue using and can't wait to try the night creme."
"I have tried many eye creams & spent lots of $. Usually I am allergic/or the eye cream is too thick and greasy. This illuminating eye cream is very light and refreshing and has immediate results, best of all its not irritating to my eyes & actually works!"
"I have only been using it in the mornings so far and it works great. I am over 50 and started to notice some little lines especially the side I sleep on, and puffy, but this takes care of that very well. I was cautious because I am allergic to a lot of the expensive things I tried, not sure why but no problem with this cream, love it!"
"I am at the age where I have more than dark circles under my eyes, but I feel I have had the problem for a while. Over the years I've tried things and really didn't see any improvement. However, I have had this product for about a week and I haven't even been that diligent in using it and I already see a significant difference under my eyes. I am quite impressed and now will use it as directed."
"I really like this, especially for the price. The container is a lot bigger than I thought it would be and after trying it I will defiantly repurchase. It feels so hydrating, I can feel the puffiness around my eyes slowly go down. This could also serve as a good moisturizer. The hydration is amazing."
"So I was shocked at how fast it diminished my dark circles. My mom and my best friend even noticed immediately. I used it over night with the night cream, and I used a light coat before applying makeup. I noticed I didn't have to use as much concealer as I usually do. So that makes me happy. Its a good price and I love the ingredients. Jojoba, Vitamin E, and Cucumber to soothe and protect the delicate skin area around the eyes. It's also rich in antioxidants Shea Butter and Green Tea."
"great and complete package, i just added the toner to it . so that my skin care routine is completed"
"It's decent. Nice moisturizer, but I don't see how it's Illuminating"
I am a 55 year old with baggy under eye. this product hydrates and brightens the under eye so I don't look old and tired all the time. I love this
"I have been using it a few months , and I can tell a big difference. My eyes are not puffy like always and the dark circles are alot lighter."
I started using this a couple days ago and it helps keeping my eyes hydrated and it minimizes the fine lines I used to see underneath my foundation.
I use this at night mostly and when I wake up I notice a difference in my dark circles. It's not a huge difference but my eyes do look brighter.
If you are prone to eczema this product may not be for you. Using this cream quickly made me develop eczema where I had applied it.
"i used every single day, just to prepare por my daily make up, but it wont works for extra full hydration for the night!"
"After about a week my eyes actually started to burn and become irritated, even made my concealer under my eyes crease really bad. Save your money"
"A little thin, but great for moisturizing the eye area."
I love the feel of this cream and really felt it helped open up my eyes.
"Very moisturizing, but I had breakouts around my eyes. I'm going to try a different one."
Affordable and effective! Light and not at all heavy so great for the eye area.
I love this eye cream! It feels so silky and smooth. It just glides on and my eyes look smoother and feel just wonderful. This is definitely a keeper!
"I have tried several different eye creams, and this is the one I will go back to. It feels great, moisturizes well, is very gentle for my sensitive skin, and helps with the bags under my eyes. There is no smell or odor, either, which I appreciate."
Used once and my dark circles look ten times better no joke!! Thank you being a mom is super tiring and stressful and this makes me feel way more confident!
"This is a great eye cream! It feels luxurious and very hydrating. My skin seems so much brighter. I also noticed after using this, my concealer does not crease throughout the day. Highly recommended."
I was send this a a gift to try. I used this for only a week and I was pleasantly surprised by how quick it brightened & smoothed out fines lines. It but s perfect for sensitive skin. I will definitely be adding this to my daily sky nacre regimen!
i got a small sample packet in my latest elf package. I tried it and it was so soft on the skin. It was hydrating and works for my skin. I will definitely purchase in the near future.
I bought this product about a week ago and I love this it helps with my purple dark spots I layer it with other products and I use it on its own as well I'm so happy with this product I've already recommended this to my mom
Worth every penny! one of best eye cream products ive used ever. found something great for an even greater price- im sticking with it! leaves eye area moist and abosrbs well. does what it is supposed to do!
"this is great! It is light wight but very moisturizing. I don't really see any thing ""Illuminating"". But other than that I love this! I think it might be my new favorite. but the real test will be how it holds up during the winter."
"I can put this on my lower and upper lids and it goes on silky smooth. It also doesn't irritate, which is a plus for my sensitive area. Another great product from ELF. Thanks!!"
I have used many eye creams through out my years and always felt that they made no difference. Not only do I see a difference with this product the cost of it is out of this world!! I highly recommend this product.
"I've used this product for two weeks. It has noticeably reduced the puffiness under my eyes. My dark circles are less dark, as well. So far the best eye cream I've used. The price makes it even better!"
"I had high hopes for this eye cream. It has good reviews, it smells nice, and it's pretty affordable. However, my expectations were shattered, and not in a good way."
"This cream does nothing for dark circles. Zip, nada, zilch. It doesn't help concealer go on--rather, it made it look scaly. In a few hours, it puffed up my undereye area, but only right under the lash line, leaving me with deep creases that no concealer would fix."
"Bought this a while ago and finally got around to using it. The first few times were okay, but then it started burning my undereye area really badly. I had to wash it off and it still stung; it hurt less when I put ice on though. Be careful with this. If it starts to burn, wipe it off right away. Not worth it."
The light reflecting qualities really minimizes dark circles even without makeup. The product also seems to reduce the appearance of under eye bags as well. The best part is you only need to use the tiniest amount. I anticipate this product will last a very long time.
"I have very sensitive skin and I am afraid to put products on it because I don't want to break out. I tried this under eye cream and the first night the bags were a little darker. The second time I used it, it was getting lighter and lighter. By the end of the week my dark circles were gone. I love this product and recommend it to anyone, but you do have to stick with the routine. Once in the morning and once before you go to sleep! Then you will get great results. Make sure you don't rub it on your eyes and you tap it all over your eye area."
I love this product! It last a long time and you only need a little. I put it on every morning and it leaves me feeling awake and hydrated. I forgot to put it on for a couple of days and I realized the skin around my eyes were getting dry like they used too and after two days going back to it the dry patches are gone. I recommend if you just need a good wake up and nice hydrating eye cream. Recommend.
"For some reason, I got this free from e.l.f., and was very pleased with this product. I use it both before my makeup (really helps to smooth out my conceal and stop it from creasing) as well as before I go to bed. I would say it helped with some of my dark circles but not all, but definitely does what it claims. It has lasted me a few months and will definitely be repurchasing when I am completely out."
"E.L.F sent me a sample of this product, I usually am very weary about my skin care routine and I almost didn't try it but this is an amazing product. It does an amazing job at reducing the puffiness that my eyes are susceptible to when I wake up in the morning. I use it twice a day (day/night) and I will definitely be purchasing more."
"I've been using this in the morning for a few weeks now, and not much has changed. I bought this in hopes of reducing the color of my dark circles, which turned out to not be the case. The only thing it really does is refresh the under-eye area, not much else. I also don't like that it comes in jar because that means germs from your hands get in there and end up on your face. I will continue using it until it runs out, but I will not purchase again. One upside is that a little goes a long way."
"Reduces puffy eyes and dark circles effectively. I have very sensitive skin and this did not bother me at all, sunk in within ten minutes and isn't greasy. As for the amount, you barely need any on the tip of your finger to use on your entire eye area. It spreads nicely and I am glad I purchased it"
"I like this product because it's not greasy under my yes. As far as my dark circles, I did notice an improvement with this but not significant enough that I would mark this as my holy grail eye product. It is in fact very hydrating. My eyes have been less puffy lately hitch is a big problem for me. Would repurchase.(I have normal/dry skin)"
"I pre ordered this eye cream before it came out because I love elf products. I honestly was not expecting much, but I'm only 22 and I do not suffer from dark circles or puffiness under the eyes. I just wanted a moisturizing eye cream that would help prevent creasing of concealer under my eyes. This feels so good when you put it on. I let it sit for a while before moisturizing the rest of my face and I have seen a significant difference in my concealer. For the price, I'm highly satisfied."
"I love this eye cream! It feels nice and cool going on, it's not greasy at all and makeup applies great over top of it. I have also noticed my under eyes are less puffy since using this product (I've been using it every day and again at night since I received it about 2.5 weeks ago). Will definitely repurchase and I'd recommend it to anyone interested in trying a new eye cream."
This is my go to under my makeup. It plumps my under eye
"This eyecream stings the skin under my eyes, it hurts."
"Long lasting, as in quantity received, and feels amazing!"
"I really wanted to love his eye cream but alas, burned my skin. I had to return. So sad."
I love how smooth it goes onto the eye area. I have noticed a big difference in the crows feet. I love this stuff!
When i used this product the dark circles were increased and it made my eyes really dark. Please save your money.
"I recibed a sample with my last purshes and i am in love, this cream make my under eyes look so smooth and relax, im just waitting for my income this month to buy it !! I love elf products ... thaks"
"I got this when they were launching it, I don't see any difference. I don't know what it is supposed to do, because it hasn't done anything. I love my ELF products, but this will not be one of my regularpurchases."
I've used this product a few week and it's doesn't really make the dark circles disappear although I have noticed they're not that dark anymore. This product is amazing for moisturizing around the eyes. And it's light weight.
"This is good for moisturizing and conditioning the eye area, but that's about it. It doesn't do much for undereye circles or puffiness at all... you will have better luck with a gel product that dispenses with a metal rollerball than you with this."
"My sister introduced me to this magnificent eye cream and now it's a product that O use every day. It's lightweight, non-greasy and lasts all day long."
"I must let you know, this is the only eye cream I have ever used, but I still love it. I definitely notice a different on nights I forget to apply it. It feels great, has beautiful packaging, and helps lighten my dark circles for sure."
"I was really excited to get a night eye cream but was not impressed with the results. Did cause slight burning after use, dont know if that was apart of the product but i do not look forward to using it again.."
"This is the best eye cream I have ever used, even better than the more expensive brands in my opinion. It really gives my eyes a less tired and ""illuminated"" look. Just a little bit goes a long way. Love it!"
"Received my eye cream this week, and after the first use my eyes were brighter and darkness was faded. It provides wonderful hydration as well. Ultra luxurious and scent free- I highly recommend this product. Can't wait to try more!"
This is a really silky and moisturizing eye cream. I really like the consistency and it really helps aging under eyes stay moist. The packaging is really sleek too.
This is a lightweight cream that absorbs quickly and feels fantastic around my eyes. I've used it for almost a week and have notice less puffiness and darkness around my eyes. Great product.
"I have been using this for a week now and the texture and look of my skin is wonderful. I love the fact that there is no scent, my Loreal worked great but I couldn't take the smell. Will definitely be getting the daily moisturizer too."
"I had gotten this as a sample years ago and never thought anything of it, when I decided to purchase it I couldn't be happier. It has no scent and feels so refreshing and looks so glowy and dewy!! I woke up with the most hydrated under eyes and eyelids. I suffer for extremely dry sensitive skin and I adore this product!!! I will definitely repurchase this for years to come!"
"This reminds me so much of the Tacha Water cream. It feels exactly the same and turns into almost a watery light liquid that you can easily spread across your eyes without tugging on the delicate skin too hard. I love it, and my fine lines stay away since they are moisturized. LOVE it, getting another jar."
this is one of those products that won't disappoint you. it feels so refreshing when i apply it and it is super lightweight and soft. i do notice a beautiful brightening effect why i use before makeup. it is not the best in the world but for ten dollars you really can't get better. but warning if you accidentally get some in your eye it for me personally burned sooooo bad.
"I wish there was more in the container because it is awesome! Super soft, applies easier, doesn't wear off easily, works, and doesn't make me feel heavy or greasy. My eyes totally feel woken up! A little goes a super long way, so don't be worried about the size of the container! You only need a dab of it and it works!"
I love to use this all over my face as moisturizer after i wash my face before I put on makeup. It is so hydrating and lasts a very long time. I've had mine for at least three months. This is very lightweight and very hydrating. It also doesn't aggravate my sensitive skin.
I love eye cream and have tried a lot of drug store brands. This is one of my faves. I have been using it for over a month and I can noticeably tell a difference in my appearance. I look more awake and my skin is brighter. Super happy with the results. I put it on morning and night and sometimes in between! I love the cool feel of the product. A little goes a long way but there is also not a whole lot in the pot. The packaging is a little deceiving.
"I ordered this because I was in line at Old Navy, and this was in one of those quick purchase ben's. I am a lady of a particular age, and I was seeing my eyes get a little puffy and baggy. Out of all the other products I've tried, this has been the most satisfying and the cheapest. Those other high priced eye creams do not do half as good of a job as this eye cream. Awesome product!!!"
"I bought this two weeks ago, I am fan of this product now. My eye lids look healthy and bright now, before they were really dry and flacky all the time. lv this cream its really cheap as compared to other eye creams. It's my first time I am trying elf products and I really like there products."
"Got this as a free gift. The pot was less than half-full, and honestly, it's just too light for me to notice a difference. It does have a nice cooling sensation when I pat it under my eyelids, but I'm not sure I notice a difference, and it's definitely too light/watery for me to use as a primer for under eye concealer."
"I was hesitant to try this because I have very sensitive skin, but got a free sample with my last order and was pleasantly surprised. After only 2 uses I can see a great improvement in the fine lines around my eyes. It glides on smooth and absorbs quickly. Does not do anything for dark under eye circle, but what does."
Ive been using this since Christmas and I can say this product works well in the morning to give your eyes that big drink of water they need. This product is very lightweight and really helps hydrate the undereye area. I still have dark circles but my eyes are not as puffy. Most of all it feels so good. Helps my concelear look great. Compared to when i didnt use it. Try it ladies.
"I've been using this product for over a week now, and I can tell a huge difference in my eyes. Because of college I do not get much sleep. But when I put this stuff on my eyes before bed and after a shower my eyes look so much better. And it has been helping with my bags under them. I use a q-tip to make the product last longer, and you really do not need a lot. I was weary on using this product, but now I am interested in the rest of the E.L.F. skincare line."
I honestly see a difference in my under eyes. I have been using this cream for 2 weeks now morning and night. I never had dark citcled per say but I did have discolortion. This eye cream really does illuminate and add a nice glow. Will definitely purchase again.
Really helps with dark circles . Inise twice a day and I really like it
Got a sample a while ago and can't wait to buy the actual product. Feels amazing
I absolutely love how this brightens up the eye area. This is now my go to eye cream!
Love it great for puffy eyes. I use it every night with my face cream
This is the best eye cream I have found that doesn't make my eyes feel goopy!
"I have bought this before, and I liked it. So I ordered some more. Well my order arrived today. And guess what wasn't in the box?"
THIS PRODUCT!
I got a sample size of this product. From the first day I saw improvements. It reduced the appearance of puffiness under my eye.
"I have dry and sensitive under eye area an this "" Illuminating eye cream"" when I applied literally burn my eyes, I don't recommend!"
I liked this product from when I purchased this m within the year off of the website. I was about to but again until I researched the ingredient butylene glycol. The second highest ingredient in the product. Now that I won't ever but this again.
Bought this a month ago and used it twice daily for two weeks and did not see any change in my under eye area. It also has very little product. Would not reccomend purchasing.
I love the packaging. It looks like high end skin care and feels amazing on my eyes. I have only been using it for a week. I'm hoping for good results.
"this eye cream is pure magic it really does moisturize the under eyes as well as giving such beautiful glowing effect , clearly recommend this to anyone thats looking for an undereye cream."
"I was not a fan of this product because honestly, I didn't even notice a difference after using it for two weeks straight. I would recommend just getting the night cream.. more product and same affect."
I am amazed at how well it brightens. After 4 days my dark circles are pretty much gone. I have gone from having to pack on foundation and concelor to hide the circles to maybe a light application for a special occasion.
