"This night cream is thin in consistency, did not absorb very well. I liked the scent but it made my face burn really bad."
"My skin was left feeling smoother. However, I didn't find that it was much different than other night creams"
I use the night cream every night after washing my face with the foaming face cleanser. [This review was collected as part of a promotion.]
Love the new night cream! My face feels so soft and no more dry skin spots in the mornings! [This review was collected as part of a promotion.]
This stuff is like butter and it makes your face baby soft! [This review was collected as part of a promotion.]
This product makes my skin feel moisturizer and so soft! [This review was collected as part of a promotion.]
This is the best night cream! I have used it a long time with great results.
I love this product! It never leaves my face greasy and in the am my face is super soft!!
Burt's Bees products are the Best.
I like all of the Burt's Bees products!!
I love all Burt Bee's product. the nite cream is wonderful
I loved how this made my skin feel in the morning. Was very soft.
Love this product always trust Burts bee's products for great results.
Feels really good on your skin. You will feel good about using this product on you face.
Like it and used it all up. Haven't bought it yet.
I really loved this product. Its way to expensive for drugstore. I do like the natural ingredients.
love the way it made my skin feel.
You can't go wrong with Burts Bees products
I personally do not use this type of product
"T, but if you do I'm sure it's a great product."
"It made my skin so soft,I'm very happy with this product."
Love this product. It truly does what is states. Keeps skin smooth and moisturized!!
Great product ... Does the job ... Works great ...
A nice moisturizing cream!
I like this Burt bees nourishment night cream.
This feels so good against my skin is love it.
Excellent product! I'd buy it again.
I liked this very much. Seemed to nourish my skin.
I'm allergic to this product
"Smelled great, made my skin feel smooth and soft. Not greasy."
"I love Burts Bees products very much, the fragrance is amazing."
"Better than some, not as good as others."
I tried this for several nights and I really did not care for it. Left my skin oily feeling.
I like this product but not as much as the Palmer's Coconut Lotion.
This product is wonderful. Totally got rid of my dry skin after just a couple of uses. Love it
This felt so nice on my skin I liked it a lot . I would buy the full size of this product .
I like how easy it is to apply.
This product leaves my skin smooth and moisturized.
This night cream is awesome it makes me feel so good when I put it on and in the morning my skin is soft and I actually feel younger
"It's a nice thick night cream. It smelled pleasant. I didn't notice anything ""unique"" about it, compared to other night creams I've used."
I receives the sample in my beauty box but it was not enough to evaluate it. At the price I don't know if I will buy it to try it out more.
anything frombb is great
Loved it!!
Product is very smooth.
I love the product!
Liked it
