"I have sensitive and oily skin and I bought this and after about a week of using it, after using it makes my skin dry and have white flakes. I will probably not get this in the future for it doesn't serve its purpose for me"
I used this for almost a year and it's lightweight and gives me the perfect amount of moisture without feeling greasy or oily. My cheeks are mostly dry while my t-zone gets oily and this moisturizer works great for my skin!
"I have used this moisturizer for years and love it. I have oily/comination skin and live in a hot, humid climate. This product protects my skin with a good SPF but doesn't clog my pores or cause breakouts. A wonderful, affordable product!!"
"It's the only facial moisturizer I've used so far that does not make me break out. Only a small quantity needs to be applied, so it lasts quite long. Works great when used with the original formula Facial Cleansing Bar. Awesome product!"
"I use this every day. It's not greasy, has sun block, and feels great after shaving too. Excellent product to moisturize and protect without clogging pores or feeling greasy."
"I used this after the wave Sonic, and my skin felt fantastic! my skin actuall had a glow to it. Which is important since I have such tan skin that can be oily. I found that adding a moisturizer actually reduced the oil amount in my face."
I use Proactiv 2x everyday and this is the perfect finish! I use it on my face and neck after step 3 and it helps keep my skin hydrated all day & protected. Thank you for making it :D
I find Oil-Free Moisture SPF-15 does a great job of hydrating my face without leaving it feeling greasy or slick. I plan to continue using this product regularly as a part of my daily cleansing routine
"I have combination skin (oily T-zone, dry cheeks) and I love that this moisturizer takes care of both of those problems. It feels really light and clean on my face. Thanks Neutrogena! :)"
"I been using this one for years. It great.I been recommend neutrogena it to people for year,and I'm 55.Looking for eye cream now. Thanks Neutrogena"
"I have sensitive skin and I thought this would be great because it's oil free and water based, and is advertised to moisturize while controlling shine. I will put this on in the morning after cleansing and by the time I get to school my nose and my forehead are shining badly. Since using this product I also started to see clogged pores on my forehead and blackheads. My skin might just not be ideal for this product, but from my experience I was not happy."
I bought this moisturizer because it is oil free and I had been dealing with some breakouts on my combination skin. I used this product for about 2-3 weeks to give it a fair try. WORST MISTAKE EVER! This product left my skin soooo dry. I had to go get a facial to add some moisture to my poor skin. I have tried several moisturizers and this has been by far the worst I've used. I was so disappointed with this product that I decided to write my fist review ever to warn others!
"I got this product because neutrogena's grapefruit scrub left my skin feeling dry. At first, I felt strange using moisturizer, because I hadn't used it before, but I soon came to love it. It really leaves my skin feeling smooth and refreshed. Having combination skin, my t-zone is especially oily, and my cheeks can be really dry. But this moisturizer balances everything out... I love it!"
"This product is amazing... I have oily skin and I've tried most of the products that I was recommended to use, but this moisturiser is the one that works for me. it slightly makes my face shinny which isn't a bad thing I guess. also I did not breakout when using this product, which is a huge thumbs up."
"I have been using this since 2 months, suggested by my friend. It was working good till now, but since a week my face becomes very oily within 2 hours.. If i wont use this cream my skin will be normal, because of oiliness am getting pimples. Kindly Suggest."
"I have very oily skin on my nose, cheeks, and forehead and while this product does moisturize the rest of my face well it does absolutely nothing to mattify the oily areas (like it claims) . But it doesn't break me out and feels noticeably lighter than every other moisturizer I've tried (alot) so I'll stick with it until I can find a something better."
"I'm not a big moisturizer person, but during winter time my skin gets a bit dry so i thought I'd give it a try, and I've always had oily t-zones so this was suppose to be perfect, while it does its best to control shine, my skin still feels dry, and even after i put it on my skin just feels tight and not exactly moisturized. If you have dry skin I would not recommend this product."
"I have naturally oily skin and this products rocks at keeping this at bay. I use this in conjunction with the face wash (the orange one). Every moisturizer I used prior to this one would create an even bigger oil problem leading to acne. And at my age, I shouldn't still be combating acne. So if you have oily skin and need an oil free moisturizer, this stuff will do."
"I bought this face moisturizer for my combination skin, and it has worked really good for me. It keeps my face matte almost all day, it gets a little oily but not that much just a hint. I have tried Yes To Tomatoes Clear Skin Daily Balancing Moisturizer it did not work for me my face would be oily 30 minutes later. I also tried Equate Dual Power Moisturizer the same as yes to tomatoes. This one worked really good for me. I just kept trying until I found the right one for me."
I have combination skin (obviously) that is extreme. My dry spots get very dry and flake if not moisturized and my oily spots get wayyyy oily if over moisturized. I used to use the Dove moisturizer but it was discontinued. Ever since then I have experimented with many different face lotions that either made me too oily or didn't moisturize enough. I bought this moisturizer about a month ago and I am glad to say I have found the moisturizer!!! It goes on light but gives you moisture. It is amazing!
"I've always suffered from dry skin and scars on my face. but once i used this cream, my face has gotten so much better! Everyone has told me my face looks a lot more healthier, and clean. i use this cream before i sleep after washing my face, and in the morning. I highly recommend this to others. But yet again, every face works different but it worked well for me. Just remember to wash your face then put the cream for better results. And put it under your makeup. I will forever use this cream, i love it!"
"I love how quickly this sinks into my face, and it feels so nice. It doesn't have a weird smell, and it lasts FOREVER. The only downside for me is that it is only spf 15. I have tried the spf 35 and it feels and smells completely different to this one. Obnoxious. I have been using this for 3 years though and I will continue."
I have combo skin and this really makes my whole face feel kind of oily and greasy :/ The spf is good but it really does take a long time to sink into your skin. I think for combo/oily skin this can make you look greasy but my mom with dry skin swears by this! She buys this in bulk lol. Just not for me.
"I have tried several products for my face that promises to deliver, finally I found one that did just that! I have also purchased the facial bar cleanser, the pore refining toner and the night time rapid wrinkle repair! Great stuff. Neutrogena keep up the good work! :)"
"I have been using this sunscreen for 2 weeks, and it started to burn. Not goood :("
"Love the smell of the lotion. It goes on light, makes my sick feel soft, and doesn't feel greasy."
I've been using Neutragena for over 40 years always exceptional value!!!
I have been using thid product for 10 years and it keeps my skin supple and balanced.
I have flaky oily skin that breaks out mildly. This product really helped my skin break out less and look and feel healthier. Best I've tried.
This product has worked great for me. It doesn't leave my skin feeling greasy. It's light and you don't even know you have it on.
This is my favoriate product. It cleanses and softens without drying. I have a healthy glow. Thanks Neutrogena
"Ive tried them all. All are thick to me and smell like sun screen. I cant walj around smelling it. Im sensitive, combi skin. I dont wear any make up but eye make up. Not acne prone. Over priced!"
I like how it moisturizes my skin but the odor burns my eyes. There's another cheaper brand that uses the same ingredients which does not burn my eyes but it makes me look oily. I thought this would be better.
i have used this for over three years & have combination skin with acne scars and a few pimples arise every once in a while. its a good moisturizer but thats it. nothing more special...
This moisturizer is great for sunny weather with UV rays. The bad thing is it smells just like sunscreen so if you wear it when it's cold you will smell like sunscreen. It doesn't leave your skin dry or tight.
"This product defiantly helps you have dry and oily skin. It keeps most of the oil controlled and the dry patches disappear! Overall, an almost everyday product for me. Thanks Neutrogena!"
it's okay I wish it was a little thicker and worked faster. I was using proactive and it really dried out my skin so I used this and u don't get fast results at all. Bottom line not that impressive.
"It makes feels greasy when I apply it and it appears greasy but the look does eventually wear off (although I can't tell you how long it takes). From what I can tell, it had not broken my skin out yet."
i use this item every night with first toner and night cream and then moisturrizer. also i use every morning just toner and this. my skin feels smoother than before.
"I have combo skin, oily T-zone and super dry flaky cheeks. I've tried EVERYTHING. Nothing has worked better than this amazing product. I wish there was some sort of SPF in it though ):"
"I have combination skin and this is fabulous. Right after I got it, I tested it out. My skin immediately felt softer. Yes, it does smell slightly like sunscreen like people said but it's not overwhelming. I will definitely purchase this again."
"Neutrogena finally reformulated the active sunscreens in this, to include Avobenzone, so it now provides both UVA and UVB protection, which it did not before. Some people might not be happy with the formula change, but there is no point in using an SPF product that does not provide both UVA/UVB protection. This also smells so good, like watermelon! I find it sinks in/absorbs quickly, but will leave behind that sunscreen sheen, that all SPF's seem to. I will re-buy!"
"I really wanted to like this product. The reviews were decent and the product promises to moisturize and control oil. Sadly, I was let down. I broke out after using it. I used it for over a month to give it a chance, but now I can firmly say that this product is not worth buying."
"Firstly, I was excited about this product because it was made especially for people with combination skin like me. I had high hopes for this product. However, this moisturizer did not moisturize my less oily places and did nothing to decrease the oil in my T-zone. ): I DO NOT RECOMMEND."
"I wanted to purchase an oil free product since my skin is already oily. However when I searched the ingredients of this product I saw there are some fatty acids and oil in it. then why do you write 'oil free' on it? also it is written 'fragnance free' too, I am not sure because the product smells like a parfume. this brand is a dissappointment for me after purchasing this product, I cannot trust you anymore."
"This cream is drying my face out sooo bad. What kind of moisturizer cream drys your face out? Says NO Alcohol, but when you look at the ingredients there is alcohol in it. I am soo upset your cream has done this to my face. All dried and cracked up. Thanks Nutrogena!!"
"My daughter has been using this product for about a year. About 3 months ago, her face began to itch and turn red. It slowly spread all over her face and got so bad her eyes were irritated and puffy. Her doctor asked her to stop using all products. We thought it was make-up she was using. After 2 weeks of using nothing, her face returned to normal. However, she used it once yesterday (and wore no make-up) and woke up with her face all red and puffy again! The company needs to look at the ingredients again!!!"
"Even in my T-zone, which is very oily, this product dries my face out like crazy. Within 30 seconds of putting it on, my entire face is so dry that my skin is pulled tight, and it physically hurts when I smile, raise my eyebrows, etc. Don't be fooled! This product will only work for you if your skin is very, very oily and needs to be dried out."
"This product is okay, but that's it. The price is fine and I guess it's okay for the money, but this makes my face really oily, especially by the end of the day. My face is not at all oily naturally, and after putting this on it's okay but after school this feels really heavy and it makes my face really oily. Wouldn't recommend..."
"I either have an incredibly oily T-zone, or this product is not working. I combine this moisturizer with two other cosmetic products from Neutrogena that are advertised for controling shine in the T-zone...and yet have four hours my skin is shiny and oily again. Not to mention that with the dry season approaching, my skin has been sucking this moisturizer up so much that my cheeks feel dry right after I put it on. I will probably stick to their sensitive skin moisturizer since I never seem to go wrong with those."
"I bought this hoping that it would help me produce a lot less oil throughout the day, because my skin is very oily. It helps, but my skin still produces a lot of oil, so I don't think that I would repurchase this. Maybe it's just because my skin produces too much oil, or maybe this product is not really made to amaze."
"I normally used a Biore Daily Moisturizing product but for some reason they stopped making it, or the store I was getting it from stopped stocking it. Anyhow I decided to try this Neutro moisturizing product but I really don't like it at all. It says oil-free but feels super greasy when putting it on. Almost like spreading vaseline on my face. Won't buy again."
"my skin is oily type..so i have many acne scars,blackheads n whiteheads..i've been using many other moisturisers but it make my skin worst..this is my 3rd day using this product n so far so good for me..it control my oily area n hydrate dry area at my face.. =))"
"I haven't used this for all that long and I know that I'm going to really like this moisturizer. It made my skin soft and smooth, and it's really hydrating. And it does help control the oil on my face. It's not the cheapest moisturizer out there, but I can tell it will last a long time, because I don't even need an entire pump for my entire face and neck. I was using Clean & Clear Dual Action moisturizer before this, and I needed close to four pumps just for my face. So although I wish this was a little less expensive, it's worth it."
"I applied this for the first time before going to bed last night. This morning I woke up with puffy eyes, and the skin around my eyes and hairline had a rash and was irritated. Who knows how long will until my face looks normal again. Will be returning this to the store."
I've tried quite a few moisturizers and this one is the best of all! I have combination skin and this moisturizer hydrates the dry areas and controls shine in the oily areas at the same time. I've been using this product along with the Deep Clean cleansers for years and I absolutely love it!
"I really like this moisturizer. It's really lightweight and that's great because I'll put a little bit in some areas and a lot in other areas and my face won't feel all gunky. It controls oil for about four and a half hours in my oiliest parts and almost all day for the dry parts. Really great! It's unscented and only irritated my usually non-sensitive skin when I started a new topical acne medication. Other than that, no problems there. Great buy!"
"I have been using this product for more than 20 years. I love it. This moisturizer provides me with a nice smooth, non sticky, non tacky moisturizer. It also provides me with SPF coverage. Plus it's fragrance free or if there is a smell it's minimal. I have very sensitive skin & this product doesn't make my skin breakout."
"Neutrogena's Oil-Free Moisturizer turned my dry skin areas into normal skin. It also does not cause acne on my acne-prone face. It even prevents my face from producing too much sebum. I use this product after exfoliating my face at night. Overall, a great product that does not leave an oily residue on my problematic combination skin. I like how this moisturizer does not contain SPF. I hope Neutrogena keeps on making this product."
"I bought this product for [$]. The first time I was happy with this product. On the second day however, I was thinking in the office with my hand on my face. White dust (similar to what we see after rubbing eraser on a piece of paper) stuck to my fingers. I looked into the mirror and when I rubbed the skin between ear and cheek, more white stuff was peeling off. It was the moisturizer, as I didn't wear make up or sunscreen. I am disappointed because my expectations were high from this product."
"I love neutrogena products and I think they are a quality brand. This moisturizer didnt work for me, I may have picked the wrong one for my skin type but I do consider myself as having combination skin, anyways I felt like this cream was drying my face alot and that I had to reapply. It also made my face feel sticky. This is one didnt work for me but im sure it will work for someone else"
"Light weight, non greasy. Perfect for everyday use."
This is one of the best moisturizing cream for my face. it leaves my face very soft.
It was a pleasure to know it works good helped with the blackheads.
"This product is not greasy, feels good on the skin, has medium SPF protection and softens skin."
I like the fact that my daily moisturizer has sunscreen.
It worked pretty well on most of my face but didn't do very much for my oily T zone.
This is the best face cream I ever got.It works fine in both cold and hot weather.
It tanned my skin. It also made it itch I used to use the sensitive moisturizer. I will be switching back.
"I turned 64 last week but I look the reverse (46), I believe it's due to good genes and Neutrogena skin care!!!"
"My cheeks are usually rough and blotchy, but this moisturizer is really moistening and softening my skin!"
"i have combo oily skin and do tend to get breakouts occasionally... tried this today for the 1st time, so far, so good!"
i have combination skin. when i used this my skin became very oily and shiny! I got lots and lots of pimples on my face. The smell is not that bad as mentioned by some.
This product is the best thing you will ever use i have the softest skin i have ever had and i have spent 100s of dollars on expensive name brand moisturizeres but this is your money's worth.
"So I have oily combination skin and I decided to try out this moisturizer today. After putting it on it completely dried up my skin, feeling a bit sticky as well. I do not recommend this to anyone."
I looked everywhere for a facial cream that wouldnt make my skin more oily and so.... HAPPY to say i found it and its not that expensive as other facial creams :D
"The smoothness it's light texture and it works, rejuvenation of my face Margr"
Neutrogena oil is fantastic
works great i use it on a daily basis
"Works great for my skin, doesn't leave it oily"
I have been using this moisturizer for many years. I love it.
A little goes a long way. It goes on without being greasy. Love it!
I have used this product for my face for about 20 years. Love it!
"This product might be good, but it smells like medicine. Also, my skin became red when I put it for the first time. Will return it."
Its my first time use this product. I love it!!!! Left my face fresh and so soft and smooth. It's a keeper.... :)
It works great
caused acne every time I used it........................................................
If you wear makeup this would be a great moisturizer for your skin and excellent in the winter.
