3.3,"['167', '47', '30', '45', '116']"
Please get this item back on the shelves? Love this product cuz it works better than anything else I've tried!
"I've been using this for a few weeks and it's the best thing for face moisture, it's not thick, it soaks in easy, and it makes your skin soft. I only wish it came in a bigger bottle. My skin is glowing."
"I have been using this product for years, love it. I have sensitive skin and it being oil free, really works well for me. It doesn't break my face out like other moisturizers do. Plus it keeps my face from getting sunburn. Great product!"
"This is a great product, my skin is better and not oily what it used to be, highly recommended"
This is such an excellent moisturizer. I can't remember the last time a drugstore moisturizer didn't break me out - I regret not trying it sooner!
"Not greasy, highly moisturizing, non irritating - highly recommend :)"
"I am 72 years old can't use soaps on my face. Cleanse with water to clean face and then this moisturizer. This is the only cream that does not break me out. Have used for many years. Beautiful skin, radiant and glows."
This moisture is great for winter skin. I have not have any bad skin reaction since using this moisture. Its not greasy or your skin doesn't quickly.
I really like this moisturizer. It's my first time using it and it feels and smells great. It's light on my skin and does not weigh it down. I don't smell of the sunscreen because it is very faint.
"I used this moisturizer hoping it would help with controlling the shine on my face. Unfortunately, it caused me to develop pimples on my face (which I don't normally have). Then I remembered I used this product a few years before with the same results. Even though it is non-comedogenic, it caused me to have more problems. After I stopped using the moisturizer, within 2 weeks my pimples were gone again. Very disappointed."
"I recently bought this for my dry face. For me, I only like using lightweight moisturizers and this one is perfect. Its hydrating and is very light weight. I would recommend this to people with dry skin."
"Even though the box said its oil-free, on my skin it still gets pretty oily just after 30 minutes of applying. In terms of hydration, my skin felt relatively moisturised and soft. Personally, I don't enjoy the scent."
"I have dryer skin and this lotion makes it even worse. I put it on and my face immediately felt tight and hard to move, almost like I had a face mask on. When i rubbed my face it started peeling and rolling off in clumps. I had just washed my face and didn't have any makeup on, so it was just the lotion peeling off my face to the touch. This product felt so cheap; putting scented body lotion on your face would probably give you better results than this drying moisturizer that flakes off your face."
as soon as i started using this the next morning my face was super dry and were lots of white heads around my chin area...and my skin was rough and patchy....please save yourself l
"I have been using this moisturiser on my face for around 15 years - it is light and easy to apply, really works on my very dry skin, keeping it feeling soft and supple all day."
"It definitely controls oil, and helps my dry spots...but for some weird reason after I apply and it soaks in my skin...I would rub my face and it would appear that all my dead skin or the product would just run into my fingers and it's kinda gross. What's happening?"
"Ive been using this everyday since 8 grade in 2008. I love this product it leaves my skin feeling hydrated I use it in the morning, at night sometimes, alone, and under makeup. It doesn't clog pores its very light weight I swear by this product and never have had any major issues at all with breakouts. In the winter I get extra dry but I'll just combine this with another moisturizer. The bottle usually last me a couple months and given the price you get a long use out of it."
I have combination skin where I get super oily on my forehead and really dry around my mouth and nose. I was at the point where my nose hurt so much from being super dry then getting oil over it and the other moisturiser I was using wasn't doing anything. I was in so much pain and after 2 uses of this product I had absolutely no more pain and my skin started to heal. I use one pump after I wash my face now and my face has never been more soft and healthy. thank you Neutrogena!!
I have combination skin so I got this moisturizer. I put it on after taking a shower and washing my face and it left my skin so dry I thought maybe I wiped it off by mistake with the towel. So I applied a bunch more (like 5 pumps although it tells you to use 1 pump) and still my skin felt dry and tight.
"I wrote a review on this site stating how much I liked this product before the fragrance was added. You say there isn't one, but obviously a lot of people including myself disagree. Are we enough of a business loss to bring back the old formula? Please return to the old formula, so I don't have to look for something else to use on my face. Thanks"
"I bought this last night, and used it twice (last night and this morning), every time after I applied it on my face, my forehead began to sweat, and the sweat is so watery. I'm afraid that the sweat would wash off the moisturiser before my skin could absorb it."
"I have been using this product for years and loved it until the latest formula change- now it leaves my skin feeling greasy within a few hours. I am also unsure whether it provides UVA AND UVB protection like it used to, the new description is a little elusive. I am so disappointed that you tampered with what used to be a five star product."
I recently purchased this as i use the moisturizer without SPF. Worst mistake it caused me to break out made my cheeks red and itchy. This was the only thing i changed in my day to day routine. I put it away today and went back to the one without SPF. I have oily/ acne prone skin and this did not help!
"I have been a Neutrogena user for 20 years. With my most recent bottle of the oil-free with sunscreen, I have a burning sensation on the areas around my eyes. I noticed there is a new ingredient, Avobenzone, and it appears I am not the only one attributing the burning to this ingredient. I hope you take my feedback and that of others to make a change to this product."
"this new formula is burning my skin and eyes. like other reviewers i thought maybe I got a bad batch, but it wasnt. Please please change it back, I just pitched my new bottle in the garbage. I was a religous user of your formula for years. why mess with a good thing?"
"I can no longer use this product. Since they have added Avobenzone to the formula, my face burns badly when I use it. It also has a very strong sunscreen smell. I once loved this product because it did NOT have a strong smell. Why did Neutrogena not advertise that they were changing the formula? Looks like I'm in the market for a new brand of moisturizer. Farewell, Neutrogena. You really screwed up this time. Can I get my money back for the new bottle I just purchased that I do not intend to use???"
"Used product for over 6 years every day and “loved” Just bought a new bottle and face turned bright red and was burning. Red is not going away, face is on fire. I am not on any medication so that is not a factor. Very disappointed as I use to LOVE this product and recommend it. What happened?"
"Until a few months ago, this was my favorite, can't live without beauty product. Simple, effective, SPF 15 moisturizer perfect for my dry yet prone to sunburn skin. However, as others have noted, the switch to ""broad spectrum"" sunblock, which has a number of new ingredients that led to a HORRIBLE burning and itching sensation all over my face, along with a red rash. Stay away from this product!"
I too just opened a new bottle and had an immediate reaction to the new formulation. The new active ingredient appears to be the Avobenzine (1.5%). I also just realized that the Visibly Even daily moisturizer with sunscreen (SPF 30) that also caused a rash on my face also has Avobenzine (3%). The Visibly Even BB cream daily moisturizer with sunscreen (SPF 30) which does not cause any reaction does NOT have the Avobenzine. Please bring back the original formula!
"I recently purchased Neutrogena Oil-Free with sunscreen SPF 15 (I have used the product in the past and loved how light it felt on my skin). This time I put the product on and immediately felt my eyes start tearing up! By the end of the day my face felt hot, dry and itchy. I tried the product one more day and it was even worse! Today, I didn't use the product and my face is still itchy, tight feeling and feeling flushed! What did Neutrogena do to the formula!!"
"I used to call this my ""magic lotion"" because it was so good - it even helped heal a severe sunburn very quickly once. Now this ""fragrance free"" lotion smells like watermelon Jolly Ranchers and doesn't moisturize at all. PLEASE go back to the old formula."
"I've been using this moisturiser daily for two months now and my skin loves it. It doesn't make me break out in pimples, and absorbs into the skin a few minutes afterward. There is some weird tingling sensation that might put some people off straight after application, but it goes away soon enough. My skin glows with this product."
"My sister gave me this product when I was only 32 years old! I am now 55 and people tell me I don't show my age, especially around my eyes. I thanked my sister for giving me this product the year I turned 50. I'll continue using it as long as you all carry this product. Tried & true, thank you!"
"I opened a new bottle and thought it might be old since there was a definite unpleasant smell. However, after reading the other reviews, I realize that you have changed the ingredients. I use only fragrance free products and I am very disappointed in this new oil free moisture lotion that is certainly not fragrance free."
I have used the same Neutrogena moisturizer for YEARS. My mom and grandmother also used it. Now none of us can use it any more. The new bottle is completely different. It smells perfumey and it stings my skin when I put it on. I've never ever had a problem with this moisturizer before. Please bring back the old product! You've lost 3 lifetime users.
I have used the oil-free moisture with sunscreen for years and was surprised when I used the latest version. It caused irritation around my eyes which I have never had before. I then noticed that the active ingredients had changed. I am hoping that there is another moisturizer with sunscreen out there that will work for my sensitive skin!
"I agree with the other reviewers. The new product (broad spectrum SPF 15) smells horrible. I had used the old version since 1998 and LOVED IT! Why did you have to change it now??? Does the old formula still exist? I am very, very disappointed that this new formula has such a nasty odor. I will no longer buy it."
"Loyal customer for more than a decade, but the recent change in formula for this product causes a burning sensation. Definite change in active ingredients listed. Reportedly fragrance-free, but certainly has a fragrance now. Already called customer service. Sad to report I will no longer be using Neutrogena products."
"I've been using the oil-free moisture for a few years and loved it. My old bottle ran out a few days ago, and I am extremely upset because the formula is not the same! Immediately I noticed a fragrance that I'd never smelled before (which would be tolerable), but it's also burning my face. I, unfortunately, will not be able to keep using this product."
"I've been a long-time user of this product and, like so many others have said, I do NOT like the changes they've made to the formula. First, you're hit with a highly unpleasant odor then moments later the stinging and burning begins. I, too, thought maybe I got a bad batch so I bought another bottle and unfortunately experienced the same issues. I'm sorry to say I have to break up with you, Neutrogena. I can't put my skin through this any longer."
Something has definitely happened to my face since using this the last week. What happened? The smell is different and I have bumps all over my face. I am terribly disappointed. Please return to old ingredients - I cannot continue to use this product with a bumpy face. I've used this product for at least 10 years. What a shame.
"I have been using this product for many years and loved it. The old formula was fragrance free-but the new formula surely cannot be. I have also started breaking out which is not normal for me. The back of the old bottle used to say ""won't clog pores, alcohol free, hypoallergenic, and fragrance free"" but the new bottle does not. Why change a product that was so great?"
"I have used this for years as my main face lotion and will continue to. I like that this is lightweight while getting the job done, not thick like many face lotions. I have olive skin and the spf is just the right amount. Very happy, wouldn't change a thing!"
"I have tried everything, from the most expensive to least expensive. This product leaves my skin feeling moisturized without feeling greasy or heavy and without ""the just came out of a sauna shine"" on my face. Excellent price, I use it twice each day for a year now. I use a light foudation as well. Excellent results and holds up all day."
I have gone to great lengths to buy this product over the years as I moved back to UK from USA 15 years ago. Very disappointed with recent purchase - thought I had ordered the wrong one as smell and product is different. Now realise it is a totally different product and my skin is very red after using.
"Living in Arizona and outside walking my dogs, I am also looking for a sunscreen that does not feel oily or heavy on my skin. The oil-free moisture with sunscreen is the best choice for me. I need all the mositureizing and sunscreen protection I can get and to have it feel good on is just a plus."
"I have been using this product for about 15 years. It has always worked well. I'm guessing the new formula has cheaper ingredients, or else why would you change it? Sorry if I sound mad, it's just that I can't use this product any more with the new formula. You lost a loyal customer. Honestly, I would much rather pay a dollar or so more for the original formula than not have it avaliable at all."
"I finally started using it after trying loads of facial moisturisers that didn't do anything for my combination skin. Unlike other moisturisers, it doesn't dry out my skin and moisturises dry areas and balances oil as it claims. It does its job perfectly. I highly recommend it if u are a teenager like me and have combination skin hard to control. It leaves my skin balanced and soft. This is the perfect moisturiser for me and I won't switch to any other for years."
"After seven years of using heavy duty acne creams and washes, my skin was left dry and flaky. I decided to try something new in order to replenish my skin and make it feel softer and less flaky. Wow! After using this product for only a couple days, my skin has completely changed textures. I no longer have dry skin on my face, and my skin feels extremely soft! Also, the product has not broken me out. If anything, I seem to have less acne. Thank you!"
"I used the product and my sensitive skin rejected it in the worst possible manner. I also had a similar reaction to the Nivea Sun Protect and Moisture SPF 30 in the same manner, among a few other products. Can you help me find out which of the ingredients might be the culprit?"
"I've used this product for years. I typically apply after showering each morning. I used to be really pleased with the product but after receiving my latest bottle, something is different about the formula. It smells of fragrance and irritates my skin and can make my eyes water. Bring back the old formula, please. Currently looking for better product."
"Have used this prod. for years. Recently my skin became very itchy, puffy, red. It was diagnosed as contact dermatitis and the doctor asked which skin products I was using... I thought Neutrogena was reliable.... However, when I came to this website, I learned that the formula had changed. Did some research and discovered ""oxybenzone"" has a high rate of SKIN ALLERGY (Environmental Work Group website, Dermatology Times, 1/16/11). Very disappointed with this company. I now have to deal with this dermatitis..."
"Why did you have to change a good thing? This new formula is horrible, it not only leaves my skin feeling sticky it stings. I used the old formula for years and never had a problem. I have read some of the reviews and pretty much the new formula is not liked. I do not like the smell either. Bring back the old formula. I am going to have to find a different product now."
"I have used this bottle of what used to be ""heaven"" on my face. I recently ran out and bought a new bottle. After a couple times of usage, I thought the product was expired because it made my skin burn, turn red, and super irritated when in the sun. I am sad after reading reviews Iv learned this product has changed. I am also upset at this company for not advertising this change. It is unfair. One more customer lost. What a shame."
"In response to a question about this product, a Neutrogena representative told me that this is in fact a reformulation of this product. I loved the old formula for my face and neck. The new one is thick and sticky--feels like ""regular"" sunscreen. I will not buy it again."
"I have been using this product for over 20 years. I just bought a new bottle. I didn't know that the formula had changed, but I did notice that there is a scent now . I prefer no scent. But the biggest thing is that this formula stings my face, especially under my eyes. I' m glad that I went to your website, because I now know that I' m not the only one with this problem. I hate to have to look for a new product. Please bring back the old formula!!!"
"This is the best moisturizer I've ever come by in my years of skin care! It says combination skin, but due to the reviews, it's probably best for people with only oily skin to use it. I have EXTREMELY oily skin, and this baby gets rid of all the shine while making my skin baby-butt soft. One pump is enough for the whole face, it's fragrance-free, and will NOT break you out. It's the best!"
I have been using this for a long time (not sure how long but this bottle definitely lasts awhile!!) and it's my favorite ever. I've gone through so many and could never find one that didn't make me feel greasy but also made me feel moisturized!! This is my holy grail of moisturizer!
"I've had horrible breakouts on my face after using this product. My skin gets rough and bumpy, peels and then turns red. I've used it on and off to make sure it was the factor and indeed once I stopped using it for a while, my skin started clearing up - although it took at least a week to do so."
"I have been using this product for years and have always liked it until now. I don't know if it has been re-formulated but when I replenished my stock this week, I did notice that the bottle size has changed. For the first time ever, the product caused burning when I applied it and today I look like I am sunburned. So disappointing. I guess I will need to find a new moisturizer."
"I have used this product for years - it is the ONLY thing I found that I could use twice daily with no problem at all. I recently bought a new bottle. It made my face red and made it burn. It says it is fragrance free, but my bottle certainly has a fragrance! I thought I purchased the wrong thing. Double checked and bought a 2nd bottle. Same result. I'm so sad - it must have changed. I have to find something new - what's up Neutrogena??"
"I have the typical oily T-zone plus dry cheeks problem, and I happen to spend my time in countries with humid climates (Malaysia and Australia). I must say I'm happy that I can find this product in both countries, especially because my 'oiliness' decreases when using it. I'm a bit put off by the smell...but that's a small sacrifice to pay because I love the way my skin now feels. Such a pleasure to be able to use a moisturiser that can cover both oily and dry areas."
"I have been using this product daily and faithfully for over 20 years. Now I can no longer use it. Immediately after applying, my face turns bright red, burns and itches like crazy - almost like the moisturizer is triggering rosacea. I am disappointed and ticked off. I won't be buying this stuff ever again."
"I love using it! A lot of creams are just extremely creamy and thick. This one is thin, but it keeps your skin soft and nice. And the price is great! The bottle will last for like a year! But the con is that, personally, I think its causing me to break out more. My nose has been getting dotty, I've been getting zits. This product does what it says, but Id rather have dry skin then breakouts. ~Only my experience. the product is still really nice."
"i bought this a week ago after reading a few reviews from other sufferers of oily skin. they said it was amazing for controlling oil and moisturizing. the fragrance i could get past but the fact that after only 2 days i began to breakout in terrible acne was shocking. it goes on and actually stings, which i've felt from a probiotic cream before so i wasn't initially concerned but after the breaking out i immediately stopped using this."
"I've been using this for a few years, and just recently bought a new bottle. For some reason the new formula is (strangely) scented and feels really thick and greasy on my skin. I've had great results with the old formula, but the new formula is causing breakouts. Please go back to the old formula!"
"I am heartened to see that all the top posts are saying the same thing I'm thinking. I've used this product for over a decade, every time after I shower. I immediately noticed the new fruity smell. Stupid. But worse is that it's making my face splotchy. Why change a good thing? It would be nice to see a real response on this page rather than the autoresponse advice to call and talk to some customer rep. Sadly I'll start looking for a new product."
"I've struggled to find a worthy combination moisturizer because I tend to have really dry skin around my mouth, but my T zone is always oily. I randomly picked up this Neutrogena product last year at a pharmacy and have never looked back since! This stuff does great to combat both aspects of my skin. It's also really light weight and soaks in instantly."
"I have used this moisturizer twice a day seven days a week for about twenty years and loved it. My face always felt good after using it. I just bought the moisturizer yesterday ...used it...my face felt dry and burned terribly. I also don't like the smell of it. What a disappointment after loving it all these years! Please, please bring the old formula back ."
"In short, I love this product. I have been using it for years and will continue to repurchase it again and again. As a NYC fashion model, good skin is quintesential to my living. I have normal skin that is sensative to fragrances and gets dull, flaky patches in the winter. Every morning after cleasing I use this moisturizer to restore some balance and bounce to my skin. It's not too thick, too thin, too heavy, too anything... It's just right:) It's my reliable go-to."
I have oily skin most of the year but in the winter my skin drys outs. This moisturizer was perfect for my skin and I will be repurchasing this. This is my favorite non acne treatment moisturizer my skin has been so much more balanced then it was before I started moisturizing with this.
"I have very oily skin and this product appealed to me because how it was ""oil-free"" and plus it had some SPF in it. I've been using it for two months and it is the worst product ever! It leaves my skin oily and it felt as if my skin is suffocating. I also started breaking out on places where I never break out. In addition to my blackheads, I even got whiteheads from using this product! Worst product ever!"
"I like the fact that it has SPF 15 and is oil-free, but I still found it to be a bit greasy, which I just do not like. I have mainly dry skin that is a bit oily and sensitive. I think this product would be good for really dry skin, but other than that I find it to be a bit too greasy for my liking. The moisture it provides is fine, but feels more like an oily type of moisture. Bottom line, I will be moving on to a different product in the future and will not be repurchasing."
"Lightweight and perfect for every day use. Goes on almost like a gel and leaves no greasy or slippery feel whatsoever to the skin. My skin is mostly oily, especially in the T-zone, with occasional dry bits on my cheeks. I have seen a significant difference and would recommend this moisturizer to anyone who appreciates oil control!"
"i cant believe theres actually people reviewing this moisturiser saying it smells a little like sunscreen - it has an SPF.. what do you expect? in saying that, i can only smell the sunscreen resemblence when i first put it on, after a few minutes it completely goes away for me, maybe people are putting way too much on. its very light, and id reccommend only using one or two pumps, thats the perfect amount for me to cover my face, neck and chest area. its a great product and id reccommend it."
"I bought this a month ago and it's been amazing! I've always had trouble managing my combination skin and this has helped a lot. Works great in my T-zone but not so great anywhere else. If I apply it anywhere besides my forehead and nose, it hurts and gets red, so I have to wash it off."
