"Bough this product a week ago as my current moisturizer was causing some breakouts. Well, this one is certainly not causing any breakouts because it is sucking all the moisture out of my skin and leaving it flakier and tighter than I have ever experienced! Very disappointed with this product. I have never had flaky skin in my life until using this ""moisturizer""."
"Have relied on your old formulation for 15 years and always get compliments on my skin. New one has awful scent (fake watermelon?!?) and irritates my skin. I bought out all the old formulations I could find a year ago but now am down to last bottle. I will not use the new one again, and am about to go on hunt for new daily moisturizer. Please, Neutrogena, explain what happened here. Or is there a replacement product I could try instead???"
"I had been using the combination skin formula from this brand (with impressive results) for quite some time, and decided to switch over to this for the SPF. However, my skin has not adjusted well to the change at all. Within a week I started breaking out a LOT along my cheeks & chin, and within a few hours after each application my face looks like an oil slick and I need to rewash. Will be switching back to the combination skin formula as soon as I can."
"I have been using this product for years and I loved that it didnt have a smell. I bought the new formulated product but barley opened it today because I still had some of the old one. I didnt have any reaction to it yet,but did notice the smell and hated it. That alone makes me not want to purchase this product anymore. I thought I had bought the wrong one. I have psoriasis and sensitive skin. If anyone fines anything like this product before the change please let me know. Thank You."
"I have been using this product everyday for almost 10 years now, but am so disappointed in the new formula. It stings when I apply it, and my skin turns red and blotchy. I haven't found another neutrogena item that is a suitable replacement, so I will need to switch to a different brand. Please bring the old formula back!"
I have used this product for over 10 years and will not be buying another bottle. The new formula for the product causes my face to have an allergic reaction. The smell of the new formula is very off-putting and my skin starts burning as soon as the product touches my skin. I am at a loss as to what to try next as I loved the old formula. Please switch the formula back!
"I've used Neutrogena SPF 15 face lotion for almost 20 years. I picked up more from store and used it this week. The smell, the texture, the burning feeling on my skin was horrible! I then looked at the bottles. This new formula says ""Broad Spectrum SPF 15"" and the ingredients are changed. I'm glad to know other users are not liking this new formula. Neutrogena--bring back the old SPF 15 face lotion! Totally disappointed and can't use this new formula."
"This is the best moisturizer I have ever used! I have combination skin (oily T zone, dry cheeks) and this does wonders for my skin! I have never been able to control the oil on my face before. This moisturizer takes out all of the shine. I put this on at night before bed, and in the morning I wake up and my face is still oil-free and no shine! I also like that it is fragrance-free so it smells completely natural."
"I love neutrogena products. I have tried all the face moisturizers. I find Combination does not work for me. like many reviewers, it dries out certain areas and causes break outs. I find that sensitive works better for me and SPF is also great. But, Combo does not work for my skin."
"This feels very light coming out of the pump, but it felt very heavy after applying it to my face. I stopped using for a while and switched to something else, but when I came back to this, I noticed it caused me to break out quite badly. Unfortunately for me, the product lasts FOREVER."
"I was really looking forward to using this product. I applied it after cleaning my face with the Neutrogena ultra gentle daily cleanser (foaming). I was disappointed when I started to develop acne, especially in areas of my face where I never had acne. Therefore I discontinued the use of this product and only used the cleanser. My skin feels much better and the breakouts have subsided. I don't recommend this moisturizer to anyone."
"I am trying your other products after being a loyal user of the intensified day cream for many years. This product is more liquid than cream and has a slight smell to it. I am sensitive to smells (sneezing, allergy, headaches). Sorry Neutragena but will be looking for other brands that are like the intensified day cream product you wrongly discontinued. cm"
I was recommended this moisturizer by a friend and am so glad!! This moisturizer doesn't make me oily or dry me out. It is a great value and comes in a HUGE bottle that I will probably never use up! A little goes a long way for sure. Will definitely repurchase again...if the bottle runs out. lol.
I love this moisturizer. I use it morning and night. I have oily skin and this is the only moisturizer I've tried that doesn't leave my skin oily right after washing. It moisturizes without leaving an oily residue and a little goes a long way so it lasts a long time. I hope Neutrogena never stops making this product because I don't know what I would do without it!
I've been searching for an oil-free moisturizer with SPF that doesn't cost a ton and I will still have to search. I agree with another reviewer who found it to smell too much like sunscreen and that it makes your face greasy/shiny. I don't know if it has made me break out or not but my skin's been more congested since I've been using it more so now I'm just using it on neck and chest to use it up while I search for something better.
"Have used this product for years, and like the other frustrated customers, I am unhappy about the change. The new formula does not smell good, it stings the skin slightly. A tiny bit of it got on my lips and now my mouth tastes like sunblock. Yuck. Never experienced this with the old stuff. Just tried to call customer service but was told there would be a very long wait."
"Like many others, I have used this product for many years and was very very happy with it. I just purchased what I thought was the same product (packing is the same but later noticed it now says broad spectrum) and it has a terrible smell, like teenage acne cream, and stings when you apply it. The new ingredient seems to be something called Avobenzone. Please revert to the old formula which was great."
"I am 30 years old and have used this product since I was in high school. A week ago I bought a new bottle and immediately noticed a new fragrant smell and when I put the moisturizer on my face I had a burning sensation and my face turned bright red. Thinking it might have been a bad bottle I went out and bought a second bottle, same results though. I loved this product and swore by it before the formula changed. I hope the old formula comes back, until then I will have to find a new moisturizer."
"This is a great product. Super lightweight and goes on without any shine at the end. There's no scent which is great, so you don't have to smell your face after your application. I've tried Clinique combination skin, Aveeno, Oil of Olay and nothing seems to work like Neutrogena for my skin. Great products for good prices. I just wish this came wih SPF as well. I don't understand why only the regular oil-free moisturizer has SPF but the sensitive and combination skin doesn't."
I bought this in need of a moisturizer that wouldn't dry me out but control the oil on my face! And it does just that and more! I have noticed a lot of my acne has gone away and my face feels smooth especially right after I put this on it also brightens up my face. I love this I recommend it to everyone!!:)
When I first ever used this product on my face it was wonderful!!!! But one day when I used this moisturizer on my face my skin started to flake out a little. I was really disappointed with this moisturizer because I thought that I had finally found the perfect moisturizer for my face. So now I will go back to my old facial moisturizer which is another brand because it was much more great on my face than this one.
I have combination skin so when I saw this product I thought it was going to be my holy grail. When I first started using this product the acne on my forehead disappeared but I noticed that around my mouth started getting dry patches. I thought it was nothing and went over it with another layer. After about 2/3 weeks in my whole face was sucked dry of moisture and I couldn't even put on concealer without it making look like I had dry patches EVERYWHERE! I had to discontinue because my face hurt when I smiled.
"I usually apply my moisturizer after I have exfoliated my face and before I put on my makeup . Must say that this is by far one if the best moisturizers to use . Its oil-free, it doesn't clog pores, it's light weight, and it makes my makeup look flawless ! For years I've been trying to find the perfect moisturizer for my acne-prone skin and I'm super excited that I've finally found one !"
I had used Intensified Day Moisture for many years and was very disappointed you discontinued it. PLEASE BRING IT BACK!!! I tried this as an option and it is ok. I have sensitive skin and break out. This one was not as light and nice as the Intensified Day Moisture. It almost felt greasy even though it is oil free. It didn't break me out but I am going to try something else. Didn't like odor at all.
"I use this every morning and night as my moisturizer. After a while, it started to hydrate my face and it didn't look as dry anymore. The only downside of this product is that it leaves my skin VERY shiny.It doesn't absorb quickly into my skin like the description says."
I wonder if this product is really designed for combination skin. It may not make the oily spots shine and sweat but it doesn't do a thing for the dry/normal parts. I made a mistake of buying it in late summer and there is no way I can use it for the rest of the year. It is way too expensive for what it is. It might be okay for people with excessively dry skin but not recommended for someone with a real combination skin. Not good for winter!
I had to stop wearing sunscreen because it burnt my eyes and left a white cast but I knew I needed it because I use retinol and alpha hydroxy at night so I tried this in the morning over my vitamin c serum and cream and it did not burn or sting and absorbed completely with no white cast I will use this brand from now on love it
I thought I had bought the wrong product as soon as I put some on my hand. I have severe allergies and this stuff stinks! More like insecticide than a product for your face. It is listed as UNSCENTED. That is definitely not true anymore. I have used this for years but no more. Not sure why you changed it but new is bad.
"I had no problems with the prior bottle of this product. After use, I broke out in a hive-like rash all over my face which has taken days to heal. I should have read the fine print which states ""stop use and ask a doctor if rash occurs"". Too, I looked up the ingredients and have found that while oxybenzone is indeed a sunscreen agent, oxybenzone can cause an allergenic reaction and affect the immune system."
"I started using oil- free moisture for combination skin several months ago. It has made a huge difference in my skin. I am glowing, I am radiant. My skin doesn't look ashy, or dry, its not oily, it doesn't feel tight. Its the best my skin has been in years! I live in a very dry state and this product has kept my skin healthy even in the harsh winter months."
"I bought this moisturizer only because it promised to be a grease-free sun protection. And, while it is not oily, there is no statement anywhere on the packaging or Neutrogena website that it actully protects fron UVA. SPF only guarantees UVB protection (sunburn), yet the UVA protection (main cause of skin cancer) is a question mark. I fell light burning sensation every time I use this moisturizer. I wonder if one of irritant ingredients is really harsh."
"this is been my summer day moisturizer for a couple years now. I have combination skin and, in the summer, it gets really oily in certain spots, no other lotion can control that as this one does. The humidity here is really high, so this might not be a good choice for someone leaving in a dry climate as thislotion is not really rich."
"I have combination skin and this product prevents both my problems. I can see that my skin didn't dry in the cheek or oily in the T-zon anymore. The product absorbs in y skin really quick, and it feels like I have nothing in my face. Then, I use my BB cream and it works really well on my face. Great for both winter and summer."
I'm so glad they haven't added SPF to this because I have allergic reactions to products with SPF. This product is awesome! I have oily T-Zone. My skin feels so much smoother and it definitely helps in my T-Zone area! It's also great on the rest of my face that's drier. I've tried many other products and this works best for me.
"I'm honestly not wild about how this performs, it seems to kind of put a thin barrier on your skin rather than really hydrating the skin, however, it's the only spf moisturizer i've tried that doesn't irritate my skin or cause it to break it out, so for that reason i absolutely love it. and it's great value for money, a bottle lasts for ages"
"It didn't really mousturize well and left my skin just as oily as before. However, it was better than no mousturizer. This was fine as a nightime mousturizer because I wash my face in the morning, so my face wouldn't be that oily. I would NOT recommend this to anyone"
"This face lotion has so many great qualities. It's light and absorbs easily, yet it still provides the moisture I need. It doesn't make my super-sensitive skin break out or itch. It's been a standby of mine for years. I love that it has SPF 15 as I wear it daily under makeup, and I don't need an extra product to protect my skin from sun-exposure. It's great for my neck as well. It doesn't have a strong scent either. A big bonus."
I originaly bought the SPF 15 (green color) version of this mositurizer but it still left some dry areas on my skin and I didn't like the greasy feeling it had to it. I had tried the Clean and Clear mositurizer but that was even worse. This one has been the best so far I wish it just wasn't as pricey.
My 11 year old has acne and her dermatologist recommended this as a moisturizer in her routine. It is great. It has provided moisture without causing a greasy or shiny appearance. It is not heavy and you only need a very small amount to cover your face. Although it is only a 4 ounce bottle it has lasted a long time. We love this product and recommend it to others.
"Not too sure on this product. It's ok for the summer when it's really hot & you want a very light moisturizer at night. However, it didn't do much for moisturization on my cheeks. I reapplied a couple of more times & it was a little better, but not by too much. I have very sensitive, easily irritated, combination skin that's prone to breaking out. I ended up going back to the store & exchanging it for the oil-free sensitive one. Sticking with what works for me!"
"I bought this moisturizer a few days ago and am in love with it! i use it twice every day. after just two days my face feels so soft and smooth! i love that it's also oil-free and contains spf 15. unlike other moisturizers i've tried, this one doesn't make my face feel oily or look shiny. to sum up, it's a very powerful, but lightweight moisturizer."
"I want to have great skin, but I'm a broke college student and I am very unwilling to spend big money on a moisturizer. I used to use Olay products, but I found that they made my skin feel oily and I could not wear them under makeup. In comparison, I can't even tell I'm wearing this moisturizer! I'm sure I could find better moisturizers that feel lighter at higher prices, but this works just fine."
"Coming from a department store moisturizer to this, I am pleasantly surprised by the results! It could be a BIT more moisturizing, but for my skin type, it clears up all of the dry patches and leaves the skin feeling tight and firm without feeling too dry or uncomfortable. It can be a little hard to blend it in, but for the price point the quality is amazing and it's definitely worth a try!"
"I wouldn't recommend following the instructions on the back of the package. I have normal skin, and using a whole pump full of this stuff is way too much for me. I also wear glasses, and if I do follow the instructions, my glasses slip and slide everywhere. Also, my nose and my forehead look really greasy after using this product. Now, I just use a little less than half a pump of this stuff and it still moisturizes and works fine. Plus, the product will last longer too!"
I bought this product to try something new and have been using it for about 4 months. When you first rub the product on your face it will make you appear very shiny and oily. After about 10 minutes it will be unnoticeable. It has really helped my skin become softer and I love the built in SPF. Definitely a great product!
Finding this lotion was such a relief for me! I've always been frustrated by trying to balance my dry yet acne prone skin and this works like a dream! I have yet to find another product that works as well as this one. My only complaint is that it is a little pricey for a working college student.
"I have tried a lot of different moisturizers and they all made my skin feel oily, greasy and made me break out more. I tried this one because it was oil free and spf and I LOVE IT!!!! It doesn't cause me to break out it leaves my skin feeling soft. I don't get shiny with it at all. Its the best moisturizer I've tried."
"I have been using this for about two years now, and I don't think I'll ever stop. I like that it has SPF, and doesn't have a tacky feel like other SPF moisturizers I've tried. Over the past two years I have tried other moisturizers, including expensive ones, and this is still the best for me. I have very oily skin, so the oil free aspect of this really helps. I highly recommend this product."
"I use this moisturizer in Trinidad when I go home to visit and in the UK where I currently reside, in the Spring, Summer Autumn and Winter and the results are the same. Great on the skin not oily and so easy to glide on make up over. Does not make my skin break out infact the entire Neutrogena line is excellent. I find it hard to use anything else on my face . An Aesthetician recommended this to me and since then I never looked back. Wish I could get it easier in the UK though. Have to get it from Trinidad."
"i struggle with acne and have tried many oil free moisturizers ( mostly expensive brands), but this is the best one by far. When I started using it my cleared up completely when other moisturizers left it slightly clogged. Love it and will continue to use it."
"I used this product for a whole month and may I say, it didn't work at all. Firstly, it stung. When I put it on, there was this unpleasant stingy feeling. Secondly, it didn't hydrate my skin where it's dry, nor did it control my oil in my t'zone. I put more of it on my cheeks, and no moisture at all. It felt like grease was sitting on my skin during the day and while I was sleeping"
"I have tried other three step procedures with other (more expensive)products, and this is the first moisturizer with a UVA/UVB SPF that doesn't leave my skin greasy. When I use this following the Alcohol-Free toner and the Deep Clean cleanser my face is oil free all day. It's light, the pump provides the perfect amount and it is oder free. Excellent day cream for a great price!"
"The first couple times when I used this product I had to use one pump, let it soak in and repeat 2-3 times because my skin was so dry on my chin and cheeks from climate change. After a week and a bit of using it, I only need one pump and my skin is moisturized all over and Ive noticed that I have not had to use powder or oil blotting sheets on my nose as much as before(once a day vs. 3-4). This is my new go to moisturizer:) Thank you neutrogena for helping with my shiny nose."
I accidentally purchased the SPF 15 sunscreen moisturizer instead of my usual Sensitive Skin moisturizer. This product makes my skin sting very badly. I tried the product in the same bottle a couple times - just to make sure the stinging wasn't a one-time result. I use regular sunscreen and have never had a reaction like this. I cannot recommend this product. It should be pulled from store shelves.
I have combo skin and this product for some reason made my skin more oily! It's interesting because item is listed as alcohol-free yet an ingredient contais alcohol. Will be returning.
"I've been buying this moisturizer for years and love it, but something's not right with my latest purchase. It smells really bad, like chemicals. Has anyone else noticed this? I'm afraid to use it."
"Love this product! I have sensitive skin and have no problems with redness or sensitivity. It is light, non-greasy and can be worn alone or with makeup and does an excellent job of protecting my skin from sunburn."
I bought this product about a month ago and I have been using it and it makes my skin very oily! It does not give that matte look as stated on advertisement
"I've used this product for 16 years. I just purchased a new bottle and immediately noticed the smell. Not good. Also, it burned when I put it my face. I only used it for a few days but will not buy it again."
"I have been using this product for over a year and love it. I wear it under foundation, for a bit extra moisture and sun protection, but it's light and clean and doesn't cause any breakouts (which I still can get at fifty-something)."
I've used this cream for years and I loved it but recently the formula has changed along with the packaging. It now leaves my skin feeling oily and it burns a little. Why did you change a perfect product?!?!
"ive been using this for more than a year now, and I've noticed it makes my whole face extremely oily. It's lightweight and moisturises well but it makes my face look very oily and shiny,"
Very disappointed with product changes. New formula smells and irritates skin. Looking for a replacement after many years of swearing by this product - very disappointed.
I bought this moisturizer yesterday. I used it last night this morning and tonight and I can already tell how clear and soft my skin is. It smells wonderful too! I will definitely be buying this again!
I have used this product for many years because I have sensitive skin but now when I use this product my skin has a burning sensation. Is this a new formula? I will need to find an another product to use.
"I don't like the new scent...it smells like fake watermelon. It's funny because it says that it's fragrance free but it's not anymore. And yes, it stings my skin too. Why did you have to change something that was working so well before?"
-Stingy on skin -irratative for the first 20 seconds -a little bit dry at first but gets oily throughout the day -soaks into s'kin good -compatible with makeup -good for acne skin -dont feel the lotion after it's on
"I have used a lot of moisturizers, and this is the best by a long shot. It moisturizes my dry spots perfectly and controls oil and shine. It could only be better if there was a little SPF in it."
"Have used other moisturizers, but I can definitely see the difference. It's not too greasy, or to thick. Thanks Neutrogena for making a great moisturizer."
"I have used this product for years and have until the last few months or so, loved it!! Not sure what you have done to it.... Eyelids burning, swollen, awful!!!"
"Seriously, I've been using this product for 10+ years and loved it, even better than expensive brands. Just bought a new bottle and my skin is stinging....why change the formula?!"
"I have always had oily skin on my T-zone, but dry on my cheeks, around my mouth, and upper forehead. But since i've been usuing this, my skin is so much clearer and softer!"
"seems to work well in controlling oil, but it drys weird on my skin it will create white patches that sheds off my face so its impossible under makeup and I end up wiping it all off my face because of how much it peels off"
"My combination skin is so soft now. Less oily on the T-zone, but not drying to the other parts. My skin is soft, and smooth all over. Touchable and beautiful. Greatly satisfied, nice product!"
"I love this moisturizer so much! I bought it four months ago and I still have 1/4 a bottle left. I use it every day, too. It's perfect for mixing with foundation to make your own tinted moisturizer."
I tried this product for a long time but it didn't work my skin at all. I have a combination skin but it didn't moisturize my dry areas even though I put a good deal of it on my skin.
"I always used the tinted oil free.....what happened to it? Neutrogena is the only product i can use on my face without breaking out,. Always used the tinted but I guess they have stopped making it....very disappointed."
"After using this moisturizer daily for many years, I find that the new scent (of watermelon) is off-putting. I also seem to experience itching on my eyelids. I am now looking for another brand."
"While I love this cream, it does bother me that I can't find any information on whether or not the protection is for both UVA and UVB. Living in New Zealand, that is an important criterion for me. Could you please clarify Neutrogena?"
