4.7,"['379', '41', '10', '4', '15']"
I have always used this as it also has a sunscreen in it. Just love it so would love to try their whips also someday. I got 2 of these so I could give one to my husband. He has had dry flaky skin on his forehead lately. I put this on his face and his problem has completely stopped. No more dry flaky forehead. Wow works on me and women both !
"Great for my skin and I love the fact it has sunscreen in it. I use it on my face, neck arms and hands after my shower using Oil of Olay body wash. It is not greasy and absorbs great."
"I am 59. My grandmother used Oil of Olay as her secret to young looking skin. She looked great until she died in her mid 80's. I have used it every day too. It is a great, time proven product."
I have very sensitive skin and this is the only lotion I can use and not break out with acne or bumps/rash. I'm 50 and have no wrinkles and no I have never had plastic surgery or any facials they also make me break out.
"Oh yes! I love this Olay product. The only problem I had I thought I was getting the one for regular skin, not sensitive. I like the regular because it has a citrus fresh smell to it. But this product too has the SPF protection."
My husband and I have used this for years. It doesn't cause breakouts and offers the added benefit of sunscreen. This is a great product.
"I love this facial moisturizer. Not too heavy or thick, but thick enough. I also love that there is some sun protection in this."
Great price with spf 15 for 2
"The moisturizer is one of the few which has zinc in it, which I was specifically looking for. It rubs in easily and isn't greasy feeling or looking. Shipment was about a week later than they promised."
Not the Product had used previously! Cannot use the two bottles I purchased! Description should have specified formula had changed!
It beats the expensive brands
"I have used Oil of Olay,for over 35 years.It is the only product I use other than soap."
I love it.
"Been using for years, My Mom also used it."
"I love this product, I like all Olay products in general but this one is by far my favorite!! It goes on smooth not oily like some face creams and runs in easily. The smell is great and it is very affordable so it won't break your budget!!! I will be an Olay customer for a while thanks Olay"
"I haven't used this product before. It only arrived a week or so ago, so it is too soon to tell if it will have a positive lasting effect on my skin. However, it feels good, applies easily, lasts all day as a moisturizer and is not greasy. It is doing just what it advertised."
I am very happy with this moisturizer. It feels light on my skin and doesn't feel oily.
I use this on the face instead of an aftershave. Works
nice.
Great for sensitive skin.
Could not have worked out better.
I use this product every day morning and night. Love the way it makes my skin feel.
Really like this brand. Sensitive skin version is just what I need during the winter!
I've used this for years. I love it
I have used Olay since I was a teen and now I'm in my 50s. It's not greasy. I love it.
Been using for years. People don't believe me when I tell them my age!!
"I love the texture of this daily moisturizer. I love that it has sunscreen, also. And! I believe that it keeps my face looking younger!"
I have used Oil Of Olay lotion for more than 30 years. It's a great
moisturizer and has sunscreen in it.
"I started using this product about 40 years ago and after trying a few other moisturizers now & again, I always govack to it."
"I have been using Oil of Olay for years and so did my Mom, I think it is really helping my skin stay healthier. I hope to use it for years to come."
I've been using this product for years. It is a great moisturizer as it is not too thick and not greasy. It also has some sun protection. Very good under your makeup.
"I use this for everyday moisture. Sometimes, during the winter months, I have to use a more ""heavy duty"" moisturizer but this works well and doesn't irritate my skin or leave it feeling greasy."
"I've used this moisturizer for several years. A couple years ago, my husband started using it, too. We both like it very much as it absorbs quickly and does not leave a sticky residue on your skin. It's also modestly priced - as skin care products go - and doesn't break the bank to purchase it."
Olay moisturizer is my only choice for my face for fifty plus years and counting.
"I've used this for years, wouldn't use anything else!"
Great value.
Used this product for many years. Good value for price
"I have a very sensitive skin which I can't really trust or try any product on me , but I give this Olay a try and I'm very happy with it . I love this product!!!"
"I actually wanted SPF30 and ordered this by mistake. Feels good, non greasy. Half the price of the Olay SPF30 Complete Defense - wish that was cheaper."
"I have super sensitive, combination to dry skin. Every facial moisturizer with SPF that I've ever tried leaves my face and eyes burning, and that's not even mentioning the nasty smell and gunky feel. I recently purchased this moisturizer and I'm in love! No gunky feel, no fragrance of any kind, and most importantly my face doesn't burn! I highly recommend this product to anyone considering a new facial moisturizer with SPF."
"I love Olay (Oil Olay, Complete)! I have been using your product on my face every day since I was 18 years old. I would work just to be able to buy Oil Olay as it was formerly named. My skin is firmer and smoother. I get compliments all the time about how young I look. I'm 68 years old."
This is the only moisturizer that doesn't break me out! I LOVE IT! I have been using it every day for over a year now. Its great that there's an SPF in it as well because it gives me added protection from the sun throughout the day. I won't use anything else!
"I LOVE the Original formula (pink swirl) Olay and Sam's had sold this dual pack for years! I have been buying this moisturizer since I was 19 years old, so for the last 23 years. All of a sudden Sam's Club only sells the complete formula which breaks my extremely sensitive skin out due to to the SPF:-( I really wish they would continue to carry the original beauty fluid as it is an excellent moisturizer and a much better bargain for me. It is the only facial moisturizer I use."
"This new formula is of lower quality, less effective, and overall inferior to the previous formulation which contained aloe juice (not 'extract'), green tea, and before 2010, chamomile. Please bring back the better formulation and do your consumers and company a favor and clearly state when you change a product. If you change an ingredient or formula, you are in fact SELLING A DIFFERENT PRODUCT."
Im so glad that Oil of Olay listened to its consumers and brought back the classic gentle formula because it is the best spf moisturizer out thier for people with sensitive skin. It doesnt burn my eyes and doesnt feel greasy at all.Love that its oil and fragrance free. Reading the reviews before PLEEEASSSE Oil of Olay don't change the formula of the product again Ive tried everything else and this is the best Ive ever used. Oil of Olay for life.
"This is a good product to always have on hand, all their products are effective."
"I use it every day. It is a nice, light moisturizer and I love that it has sunscreen protection."
I BOUGHT ABOUT THREE WEEKS AGO AND AM HAPPY ABOUT THE PRODUCT AND THE PRICE
I've used this brand for a long time. It gives me just the amount of moisture I need.
The convenience of ordering online makes shipping so easy. I love the oil of Olay and so glad Sam's has large 2 packs.
Took on vaca .Used as sunscreen everyday.Never got burned. Great for sensitive skin .Doesn't bother your eyes.
we use this every day and t's one of the best moisturizer for sensitive skin for the price. Thank you Olay!!
Nothing beats the consistency of this moisturizer. Been using it for years...and I think it's why I generally look younger than I am!
I no longer where foundation so I put this on my face every morning. It gives me a fresh look and feels great. Not oily or thick.
I've been using Olay products for many years now. I'm always told I don't look my age. I owe it all too Olay products!
This is a good moisturizer but I do like something a bit thicker for my aging skin so I gave it 3 stars.
A great moisturizer with a great price. Used for years by myself and friends. Also a SPF. Others are so expensive and do the same thing.
I use it as a moisturizer and sunblock everyday. I wouldn't use it during an extensive duration in the sun.
"I use this when I wil be hanging around the house, in addition to anti-aging products, and a no make-up day."
I have used Complete all day moisture for 30 years and it was passed down from my grandma. Not greasy or oily so I never get black heads or sticky feeling. I love this!
"I have used this for about month now. It is AMAZING! I have extremely sensitive skin (mild rosacea). This is very hydrating, non irritating, light, not greasy, and I love that is has an SPF!"
A little bit goes a long way. Very creamy and smooth. Great moisturizer for my acne prone skin. I've been using it for a couple weeks and my face looks and feels better. (I do use a 2.5% benzoyl peroxide under it.)
I started using this lotion because it was recommended in the acne.org regime. I have always had combination/oily skin and this product helped me control my acne without getting dried out skin.
"Olay, are you reading your negative reviews for your new bottle of this moisturizer? I was on Ulta.com, and the first 5 pages are mostly all complaints about the new formula change with your new bottle that came out this year. I have both bottles, the older one with the yellow sun on bottle and the new one with the black font. I can tell you, the new one is not the same. I hope you take into consideration all the complaints and can make changes."
I use Oil Of Olay on my face and neck and love the feel of my skin.
"Nice price, dependable product and love the spf coverage."
I HAVE BEEN USING THIS PRODUCT FOR MANY YEARS. MUCH ESIER AND CHEAPER TO BUY AT SAM'S CLUB
I only purchase this at Sams. Best price and service
Awesome product. I have used it for six years.
Have used this product for many years. It was a good price at sams
"I love Olay products, and was thankful to get them at such a good price!"
I like the texture and how easily this product absorbs into my skin. I wear it everyday!
Have used for many years.
"I have used this sensitive skin zinc oxide lotion for as long as I can remember, so has my mom. It's lightly moisturizing, perfect for my combo/acne-prone skin, and keeps my skin clear of uv damage. I burn VERY easily and this daily lotion prevents that. There is no scent, no oil, does not aggravate my acne-prone skin, or break me out, simply perfect :)"
Love it!
"I have been using this product for decades and I love it. Every time I stray to try some other, generally more expensive, product, I end up coming right back. Effective sunscreen and the moisturizer is non-greasy and absoreasily into my skin."
"This will be the last Oil of Olay Complete I purchase. After 25 years i need to find a new facial moisturizer. Terrible odor, even though it is fragrance free for sensitive skin. Why change such a good product. I see that I am not the only one."
been using original for 10 years.ran out and bought another bottle.should be advertised as complete garbage.the formula change is junk and i will be squirting the rest out down my toilet.bring back original or be aware people.do not purchase!!
Good on my oily skin - Skin feels light and not oily all day
Feels nice
works well
good
Great for under make-up
"This is ONE Of muy favorite moisturizer product for now,my face feels really soft, have fast absorption, not oily ,whit SPF 15 is perfect for my,smell like a sunscreen but more light ,I'm Olay fan so I don't have complains. I thrust in this brand %100."
I bought this cream because my skin is sensitive. I like the fact that it is fragrance free. Unfortunately it made me break out a bit and it makes my skin feel dry. I used it 3 years ago but in the lotion formula. Perhaps I should have bought the lotion not the cream formula.
"I found the ""new old"" product. Yippee! The box has the familiar yellow, white and black graphics with a green band at the bottom that says light, non-greasy lotion--FRAGRANCE FREE; and the same green color oval on the top left of the package that says ""Classic Gentle Formula"". Many thanks P&G--a belated but still appreciated return of my beloved zinc oxide formula!"
Love this product!! I have very sensitive skin and it works great.
My skin is super dry & this lotion is all that helps with it!!
This makes my face feel so good!! I will not use anything else on my face! Love it !
I love this product it isnt greasy and also has a little sunscreen in it
This is the only moisturizer I can use. It doesn't cause my skin to burn or get red. I have never broken out from this product. I have tried some of the most expensive products and find this to be the gentlest and most effective.
"I have been using this with clean and clear 3-in-1 cleanser trying to get rid of my pimples but its hasnt worked. It may be the cleanser that is not working but not sure if the lotion is doing anything to make it worse. this is a very light moisturizer and I purchased it for the SPF. It doesn't feel as moisturizing as my other moisturizer because after I put it on, my face still feels a bit dry."
"I live in FL, where the sun is a constant battle. I enjoy being tan, but I do not want the wrinkles that go along with a tan. I've use Olay daily moisturizer every day and people consistently card me, or think I'm younger than what I look like- I just turned 35yrs old. I think my young look is definitely attributed to the daily use of Olay face moisturizer. I highly recommend that all girls and ladies use this product."
A loyal customer for 10 years (daily use) but whatever changed in formulation is not giving same results. switched from another lotion after trying a friend's bottle ~10 years ago and being amazed it was actually clearing up my otherwise frustrating facial skin. Please change formulation back!! As others mention also don't like re-branding - guessing company cost saving measures (removing colored ink and bulk ingredient savings) but may be short-sighted.
I agree with the reviewer who said the formula was changed AGAIN. I used the sensitive formula for over a decade & loved it. I saw when they switched to chemical spf then went back. Then they changed it yet again around 2015 with a “new look” claim but really they switched the aloe juice to aloe extract & added triethoxycaprylylsine as an extra ingredient. I can't use this anymore—it burns my face (& eyes even tho I don't put this near them). Please bring back the original sensitive formula!
"I used the original gentle formula for 10 years. Olay has changed the formula by replacing some ingredients and using SolaSheer. The new formula is not moisturizing enough and I cannot use Olay anymore. I tried other Olay alternatives such as the total effects feather light moisturizer spf 15, but it is not comparable to the beautiful skin results of the original formula of the complete sensitive spf 15. Olay, please bring back the beloved original gentle formula. It was perfect."
"This is my favorite moisturizer!! I have used this product for years and it is great for my sensitive skin. There's no strong scent and it leaves my face feeling fresh and moisturized. A little bit goes a long way, making the bottle last for a long time too! #contest"
"I have been using this moisturizer for 10+ years! I have a problem with lotions being too heavy or greasy on my face, but I find this one very light. I love that it has sunscreen and minimal smell--I am sensitive to smells. It's also very reasonably priced. I use other Olay beauty products too! #contest"
"I've used this lotion for over 10 years. It's great! I have sensitive skin that usually prefers expensive Sephora brands. This is just as good as any $40 moisturizer carried in department stores. The lotion doesn't have a strong scent and doesn't cause any reactions to my skin. It's also not too thick or runny. Lastly, it does very well under makeup. I love it!"
"I used the original gentle formula for 10 years. Olay has changed the formula by replacing some ingredients and using SolaSheer. The new formula is not moisturizing enough and I cannot use Olay anymore. I tried other Olay alternatives such as the total effects feather light moisturizer spf 15, but it is not comparable to the beautiful skin results of the original formula of the complete sensitive spf 15. Olay, please bring back the beloved original gentle formula. It was perfect."
"I want to start by saying this is my first review EVER!! That's how In LOVE I am with this product. I remember my mother using this since I was a child. I have been using this DAILY since I was 16 and I am now 39. I'm always getting compliments on my skin and on how I look like 10 years younger, thanks Oil of Olay!!!"
I live in the Middle East where it's air cons everywhere you go. My skin is parched and couldn't find any cream that suits my dry-combination sensitive skin that won't clog my pores or break me out. I tried all sorts of expensive brands and none of them worked. Finally bought this from a local supermarket and I'm stoked to see the results from such an inexpensive product. It didn't break me out nor clog my pores. Super happy with how well it moisturizes my skin and leaves the skin plump.
"I've been using this moisturizer complete with SPF 15 FOR OVER 10 YRS NOW, I LOVE IT N I WILL CONTINUE TO USE IT IN THE FUTURE. IT'S GOT VITAMINS E B3 & C IN IT N I LOVE TO USE IT ON MY FACE N NECK. THANKS OLAY MY FACE LOOKS SO YOUNG BECAUSE I HAVE PEOPLE ASKING ME ABOUT HOW YOUNG I LOOK N I'M 58 NOW. KEEP UP THE GOOD WORK U R DOING ! THANKS !"
"I've struggled with break outs, extreme combination skin, and redness for as long as I can remember. I bought the cleanser and this lotion and my skin hasn't been the same since. Since switching I've found my break outs to be purely hormonal and minimal at that. My skin is much more even in terms of tone and texture and I have noticed the redness I used to experience and stress over is not that noticeable now!"
I really like this moisturizer for its formula and the way it makes my skin feel. I appreciate that zinc oxide is used for its sunscreen ingredients and that it's fragrance-free. I also like how it's quite moisturizing and prefer to use it during the colder months.
I love complete all day moisturizer I use it everyday. I started using it about 12 years ago and never had to buy a different brand.This moisturizer works great and does not make my skin red as I have very sensitive skin. Thanks for the great product!! [This review was collected as part of a promotion.]
"I've been using Oil of Olay since my 20's. I am 63, spent a lot of time in the Sun and proud to admit it my age. I tell every young lady I know to use it. Someday when they're my age they will remember me and thank me for having the beautiful face they'll be proud of also. [This review was collected as part of a promotion.]"
I have been using Olay products for over twenty years. When the sensitive with sunscreen became available I decided to try it. I love the fact that it is unscented and protects the skin from harmful rays. I am fifty seven years old and have been mistaken for forty many times. I think Olay products are the reason people are surprised at my age. Thank you Olay! [This review was collected as part of a promotion.]
I am 51 and I have been using Oil of Olay since I was 15. My mother used it before me. People constantly tell me I don't look my age. Some have told me they thought I was only in my late 30's. Some say it's good genes but I give all the credit to Oil of Olay. You have such a wide variety of products for all skin types and no greasy feel. I have always loved Oil of Olay! [This review was collected as part of a promotion.]
"This product works wonders. I had a very deep frown line in my forehead. I had tried other products, but there was no change. I finally chose Oil of Olay moisturizer. I liked that it had sunscreen because I was in the sun a lot and wanted the protection. In only about 2-3 weeks I started noticing that the frown line was not as deep. Before long it was basically gone. I will swear by this product forever ( as long as it continues to work so well). Thank you for such a great product. [This review was collected as part of a promotion.]"
"I have been using this product since I was a teenager and I'm in my fortys now,and I also shared this product with my daughter when she was a teenager and she will not use anything else. Thank You for keeping our skin looking great!!!!!!!!!! [This review was collected as part of a promotion.]"
"The oil of Olay with 3% zn Oxide and NO orher chemical suncreens is great! It is the only sunscreen I use and as a readhead it is VERY effective. I can not use othe sunscreen chemicals, so really depend on the Zm oxide ONLY formulation with the nano particle size so it's not white on the scin Because I use it, I know the sun protection it provides is much higher that the SPF 16 tested- reality vs a test result! Please leep it in your line!! [This review was collected as part of a promotion.]"
I have been using Complete All-Day Moisturizer since the 1970's - I started with the sunscreen - Sensitive as soon as I became aware of them. I am now 70+ and no one believes me when I tell them my age. I give all the credit for my skin condition to Oil of Olay Complete All Day Moisturizer with sunscreen Broad Spectrum SPF- Sensitive. Love it! [This review was collected as part of a promotion.]
This product was used by mother-in-law who had beautiful skin. She used it faithfully every night and never showed her age. She died at 82 and was alway complimented on her beautiful skin. I'm trying to do that so I use it every day and usually 2 to 3 times. [This review was collected as part of a promotion.]
I use this sunscreen on my hands and arms daily. It has adequate UV protection and it keeps my skin from drying out. It I have used it for years due to its effectiveness and its affordability for daily use. [This review was collected as part of a promotion.]
"The product can be very well absorbed very quickly. It doesn't make your face oily at all. I am a person who needs sun protection daily, so I put on some high SPF sun screen cream over this product. The product doesn't mess up your make up either. [This review was collected as part of a promotion.]"
"I have been using Olay Complete since it came out. I love the fact that it is safe for sensitive skin, the SPF 15 sunscreen and the fact that it is so light I often forget I have even put it on. This is the BEST product I have ever used on my skin. [This review was collected as part of a promotion.]"
I have used their products for 20 years. My skin is clean and smooth. I have had little problems with aging and I am often told I look younger than I am. I attribute this to the great skin care lines of oil of Olay. [This review was collected as part of a promotion.]
"In the line of products for sensitive skin by Olay, this is daily moisturizer is another success. It is unscented, which makes it perfect to use on my skin with fragrance allergy. It is great ti use either in the morning or in the evening, after cleansing. The SPF15 is another great benefit for use during the day, to protect from sunburn. [This review was collected as part of a promotion.]"
"I have been using this product for the last 25+ years. If it had the sunscreen in it when I started, I'm not sure, but I can say with certainty that I love this moisturizer, and it does not cause my skin to break out like other products I have tried. I now pair it with another OLAY ""Regenerist"" product, but there is hardly ever a day that I do not apply this SPF 15 sensitive product. [This review was collected as part of a promotion.]"
"I enjoy this light moisturizer, and have been using it for many years. It is low priced and does the job. I don't particularly require a lot of moisture to my skin, so I appreciate the lightness of this moisturizer. I do have sensitive skin, and am allergic to many products, so I appreciate Olay making a sensitive skin moisturizer. [This review was collected as part of a promotion.]"
Olay All Day Moisturizer with sunscreen Broad Spectrum SPF 15-Sensitive is easy to put on. With some sunscreen you have to do a lot of rubbing to get it worked into your skin but this product is not like that. You only have to use a little to go a long way. [This review was collected as part of a promotion.]
I have used oil of Olay for years and plan not to ever try change. I have many people compliment me on how nice my skin looks. I tell them I owe it to Oil of O'lay I use it daily and a regenerist micro-sculpting cream at night. [This review was collected as part of a promotion.]
"I have used this moisturizer every day for years. The first thing I do when I get out of the shower is moisturize my face. It feels great and lasts all day. I will continue to use this as long as it is produced. I am told many times that I do not look my age (70) because I have very soft skin and no lines. Thank you, Olay! [This review was collected as part of a promotion.]"
"I have used this product for over 40 yrs before it became ""complete"" w/sunscreen. Even my dermatologist confirmed my opinion that this was good for my skin- and the sunscreen makes it even better. I use it in morning after cleansing and at night after cleasening. [This review was collected as part of a promotion.]"
