"this product is great for sensitive skin, and for sunscreen protection, Since i light skin with freckles,, the sunscreen is very important. Since i am getting older, and find my skin needs have changed, do need more moisturizer as well. I would definately reccomend this product to anyone, it is never too early to start protecting and caring for your skin. [This review was collected as part of a promotion.]"
This has been the only moisturizer to touch my face since it was introduced on the market! I love that it contains a sunscreen and keeps my skin looking great. Been an olay user for over 20 years and plan on at least another 20! [This review was collected as part of a promotion.]
"i have used Olay for over 15 years . Having fair skin, the added protection with sunscreen has eliminated the need for 2 products. I am 54 and my skin looks good and I know its from using Olay all these years. [This review was collected as part of a promotion.]"
I love the All Day Moisturizers with sunscreen for sensitive skin. I have to watch what I put on my face or I will have a date with the dermatologist! This product helps keep my face moisturized and fends away the wrinkles. It is wonderful that there is sunscreen in the moisturizer to protect from the sun during the day. [This review was collected as part of a promotion.]
"I have used the Oil of Olay for many years, and my daughter has as well. We love the light texture, feel and coverage of the Complete All Day Moisturizer with the built in sunscreen. It is especially good for my daughter's sensitive screen. [This review was collected as part of a promotion.]"
"This product is awesome! Perfect for summer because it is light, non greasy, feels smooth all day and has SPF 15. Highly recommend for anyone who has sensitive skin like me, my number one moisturizer for the summer months. [This review was collected as part of a promotion.]"
"I have been using Olay for many years and I continuously get compliments on my skin...What do you use, you don't seem to age - you have no wrinkles or lines. What more can I say; I am a true believer in the Olay products. [This review was collected as part of a promotion.]"
"For the past year, I have been using Olay's All Day Moisturizer with sunscreen Broad Spectrum SPF 15 - for sensitive skin. What I love about it, is that it is light and covers me without feeling greasy. I love the added sunscreen protection and leave my house always feeling fulling protected. I highly recommend this product for anyone. [This review was collected as part of a promotion.]"
"My mom has been using this product for so many years and everyone compliments her skin and how young she looks (she's in her 50's)! And now I use this product everyday. I Love it! I have turned so many people on to olay, especially the sensitive moisturizer because it just feels so great and one day I hope to have skin as youthful as my mothers! [This review was collected as part of a promotion.]"
"I have very sensitive skin and this product is absolutely perfect for it. Most facial lotions break my face out and make it appear greasy, but not this product! It provides great all day moisture without feeling heavy. And since my skin also burns very easily its nice to have a SPF for everyday protection. LOVE LOVE LOVE it. [This review was collected as part of a promotion.]"
"This is my ""go to"" moisturizer. I apply it each day under my make up. It provides a full day of moisture and sun protection without any irritation. My daughter also uses it on her acne-prone skin, and it does not clog her pores. It is priced well, too [This review was collected as part of a promotion.]"
This is a Must for me to use everyday!! I use it as soon as I get out of the shower and it really helps my dry skin. The SPF is great too because we all need protection from the sun every time we step outside and the sunscreen in this product works! It feels good knowing when I go outside that my face is protected from the sun and we know that not only can sunscreen help protect us from skin cancer but also help premature aging. [This review was collected as part of a promotion.]
"I have very dry/sensitive skin and this moisturizer is excellent in treating these issues. I apply this in the mornings before applying my make up and it leaves me skin with a dewy finish, just how I like. It is not greasy, no strong scent, and has not caused break outs. I have bought 2 bottles of this moisturizer so far and it lasts a really long time! I see myself making this my holy grail face lotions for years to come. [This review was collected as part of a promotion.]"
"I've been using this moisturizer since January and I think it's better than those expensive moisturizers I buy. I noticed a difference in my skin, more so than other expensive lines I've tried in the past. I am also using the Regenerist at night and the luminous serum after moisturizing."
I love the Complete All Day Moisturizer with Sunscreen Broad Spectrum SPF 15– Sensitive! I've been using it for about a year and absolutely rave about it. I have very sensitive skin and can't wear most sunscreens or moisturizers on my face. It takes a special product so that I don't break out in rashes or acne. This does the trick and keeps my skin looking beautiful!
Thank you for returning to the original formula for Sensitive Skin. I think I must have been one of the first ones to call Customer Service last year stating that eyes were stinging with the re-formulated brand. I love the old formula it works well doesn't feel greasy does not have a scent that makes my eyes water. I use it as do both my teenage girls before any foundation is applied. Please keep this formula and think about a better price. The bottle has decreased in size and the price has gone up.
I wore the original formula about twenty years ago and got many compliments on my glowing skin. I am thrilled to see it back! I love the zinc oxide in the formula I can trust as long as it doesn't change again.Sometimes we cannot improve on what is already excellent. Please consider making a night firming formula or something complete for all ages. I think gentle and non irritating is what everyone loves. Thanks again for returning something I love.
"I was pleased with the feel of my skin after using the Olay Complete with SPF 15. It has a nice scent, and it is barely noticeable (feeling) on my skin after I apply it. I use topical medication on my face 20 minutes prior to applying Olay Complete, and the Olay Complete does not aggravate my skin or counteract the medication. I am so pleased to have the SPF already in the product because I have had sun damage over the years."
"This stuff makes your skin soooo soft and is NOT GREASY at ALL. Use it around your eyes, it helps prevent or reduce thse wrinkles and doesn't burn or make your eyes water if you happen to get a little in your eyes. Use it anywhere to moisten without the greasy feeling, completely absorbes into your skin! Been using it for YEARS!!! SAM'S 2-pack is also the CHEAPEST way to buy it!!!"
"I hated all face sunscreen because I would always get terrible blocked pores and acne (even cystic). I finally found the one. The sensitive skin one I use is very light weight and doesn&#39;t cause me any problems. It doesn&#39;t feel like sunscreen is on, with that mask-like feeling. You may need to reapply if you&#39;re sunbathing or sweating. Oh yeah, it doesn&#39;t really burn the eyes like so many do. I was happy to find my miracle!"
"I used Olay as a teen but then switched to more expensive brands. My skin has changed and became extremely sensitive with age. I now use this product in Sensitive. It is great! Lightweight but seriously moisturizing. The SPF will be tested during the summer months, but I have faith it will hold up to the test.(Most with SPF's break me out with the first use, but not this one.)"
My intention was to buy the combination/oily formula but it wasn't available. I figured the sensitive formula couldn't hurt. I bought the renegerist trio but the deep hydrating cream was too moisturizing for me during the day. This a great lightweight moisturizer for combination/oily skin!
"I am so glad I tried this moisturizer w/ SPF! It's just what I was looking for to complete my daily face regimen, it is perfect for my fair, sensitive skin - it's moisturizing enough to wear on it's own (without layering with another moisturizer) - and I love that it has zinc in it. I wear it everyday! Thanks again, Olay!"
"This product is okay. I try to use as little as possible on my face and neck until my face feels moisturized. If i use what I would consider a normal amount, it doesn't soak in well and my face looks greasy. If this happens I just take a towel and wipe the rest off of my face. Good for the UV protection, but as an overall moisturizer it's just okay."
"Classic sensitive formula is back!!! I almost cried when I found it on the shelf....was about ready to give up. I tried store brands with 6% octinoxate 3% zinc oxide and they didn't irritate my skin, but your formula is the best for creamy, non-greasy moisture."
My rating of this product is still 1 star which means Poor (to say nothing of disappointing and unpleasant). But I am very happy to have finally found the reinstated Classic Gentle Formula which deserves 5 stars. Perhaps you will even give the Classic Gentle Formula its own place on this Website.
"You did it again, changed it, this time you lost me for good."
Love this moisturizer
did not like it
"Not the same, ingredients and order, are Not the same. There is a reason people love these products, and are faithful users, because of formula. So why change it ?"
"I have used this product all of my adult life. It is the best!!! When I used makeup, this was my foundation, now I don't use makeup and this is all I put on my face after I wash it. It is perfect on my skin!!! I recommend it highly!!!"
"I absolutely love this formula, very gentle on my sensitive skin! I have been using this product for years and has no problem with it!! Hugs! Thank you Olay!!!!!!"
This is the only product with zinc in that doesn't clog my pores and turn my face white. It makes my face glow and the moisturizer is light enough so that your natural skin color shows. Thank you Olay!
"This product is amazing because it helps my skin look smoother, healthier, and I also feel young again. It was the best product I could choose, than the others."
I have sensitive skin and this is the only product I can use on my face without irritations. I have been using this for years and would recommend it to anyone. Excellent product.
Been using this for years and it shows. I do not have great skin but this keeps me young looking. Its light and smells good. [This review was collected as part of a promotion.]
"Do you know how embarrassing it is to be 51 years old and still break out like a kid? This is the only product that doesn't break me out, and I've tried everything! [This review was collected as part of a promotion.]"
I have used this product for over 30 years. Since I was in high school into my 50's! I will continue to use always! [This review was collected as part of a promotion.]
I love Oil of Olay with SPF 15 for sensitive skin. I use it all year round and always have a extra bottle with me. My skin is dry and sensitive. This product was made for me. [This review was collected as part of a promotion.]
"So many products make promises they can't keep, but I've used the Olay all day moisturizer for years without it letting me down! Great everyday moisturizing and SPF protection. [This review was collected as part of a promotion.]"
Light enough to wear all day long with NO scent to attract insects when outdoors or clash with your perfume or to bother us with sensitive allergy issues. Wear alone or under your make-up. [This review was collected as part of a promotion.]
I have been using this moisturizer for years and really love it. My face is protected from the sun and moisturized at the same time. [This review was collected as part of a promotion.]
Goes on light. I only use it when the weathers gets warm since I have oily an dry skin. I also use it on my kids year round [This review was collected as part of a promotion.]
"I have been using the Regenerist Eye Lifting Serum for months now, I just had a birthday i'm 57 years old and i have to say I don't look my age! I contribute that to using the Olay products!! [This review was collected as part of a promotion.]"
"I have been using this for years and it has consistent results for an everyday moisturizer. My skin is soft, supple and stays moisturized throughout the day. [This review was collected as part of a promotion.]"
I have used this product since the 80's the addition of sunscreen just makes it that much better! It absorbs right into my skin making it feel soft but not greasy. [This review was collected as part of a promotion.]
3rd generation user of Olay. Love the product and the beautiful results on my skin. The SPF says 15 but works as if it's SPF 50! [This review was collected as part of a promotion.]
I love this product! I can put is on in the morning as I usually do and then go to a baseball game and don't have to worry about sunscreen on my face. [This review was collected as part of a promotion.]
I started using this a few months ago and i like it a lot it's light weight and does what it says its all around good lotion and you cant beat the price [This review was collected as part of a promotion.]
"This is a great moisturizer and sunscreen! I began using this product at 14yrs old, am now over 60, and many people comment on how young my skin looks (my husband uses it too). [This review was collected as part of a promotion.]"
This is what I use on my face daily. I like how there is no scent and it has SPF in it which is important! [This review was collected as part of a promotion.]
I have been using this product for years and love the look and feel when it's on my face...Like nothing's there but keeps my skin looking great [This review was collected as part of a promotion.]
"I liked this moisturizer. It made my skin feel smooth and hydrated without feeling greasy, and I was protected from the sun. [This review was collected as part of a promotion.]"
I've used Complete All Day Moisturizer for as long as I can remember. I put it on every morning before my makeup and each night after washing my face. I wouldn't want to be without it. [This review was collected as part of a promotion.]
I have been using this product for a long time and have been using olay for more than thirty five years love it! [This review was collected as part of a promotion.]
"I like this product because it contains sunscreen, which helps with the aging process and it is for sensitive skin, which you can use daily. I also like that it contains Vitamin E and Aloe. [This review was collected as part of a promotion.]"
"The first Oil of Olay product I bought was the original pink bottle when I was 17. I loved the smell of it and it made my skin feel soft, it still does! [This review was collected as part of a promotion.]"
I have been using olay since i was 12 and it has never failed to provide moisture and not irritate my skin. I love this moisturizer. [This review was collected as part of a promotion.]
This moisturizer is a good way to start the day. I apply after my shower each morning and it gives me soft smooth start to my day. [This review was collected as part of a promotion.]
"For many years I used cheap products. They did nothing for my face. I discovered Olay products and I'm hooked. For the first time in years, and I'm 60, my face actually feels hydrated. [This review was collected as part of a promotion.]"
"Winter drys me up and causes redness and peeling, this works great in the winter and summer coming out of the pool as well. [This review was collected as part of a promotion.]"
I like the sensitive formula. I really have issues with scented products and this does not irritate my skin at all. The formula goes on smoothly and absorbs well. [This review was collected as part of a promotion.]
"I've used this product since I was in my 30's. Wouldn't use anything else. Save on my sensitive skin, and does a great job. I'm constantly getting compliments on my complexion. [This review was collected as part of a promotion.]"
"I have using this product for many years. I literally don't go a day without it. It's a nice light moisturizer, not greasy and has SPF. [This review was collected as part of a promotion.]"
"Have used your products for many years, people tell me how young I look and I will be 96 in two weeks. [This review was collected as part of a promotion.]"
"I have been using this product for years, I like the way it stays on and you hardly know you are wearing it..... [This review was collected as part of a promotion.]"
I have used Oil of Olay's Complete All Day Moisturizer with Sunscreen for Sensitive Skin since I was in high school. It moisturizes without causing my skin to break out. I would highly recommend. [This review was collected as part of a promotion.]
"Good product. Absorbs easily in to skin...I will mix a bit of this with my Olay CC cream for a bit more coverage. No nasty smell, either! [This review was collected as part of a promotion.]"
I use this product after showering when my pores are open. It glides on easily absorbs quickly and is light non greasy feeling. Used it for years and I'm told I never look my age :) [This review was collected as part of a promotion.]
"I love the clean, light protection & moisturizer that I get. The price is right and a timeless classic in anyone's arsenal of health regimes. [This review was collected as part of a promotion.]"
I have been using this product consistently for at least the past 12 years. I have sensitive skin and this moisturizer is non-greasy and has spf sun protection which is important to me. [This review was collected as part of a promotion.]
"The all Day Moisturizer with SPF- Sensitive, works very well on my face as it does not make my face warm or hot. It is very light and I would not use anything different. [This review was collected as part of a promotion.]"
This is the best product for sensitive skin. It absorbs so fast into your skin the best moisturizer too. I have been using this for years and have recommended it many times. [This review was collected as part of a promotion.]
"This moisturizer is just perfect, not too heavy, not too light and it leaves my skin so soft and supple without making it feel greasy. [This review was collected as part of a promotion.]"
i use the all day moisturizer with sunscreen it has really helped my skin stay looking young wish i could afford more of the olay products [This review was collected as part of a promotion.]
"This has been my favorite daytime moisturizer for many years- I is gentle, has an SPF to protect me from the sun, and works so very well! It is the perfect daytime moisture! [This review was collected as part of a promotion.]"
"This product applies very lightly, not thick and heavy, but provides excellent protection for my very fair skin. [This review was collected as part of a promotion.]"
"Ive been using ONLY Oil of Olay for over 20 years. Ive tried others but ""no comparison."" It does the trick. I even have my sons using it. Now i have to buy 3 times as much. [This review was collected as part of a promotion.]"
I live in a desert (Nevada) and MUST use sunscreen daily but most products are too harsh for my sensitive skin. This is the ONLY one that has worked well for me. [This review was collected as part of a promotion.]
"I love this product because it is not oily, it leaves my skin soft, and has the added benefit of UV protection. [This review was collected as part of a promotion.]"
I have used this product since recommend by a Dermatology resident when I was 23. At nearly 50 I still have people think I'm under 40. This speaks volumes for general care everyday. [This review was collected as part of a promotion.]
I love this mosturizer it keeps my skin feeling soft and plump. And I love that it has spf 15 in it. Please don't change this product [This review was collected as part of a promotion.]
This product is a good base moisturizer for all day use. I have very sensitive skin and am particularly allergic to many sunscreens. The sunscreen in this product is effective while gentle. [This review was collected as part of a promotion.]
I have very sensitive skin and for almost 30 years I have been using this product. No problem with breakouts like previous brands I've tried. [This review was collected as part of a promotion.]
I have used the all day moisturizer under my makeup for years when i tell them I will be 68 they are surprised and i always say its because I use Oil of Olay moisturizer. [This review was collected as part of a promotion.]
"After having skin cancer removed from above my eye, I forgot my Olay on a vacation and my face got sunburned. Don't leave home without it now [This review was collected as part of a promotion.]"
Olay is my go to moisturizer for day and night! one question.. why is there a bump on top of the cap this makes it impossible to turn upside down to get the last of the moisturizer ? [This review was collected as part of a promotion.]
"I love this moisturizer, it's light and non greasy. I love that it already has SPF in it, one less step makes for a smoother morning. [This review was collected as part of a promotion.]"
"I use this cream all year long as I have normal to dry skin. I find that this cream absorbs well, and gives me the hydration I need for day or night use. [This review was collected as part of a promotion.]"
I absolutely love this moisturizer! It work's great for me. I have very dry skin and this face lotion really does the trick [This review was collected as part of a promotion.]
"I started using this on a recommendation when I was in my late 30s. It's the only thing I've used since then, and the only thing I'll ever use. My skin looks terrific! [This review was collected as part of a promotion.]"
"I have been using this product for many years and have never been let down with results. My skin is smooth, feels soft, and there are never any break-outs due to clogged pores. [This review was collected as part of a promotion.]"
"Wonderful product that provides great moisture without any oily feel, plus has the added bonus of SPF 15. [This review was collected as part of a promotion.]"
"I love this moisturer, it is great for sensitive skin without the greasyness of other moisturizers and has SPF!! [This review was collected as part of a promotion.]"
"this is the best everyday moisturizer I have ever used. Light, non oily and easy to absorb. Works great under my makeup! [This review was collected as part of a promotion.]"
This product does not go on oily or thick. I like the feeling after I put on. It does not cake either. [This review was collected as part of a promotion.]
"This is one of the only products I can use that softens my skin, prevents wrinkles (people say I look ten years younger than my actual age), and doesn't cause breakouts!!! [This review was collected as part of a promotion.]"
"I look forward each day to using this moisturizer as not only does it feel fantastic, it smells heavenly and makes me fee fabulous all day long! [This review was collected as part of a promotion.]"
many decades ago my mother used olay products. Today I am still using them. my very sensitive skin only tolerates these products. [This review was collected as part of a promotion.]
"I have used this moisturizer ever since I found they had a sensitive version, and the original before that. I love, love, love this product. The SPF 15 is a bonus but I would use it anyway. [This review was collected as part of a promotion.]"
Great everyday moisturizer that does the job along with the benefits of sunscreen. Feels great on your skin and looks good under your makeup. I use it every morning! [This review was collected as part of a promotion.]
"For everyday use, this is the best lotion on the market. Have tried several competitors but always come back to Olay. Not switching, again. [This review was collected as part of a promotion.]"
"I have tried a lot of different day creams, but this one by far takes the cake. Never greasy, easy to wear under makeup. it is my go to day cream [This review was collected as part of a promotion.]"
"Living in Florida, I am in the sun frequently and love how the Complete All day moisturizer leaves my skin protected and soft. I have had no dryness since using it religiously. [This review was collected as part of a promotion.]"
I love Olay products as they have kept me moisturized all day and comes with SPF 15 during the day! [This review was collected as part of a promotion.]
This is the only product that I have sworn by for years. The fresh feeling and protection it gives your face. One of the BEST in the WHOLE world. I would not use any other product. [This review was collected as part of a promotion.]
"I have used this for years and would not replace it with any other product. Works very well on my sensitive, fair skin. [This review was collected as part of a promotion.]"
I have used Olay daily moisturizer for over 10 years. The sensitive formula is just what I need and the results are the BEST! [This review was collected as part of a promotion.]
"Pleasant smelling, non-greasy cream that is easy to use and can be used every day. Great results with little effort. [This review was collected as part of a promotion.]"
"I actually use two Olay products, the Total Effects throughout the winter and this moisturizer during the summer. It is light & smooth and yet gives me the protection I need for my skin. I love it! [This review was collected as part of a promotion.]"
