"I am sixty-four years young & will not trade my Olay Moisturizer with SPF 15 protection for any other product. I have used it for many years & my skin looks great, feels soft & I am told there is no way I am sixty-four years of age. I know the SPF will protect my skin when I am out in the sun & this to me is so important. Thank you for making it a priority for women of all ages to feel there best & also look there best. I truly love my Olay. [This review was collected as part of a promotion.]"
"I LOVE Olay products. I have been using them faithfully for 30 plus years! I constantly receive compliments on my ""beautiful skin"" at age 51, I look like I'm 31!! OLAY is my first pick for beautiful, affordable, healthy skin. [This review was collected as part of a promotion.]"
"I was 14 years of age when my grandmother who was dutch, gave me a bottle of Olay daily and said she uses this only. With the cold weather in Holland that's all she used, and since then, for 35 plus years that's all I have ever used. My skin is fine, no great. That should tell you what an excellent product this is. Thanks. [This review was collected as part of a promotion.]"
I find this product absorbs in seconds and leaves my skin feeling moisturized all day. It is light and fluid and you really don't need more than a tiny amount each time. It makes a nice base before applying my makeup. [This review was collected as part of a promotion.]
"I use this product daily. It provides great moisturizing effect and one gets the SPF protection. This protection comes in handy as many of us forget to use SPF on overcast days, even though we need sun protection on those days too. The face and neck are always exposed! I am excited to see there is now an SPF 30. [This review was collected as part of a promotion.]"
"This is a great product for individuals with sensitive skin. You can still get protection from the sun and keep your skin soft and smooth without perfumes or other ingredients that clog your pores. I highly recommend it!! It is much better than other name brands that cost much, much more. Thank you Olay. :-) [This review was collected as part of a promotion.]"
"I use this reasonably priced moisturizer for years, and I'm going to be 69 yrs. this September 2015, and friends & family remark how beautiful my skin looks. And they are astonished when I tell them I use Olay and the price. I've tried other well know expensive brands and always to back to Olay products since they do the same job and a lower price. Thanks to you Olay I received many compliments of my facial skin and neck line. [This review was collected as part of a promotion.]"
"I have used Oil of Olay for over 30 years. I have tried other brands, only to immediately realize there is nothing better. I get positive comments about my skin all the time. I think I can thank Oil of Olay for that! [This review was collected as part of a promotion.]"
i grew up using these products it was all my mom would use.i still use them because they do what they say they will do.My skin glows from using these i am 54 and get carded for buying smokes for my husband .i just love these products [This review was collected as part of a promotion.]
Olay Complete for Sensitive skin with SPF is the only moisture I have used for forty plus years. I have allergies to certain chemicals and fragrances and found this product perfect for me. Since I am a senior my skin seems to need more moisture. I am happy that it has the PFT that protects. I can walk outside knowing I am protected from the sun. Being fragrance free is a added bonus. [This review was collected as part of a promotion.]
"I have used All Day Moisturizer for a great many years. I am 70 years now and I think I have used it since I was 40. I have been without it once and my skin was so dry and cracked that I cried. It keeps my skin so smooth and soft that I think I am going on 30 years. I will never change moisturizers, I am Olay branded. [This review was collected as part of a promotion.]"
"I've tried many facial moisturizers including professional brands that cost 2-3 times as much as Olay. I keep coming back to the Complete All Day Moisturizer. My skin feels great without feeling greasy or heavy. It's light enough to wear under make up or alone. And the spf is a must. Great product, great price. You can't go wrong. [This review was collected as part of a promotion.]"
"I have been using Olay products for more than 10 years, even introduced to my mother and sister as well. This product is work well with my skin, I have never had any problem with skin allergy or anything wrong on my skin since I used Olay, so I will keep using it for as long as I lives. It makes my skin look younger and shine. I loved this product keep jp your good work. [This review was collected as part of a promotion.]"
"tried boot 7 and my skin was so red then tried OLay and it stopped the red ness, so I am back and will not stray away again. would like trial of other OLay products without spending a lot of money because I am retired but still would like to look younger. Hope I win? [This review was collected as part of a promotion.]"
"I have used Oil of Olay since I was 19 years old. Having dry skin it has become essential to protect my skin especially in the winter. I am now 65 years old, my skin looks great and I intend to use it for a life time because it works. [This review was collected as part of a promotion.]"
"I have used Olay products for years, and have always had great results .The sensitive formula is by far the best product available to date. It goes on creamy and absorbs well , and makes a great make-up base or used alone keeps my skin soft and moist. [This review was collected as part of a promotion.]"
"I have used this moisturizer since my teen years. Now I am in my mid-forties, and I would not use any other daily moisturizer. It protects and moisturizes perfectly. It's light and non greasy. It does not cause breakouts. I've since passed this product along to my daughter. [This review was collected as part of a promotion.]"
"I have very sensitive skin, live in Florida and have had skin cancer. The sun is not my friend, but with this product with spf protecting my skin and not irritating it, its a win, win situation. Great where were you twenty years ago. [This review was collected as part of a promotion.]"
"I have been using Oil of Olay Moisturizer since I was a teenager, I am now in my 50's, I always have folks coming up to me and complimenting me on my skin, when I tell them that I only use Oil of Olay they are amaxed. I have been using it every morning and night for 30 years...Thanks Oil of Olay! [This review was collected as part of a promotion.]"
My face sustained major skin damage many years ago and is very easy to chap today. I depend on this moisturizer to give my skin the added layer of protection that it needs. It works so much better than other products. [This review was collected as part of a promotion.]
I have used this product for over 10 years and have not found one comparable both in product and price. Love the way it feels on my skin. Goes on quickly and smoothly. I know I have the added benefit of SPF. Does not clog the pores or leave me greasy feeling. Use under my BB cream. [This review was collected as part of a promotion.]
"For over forty years I have been using Olay complete Moisturizer. When it came out with sunscreen added, I changed to that. As I aged I changed to Olay Complete Moisturizer with SPF 15 for sensitive skin. It has never failed me and would recommend it to anyone looking for a good moisturizer. [This review was collected as part of a promotion.]"
I have been using Olay moisturizer since I was a teenager and I am know 52. It is not greasy and is kind to my sensitive skin. The added sunscreen is a benefit since I spend alot of time outside and don't always remember to use sunscreen on my face. I love Olay and really can't say enough good things about it! [This review was collected as part of a promotion.]
"My grandmother., mother, myself and now my daughter use Olay moisturizer. My grandmother looked wonderful at 90 when she passed away and she used Olay for as long as I was old enough to remember. Since my teens I have used Olay moisturizer every day and now I am 43. I have never tried anything else. [This review was collected as part of a promotion.]"
"I have tried other products, however none compare to Oil of Olay. I love how it makes my skin feel. And I especially love that it has sunscreen in it too. Most women would cringe at the thought of putting sunscreen on their face, but this is amazing. Goes on smooth and isn't greasy. I have very sensitive skin, and Olay makes a Complete lotion for sensitive skin. By far, the best skincare line that's on the market. [This review was collected as part of a promotion.]"
"I have been using Oil of Olay for many, many years. My mom has always used it for as long as I can remember. It makes my skin feel so soft and subtle. My husband always compliments me on my beautiful skin which, to me, is the best reason to continue using it! [This review was collected as part of a promotion.]"
"A few years ago I found that sunscreens were ruining all of my clothing. I learned from Olay that it's because Avobenzone is now used in most of them. Olay All Day Moisturizer with Sunscreen Broad Spectrum SPF 15 - Sensitive doesn't have avobenzone and doesn't stain my clothes like other sunscreens. Since sunscreen is essential, I am committed to using Olay Complete, which feels good on the skin and helps me avoid skin cancer. [This review was collected as part of a promotion.]"
I use this every day after scrubbing with the complete cleanser. It moisturizes my skin like no other lotion has. It isn't greasy and I can put my makeup on right over it immediately after applying. I love what it is doing for my skin! [This review was collected as part of a promotion.]
"I have used this moisturizer for 10+ years in combination with Olay cleansers, toners, Olay regenerist serum and eye roller. I am 58 years old and have no wrinkles. I believe Olay has played a huge part in that! The products are great and comparable to many department store products that are much more expensive. I recommend them to my friends. [This review was collected as part of a promotion.]"
"Love the creamy texture of Complete moisturizer. Goes on quickly and cleanly, so I can follow immediately with my foundation. Lasts ALL day without any greasy feeling. Perfect protection for my face when I""m outside for hours. This moisturizer does its job.. [This review was collected as part of a promotion.]"
I've used this product for years. It's light and goes on smooth making it perfect before putting on my makeup. No one ever believes I'm old enough to have a thirty year old son. I thank Olay for that. [This review was collected as part of a promotion.]
"I love the fact that Olay makes moisturizers for sensitive skin, as my skin is very sensitive to fragrance! The sunscreen is also a big plus. This moisturizer makes my face feel soft but goes on clear and doesn't go on gloppy. A great overall moisturizer for daytime! [This review was collected as part of a promotion.]"
This is without a doubt the best daily moisturizer. It is not at all greasy and leaves your skin feeling soft. Protects from the sun as you go about your daily activities. It's a staple for me and goes on first thing every morning. [This review was collected as part of a promotion.]
"I watched my mom use Oil of Olay products my whole life so no surprise that I would choose this product also. She had beautiful skin! I like this one because I get sunscreen and it's light. Great base for my make-up, too. Thanks for continuing to produce great products for skin care at any age! [This review was collected as part of a promotion.]"
I have been using Oil of Olay Complete All Day Moisturizer with Sunscreen Broad Spectrum SPF 15-Sensitive since I was about 17 and I will be 50 this year. I have been told by many people that I don't look my age and what is my secret. I tell them it is Oil of Olay. [This review was collected as part of a promotion.]
"what can I say, my grandmom started me on Pink Oil of Olay that came in a glass square bottle. I've been using this standard ever since. I am always getting compliments on my skin and how young I look. Is it Olay or good genes? I think it's both. [This review was collected as part of a promotion.]"
Excellent lightweight moisturizer with sunscreen for morning. It's the only lotion i have found with a sunblock that is also unscented for sensitive skin. I use all Olay products and have been very happy with them for years. Tried other brands but always go back to Olay [This review was collected as part of a promotion.]
i have been using oil of Olay moisturizer with spring for over 15 years. I love how the moisturizer goes on smooth and evenly on my face. The moisturizer helps my makeup go on evenly and provides a nice fresh glow to my face. [This review was collected as part of a promotion.]
"I have used Olay Complete All Day Moisturizer for twenty years and it is the best product I have ever used. It is light weight and absorbs instantly, leaving my skin feeling moist and smooth. The smell is not overpowering and it is gentle on my skin. I have tried other lotions, but nothing compares to Olay Complete. [This review was collected as part of a promotion.]"
I love this product!! It makes your skin so soft and I get great results when I'm in the sun. I'm always recommending it to family and friends. One time I couldn't find it anywhere around where I live so I wrote to e-mailed to find out where I could find it. It was months before I found it again!! Great product that I will use for a long time!!!!! [This review was collected as part of a promotion.]
"Ourdoor seniors like me need light but powerful moisture protection as well as basic sun protection. This product does as advertised, is easy and pleasant to use and I keep an extra container in my golf bag. I'm a walking advertisement and can share my secret with the ladies in our foursome as it's in my bag. [This review was collected as part of a promotion.]"
"I have used Oil of Olay facial lotion for over 20 years. At age 41, I get compliments on my skin and appearance. The added benefit of spf is truly a bonus. This is a non-greasy, lotion that I make sure to wear every day, under my make up. [This review was collected as part of a promotion.]"
"My mom used this product and I use it and now my daughter has started using it. I find it hydrates my skin without clogging my pores and even though I use a bit of sunscreen, I think this product provides additional sun protection. After coming home from Florida last week, my friend wanted to know if I was using botox for crowsfeet. I told her no, and recommended Olay. [This review was collected as part of a promotion.]"
"I have an issue with a sun allergy on my face. I have tried many high SPF suntan lotions, including those for babies. The only thing that works is the Olay Complete All Day Moisturizer with SPF 15. You'd think it wouldn't be enough, since it is only SPF 15, but it works better than the 60+ I have tried. Great to use every day as a moisturizer, too! [This review was collected as part of a promotion.]"
"I've been using this moisturizer for a long time,especially during the summer because it gives my skin moisture and protection from the sun without feeling oily.I think it's the best product, simple and very effective. [This review was collected as part of a promotion.]"
"I have used Olay since I turned 18, and upgraded to Complete All Day Moisturizer with sunscreen Broad Spectrum SPF15 - Sensitive when it first came out. This product provides the moisture & sunscreen my sensitive skin needs without feeling greasy. I recently turned 60 & people can't believe I am ""That Old""! I know this product has a lot to do with this. [This review was collected as part of a promotion.]"
"I have highly sensitive skin, and allergic to many scents. I was hesitant to try another moisturizer, that would irritate my skin, or the scent to cause an allergic reaction. I have used many Oil of Olay products and have been satisfied. Once again, I am excited to be able to use this product with no reactions or something or problems. Kudos for making products for those of us with sensitive skin and allergies!!! Thank you!!!!! [This review was collected as part of a promotion.]"
"My grandmother got me started on Olay products. I know I can wash my face with Olay sensitive foaming face wash, apply Complete All Day Moisturizer and I'm good to go. My skin is protected and feels great! [This review was collected as part of a promotion.]"
"Complete All Day moisturizer with sunscreen Broad Spectrum SPF 15 allows me to feel secure that I am protecting my face from harmful rays of the sun. the smooth feel it gives my face makes me feel like it is being absorbed well. I don't really need the ""sensitive"" kind but use it so as not to add any ingredients to my skin that would make it appear reddened or blotchy, as in an allergic reaction. [This review was collected as part of a promotion.]"
"I have been using this product for several years and I never go without it. Not only does it protect my skin with the SPF15; it keeps my skin hydrated all day. My skin is soft,smooth and beautiful!!! [This review was collected as part of a promotion.]"
"First, I love Olay products without a doubt, but as I get older I need more protection and thought I had found it with all day protection normal. It's hard to find, so I use sensitive. It's the next best thing. [This review was collected as part of a promotion.]"
I have been using Oil of Olay moisturizer every day for as long as I can remember. I always have a bottle waiting; I can't run out. It is part of my daily ritual and my only one. I am not one for makeup. I am 72 years old now and figure I have been using it for about 50 years. People think I am younger than my years. It is all because of my daily use of Oil of Olay! [This review was collected as part of a promotion.]
"I have used this product for many years. When I was in my early 20""s my mother told my to start using Olay moisture on my face and my face wouldn't get so many lines and wrinkles. I took her advise because she had a lovely skin. Now I am in my 60""s and asked by pother friends what I use on my skin. [This review was collected as part of a promotion.]"
Love this product because when it is applied to the skin does not leave the skin feeling oily. I live in a hot climate (Florida) so this product is perfect for me because makes me look natural even when I sweat and it does not accumulate the sweat underneath the product. [This review was collected as part of a promotion.]
Okay-- I am a Florida Girl who spends my summers fishing the Gulf of Mexico. My morning routine has always included Olay All Day Moisturizer .. No Make Up when on the Boat -- Only SPF 15.. Never Burn -- just a healthy glow.. [This review was collected as part of a promotion.]
"I'm so particular when it comes to a good daily moisturizer. Leaves my skin feeling moist but not sticky and delivers for applying makeup. I have never broken out with this moisturizer either, it's great for my sensitive skin [This review was collected as part of a promotion.]"
This is a great product. Not greasy and works great under make-up. I use it on my arms as well in the summer to keep them from getting sunburned as I go from place to place. It offers protection without that horrible suntan lotion smell. [This review was collected as part of a promotion.]
"I have very sensitive skin and have to really watch what I put on it. The Complete All Day Moisturizer w/sunscreen-Sensitive works great. It keeps my face from burning, keeps it moisturized and the zinc in it helps reduce redness. [This review was collected as part of a promotion.]"
I am very low maintenance woman & fuss free and on the go. Oil of Olay all day moisturizer does the trick for me it is light & covers well. When I was in college I spent lots of money at the beauty counter. I wish I could have the money back that I spent all I need is Oil of Olay moisturizer. [This review was collected as part of a promotion.]
"I first tried this product over 10 years ago when the name changed (from ""Oil of Olay"" to just ""Olay"") since I was familiar with the old ""Oil of Olay"". It was good that P & G improved alot for this brand since it already had a following. [This review was collected as part of a promotion.]"
I'm a pale redhead who burns in minutes. This is a great everyday moisturizer and sunscreen that doesn't leave a greasy film on my skin. This moisturizer doesn't cause breakouts and absorbs quickly while keeping the sun at bay. Love it! [This review was collected as part of a promotion.]
"If you have skin issues - sensitive, redness or itchy, this is a good product to use. It's not too heavy and only needs one application. It has no fragrance and so few products fit this requirement and actually work. It's easy to put on in the morning and leave it on all day. Try it and like it. [This review was collected as part of a promotion.]"
I have been using this for years. I have a fair completion and very sensitive skin. I can not use anything heavy on my face. I use this year round even during the winter and have had wonderful results. [This review was collected as part of a promotion.]
Have used this many yrs. Love the non-greasy feel. Use it 2x a day. Morning and evening after my shower and evening. I also use enough for my neck and decollette area. Nice fresh smell and creamy feel. My skin immediately feels nourished and hydrated(not dry). [This review was collected as part of a promotion.]
Olay's Complete All Day Moisturizer with SPF15 is a fantastic value. I use it everyday. It's a great foundation with sunscreen protection. It comes in a variety of skin types. I usually use either Nornal or Sensitive. I take it with me for use everytime I wash my face; it's part of refreshed glow. It is quickly absorbed and worked wonderfully! Thanks! [This review was collected as part of a promotion.]
I think it has some good qualities like its lightness and non greasiness. I would rather it was more creamy. it does not seem to dry out my face and it may hydrate it a little. but I don't fhi I it moisturizers it much either. [This review was collected as part of a promotion.]
"Complete All Day Moisturizer with sunscreen Broad Spectrum SPF 15 - Sensitive leaves my skin feeling soft and moisturized as it protects from the sun's harmful rays even when I am indoors or out on a cloudy day in the rainy weather. When I put this lotion on in the morning, it immediately relieves that dry feeling, yet is light and feels great on my sensitive skin. [This review was collected as part of a promotion.]"
"This is an excellent moisturizer. My husband's grandmother always used Oil of Olay and she was beautiful. There are so many choices for moisturizers - but, I stick with Oil of Olay. I also love the added benefit of SPF - it is so necessary and good to know it is in my morning lotion. I would prefer SPF30 - but, it is a bit harder to find. This lotion - I apply every day. Thanks [This review was collected as part of a promotion.]"
Olay Complete is a great all around moisturizer. I use it every day and it keeps my face and neck looking great. It is easy to use and absorbs quite well and is non-greasy. It is nice to have such a versatile moisturizer. [This review was collected as part of a promotion.]
"This is my everyday go to. I do not start a day without it. It goes on easy and gives great UV protection so you never have to worry about being outdoors. I have used this lotion everyday since college and although I won't tell you how long ago that was, I am always being told I look younger than my years. Thank you Olay. [This review was collected as part of a promotion.]"
"Although this product seems a little watery, it absorbs very quickly and does not clog pores. It goes on very smoothly, again a little watery, but seems to work very well. I would use it again and recommend it to others. I picked the sensitive skin kind, so it would be a little less harsh and it does not cause any irritations. [This review was collected as part of a promotion.]"
This moisturizer is great! Wear it under my make up and on my bare face. My skin glows! My teenage son and husband are both using it daily to protect their face from sun damage. Highly recommend this product for whole family. [This review was collected as part of a promotion.]
"This has been my go-to moisturizer for years...and the one I always come back to after trying others from time to time. It is light yet penetrating, and the sensitive skin formula has no fragrance or irritants, making it safe to use around eyes. I can use it alone or as a base under make-up, and it does not clog my pores or make my face shiny. A classic product for a reason! [This review was collected as part of a promotion.]"
"Soft, gentle, very well absorbing All Day Moisturizer with sunscreen Broad Spectrum SPF 15 - Sensitive keeps your skin young, clean and good looking for years. I'm using this moisturizer on a regular basis for over then 5 years and my skin didn't change since then. Price is amazing also! [This review was collected as part of a promotion.]"
"I have been using this product daily for many years..it is the only product that I have ever used as a daily moisturizer. It leaves your skin hydrated and protected with the spf 15, but there is never a greasy feel. [This review was collected as part of a promotion.]"
