"love Olay would rather use the original with out the sunscreen. it tends to be a tad greasy overall, I will continue to use Olay. [This review was collected as part of a promotion.]"
I have used this product for years. Love that it does not irritate or leave me with red splotches. The moisturizer sinks into the skin. Never feels greasy or leaves my skin shiny. Love it. [This review was collected as part of a promotion.]
I am 58 years old and have been using this(and more products) for many years!! Use every morning especially in the summer months due to the spf in it-makes my face feel fresh and soft!! [This review was collected as part of a promotion.]
I have been using this moisturizer since I was 20 years old! It is the only one that does not cause a break out. I use it every morning and it suffices for a sunscreen too! [This review was collected as part of a promotion.]
I have used this All Day Moisturizer with sunscreen for years and never found any other that equals it. It feels good and makes my face look moist and fresh. [This review was collected as part of a promotion.]
"the features in this product is so good I use it everyday,sometimes I'm in the sun all,sometimes in and out but it makes my skin feel so soft but yet protective [This review was collected as part of a promotion.]"
I have been using this great product since my 20s. I am now in my 60s & everybody says I don't look my age. [This review was collected as part of a promotion.]
I use this because of the SPF protection. I usually look for the SPF 30 but I use the SPF 15 also. Great moisturizer. [This review was collected as part of a promotion.]
I use this daily and it keeps my skin soft and moisturized and protects from the damaging sun rays. [This review was collected as part of a promotion.]
"I love this lightweight moisterizer for sensitive skin...it's non-greasy, absorbs quickly and has SPF protection. At 54 years old, I still use this every morning [This review was collected as part of a promotion.]"
Been wearing this since I was 18 and I always say I look 15 years younger than I am. Love this stuff!! [This review was collected as part of a promotion.]
Complete All Day Moisturizer works so well with my sensitive skin. It is not too oily or too dry which makes my skin healthy. I appreciate having a product like this. [This review was collected as part of a promotion.]
"I tried ""many"" moisturizers and Olay's Complete All Day Spectrum Spf 15 is my first choice. There's no oily residue, no embarrassing ""shine"" but just plain moisturizing to my face. [This review was collected as part of a promotion.]"
"I like it so much. I have been using it for 20 years and it's not too oily, not too drying. It' is very fairly priced and I don't have to use too much at a time. [This review was collected as part of a promotion.]"
Use Olay everyday for the last 30 plus years. I have sensitive skin. Olay leaves my skin soft and moisturized with no irritation. It also provides protection from the sun as an additional bonus. [This review was collected as part of a promotion.]
"This moisturizer is just what I need to start the day! Good hydration for my dry skin, and sun protection (very lightweight). [This review was collected as part of a promotion.]"
"Love this moisturizer - I use it daily on my sensitive skin and have had no problems. I love that it contains sunscreen - one less step in the morning, [This review was collected as part of a promotion.]"
This product has a light texture that comforts and protects skin exposed to the harsh summer light. [This review was collected as part of a promotion.]
I have been using this moisturizer for many years and it is always one I can trust and love the results. [This review was collected as part of a promotion.]
"I like the non-greasy feel to this product. My skin feels soft and smooth. The product is light. My skin is not greasy. Furthermore, I like the fact that it also contains SPF-15 protection. [This review was collected as part of a promotion.]"
I have sensitive skin that breaks out with almost all products (including Burts Bees) - Oil of Olay is one of the only lotions gentle enough to moisturize without causing break outs. Love it! [This review was collected as part of a promotion.]
"This product has it all covered, moisturizing, sun protection and suits my sensitive skin, love it!! [This review was collected as part of a promotion.]"
"I started using Oil of Olay at the age of 30, and I must say that I am ageless at 57 thanks to using my favorite moisturizer daily. [This review was collected as part of a promotion.]"
I have used this product for about 15 year and recently have received comments on how clear and smooth and youthful my skin is. [This review was collected as part of a promotion.]
Just the right amount of moisturizing. Lasts a long time. I would recommend this to anyone....male or female. Thanks. [This review was collected as part of a promotion.]
I've been using Olay moisturizing lotion for sensitive skin on my face for over 20 years. I have always worked outside yet my skin looks great for my age. Thanks Olay!
"I use this product on a daily basis, I live in South Florida and this product not only moisturizer but provides 15 Sunblock Protection. Non greasy and good on the skin"
"This is great moisturizer. I break out easily, and this doesn't make me break out. I've had the same bottle for about 3 months now, and I use it twice a day on my face. It's not oily, and leaves my face soft, moisturized, and protected."
This product is amazing. When I first started using it I had. Serious lines forming on a very dry face. Now my face is soft again and the lines not so prominent.
I have used this product for years. I was very happy when the sensitive skin formula added SPF to it several years ago. It makes my face feel smooth without feeling greasy.
I have used Olay for many years and would not give it up for anything. I am almost 51 but still have to try and convince people that I am not as young as they think I am.
It's really the best moisturizer to use. It's not greasy and it leaves your skin feeling so soft and smooth. I've been using it for as long as I can remember and do not plan to switch to any other kind!
I have been using olay complete for a long time and I love it. I have extremely dry skin and olay is the only one that I've found that really does moisturize my face so it doesn't get dry and flakey
"Thank you, Olay, for hearing your customers and bringing back the ""Classic Gentle Formula."" I'm so happy to know I can now continue to use the product that I've loved for so many years."
I love this product- I have dry skin and it helps my skin stay moisturized all day and the SPF is great in the summertime.
This is a completely different product and it is awful. So sad that my favorite sunscreen is no more.
Left my face very very shiny and felt kinda heavy on my skin my face also broke out like it never does after the second day I used this
This product will make you skin soft and moist. It smell amazing because it is made with scented strawberrys.
The best product on the market. If you don't have this then your missing out. Try it now! You won't regret it
This product changed my life because my skin is always so dry and now it's as if I never had a skin problem
"Perfect for my skin, the spf 15 works great n the sun!!!! It keeps my face moisturized all day! [This review was collected as part of a promotion.]"
every good it make my skin look good all the time. [This review was collected as part of a promotion.]
I love the smooth silkiness of the oil of olay moisturizer. It makes my skin feel the same way. [This review was collected as part of a promotion.]
"The is a fantastic product. I have been using Olay since I was a teenager, I love it. [This review was collected as part of a promotion.]"
Love it I have been using it for the past 10 yrs. great product!!!! [This review was collected as part of a promotion.]
I have been using this product for 20 years it is wonderful [This review was collected as part of a promotion.]
I've used this product for as long as I can remember and no one says I look 60 [This review was collected as part of a promotion.]
LOVE THIS STUFF IT FEELS SO GOOD TO PUT IT ON LOVE LOVE LOVE. [This review was collected as part of a promotion.]
I've been using this for years. I love everything about it. It's light on the skin. [This review was collected as part of a promotion.]
Like this product for my sensitive skin. Doesn't break me out. [This review was collected as part of a promotion.]
I have used Olay products all my life and get compliments on my beautiful skin! [This review was collected as part of a promotion.]
"Does a great job, nice feel to the skin after you apply and seems to last long. [This review was collected as part of a promotion.]"
"I have been using this moisturizer for over 20 years, I would never use anything else. [This review was collected as part of a promotion.]"
I have use Olay product since I was 11yrs old. I love your products. [This review was collected as part of a promotion.]
I get great coverage of moisturizer and sunscreen in one product. The soft skin is an added plus! [This review was collected as part of a promotion.]
I have used this product for years and it has kept my skin soft and smooth. [This review was collected as part of a promotion.]
I love this moisturizer and I love the light smell. [This review was collected as part of a promotion.]
This product has kept my face wrinkle free. please keep the zinc oxide in it [This review was collected as part of a promotion.]
I am satisfied with the results of this product. It leaves my skin hydrated and soft. [This review was collected as part of a promotion.]
Have used this product for years and now my daughter is using! :) [This review was collected as part of a promotion.]
my go to mousturizer for years now. i use it not only in my face but all over. [This review was collected as part of a promotion.]
This product offers great sun protection without leaving an oily feel. [This review was collected as part of a promotion.]
"Used for many years. Every time I try something else, I end up back with this for my daily use. [This review was collected as part of a promotion.]"
People notice my skin all the time. They said at my age I have a young and beautiful skin. [This review was collected as part of a promotion.]
This moisturizer does not leave your face oily. It lasts all say long. [This review was collected as part of a promotion.]
I been using this for over 6 year and my skin has look this amazing even I was younger. [This review was collected as part of a promotion.]
I've been using this for years! I wish it would come in an SPF 30. [This review was collected as part of a promotion.]
"Very smooth and light , great for Summer with light SPF protection . [This review was collected as part of a promotion.]"
I have been using this product for over 8 years now. It really keeps my skin soft. [This review was collected as part of a promotion.]
I like to use Olay moisturizer. The product goes on super easy and makes my skin feel smooth. [This review was collected as part of a promotion.]
I've been using this product for years and I love it! [This review was collected as part of a promotion.]
This product keeps my skin looking smooth and younger. It is not greasy and goes on evenly. [This review was collected as part of a promotion.]
Love my baby soft skin after just a few applications. Easily absorbed and not a strong smell. [This review was collected as part of a promotion.]
"I've been using this product for many years, and it keeps my skin smooth and wrinkle free. [This review was collected as part of a promotion.]"
This is a great product and provides moisture and sunscreen all in one [This review was collected as part of a promotion.]
Won't go a single day without it. Is absorbed so quickly & the sunscreen is an added bonus. [This review was collected as part of a promotion.]
This is a great product. Protects and softens my skin. Have used for years. [This review was collected as part of a promotion.]
I have been using this product since I was in my 20s and I am now 76. It is a terrific product. [This review was collected as part of a promotion.]
Good moisterizer but doesn't feel heavy on your face. Keeps my face from being too dry and protectsfrom sun while feeling like I'm wearing nothing.
Feels like pure sunscreen instead of a moisturizer. Did not make my skin feel soft. Couldn't even finish the bottle.
I have been using this for a while now. It's my go to daily moisturizer. Great investment for any age.
"It's amazing for my sensitive skin. Light, non-greasy, absorb quickly, dont break me out or clog my pores, can't really smell the suns cream."
"Light, non-greasy, great for sensitive skin. I highly recommend this."
I like that it doesn't clog my pores and cause acne.
I love this product. My skin feels and looks great.
best olay product great on the skin. olay is popular price is afordable
This works well. It did not aggravate my skin yet produced results.
I love it it is a absolutely amazing product I'd recommend any and everything about it it's awesome
this product is pretty good and it moisturizes very well.
This product is very smooth and refreshing going on and leaves skin feeling radiant
It was a good product it really worked good made my skin feel like new
This product made me young again because it made my skin Smooth and made me shine
"So silky on my skin, sun block was amazing ,I felt it was terrific for the cost"
"A great product for ""aging"" skin !!"
Great product and good price.
I love Oil of Olay - been using it for years.
I have been using this product for 10+ years. It is tremendous.
It makes the skin softer and also has the sunscreen which I am supposed to use.
I will forever buy Olay Products
Is it true that this moisturizer does not provide broad spectrum coverage under the new FDA rules?
Love this product. First thing I put on after the shower!
This really is a very nice product. I will surely recommend this to other people.
I have dry skin and this helps my face stay soft all day and does not clog my pores
Just WOW !!!
"GREAT STUFF1, I LOVE IT1"
Nice feeling product. Not too heavy on smell.
"Love this, not oily at all."
"I use this moisturizer everyday ,it's easy to apply .Love Olay product."
"I use this moisturizer everyday ,it's easy to apply .Love Olay product."
