"I LOVE MASKS AND SCRUBS, LOVE THE FEELING ON MY SKIN, SO WHEN I GOT TO TRY ""Garnier SkinActive"" ""Glow Boost 2-in-1 Facial Mask + Scrub"" I WAS EXCITED! I SMELLS AMAZING, GENTLE ENOUGH FOR DAILY USE, LEFT MY SKIN FEELING SMOOTH AND REFRESHED! [This review was collected as part of a promotion.]"
"Though it feels like straight silicone, it is smooth going on with mild grit. It sinks into the skin within about 10 minutes leaving the exfoliant behind. I didn't notice a big change in my skin or anything and I'd prefer it to be more scrubby [This review was collected as part of a promotion.]"
I loved the Garnier SkinActiveGlow Boost 2-in-1 Facial Mask + Scrub that I recieved for free by PINCHME. It has a citrus scent and I loved it. It's a time saver by being both a mask and a scrub so I could get a good facial cleanse in the morning. The scrub has just enough grit to exfoliate but not too much to where it leaves your face raw. It also did not dry my skin out. I call this a win. [This review was collected as part of a promotion.]
"Garnier SkinActive's Glow Boost 2-in-1 Facial Mask + Scrub is gentle enough that it doesn't irritate my skin, but it still gets the job done and leaves my face feeling so soft and smooth! It smells great, and I like that it doesn't take a long time to use. I received a free sample from PINCHme. [This review was collected as part of a promotion.]"
Omg I love this product. My face is a little texture and this stuff is awesome to smooth it out. The smell is so good and pairs great the the glow boost moisturizer by Garnier as well. My face is smooth all day. I love this stuff. [This review was collected as part of a promotion.]
"Glow Boost 2-in-1 Facial Mask + Scrub from Garnier SkinActive is a great scrub for all types of skin. The scrub is can be gentle if you use a grape size amount or you can use a smaller amount for a better scrub experience. I used it mostly as a daily scrub instead of a mask, but I like this product both ways. the scent is light and fruity and I truly enjoyed using this product. [This review was collected as part of a promotion.]"
"I received Garnier SkinActive Glow Boost 2-in-1 Facial Mask + Scrub as a sample. I loved the fruity Apricot scent as soon as I opened the jar. It's great that this product can be used as a scrub or as a mask. I used it as a scrub and felt that my skin looked and felt smooth, fresh and less more radiant than before. I recommend using this if you need to add a naturally-derived exfoliant to your skincare routine. [This review was collected as part of a promotion.]"
I received the Garnier SkinActive Glow Boost 2-in-1 Facial Mask + Scrub free from Pinchme in exchange for my honest opinion. This product was too harsh for my face. The smell wasn't my cup of tea. It does however make a good foot scrub. [This review was collected as part of a promotion.]
I received Garnier Skin Active Glow Boost 2-in-1 Facial Mask & Scrub as a trial from PINCHme and when I got it I couldn't have been more ecstatic! It was the actually product size and not just a small sample so I could really use it for a few days to see how it truly works and I am happy to say it is amazing! It smells great and feels great! The only thing I do wish is that it was a squeeze or pump for easier application but otherwise it is truly a great product! [This review was collected as part of a promotion.]
When I used the Garnier SkinActive Glow Boost 2-in-1 Facial Mask + Scrub as a mask it felt a little cooling and refreshing. When I used it as a scrub after I masked with it I feel that it was a pretty good scrub. The only thing wrong ith it was that I didn't find that it made my skin glow but it did feel good. [This review was collected as part of a promotion.]
The Garnier Skin Active Glow Boost 2-in-1 Facial Mask + Scrub is amazing. I used it as both a face mask and a scrub and I was not disappointed. It was gentle while also removing the dead skin cells and left my face feeling refreshed. I will say that the citrus did leave a little tingly feeling and it may burn/sting if lotion is applied immediately after. So I would recommend waiting a couple of hours to allow pores to fully close. [This review was collected as part of a promotion.]
I received the Garnier SkinActive Glow Boost 2-in-1 Facial Mask + Scrub for free in exchange for my review. I must say I love that you can use this product as either a mask or scrub depending on how much time you have. I love how soft and smooth it made my skin feel. I would definitely recommend this product to anyone. [This review was collected as part of a promotion.]
"I tried the Garnier SkinAcrive Glow Boost 2-in-1 Facial Mask and Scrub for free through PinchMe. This is my first scrub for Garnier and I must say that i really like it! The scrub feels so fine in terms of granules, yet thick in terms of texture of product. It's easy to use and store right in the shower. I think the scent smells a little lie hairspray or shampoo, but it's nice. [This review was collected as part of a promotion.]"
I am thankful to Pinchme for giving me a full size Garnier SkinActive's Glow Boost 2-in-1 Facial Mask + Scrub to test and provide my opinions! This scrub is different - it almost feels a little waxy but it does not contain wax obviously. It has a thick consistency and has scrub particles that are not harsh on your skin. After using the mask I did see a glow and I love it! It is a good me-time product :) [This review was collected as part of a promotion.]
Garnier SkinActive's Glow Boost 2-in-1 Facial Mask + Scrub was an interesting experience. It started to tingle after having it on for awhile. I didn't appreciate the strong smell. It seemed very unnatural even though it claimed to be naturally scented. I have dry skin and my skin felt dry after using this but it did exfoliate well. I did break out after using it. [This review was collected as part of a promotion.]
Thank you to PINCHme for allowing me to test Garnier SkinActive Glow Boost 2-in-1 Facial Mask + Scrub. This product was just ok for me. It didn't apply well as a facial mask. When applying the product it rolls up in clumps. I have to set my face to make it stay. It does work well as an exfoliate. [This review was collected as part of a promotion.]
I have received a sample of Garnier skincare active product Glow boost 2in 1 facial mask +scrub from pinchme.I absolutely loved the results of using and working great for my dry skin. Leaves a fresh skin after wash and smells good [This review was collected as part of a promotion.]
"I received my free sample of garnier skinactive glow boost 2-in-1 facial mask and scrub and immediately tried it. It felt so good and my skin was so smooth afterwards, I've been using it regularly and already see that my skin loves it [This review was collected as part of a promotion.]"
"I love the consistency of this mask it's different from everything I've tried before i also love the smell but what I love the most is how smooth my skin is after using it I really recommend it if you want a gentle scrub, [This review was collected as part of a promotion.]"
"i like that Garnier is using vegan and “natural” ingredients, but they still test on animals so that's an automatic 1 star for me. product smells nice, but doesn't exfoliate that well. was not that impressed. [This review was collected as part of a promotion.]"
Garnier SkinActive has created an amazing all in 1 product. I love that this covers multiple steps in my skincare routine. You can also use it as a scrub or a mask if you have a little more time. The apricot smell is amazing! [This review was collected as part of a promotion.]
"I received the Garnier SkinActive Glow Boost 2-in-1 Facial Mask & Scrub from Pinchme in exchange for my honest review. I used it as a facial mask and loved it. My skin smelled so good and was very smooth after. It's very easy to use and the consistency is great, it stays on your face so you don't have to stand over the sink while it does its thing. [This review was collected as part of a promotion.]"
"I received a full sized sample of Garnier SkinActive glow boost 2-in-1 facial mask and scrub from pinchme. This mask is great. It smells good, it's a little coarse, but not abrasive, and leaves your skin feeling so great. I love that you can use it as a mask or as a cleanser of you don't have the time to do a mask. [This review was collected as part of a promotion.]"
"I was skeptical about trying the 2 in 1 facial mask plus scrub because my skin is very sensitive, yes it's made for sensitive skin my skin breaks out from everything. I used it every morning as a scrub every morning after I used the scrub my skin felt amazing it's refreshed, I feel more awake, my skin is glowing i love it [This review was collected as part of a promotion.]"
I received the Garnier SkinActive Glow Boost 2-in-1 Facial Mask + Scrub as a sample from PinchMe. I really liked the fragrance of the product and found the consistency to be great to cover my whole face - a little goes a long way! I preferred to use as a mask rather than scrub as I wish there was more pumice to exfoliate. Left my skin soft and 'glowing'. I would recommend and will continue to use this product! [This review was collected as part of a promotion.]
I love the 2 in 1 it saves so much time and money with this product you get the scrub then the mask and your face feels so soft and clean feeling and it looks so much brighter then before. I recommend his product for anyone that would love to save time with a 2 in 1 mask and scrub cant go wrong and it smells so good not strong or overwhelming. [This review was collected as part of a promotion.]
I received the Garnier SkinAvtive Glow Boost 2 in 1 Faciak Mask + Scrub from pinch me. I didn't like it at all. It was an awful texture and hard to get off. It left my skin feeling dry as well. Not impressed at all. Don't even want to finish al the product. [This review was collected as part of a promotion.]
"I tried the Garnier SkinActive Glow Boost 2-in-1 Facial Mask and Scrub made with apricot seed thanks to Pinchme. Overall, I really like that it is made with natural ingredients and it smells amazing as well. It also works really well for exfoliating and is really hydrating for the skin. [This review was collected as part of a promotion.]"
I love this scrub. I have recently started using a scrub daily and this is gentle enough for daily use in my opinion. The smell is amazing and it's very gentle. It leaves my skin feeling super smooth. [This review was collected as part of a promotion.]
I I absolutely love this product. I was able to try Garnier SkinActive Glow Boost 2-1 Facial Mask +Scrub for free from Pinch me. I tried it as a scrub and as a mask. I like the scrub better. My face feels so refreshed afterwards. Not to mention I love the smell of it too. [This review was collected as part of a promotion.]
"I have been using this Garnier SkinActive Glow Boost 2-in-1 Facial Mask + Scrub every night for two weeks on my trouble spots, nose, chin and cheeks. And the results are amazing. My pores appear smaller because they are less full if gunk. And my skin is softer. It's very gentle and not harsh. Smells amazing. [This review was collected as part of a promotion.]"
"This has a rather strong smell but I didn't mind it. It looks like it's the same texture as a salt scrub, but it's not at all! It's like a squishy, jelly-like consistency. I put it on like a mask and then after letting it sit for a while I scrubbed my face with it before rinsing. It is a nice treat that helps exfoliate and makes your skin feel nice and clean. [This review was collected as part of a promotion.]"
I recieved a full size sample of Garnier SkinActive Glow Boost 2-in-1 Facial Mask + Scrub. I enjoyed using this product. Ot is first used as a mask and then a scrub when the masking time is up. The instructions were easy to follow and my skin felt good after. Even a couple days later my skin felt extra soft. Given the current cold winter weather that is high praise. I will be purchasing this product in the future. [This review was collected as part of a promotion.]
"I love this mask because it is very thick with a gel like consistency. It's awesome to use in the shower because it will stay put on your face while you shower. The smell is nice, but could be a bit more fruity. [This review was collected as part of a promotion.]"
The packaging on garnier skinactive glow boost 2-in-1 facial mask + scrub is what ultimately made me want to try this. Then when I opened the bottle the smell was AMAZING. I really enjoy using this product because I have very sensitive skin and it didn't hurt my skin or leave any filmy residue. I will be purchasing another jar when this one is out. [This review was collected as part of a promotion.]
"This is more of a lighter scrub mask that provides a nice glow after rinsing. It has scrubbing beads but it isn't overly abrasive. It has a gritty, oily texture but did not leave my face oily. I use it sparingly as to not overly exfoliate my sensitive skin and it works very well at clearing dull skin and providing a fresh glow afterwards. I do recommend this product. [This review was collected as part of a promotion.]"
Garnier SkinActive's Glow Boost 2-in-1 Facial Mask & Scrub is officially one of my new fave products! I have really sensitive skin so anything that is harsh or scrublike but this scrub was great and was very gentle on my skin! It helped clear my pores and clean up any problem areas I have while giving me a nice glow! 10/10 would recommend! [This review was collected as part of a promotion.]
The Garnier skinactive flow boost 2-in-1 facial mask+scrub is amazing. I love that you can use it as a mask or if your in a bit of a hurry just use it as a scrub. It left my face soft and smooth. Smells great too. [This review was collected as part of a promotion.]
"Garnier SkinActive ""Glow Boost 2-in-1 Facial Mask + Scrub"" was sent to me to review. I have to say I was shocked that I was sent a full-size product! Amazing! The product itself is extremely effective in getting you that perfect glow you normally would achieve using a much more expensive product. It's a great addition to the Garnier brand and I would 100% recommend this product to a friend or family member. [This review was collected as part of a promotion.]"
I rcvd a sample of garnier skin active glow boost 2 in 1 facial mask scrub from pinchme. I really liked this product. Super easy and quick with great results. Love that you can use as a mask or daily scrub. Really gentle exfoliation without any harshness. Will definitely purchase more and make part of my routine!! [This review was collected as part of a promotion.]
I used this in the shower for a week straight before I left a review. I noticed that my skin was left feeling soft but I still had dry skin left on my face. I used moisturizer every single day. I use the Peter Thomas Roth Pumpkin enzyme scrub and after on use of that it takes all my dead skin off rather than this I used it every day and was still left with dead skin. I will continue to use it until it's gone but I won't be purchasing after the product is finished. [This review was collected as part of a promotion.]
"I recently tried Garnier SkinActive Glow Boost 2-in-1 Facial Mask + Scrub"". I enjoyed that it can be used as both a mask and a scrub. I tried both ways and the issues that I came across was that it did not feel that it rinsed away completely. I rinsed off in the shower and my face still felt rubbery after washing it away. I enjoy the smell and it did seem to work well after drying. [This review was collected as part of a promotion.]"
"I've been using the Garnier skin active glow boost 2-in-1 facial mask and scrub... and overall the product is good. The scent is very nice, the product is very gritty so it makes for an excellent scrub. I just have sensitive skin so i notice this product dries my skin out a little bit which is my only complaint [This review was collected as part of a promotion.]"
"I'm a huge fan of Garnier products. I really love Garnier SkinActive Glow Boost 2-in-1 Facial Mask + Scrub. I like that it has dual purposes. It smells great, cleansed my face, and left my skin soft and smooth. I'll purchase this again after I run out. Thanks PinchMe. [This review was collected as part of a promotion.]"
"Received “Garnier SkinActive Glow Boost 2-in-1 Facial Mask and Scrub” as a trial through Pinchme.com. I have been a Garnier fan for 15+ years and this product does not disappoint. Great smell and texture, leaves skin feeling smooth, clean and pampered. [This review was collected as part of a promotion.]"
I received Garnier skinactive glow boost 2 in 1 facial mask and scrub from pinchme. This product was great. I loved the fact that it was a mask and a scrub. It left my face feeling refreshed and looking vibrant. I would definitely recommend this product to everyone! [This review was collected as part of a promotion.]
I really enjoyed using this Mask+Scrub. I liked how I had the option to use it as a mask or just a scrub. If I used it has a mask I applied it to my face at the same time I put the conditioner in my hair and washed everything out/off at the same time. It left my face feeling clean and moisturized. [This review was collected as part of a promotion.]
I received Garnier SkinActive Glow Boost 2-in-1 Facial Mask + Scrub in the Apricot scent as a free sample from PinchMe. I was highly impressed with this scrub. It has an amazing apricot scent and little scrubbing beads that feel amazing when you rub your face. I have used it as both a scrub and a mask. I definitely feel like my skin glows and it feels smooth after use. Highly recommend! [This review was collected as part of a promotion.]
GARNIER SKINACTIVE GLOW BOOST 2-IN-1 FACIAL MASK + SCRUB works very well on my combination skin. I tend to be oily in summer and dry in winter and it hydrated my skin rather than drying it out further. [This review was collected as part of a promotion.]
"I received a free sample of Garnier SkinActive Glow Boost 2-in-1 Facial Mask + Scrub and this is a wonderful product! I used it as a mask the first day and right after washing off, my face was left feeling soft and clean. The next day I used it as a scrub and it removed excess makeup without turning my face red. I highly recommend this product. [This review was collected as part of a promotion.]"
I received a free sample of Garner SkinActive Glow Boost 2-in-1 Facial Mask + Scrub from PinchMe. This product smells amazing and truest smells like sunshine and mimosas. The product is thick and so easy to apply on your face and neck. I used it first as a scrub that I added to my daily skin care routine the as a mask. It does provide shine and brightness to my skin after a long day. [This review was collected as part of a promotion.]
I have fell in love with Garnier SkinActive 2 in 1 Facial Mask + Scrub. It smells great but more of is it makes your face so soft. You can tell a difference in just a few uses. I even use it on other rough skin areas. I will forever use this. [This review was collected as part of a promotion.]
"I couldn't get enough of the Garnier SkinActive Glow Boost 2-in-1 Facial Mask +Scrub! It smelled amazing!! The texture is light which I didn't expect but its so light and almost fluffy. It made my face feel fresh and bright, and it made my skin softer. It's not super grity and it's very gentle on your skin. I absolutely adore it! [This review was collected as part of a promotion.]"
I just received a free sample of Garnier SkinActive Glow Boost 2-in-1 Facial Mask + Scrub from PINCH me and I love it! It goes on smooth and feels light and airy. It isn't drying like some masks. After it has been on a few minutes you just add a bit of water and it turns to a scrub. The grain size is just right. I have sensitive skin and it was a fine enough grit to scrub but not irritate. I will definitely be purchasing. [This review was collected as part of a promotion.]
I received a free sample from PinchMe of the Garnier SkinActive Glow Boost 2-in-1 Facial Mask + Scrub. I love how this leaves my face feeling fresh and rejuvenated! I love how it exfoliates but is a face mask as well. I have sensitive skin and had no issues with it so that's a winner in my book! I definitely recommend this product to any. [This review was collected as part of a promotion.]
The 1st thing I noticed was how great this product smells. The scrub is a fine texture but does a good job and making the skin soft after use. It does not remove make up at all so face must be cleansed properly before using. [This review was collected as part of a promotion.]
I adore using this in the morning. It really helps wake me up and makes my skin so glow-y. it gets rid of any tiny blackheads I have and leaves my skin feeling soft and supple. The scent is my favorite. Smells like real fruit. [This review was collected as part of a promotion.]
"I received the Garnier SkinActive Glow Boost 2-in-1 Facial Mask + Scrub courtesy from PINCHme and used this mask/scrub product in the morning and night. This is great for people with dry sensitive skin, and I found the scrub particles were not grainy, did not dry out my face nor did it irritate my face. [This review was collected as part of a promotion.]"
This Glow boost 2-in-1 Facial mask + scrub is amazing it made my skin soft and felt hydrated after using and loved that I got the full size to sample it I will purchase this Garnier SkinActive after it's all gone (: [This review was collected as part of a promotion.]
"Garnier SkinActive Glow Boost 2-in-1 Facial Mask + Scrub has a great scent. I love using it in the shower as either a Mask or scrub. After using the mask my face feels clean, is glowing and smooth. I would recommend this to anyone. [This review was collected as part of a promotion.]"
"refreshing and clean is what I say about this Garnier SkinActive Glow Boost 2-in 1 facial mask and scrub. It's 2 things in 1. I couldn't ask for a better product. After 1 use, I can truly see the difference. Man my skin needed this. The smell is amazing and the scrub effect is great. Will continue to use. [This review was collected as part of a promotion.]"
I received a free sample of Garnier SkinActive Glow Boost 2-in-1 Facial Mask + Scrub from PinchMe. I loved it! I used it as a scrub daily and it really makes my skin feel great and it has a glow to it afterwards. I have also used it as a Mask and found that it made my skin look glowing. The scrub has a really nice smell to it and it goes on pretty lightweight. I will purchase this when I run out of the sample. [This review was collected as part of a promotion.]
"Garnier SkinActive Glow Boost 2-in-1 Facial Mask + Scrub is everything I never even knew I needed! I love masks and this was no exception but the exfoliating scrub aspect is an absolute bonus! My skin was super smooth and hydrated all day long, I've never had such great results from any mask! [This review was collected as part of a promotion.]"
"I am writing this review for Garnier SkinActive Glow Boost 2-in-1 Facial Mask + Scrub. I have to say that this product is OK. Garnier has always been a hit or miss for me. This product wasn't all that to me. I feel like the product was heavy on my skin and was a mild exfoliant. Although it smells good, I would recommend it to others even though it didn't work for me. Thank you PinchMe and Garnier for the opportunity to try this product. [This review was collected as part of a promotion.]"
"GARNIER SKINACTIVE GLOW BOOST 2-IN-1 FACIAL MASK + SCRUB uses very gentle exfoliation to clean skin. It looks dry when opened, but touching it has a jelly-like consistency. It applies easily and stays in place until ready to scrub and wash off. I did find this a bit drying, but following with a moisturizer fixes that. It does a nice job of cleaning. I received a free product in exchange for my honest review. [This review was collected as part of a promotion.]"
This Garnier SkinActive Glow Boost 2-in-1 Facial Mask + Scrub is awesome! It made my skin really soft - and I love that you don't have to use an exfoliant separately. Very gentle on my sentisive skin. [This review was collected as part of a promotion.]
I love this Garnier SkinActive Glow Boost 2-n-1 Facial Mask + Scrub. The smell is great. I like the fact that I can use it as a mask first then scrub 5mins later. It leaves my skin smooth to the touch! [This review was collected as part of a promotion.]
"I received a sample of Garnier SkinActive Glow Boost 2-in-1 facial mask and scrub free from PinchMe. I cannot say enough marvelous and wonderful things about this product!!! So easy, so quick and fit into morning routine seamlessly. When I'd turn on shower I would apply the mask while water heater up. Then after the 5 minutes, Id then scrub my face and wash it off and go on with shower. Skin feels softer and healthier. Amazing product! [This review was collected as part of a promotion.]"
"I have been trying out different skin care products because I hadn't had a certain product that I really loved. Garnier SkinActive Glow Boost 2-in-1 Facial Mask + Scrub is amazing. I used it as a mask. It smells so good, and I love the texture of it. It made my face soft, bright, & smelling good. I will definitely be using this regularly. [This review was collected as part of a promotion.]"
This mask is the best! The Garnier SkinActive Glow Boos 2-in-1 Facial Mask + Scrub made me skin look glowy and healthy! I love how I can leave it for 5 minutes as a maks and then I can use it as a scrub!! [This review was collected as part of a promotion.]
"Garnier SkinActive"" and the product ""Glow Boost 2-in-1 Facial Mask + Scrub is really good as i felt my skin very smooth after using it as a mask as well as a scrub. The smell is also really refreshing. [This review was collected as part of a promotion.]"
