"I liked the convenience of it being 2 in 1! A scrub for quick washes or a mask if you wanna pamper yourself! My only dislike was texture, I like a more abrasive scrub! [This review was collected as part of a promotion.]"
Garnier skin active glow boost 2 in 1 facial mask and scrub good for a quick mask and leaves the skin looking nice [This review was collected as part of a promotion.]
The Ganier SkinActive Glow Boost 2-in-1 Facial Mask + Scrub is a nice mask/ scrub combination. After each use my skin feels nice and soft. [This review was collected as part of a promotion.]
I have been using it since one month and really liked the exfoliating scrubing of this product .its mild on my skin [This review was collected as part of a promotion.]
Garnier SkinActive Glow Boost 2-in-1 Facial Mask + Scrub softens your face and makes it feel so smooth. It also has a nice smell to it. Really great product would definitely get it again! [This review was collected as part of a promotion.]
I really like Garnier SkinActive Glow Boost 2-in-1 Facial Mask + Scrub! It felt great on my skin and I noticed an improvement after one use. [This review was collected as part of a promotion.]
I love this Garnier skin active glow boost 2 n 1 facial mask plus scrub! I have used it as both the mask and scrub and it's great!! [This review was collected as part of a promotion.]
I love the Glow Boost 2-in-1 Facial Mask and Scrub by Garnier SkinActive I received to try out for free. Love the scent and how my skin feels every time I use it. [This review was collected as part of a promotion.]
"I tried the Garbier SkinActive as a facial scrub and I really liked it. It did not dry out my skin, but helped exfoliate it. The Glow Boost 2-in-1 Facial Mask + Scrub is an awesome facial product. [This review was collected as part of a promotion.]"
The Garnier SkinActive Glow Boost 2-in-1 Facial Mask + Scrub left my skin feeling extremely soft. My skin also cleared up [This review was collected as part of a promotion.]
Garnier SkinActive glow boost 2-in-1 facial mask and scrub is a great product. I have sensitive skin and it was pretty gentle. Overall happy with my experience. [This review was collected as part of a promotion.]
Garnier skin active glow boost 2 in 1 facial mask and scrub is amazing! It left my face feeling smooth and clean and my face looked better! I recommend to everyone! [This review was collected as part of a promotion.]
I love the garnier skin active glow boost facial mask and scrub. It smelled so good and left my skin so clean and soft. Its so easy to use and i enjoyed it. Will definitely buy in the future! [This review was collected as part of a promotion.]
I got to try the Garnier SkinActive Glow Boost 2-in-1 Facial Mask + Scrub and it made my face feel wonderful it was soft and gave it just a but of glow. [This review was collected as part of a promotion.]
Garnish SkinActive Glow Boost 2-in-1 facial mask and scrub made my skin feel super soft after using! The texture of the product felt really thick and I wasn't a huge fan of the fragrance [This review was collected as part of a promotion.]
This was great! Garnier skinactive glow boost 2-in-1 facial mask and scrub works awesome! My skin feels wonderful and soft after [This review was collected as part of a promotion.]
The Garnier SkinActive Glow Boos 2-in-1 Facial Mask + Scrub is LIFE hands down amazing i have sensitive skin and its like a godsent to my skin [This review was collected as part of a promotion.]
Garnier SkinActiv Glow Boost 2-in-1 Facial Mask + Scrub left my skin feeling so smooth! It smelled great and washed off easily. I will be using this often. [This review was collected as part of a promotion.]
This is a great product! It takes only a small amount and it leaves my skin feeling so soft and smooth. [This review was collected as part of a promotion.]
My daughter and I both used this mask and scrub. We love how it makes our face feel so clean and soft! [This review was collected as part of a promotion.]
Garnier Skin Active Glow boost 2-1 facial mask + scrub is amazing it smells delicious and left my skin feeling radiant and soft! i highly recommend [This review was collected as part of a promotion.]
Glue Boost 2-in-1 Facial Mask + Scrub is absolutely perfect for cleansing your face. It makes your face smooth and soft [This review was collected as part of a promotion.]
"So, I often times break out. Trying this didn't change my break outs but it hasn't given my any more than I normally get so I'd say that's good. Maybe after more uses I'll see a full on change. [This review was collected as part of a promotion.]"
"Oh my goodness! i was not expecting much of this mask, but wow! love the smell and feel! Left my skin super soft and clean! [This review was collected as part of a promotion.]"
I have been using as a scrub and it's amazing! It leaves my skin feeling fresh and smooth! It has a great smell too! [This review was collected as part of a promotion.]
I like the glow boost 2-in-1 facial Mask & scrub. I like it more as a scrub then a mask. It doesn't have enough coverage to be a mask! [This review was collected as part of a promotion.]
I feel so soft to the touch but yet you can feel the scrubbing on your face. I love way it smells and makes my face feel clean. [This review was collected as part of a promotion.]
"I receive this free sample from Pinchme for Garner SkinActive Glow boost 2-in-1 Facial mask, easy to use and keep my face glowing everyday [This review was collected as part of a promotion.]"
The Garnier SkinActive Glow Boost 2 in 1 Facial Mask and Scrub is a must have it leaves your skin so smooth and soothing to the touch and it smells extremely delicious [This review was collected as part of a promotion.]
I loved my Garnier SkinActive Glow Boost 2-in-1 Facial Mask! Left my skin looking and feeling great! [This review was collected as part of a promotion.]
Love the way this facial mask Plus scrub by Gardiner get the job done on my face very refreshing feeling and soft [This review was collected as part of a promotion.]
I tried the Garnier SkinActive Glow Boost 2-in-1 Facial Mask + Scrub and I love it. It made my skin feel fresh and clean. It also made my skin look better than before. [This review was collected as part of a promotion.]
I have extremely sensitive skin and this 2 in 1 was absolutely amazing. My face has cleared up and I haven't had any reactions [This review was collected as part of a promotion.]
"So I tried this product both ways that it recommends. Simple scrub or mask. With the scrub is seems too think to adequately scrub, and for a mask it seems to heavy and wet to harden. [This review was collected as part of a promotion.]"
I received a sample from pinchme of the skin mask and scrub and this product is awesome. Smells great and it actually works. [This review was collected as part of a promotion.]
I really like Garnier SkinActive Glow Boost. 2-in-1 Facial Mask + Scrub. It makes my skin look and feel great. It cleans my skin really well. [This review was collected as part of a promotion.]
PinchMe sent me a jar of Garnier SkinActive Glow Boost 2-in-1 Facial Mask + Scrub for free for my honest review of the product after trying it out.. 10/10 would recommend. [This review was collected as part of a promotion.]
"Absolutely love my sample of the Glow Boost 2-in-1 Facial Mask + Scrub. I've never used the Garnier SkinActive product until now, but I'm glad I got to try it. I use it daily now. [This review was collected as part of a promotion.]"
"This mask scrub was nice. Like that is was more natural. No harsh chemicals, I like that. Made my skin feel refreshed and soft. [This review was collected as part of a promotion.]"
Extremely easy to apply and washes off completely leaving my skin feeling clean and shinning bright like a diamond. [This review was collected as part of a promotion.]
I really liked the Garnier SkinActive Glow Boost 2 in 1 Facial mask and scrub. It makes my face feel so smooth and felt like it really cleaned my pores out. [This review was collected as part of a promotion.]
Garnier SkinActive Glow Boost 2-in-1 Facial Mask + Scrub is an amazing product! love the fresh scent and the way it feels on my face! Love the way my face looks and feels afterwards! [This review was collected as part of a promotion.]
"I absolutely love this product! After using it, my face feels clean and refreshed! The Garnier SkinActive Glow Boost 2-in-1 Facial Mask + Scrub will be a new addition to our shower shelf! [This review was collected as part of a promotion.]"
"this is amazing my skin feels great, and i love that it is a mask and scrub in one, based on how it is applied. it smells amazing. [This review was collected as part of a promotion.]"
Garnier SkinActive Glow Boost 2-in-1 Facial Mask + Scrub is an amazing product! It has a great scent and makes your face feel clean! I already went out and bought another jar! [This review was collected as part of a promotion.]
left my skin looking and feeling refreshed. would highly recommend garnier skin active glow boost 2 in 1 facial mask and scrub. [This review was collected as part of a promotion.]
I have been using the Glow Boost 2-n-1 Facial Mask + Scrub as a mask in the shower. I let it sit for five mins and I scrub away and rinse. It leaves my pores and skin nice and clean. [This review was collected as part of a promotion.]
I love this product. It leaves my skin soft and glowing and helps improve blemishes that I have on my skin. [This review was collected as part of a promotion.]
I received a Garnier SkinActive Glow Boost 2-in-1 Facial Mask + Scrub sample from PinchMe and fell in love with this product! My skin is smooth and moist now! [This review was collected as part of a promotion.]
The Garnier SkinActive Glow Boost 2 in 1 Facial Mask + Scrub works wonders! I love how my face looks and feels after using it. I use it 2x a week as recommended and I look forward to using it. [This review was collected as part of a promotion.]
my face loves the glow boost 2 in 1 facial mask and scrub from garnier skin active! ive using it after the gym and at home and so far my skin loves it [This review was collected as part of a promotion.]
Garniers SkinActive mask/scrub is something out of this world. This has changed the game forever. So soft and dry yet wet at the same time. Awesome [This review was collected as part of a promotion.]
I definitely like the glow boost 2 in one facial mask. I've used it for a week now and my skin feels much smoother and overall looks better. I like the smell and the texture of this. [This review was collected as part of a promotion.]
I love the garnier skin actibe glow boost 2 in 1 mask and scrub. It leaves my face smooth and clean. [This review was collected as part of a promotion.]
The Garnier SkinActive Glow Boost 2-in-1 Facial Mask + Scrub smells absolutely amazing and makes my face feel extremely soft and smooth. [This review was collected as part of a promotion.]
This Glow Boost 2-in-1 Facial Mask + Scrub by Garnier SkinActive is amazing! I notices brighter/smoother skin after the first use. I also think the smell is really nice! [This review was collected as part of a promotion.]
Glow Boost 2-in-1 Facial Mask + Scrub by Garnier SkinActive smelled and worked great!
Note: received this product for free from PINCHme. [This review was collected as part of a promotion.]
Garnier SkinActive Glow Boost 2-in-1 Facial Mask + Scrub was an awesome product.I love that its 2 in 1.It worked great! [This review was collected as part of a promotion.]
"I love all Garnier products, specially the 2 in 1 facial mask and scrub. I like using it more as a scrub, it cleans your face throughly and you notice a huge difference right away. [This review was collected as part of a promotion.]"
I love this glow boost 2-in-1 facial mask + scrub because it gives me glowing skin and I like the texture because it's like velvet satin. [This review was collected as part of a promotion.]
I really like the 2 in 1 facial mask scrub. It is eassy to use. Its eassy to follow the instructions. The mask has a great smell. This product removes dead cells. My skin feels soft and fresh. [This review was collected as part of a promotion.]
I got to try out for free the Glow Boost 2 in 1 facial mask scrub from pinchme.com this product is great it cleans and hydrates my face. It actually left it glowing. Great product. [This review was collected as part of a promotion.]
"""Garnier SkinActive"" ""Glow Boost 2-in-1 Facial Mask + Scrub"" I TRIED IT AS A MASK AND A SCRUB AND IT WAS AWESOME THAT I GOT A FULL SIZE SAMPLE [This review was collected as part of a promotion.]"
"I got a full-size sample in the mail and I was so excited to try it, it smells amazing and it works amazingly well I would definitely purchase after I use this jar thanks pinchme! [This review was collected as part of a promotion.]"
"Love the soft grainy texture, not too abrasive, seems to moisturize as well as exfoliate. I use this almost daily and have noticed a positive difference in my skin! [This review was collected as part of a promotion.]"
"I love the ""Garnier SkinActive"" the product ""Glow Boost 2-in-1 Facial Mask + Scrub"". Excellent quality and product Im in love with this recommended 100% [This review was collected as part of a promotion.]"
Does a great job exfoliating your skin and leaving it feeling soft and clean. Not too harsh and has a nice scent. [This review was collected as part of a promotion.]
Thanks Garnier for my full Size Garnier SkinActice Glow boost facial mask love it so great for my face. [This review was collected as part of a promotion.]
Garnier SkinActive Glow Boost 2-in-1 Facial Mask + Scrub is a gentle exfoliating mask that smelled great and left my skin feeling soft and smooth after using! [This review was collected as part of a promotion.]
"I absolutely love Garnisr Skinactive Glow boost 2 in 1 facial mask and scrub!! I use it both ways, the mask and scrub. I love the feel of my skin afterwards! The scent is amazing and not too heavy. [This review was collected as part of a promotion.]"
Garnier SkinActive glow boost 2-in1 facial mask + scrub is awesome. Leaves my skin glowing and nice and soft. I will definitely buy it again. [This review was collected as part of a promotion.]
"I really liked this garnier skin active product. The glow boost 2 in 1 mask and scrub was really great! Worked well, smelled great! [This review was collected as part of a promotion.]"
The garnier skinactive Glow Boost 2-in-1 Facial Mask + Scrub is a good product. Feels good on skin. [This review was collected as part of a promotion.]
The garnier skinactive glow boost 2-in-1 facial mask +scrub made my skin really soft and helped with my dry face. It also cleared up some of my ance spots I had on my face. [This review was collected as part of a promotion.]
Me and my daughter Tryed Glow boost 2-in-1 facial mask+scrub. We loved it it made are skin so soft and took off the dead skin. [This review was collected as part of a promotion.]
I got my free sample of garner glow boat 2 in 1 facial mask scrub from pinch me and I love it it is better than my Mary Kay products highly recomend will diffently be buying [This review was collected as part of a promotion.]
"Garnier skinActive glow boost 2 in 1 is a good face product, I like the way it's smell, and I like how this product live my face feeling clean . [This review was collected as part of a promotion.]"
"The garnier skinactive glow boost 2-in-1 facial mask + scrub smells so good i could eat it, it made my face afterwards super smooth and felt amazing. [This review was collected as part of a promotion.]"
I love the scent.. feels very soft on skin and not like sand paper as some do.. instant feeling of cleanliness.. [This review was collected as part of a promotion.]
"The Garnier SkinActive Glow Boost 2-in-1 Facial Mask + Scrub left my skin feeling refreshed, clean and smooth. [This review was collected as part of a promotion.]"
"Garnier SkinActive Glow Boost 2-in-1 Facial Mask + Scrub is amazing. Not only does it leave my skin feeling refreshed and clean, it also smells great! I highly recommend! [This review was collected as part of a promotion.]"
I have rosacea so facial scrubs are often too harsh on my red skin but this scrub/mask combo was very gentle. I have used it around 4 times and it has made my skin super soft. [This review was collected as part of a promotion.]
"This Glow boost 2-in-1 facial mask + scrub is simply amazing! I love how it makes my skin feel, soft and smooth. It's also smells soooo good! Will buy it for sure in the future [This review was collected as part of a promotion.]"
I got this as a sample from PINCHme and I could not have been more excited! It smells great and really left my skin smooth! I will be buying this in the future! [This review was collected as part of a promotion.]
This's my first time trying the product. I honestly I love how my skin looked and feel. It gave me a natural glow. [This review was collected as part of a promotion.]
There wasn't anything that set this apart from any of my other mouisturizers-in a good way. It did however leave a glowy effect shortly after application. Not something I'd purchase. [This review was collected as part of a promotion.]
I loved using this Garnier SkinActive Glow Boost Illuminating Moisturizer! It leaves my skin feeling soft and with a subtle but noticeable glow! [This review was collected as part of a promotion.]
The Garnier SkinActive Glow Boost Illuminating Moisturizer wasn't for me. I didn't like the way it made my skin feel and it made my face extremely oily. [This review was collected as part of a promotion.]
I loved the Garnier SkinActive Glow Boost Illuminating Moisturizer! I love the shimmer it gives and how moisturizing it is! I'm not the biggest fan of the scent but I love everything else about it! [This review was collected as part of a promotion.]
"I have been using Garnier Skin Active Glow Boost Illuminating Moisturizer for about a month. I am in love with this product. It leaves my skin soft, moisturized, and gives it a wonderful glow. [This review was collected as part of a promotion.]"
I love Garnier SkinActivee Glow Boost Illuminating Moisturizer. It made my skin look so good especially in the cold Chicago winter [This review was collected as part of a promotion.]
Garnier SkinActive Glow Boost Illuminating Moisturizer gave my skin a nice glow. My skin felt moisturized for the whole day. I didn't need to use a lot for my face. [This review was collected as part of a promotion.]
After using the Garnier SkinActive Glow Boost Illuminating Moisturizer my skin looked hydrated and more even without having to use any makeup. Nice spf in it and didn't feel overly greasy. [This review was collected as part of a promotion.]
The garnier skinactive glow boost illuminating moisturizer worked pretty well. It smells good and made my skin feel nice. [This review was collected as part of a promotion.]
This moisturizer is amazing. If feels so smooth on your skin and gives you a great glow. It does not feel heavy or sticky. This has become my new go to moisturizer. [This review was collected as part of a promotion.]
I really like Garner SkinActice Glow Boost Illuminating Moisturizer! I have slow stopped wearing foundation because of it! [This review was collected as part of a promotion.]
This glow boost illuminating moisturizer is the best I have ever used. My skin looked and felt great [This review was collected as part of a promotion.]
I havent really been using it soo much but wen i do it leaves my skin so soft and so shining i love it ! [This review was collected as part of a promotion.]
It has a nice light citrus scent and feels good on my skin . It works well with my combination skin. It is perfect for every day use [This review was collected as part of a promotion.]
I got a sample of garnier skinactive and it was a great moisturizer. We used in in our daughters thick nappy hair and he was helpful [This review was collected as part of a promotion.]
I have the garnier illuminating moisturizer to my husband. He has very dry skin. It hydrated him and gave him a youthful glow. [This review was collected as part of a promotion.]
"Nice silky texture. Perfectly moisturizing with a subtle glow that's absolutely wonderful in the winter to combat dull, dry skin. Wish it contained SPF though [This review was collected as part of a promotion.]"
"This product gives you a glowy dewy look, and I feel that it is the perfect winter moisturizer because it gives you a little bit of shimmer and color while doubling as a moisturizer [This review was collected as part of a promotion.]"
I personally wouldn't purchase glow boost. While it made my skin feel soft initially that softness didn't last. I did not see a noticeable difference in my skin appearance. [This review was collected as part of a promotion.]
I tried garnier skinactive glow boost illuminating moisturizer and it was ok. Worked like most mosturizers but it wasn't my favoritr. [This review was collected as part of a promotion.]
"It smells nice and applies to my face evenly, but i like it more for use on my arms and hands rather than for its intended use on my face [This review was collected as part of a promotion.]"
I was a little hesitant to try this product because i have pretty sensitive skin but this product was amazing and i will definitely be purchasing another one! [This review was collected as part of a promotion.]
It made my skin feel so smooth and glow radiant. People would compliment how radiant my skin would look everywhere [This review was collected as part of a promotion.]
I got this garnier skin active glow boost illuminating product from pinch me to review . It doess leave skin glowy but not moisturizing at all & has a tint [This review was collected as part of a promotion.]
"I love Garner SkinActive, but they did even better than normal with this Glow Boost Illuminating Moisturizer!! I'm obsessed with how glowy and healthy it makes my skin look! [This review was collected as part of a promotion.]"
"Garnier SkinActive Glow Boost Illuminating Moisturizer is amazing!! Smells great, it's creamy and did make my skin glow! [This review was collected as part of a promotion.]"
Garnier skinactive glow boost illuminating moisturizer is amazing. So smooth & so soft! & it adds the perfect glow to ANY skintone! [This review was collected as part of a promotion.]
The Glow Boost Illuminating Moisturizer is so good for your skin. Garnier SkinActive is by far one of my favorite brands. [This review was collected as part of a promotion.]
I love it. It's not greasy and it makes my skin really glow and it smells amazing. A little goes a long way. [This review was collected as part of a promotion.]
The glow boost Illuminating Moisturizer is really great under the makeup! I think it gives such a nice glow to the skin. [This review was collected as part of a promotion.]
I tried a free sample of Garnier Skin's ActiveGlow Boost Illuminating Moisturizer. It was fine but nothing to rave about. I wish it had more natural ingredients and less chemicals. [This review was collected as part of a promotion.]
"Garnier skinactive's, Glow Boost Illuminating Moisturizer is probably one of the best products I've ever used. I will be purchasing this in the future [This review was collected as part of a promotion.]"
Garnier SkinActive Glow Boost Illuminating Moisturizer is a nice moisturizer it definitely brightens the skin [This review was collected as part of a promotion.]
This Garnier SkinActive Glow Boost Illuminating Moisturizer is so amazing! It has a nice smell and it feels great on the skin. It leaves your skin with a dewy glow and it looks good under makeup. [This review was collected as part of a promotion.]
"Fantastic moisturizer. I would recommend. Like the way it makes my skin feel, has a pleasant smell as well. Very silky. [This review was collected as part of a promotion.]"
I recieved a free sample from pinch me I really liked the way it made my skin look and feel! Really is a great product! [This review was collected as part of a promotion.]
I received the glow boost illuminating moisturizer for free from Pinchme and its fabulous . its very moisturizing and not oily at all. [This review was collected as part of a promotion.]
GARNIER SKINACTIVE GLOW BOOST ILLUMINATING MOISTURIZER smells great and really moisturized my face. [This review was collected as part of a promotion.]
Big fan of the Garnier SkinActive Glow boost illuminating moisturizer. It has a pleasant smell and very subtle shimmer [This review was collected as part of a promotion.]
I loved the Garnier illuminating moisturizer it had my skin glowing with makeup and without the makeup and it left my skin looking just so smooth and glowing it's an amazing product. [This review was collected as part of a promotion.]
This product is so silky smooth and light. The added light tint to it is amazing. It is a great moisturizer!! I would Highly recommend! [This review was collected as part of a promotion.]
"I recieved Garnier SkinActive Glow Boost Illuminating Moisturizer as a sample from Pinchme. It smells good, light-weight moisturizer, non-greasy and left my skin with a glow. [This review was collected as part of a promotion.]"
This product was great. Most items irritate my skin and this overall was the miracle worker! Garnier SkinActive Glow Boost Illuminating Moisturizer is the best product [This review was collected as part of a promotion.]
I tried the Garnier SkinActive Glow Boost Illuminating Moisturizer through a full size sample I received from PinchMe. I enjoyed to moisturizer. It left my skin glowing and healthy. [This review was collected as part of a promotion.]
