"I had actually never heard of Garnier SkinActive Glow Boost Illuminating Moisturizer until I received a free sample of it from PINCHme. It goes on nice and leaves your skin feeling smooth with a very subtle glow. It also has a nice scent! I have pretty sensitive skin but had no issues with this product, I really like it! [This review was collected as part of a promotion.]"
I got sent this Garnier SkinActive Glow Boost Illuminating Moisturizer from PinchMe and i have mixed feelings about the product. It applies nicely and does make you glow but since i have oily skin it just looks like i greasy lol I'll continue to try the product though [This review was collected as part of a promotion.]
The Garnier SkinActive Glow Boost Illuminating Moisturizer is an excellent moisturizer. It leaves the skin feeling great and is not too heavy. It also has a subtle illuminating property without being overwhelming or looking too shiny. [This review was collected as part of a promotion.]
Garnier Skinactive Glow Boost Illuminating Moisturizer gives my face a natural sun kissed glow from all angles. It smells amazing. It's very gentle on my skin which is a good thing. I received Garnier Skinactive Glow Boost Illuminating Moisturizer free from PINCHme to test and review. All opinions are my own. [This review was collected as part of a promotion.]
"This glow boost illuminating moisturizer is awesome!! I use it before applying makeup, and it makes my skin look beautifully dewy and healthy. I love it and highly recommend under makeup or by itself [This review was collected as part of a promotion.]"
"This moisturizer is fairly decent, and the ""illuminating"" micro shimmer makes for a pretty complexion, but the moisturizer itself, the formula, is SUPER thick. I had to use a lot of product to cover my face, because it goes on like paste. It absorbs in nicely, and doesn't sit heavily on the skin, but the actual application was a bit of a pain. [This review was collected as part of a promotion.]"
"The Garnier SkinActive Glow Boost Illuminating Moisturizer was absolutely amazing for my face. I have a combination of dry and oily skin, but this cream moisturized my dry skin without making my skin oily. I highly recommend this product! [This review was collected as part of a promotion.]"
"At first when I squeezed this product out of the tube for the first time, I was a little taken back at the color as its not very appealing, but the smell is very light and good. I also really love applying this prior to my foundation and makeup. I have noticed it works as a primer in a way. Overall, I like this product! [This review was collected as part of a promotion.]"
Garnier SkinActive Glow Boost Illuminating Moisturizer is seriously amazing! Beautiful formula. I have used it everyday since it arrived and it will become my new daily moisturiser. Feels great. Smells great. Very pleased. Thank you! [This review was collected as part of a promotion.]
I received my sample of GARNIER SKINACTIVE GLOW BOOST ILLUMINATING MOISTURIZER from PincMe . Com .Love how even and smooth this moisturizer applies and it leaves just the right amount of glow to your skin. Love how skin feels nice and soft after each application. [This review was collected as part of a promotion.]
"Garnier SkinActive GlowBoost Illumination Moisturizer gives your skin a light, healthy glow while adding moisture to smooth over fine wrinkles and dry skin. It is light on the skin and can be used w/o added makeup. [This review was collected as part of a promotion.]"
"Garnier SkinActive Glow Boost Illuminating Moisturizer, upon initial application, left me looking glowing and dewy. I have quite a oily complexion so I thought this product would leave me feeling extra greasy a few hours later, however, my skin looked fresh and youthful during my workday. It made my face feel more plump and radiant and made me overall feel confident and ready to tackle on my day. [This review was collected as part of a promotion.]"
Garnier's SkinActive Glow Boost Illuminating Moisturizer is a fantastic addition to my daily routine. It leaves my face feeling young and healthy and vibrant. It's not heavy and does not irritate my sensitive skin. It's a must have! [This review was collected as part of a promotion.]
Usually with all the humility in my area I tend to leave moisturizer off my skin care routine. This one not only makes my face glow and make it actually look awake; it also keeps my face soft without being oily. [This review was collected as part of a promotion.]
"I love the Garnier SkinActive Glow Boost Illuminating Moisturizer that i got as a sample From PinchMe. It goes on smooth and light. Doesn't have a greasy feel and doesn't leave my face feeling greasy or heavy either. I love the hint of glow it leaves too, I also love that I can layer it for a more darker noticeable glow. [This review was collected as part of a promotion.]"
"I found the Garnier SkinActive Glow Boost Illuminating Moisturizer to be good. Not great, not terrible, just good. It was definitely glowy, but on it's own it can verge on greasy looking pretty easily. I would only use this under makeup, that being said it didn't really function as a moisturizer OR have the qualities I like in a primer so I can't give it high marks there either. Get this only if you want glow and for no other reason. [This review was collected as part of a promotion.]"
"I usually use expensive facial moisturizers but was surprised that I like the Garnier SkinActive Glow Boost Illuminating Moisturizer as much and even better than most of the more pricey counterparts. It smells great, goes on smoothly and does truly give my skin a glowy look! [This review was collected as part of a promotion.]"
"I received a free sample of the Garnier SkinActive Glow Boost Illuminating Moisturizer. Like most Garnier products this moisturizer smelled amazing and a little tangy. Unfortunately, this product wasn't the best for my sensitive skin, meaning I turned pink. If you don't have sensitive skin though I would highly recommend this product. [This review was collected as part of a promotion.]"
"Love this new Glow Boost Illuminating Moisturizer from Garnier SkinActive. It is super moisturizing without feeling heavy or greasy. It melts into the skin and makes the perfect base for makeup, or alone for a hydrated look. Not glittery at all just the perfect touch of shimmer. [This review was collected as part of a promotion.]"
I was sent the Garnier SkinActive Glow Boost Illuminating Moisturizer as a sample from pinchme. The product has a wonderful smell and goes on lightweight. It has little specs of glitter which I really didn't care for. The one thing that really stood out about this product is that my once dry skin turned very oily and greasy when using it. I never noticed any brighting effect either. [This review was collected as part of a promotion.]
"When I used Garnier SkinActive Glow Boost Illuminating Moisturizer, I could immediately notice the glow effect. I was very pleased with how it made my skin look. It's also lightweight and doesn't feel greasy on your skin. Will highly recommend to others! [This review was collected as part of a promotion.]"
I received a full size bottle of Garnier SkinActive Glow Boost Illuminating Moisturizer from pinch me. It was a free sample. That was the best part about it. One thing I did not like about this product is that it left my skin feeling sticky and oily. I tried it as a primer for my make up and hated it. [This review was collected as part of a promotion.]
"I didnt really like it. I have tried it for 2 weeks and i dont see a chance. My face is still dry. The cream is easy to apply, but it feels somwhat thick in the face and ot takes really long to be abosrbed. I also did t like it because it says that “ illuminates” the face and i really dont see it. [This review was collected as part of a promotion.]"
I received the Garnier SkinActive Glow Boost Illuminating Moisturizer for free to test from PINCHme. I am so glad that I was sent these product to review!! I really love it. It has a fresh scent that is very pleasant. It also gives my skin a slight glow. It looks very natural and pretty. I have used this under my makeup as a primer and it works very well. I would definitely purchase! [This review was collected as part of a promotion.]
"I really liked how the Garnier SkinActive made my skin glow. It left a bit of that sticky feeling some moisturizers leave after putting it on. I don't think it improved my skin that much, and the smell was pretty fake. But immediately after I put it on my skin looked glowy. [This review was collected as part of a promotion.]"
I enjoyed the smell of this product and wearing it alone or as a primer. I truly think they should sell this as a primer over a main moisturizer. I loved this more as a primer. The smell was great and it gave a glow to my skin. I did need to use a little more foundation throughout the day due to the moisturizer. It was overall a great freebie and look forward to using it more. [This review was collected as part of a promotion.]
"Garnier's SkinActive Glow Boost Illuminating Moisturizer was simply aaaamazing! After, just my first use my face felt refreshed, hydrated, and baby soft. Then, to top things off it left me glowing like on a sunkissed day. [This review was collected as part of a promotion.]"
"I got the Garnier SkinActive Glow Boost Illuminating Moisturizer for free from PinchMe. It is great for my skin, just a little bit of product is enough for my whole face and it stays hydrated for long. I mix it up with my foundation for an extra touch of glow on my makeup. [This review was collected as part of a promotion.]"
The Garnier skinactive “Glow Boost Illuminating “ is nice and very absorbing. I personally prefer thicker creams but this goes on quite well and leaves a nice dewy glow. nice pleasing smell and didn't cause any break outs so far. [This review was collected as part of a promotion.]
I LOVED this product! After I washed my face at night is when it worked best. The scent was very pleasant and the consistency was very smooth.
"I would NOT use it as a primer or under makeup in the morning because it does peel off if combined with another product. Other than that, as a moisturizer, it works great! [This review was collected as part of a promotion.]"
"I brought the new Garnier SkinActive Glow Boost Illuminating Moisturizer with me on a trip to Central America. I normally get super dry when I travel, but this moisturizer kept up with my needs without being overly greasy. It's great under makeup or alone. The only reason I didn't give it five stars is because I felt it smelled almost like medicine. I'd prefer a fruity or fresh smell personally. [This review was collected as part of a promotion.]"
I received from pinchme Garner SkinActive product Glow boost illuminating moisturizer for free in exchange of my honest review. I received a full size product so I had plenty of time to really test it and I was very happy with the result. My skin is glowing and feels great. Definitely I will be buying more. [This review was collected as part of a promotion.]
This is a nice light moisturizer. It doesn't feel heavy and the fragrance is nice and light. The Garnier Skin Active Glow Boost illumination moisturizer is a nice addition to my skincare. I have not had any bad reactions. [This review was collected as part of a promotion.]
"I received a sample of Garnier SkinAcrive Glow Boost Illuminating Moisturizer from PINCHMe. After using the sample, I noticed that it was a lot more moisturizing than my current one. My skin never felt better! [This review was collected as part of a promotion.]"
"I received Garnier SkinA five Glow Boost Illuminating Moisturizer as a sample from PINCHme. I've used the product a few times and it's really nice for a while. When you first put it on and for hours afterwards, your skin is soft and smooth. After a while though, it's starts to get oily. I think it works best as an overnight cream. I really like it [This review was collected as part of a promotion.]"
Garnish SkinActive Glow Boost Illuminating Moisturizer is so good. It's easy to apply and not much product is needed to put on all face. Love how I can wear it under makeup or alone. Not greasy & absorbs easily into the skin [This review was collected as part of a promotion.]
I received a sample of Garnier SkinActive Glow Boost Illuminating Moisturizer. I have combo skin and so far this product has not given me a bad reaction on my skin. The moisture it gives is good and lightweight. The glow is not so overpowering that you look greasy. It does dry down well and does not stay sticky. I wish it did have some spf in it though. [This review was collected as part of a promotion.]
I was thrilled when I got the Garnier illuminating moisturizer! It's great to use as a lotion to nourish your face without breaking out. I especially liked using this product as a makeup primer. The subtle shimmer gave my face a nice glow after applying my foundation as usual. I would recommend this product to anyone wanting an affordable product that is surely to please! [This review was collected as part of a promotion.]
"After trying the new Garnier SkinActive product I actually noticed the glow in my skin very much. I also enjoyed the scent of the overall moisturizer. I noticed that it didn't have my face extra oily or anything, which is a great bonus. I can overall say that I like the Glow Boost Illuminating Moisturizer by Garnier. Thanks to PinchMe for the free sample. [This review was collected as part of a promotion.]"
The Glow Boost Illuminating Moisturizer from Garnier SkinActive does everything it claims. I have sensitive skin and this left my skin with nothing but a beautiful healthy glow and super soft skin. [This review was collected as part of a promotion.]
I received a sample of Garnier skinactive glow boost moisturiser in exchange for my honest review. I love the quantity of this sample. I have been using it daily as a primer and i love the result. It really gave my skin that glowing effect. Overall i love it. [This review was collected as part of a promotion.]
"i received Garnier SKinActive Glow Boost Illuminating Moisturizer to try from PinchMe. I really like this moisturizer - it leaves my skin feeling great. I don't think it really gives me much of a glow, but it's a great lotion I'll continue to use. [This review was collected as part of a promotion.]"
"I really like this moisturizer! I was a little hesitant to use it, as I have oily skin and didn't want to enhance my already shiny face. But this adds a glow after all the matte products on my face so I look more natural. It smells good and the scent isn't overwhelming. Feels great on the skin and can be worn alone! [This review was collected as part of a promotion.]"
"The new Glow Boost Illuminating Moisterizer from Garnier SkinActive is amazing. Its not the type of moisterizer you would expect. The cream is a papaya color instead of white, but it blends in so well that you can't tell. And you gives you a nice subtle glow. I've worn it alone, with an SPF moisterizer and under makeup as a primer. It's very versatile. I love it [This review was collected as part of a promotion.]"
"Thank you so much to PinchMe for this sample of Garnier SkinActive Glow Boost Illuminating Moisturizer! This product did (and still is) working just as it claims. It makes my skin feel moisturized just right, but not greasy. I love the subtle tone that it provides. It really does illuminate my skin and make it glow. I have gotten numerous compliments on my complexion and I will absolutely purchase this product after I am finished. I really do love how this makes my skin feel! [This review was collected as part of a promotion.]"
"I was given the chance to review Garnier SkinActive Glow Boost Illuminating Moisturizer with a free sample Pinchme. It is the first moisturizer I have used that had a darker color. It smells great and is a good moisturizer. However I did not notice a glow at all or any ""illuminating"". It was good as a primer but as just a moisturizer, it left my face feeling a little sticky and oily. It isn't as light of a moisturizer as I like but I am not saying it is a bad product, just wasn't right for me. [This review was collected as part of a promotion.]"
"I have combo skin which can be a bit dull at times. Garnier skinActive glow boost illuminating moisturizer works well for what it is, it brightens my skin decently enough. I don't seem to notice it a ton under makeup so I'm glad for that. But, it did seem to make my skin a little more oily under my matte foundation with setting powder. I don't dislike it, but it doesn't necessarily work amazing for me. [This review was collected as part of a promotion.]"
Glow Boost by: @garnierusaBig thanks 2 @pinchme 4 letting me try this product! I used this to prep my foundation application and it provided me with a light tint of warmth in color as well as a hint of glitter for shine which was a nice surprise. #beauty #happypincher [This review was collected as part of a promotion.]
"I received my sample of Garnier SkinActive Glow Boost Illuminating Moisturizer for free from Pinch Me. I liked this moisturizer's clean, non greasy feel. Glow Boost Illuminating Moisturizer left my skin looking healthy and dewy. [This review was collected as part of a promotion.]"
I love love love Garnier SkinActive Glow Boost Illuminating Moisturizer because it makes my skin so bright and beautiful. It really gives me a ling lasting glow without any greasy feeling left on the surface of the skin. Some moisturizers tend to just sit on the surface and never dissolve into the skin. But this one was a winner in my book. Especially for sensitive skin and wearing it under makeup is fabulous! [This review was collected as part of a promotion.]
Garnier SkinActive Glow Boost Illuminating Moisturizer is best skin care products ever. I've never had a moisturizer and primer make my face really really soft. The apricot in the product makes my skin wake up. [This review was collected as part of a promotion.]
"I received a free sample from PinchMe for my honest review. I love this moisturizer. I've been using it for almost two weeks now and haven't found anything not to like. It smells good, it give me a glow, you can use it as a makeup primer(I chose not to), it's not too thick, and keeps my dry skin moisturized. [This review was collected as part of a promotion.]"
"I received a sample of Garnier SkinActive's Glow Boost Illuminating Moisturizer from PINCHme and it was an okay moisturizer. The glow was too subtle and I wanted it to give more of a boost, but it sadly didn't deliver how I expected. It is a nice light moisturizer though! [This review was collected as part of a promotion.]"
Garnier Skinactive has great products. This glow boost illumination moisturizer is pretty good. Its good even if you have oily skin for getting beautiful glow. I would recommend this for dry skin over oily skin. Thank you Garnier for making amazing products at a affordable price. also thank you PINCHme for sending me this free product. [This review was collected as part of a promotion.]
Glow boost Illuminating Moisturizer from Garnier Skinactives is an amzingly light and a tinted moisturizer that makes your skin appear glowing. Not at all greasy and feels great. Can be used as a moisturizer or as a primer too. Loved it. [This review was collected as part of a promotion.]
I got Garnier SkinActive Glow Boost Illuminating Moisturizer from PinchMe and I definitely will buy it. I like that it's made of natural ingredients. I can confirm that my skin has really luminous effect. I really love that the tube is made of pecycled plastic. I will recommend it for my mother and friends. [This review was collected as part of a promotion.]
"i want to thank pinchme for giving me the chance to try this for free,"
"I have oily and very sensitive skin, but i wanted to give this Garnier SkinActive Glow Boost Illuminating Moisturizer. a go, and to my surprise it was wonderful i was glowing just enough that i was not a disco ball. once i am out of this sample i am going to get more. [This review was collected as part of a promotion.]"
"Garnier SkinActive Glow Boost Illuminating Moisturizer feels so soft on the skin. My skin feels so moisturized after using it. Since it's getting cold and my skin tends to get dry this time of year, I'm so glad to have this product! [This review was collected as part of a promotion.]"
I received a sample of Garnier SkinActive's Glow Boost Illuminating Mositurizer from PinchMe and really liked it! It rubbed in well and wasnt oily. I have fair skin and it was fine for mskin tone. e. [This review was collected as part of a promotion.]
I received a PinchMe Sample of GARNIER SKINACTIVE GLOW BOOST ILLUMINATING MOISTURIZER and I absolutely love it! I put just a pea size amount on my face before makeup and it makes my face so soft and youthful. :) [This review was collected as part of a promotion.]
"I received a free sample of Garnier SkinActive Glow Boost illuminating Moisturizer from Pinchme. This moisturizer really does make you glow, it has like sparkles which make my skin look really glowy. When applying the product is feels a bit thick but after a while I didn't feel it anymore. [This review was collected as part of a promotion.]"
I received a sample of The Glow Boost Illuminating Mousturizer from Garnier SkinActive in my PINCHme box to try out. I did not find it moisturizing on me. I have combo skin but I tend to get really oily. It does seem to be a good primer depending on what your needing this product for. [This review was collected as part of a promotion.]
I received Garnier SkinActive Glow Boost Illuminating Moisturizer free from PINCHme. This moisturizer smells great! It went evenly onto my skin and absorbed without leaving greasy spots on my face. It appeared to brighten my skin while also moisturizing. It's a great product that will become part of my daily skincare routine. [This review was collected as part of a promotion.]
"I don't think Garnier SkinActive Glow Boost Illuminating Moisturizer really did much of anything other than make my face look super oily. I wasn't ""glowing"". I wasn't ""illuminated"", just greasy. This is a definite no for me. [This review was collected as part of a promotion.]"
I loved the way this product made my skin glow. I wish it had a lighter scent but overall it applies nicely and looks great once on. If you look closely at your face you can see the tint in your pores. [This review was collected as part of a promotion.]
I received Garnier SkinActive Glow Boost Illuminating Moisturizer as a free sample from PinchMe.com. I love the natural looking Glow that this moisture gives. It doesn't leave any greasy or sticky residue. Also the glow boost illumination Moisturizer blend into my skin seamlessly. [This review was collected as part of a promotion.]
The Garnier Skin Active Glow Boost Illuminating Moisturizer is great my skin has a natural glow to it. It works very fast and the results are truly there. And I love that this product is for all skin types. The fact that there is a very light scent to this product is great and this product is non greasy which is a plus. [This review was collected as part of a promotion.]
"I already like Garnier SkinActive products and the Glow Boost Illuminating Moisturizer does not disappoint. Wearing this as a base moisturizer, I already felt / looked like I had on my light makeup for everyday. [This review was collected as part of a promotion.]"
"I probably never would have bought the Garnier SkinActive Glow Boost Illuminating Moisturizer on my own and have loved this sample! It really does make my skin glow and as someone with oily skin, that usually takes effort to glow without looking gross. [This review was collected as part of a promotion.]"
"I tend to break out with heavy moisturizers and have always had to stick with clinique to keep that from happening. I was surprised that this didn't cause me to break out. It's smooth, thick, creamy, and didn't clog my pores. Surprisingly nice product. I'm considering adding to my bag on a regular basis. [This review was collected as part of a promotion.]"
The garniee skinactive glow boost illuminating does what it's supposed to do give you a glow I used very little and without makeup. I have very oily skin so I have alot of natural glow and I hate it so that's why I only used very little I would recommend if you have dry skin not oily. [This review was collected as part of a promotion.]
Garnier SkinActive Glow Boost Illuminating Moisturizer is a great addition to my skin care routine. It comes very light scented. It is easily spreadable and doesn't leave greasy residue. It leaves my skin with a light glow. [This review was collected as part of a promotion.]
Just tried my sample “GARNIER SKINACTIVE”/GLOW BOOSTING
"ILLIMINATING MOISTURIZER. I LOVE IT AND MAS SOON AS I AM FINISHED I AM GPING TO BUY MORE. THE MOISTURIZER GOES On SMOOTHLY, the consistincy and color are perfect match. What I love is the moisturizer has s BEAUTIFUL GLOW [This review was collected as part of a promotion.]"
I used Glow Boost Illuminating Moisturizer during a recent stay at the hospital and it was super useful. I was not feeling well enough to do a full face of makeup but I still wanted to having something on my face to make feel feel better about the way I look. This moisturizer ads just enough glow and works as a primer. It made me feel better about my skin and will definitely be purchasing soon. [This review was collected as part of a promotion.]
