4.8,"['134', '23', '5', '1']"
Rich Hydrating Night Cream with Hyaluronic Acid works great and doesn't irritate my skin. I instantly could feel my skin being hydrated. I love the results and would recommend it to anyone else. Amazing [This review was collected as part of a promotion.]
"I have very dry skin and have had a hard time finding something that really hydrates my face. I love this product, as it moisturizes, but doesn't leave it feeling greasy. It really works for me. I use this as a nightly face moisturizer and it does the job - non-scented, non-irritating. [This review was collected as part of a promotion.]"
I love this night cream. I put it on before bed and my skin feels so nice after putting it on and even better the next morning. It doesn't leave your face greasy like other creams and it feels so clean and refreshing! [This review was collected as part of a promotion.]
"This ceraphil night cream is amazing, super light, not greasy or sticky really fast absorbing to the skin, i always read about how amazing this brand how awesome ia for the skin and now i absolutely agree, now with this cold days is great no more dry skin [This review was collected as part of a promotion.]"
The Rich Hydrating Night Cream with Hyaluronic Acid is fantastic for my night time routine and works well with the proactiv system of products. You can always rely on cetaphil to provide you with what your skin needs without reacting with other products. It's highly moisturizing and has evened out my skin tone since I started using it. [This review was collected as part of a promotion.]
"I received Cetaphil Rich Hydrating Night Cream with Hyaluronic Acid to try and here's my opinion. The scent smells so good, the cream is medium thick so not too thin like others. I feel like my face will be moisturized for a week if I let it. Overall good product. [This review was collected as part of a promotion.]"
I have been using this product EVERY night for the past 2 years and it has improved my skin drastically. I never miss a night because I know the next day my skin won't look as hydrated.
Great hydrating cream for night from night time. My skin is moisturized and soft. Usually my skin is very dry but this cream keeps my skin soft and smooth. I really love this cream at night and will buy more [This review was collected as part of a promotion.]
I feel like using this product does really help your skin during the night especially after you wash it with a heavy cleanser. And it doesn't feel super heavy while you sleep. In fact in the morning your skin feels really smooth. [This review was collected as part of a promotion.]
"I have been faithfully using this along with their other products int their new skincare line, for over thirty days now. I have noticed my skin to be much more hydrated, the night cream is slightly heavier then the day cream, but not greasy . I would recommend this to anyone looking for a daily use cream. [This review was collected as part of a promotion.]"
"I have been using this for over a month now, and my patchy dry/oily skin has really improved! I was concerned that too much moisture would be bad for the few oily spots I have but it hasn't at all! My super dry chin is now smooth and MUCH easier to apply foundation to! [This review was collected as part of a promotion.]"
"I really like this Rich Hydrating Night Cream with Hyaluronic Acid. I like what it does for my skin. I use it at night, sparingly because a little goes a long way. But it helps to even out wrinkles and make my skin look hydrated. [This review was collected as part of a promotion.]"
great features. very efficient night cream.makes skin soft and smooth. skin glows in the morning. I use it daily.I strongly recommend it to my friends .lamd family. I have ordered them as gift to my cousins. [This review was collected as part of a promotion.]
"I received this product free to try. I have been using it in the evening before bed. I use prescription acne products, so my face is usually dry. This cream helps keep my face moisturized nicely without a heavy feeling. [This review was collected as part of a promotion.]"
"This was my first time using a night cream. I have read alot about the benefits of hyaluronic acid but was hesitant to try it. I finally did and saw results the next morning. My skin looked so radiant,fresh and felt very soft. I really like this brand and will defintely continue to use it [This review was collected as part of a promotion.]"
"I've been using now for a month and it gives great moisture while still feeling light and gentle, not greasy. It's easy spread evenly across your skin. The product is gentle and effective. I recommend! [This review was collected as part of a promotion.]"
I got this for fred in exchange for an honest review. Honest: finally!!! A night cream that doesn't feel disgusting on my face when I go to bed! I absolutely Love it! Absorbs well and feels so nice and soft [This review was collected as part of a promotion.]
"I Bought This Awesome Night Cream about A Month Ago, and I'm So Glad That I Did, I Love the Feel of My Skin after I use it, It makes it feel Softer and tighter, I Definitely Recommend Buying this Product, I Give it #5 Stars!! [This review was collected as part of a promotion.]"
"I'm glad, I got this I use it at night before I go to bed. Refreshing and you just need to had 2-4 drops on your hand. I didn't use that much. I use it every night feels good on my skin. Made my skin soft. [This review was collected as part of a promotion.]"
I use this every night to keep my face feeling smooth and clean. It helps with hydration and cleanliness. the container is easy to use and it doesn't leave any sticky feek. Only nice smoothness and hydration [This review was collected as part of a promotion.]
"I bought this about 20 days ago and I have already noticed a difference in my skin. It is a little thicker due to it being a night cream, but I love it. Very impressed with this product."
I got this product about a month ago and have been using it at night. Feels good on my skin and has not caused any allergic or adverse reactions. My skin can be sensitive sometimes so it is nice to find a product I can use. [This review was collected as part of a promotion.]
I love this cream! Super lightweight and very moisturizing. I can not say enough great things about it. My skin feels so soft in the mornings and almost glows. That hasn't happened in many years. I can't live without it! [This review was collected as part of a promotion.]
"I absolutely love this night cream! I have always been used to a very thick night cream thinking that was the best and most effective kind, but I was wrong! I do not feel like I am clogging up my pores, or feel like I am rubbing foundation all over my face before I go to bed! When I wake up in the morning my face feels very fresh and clean, not oily! [This review was collected as part of a promotion.]"
"I used this in the evenings, and used the Daily Hydrating Lotion in the mornings, in conjunction with the daily foaming cleanser. It seemed like the regimen worked reasonably well, as my skin seemed fairly hydrated. I have acne prone skin, and this did not worsen it or make me break out. It was thick in consistency, as I expect a night cream to be. It felt quite moisturizing, but didn't feel greasy or oily on my skin at all. It absorbed quickly into the skin. [This review was collected as part of a promotion.]"
I love this night cream. It absorbs quickly and hydrates my skin beautifully overnight. I have been using Cetaphil skin products for less than a month but I am so impressed with how well they work I can't see myself buying anything else. I am already noticing a huge improvement in my skin tone and texture. [This review was collected as part of a promotion.]
Iâve been using this for about a month now at night and im not use i see any difference. It is moisturizing and a thinner consistency then the regular lotion. But does it work for wrinkles? I doubt it. But my face does feel more hydrated in the morning
"I have been using the night moisturizer for two weeks and am very happy with it. It feels very silky, applies smoothly, and provides a rich moisture. I use Retin A and I apply the night moisturizer on top of it and it stopped the dryness that Retin A can cause. My skin feels and looks great. Very happy that I purchased this product and love the results."
Finally a night cream for extra dry skin. I have been looking for this type of cream for the longest time. Im going on my second now. Let me say I'm relieved! I would have dry skin around the my mouth especially at night and since i started using this my skin hasn't been chapped or dry. Thanks Cetaphil!
"Wow! I'm 60 and have tried many different face creams. This one is silky and luxurious but lightweight and non-greasy. I use it night AND morning. A little goes a long way, and the price is definitely a plus. Great for skin prone to breakouts, too."
"In my 60s I started having very dry skin in my face & all white little oil cyst around the jaw line. Went to a dermatologist & she prescribed Cetaphil cream, face cleanser. My face toda (65) is smooth, soft, no wrinkles, get lots compliments about looking as 50s not 65z. I also use the cetaphil body lotion, make up remover , facial cream with SPF for sunny etc. I highly recommended"
"This nighttime moisturizer was absolutely amazing. It went on smoothly and wasn't greasy or oily, so it absorbed well. It had a really light scent which was perfect for my sensitive skin. And best of all — it moisturized well without making my skin greasy the next day! [This review was collected as part of a promotion.]"
"This is the perfect overnight moisturizing cream. I use it nightly and love how I wake up with my skin feeling like it had a long drink of water, without being oily. It does not clog my pores or leave my skin with any residue. Just feels moisturized and smooth. Exactly what I want in a moisturizer! [This review was collected as part of a promotion.]"
This cream does all the wonders expensive night creams do without having to pay big $ for it. It protects your skin from feeling dry overnight and it moisturizes without clogging your pores or feeling heavy. Perfect for sensitive skin [This review was collected as part of a promotion.]
I have been using cetaphil night cream for almost a month. The night cream is non fragrant and not greasy. I have combination skin type. I did not break out using this night cream. It did not irritate my face and neck. The night cream is pretty light for a night cream. You do not need to use much to cover your face and neck. I think this would be great for spring/summer time for a night cream. [This review was collected as part of a promotion.]
I have to be picky about my night creams since i have combination skin. I do not want to break out while i am sleeping because of an oily night cream. This is not the case with this product. I have been using it for two weeks and my face is moisturized when i wake and not too oily. Great product. [This review was collected as part of a promotion.]
"This cream is moisturizing for my skin free of oils not like other creams at night that are very greasy this is realy work in short time , it comes in a good size I recommend Cetaphil rich hydrating night cream. [This review was collected as part of a promotion.]"
"I really like how quickly this lotion absorbs in the skin, and makes my skin quite smooth. Furthermore, I am not a fan of those face lotions that smell strongly like suntan lotion, and this one does not. It's got a nice thick consistency and doesn't cause me to break out. [This review was collected as part of a promotion.]"
"I'm not huge on night time routines as all I want to do is go to bed; but, I tried this for a week in addition to other Cetaphil products and have noticed a more softer texture to my skin - it's really come in handy especially as we are heading into the winter season. [This review was collected as part of a promotion.]"
I received this product for testing- I enjoyed the cream and thought it made my face feel soothing and nourished making my skin soft. It gives it a moisture barrier to protect my skin from becoming dry and helps hydrate it. [This review was collected as part of a promotion.]
My dermatologist said this line of lotions is the best! I agree completely! Since using this line I haven't had any problems. This night cream is one of my favorites. I love the creamy texture of the lotion. It goes on very smooth and easily. My skin feels great as I put this on every night. I have not has any reactions to this. It doesn't irritate my skin or burn when going on. Love that! It is not scented for those who dislike scented lotions. I will continue to use and buy this product! [This review was collected as part of a promotion.]
"I started using Cetaphil's Rich Hydrating Night Cream just five days ago and I have to tell you, I'M IN LOVE WITH IT! Just apply it to dry, clean skin before bed and when you wake up you won't believe how incredible your skin feels. Hydrated, not greasy, and silky smooth. It really feels like I've had a facial or something. Hands down, my new favorite skin product. Try it, you'll love it too, guaranteed! [This review was collected as part of a promotion.]"
I have been struggling to find a good hydrating cream but I finally found the perfect one. I am feeling a difference in my skin using Cetaphil. I am changing my daily routine for better looking skin to Cetaphil. Absolutely worth trying. My skin is not dry in the mornings when I wake.up anymore. [This review was collected as part of a promotion.]
My skin is so much more hydrated when I wake up. This product is so light feeling but really effectively quenched my very dry skin. My skin is so soft and smooth since using this in the evenings. Definitely a great moisturizer [This review was collected as part of a promotion.]
"I love, love how hydrated this product makes my skin feel. My skin looks refreshed and dewy in the morning after using this product at night. Since using this product my skin definitely looks healthier and my other skin care and makeup products go on so much better. [This review was collected as part of a promotion.]"
I purchased 5 weeks ago on a whim. Best night cream I gave ever purchased. Use every night on face and neck. No fragrance a huge plus. Don't want to smell my face and goes on like silk.
"I can't get enough of this. Night time. Day time. This soaks right in. No stinging, no greasiness, no heavy perfume. Just perfect. My skin plumps up and feels the right size again. I kind of wish I could jump in a tub of it."
"I've used all the expensive brands, to no avail. I'll almost 78, started using this product about two months ago and love it. I use it at night and during the day as a moisturizer. It is, without a doubt, the best cream I've ever used!"
"i have been spending too much on facial cream and wasn t too satisfied....This so far beats all of them , it actually helped my dry skin ... its not greasy uncomfortable and it is easily absorbed ... this is a keeper.."
"I love the clean approach of Cetaphil, and this night cream is actually moisturizing enough for overnight. In the morning, my skin feels terrific. LOVE this cream."
"I've been using this for about a year now! Light enough to use every night, but extremely hydrating! I have fairly sensitive skin and this does not make me break out!"
"I do not like a think facial hydrator, even if it is a night cream. The moisturizer is slightly too think and oily for my skin type. I do not need a whole lot of hydration unless it's during the winter months. I think it will be better in the coming colder months. [This review was collected as part of a promotion.]"
With aging skin I often look for something that will hydrate while I sleep. I feel like while you are sleeping products have more of a chance to work because the pollution factor and daily touching of your skin is not involved. This cream works wonders. [This review was collected as part of a promotion.]
i waited a bit before i reviewed this because i wanted to give it time to see how well it works and let me tell you it works great and is even easy on the skin which is great because i have sensitive skin for some things and this was super gentle and makes my skin feel great afterwards. i will totally be buying more when i run out [This review was collected as part of a promotion.]
I received this product used and I used it. I didn't know what to expect. I now have glowing smooth looking skin. It has made a big difference to what my other products have done. I'm very pleased with the moisture feeling of my skin. Very happy person. [This review was collected as part of a promotion.]
This is grate for hydration use right along with the rest of the cetaphil daily hydration and your face will feel smooth and refreshing you wont regret that you tryed it it's a grate product and recommend buying [This review was collected as part of a promotion.]
"This is a nice moisturizing cream that is perfect for anyone looking to keep their face moisturized throughout the night, especially in the drier winter months. It's not particularly heavy and goes on really nicely. It definitely hydrates but it absorbs in the skin too so it doesn't leave any icky residue. Recommended. [This review was collected as part of a promotion.]"
I really love this night cream. It's super creamy and moisturizing. Yet it soaks into my skin quickly and does not leave a sticky residue. I would definitely recommend this night cream. It keeps my skin soft even in the cold weather [This review was collected as part of a promotion.]
I use this every night and my skin feels soft and nourished when I wake up. The best part is that it is non comedogenic so my skin doesn't break out or get irritated when using it. Especially Great during the winter months but it is just as effective to use a bit when it's humid out to help moisturize skin before applying makeup. [This review was collected as part of a promotion.]
"Non-scented cream is lightweight and not greasy like other night creams can be! I wash my face with Cetaphil foaming face wash in the evening, then apply this cream all over. It doesn't burn or cause irritation like some night lotions can be. I wake up with a very hydrated face, free of oils! [This review was collected as part of a promotion.]"
I love this night cream. It hasn't caused me any break outs which often happens when I change products. It is gentle and makes my face feel soft and moisturized. I am very happy and would recommend it to anyone. [This review was collected as part of a promotion.]
"Rich, creamy and luxurious! A little goes a long way to hydrating overnight. It is not greasy or sticky. It has a very light scent that is pleasant. My skin loves this stuff! I will certainly buy in the future. [This review was collected as part of a promotion.]"
Out of all they're products I've tried I've liked this stuff the most. It doesn't go on or make your face greasy and really keeps you're face hydrated all night. It makes it feel silky smooth with notice. [This review was collected as part of a promotion.]
"Let me start that I have VERY sensitive, acne prone skin. With this product, there wasn't an adjustment period. I added it into my nightly skin care regime about a month ago and I love it so much. I use it every other night before bed, it absorbs quickly (leaving no mess on my pillowcases), and my skin feels soft and refreshed when I wake up. No oil slick in the AM. So grateful to find something to use in the upcoming winter months. [This review was collected as part of a promotion.]"
I've been using this lotion at night for about a month now and I love it so much. I put it on before bed and it does all the work while I'm sleeping and when I wake up my face doesn't feel dry anymore. My skin looks so much more refreshed all the time now. [This review was collected as part of a promotion.]
"This lotion is gentle, yet rich and luxurious feeling. Leaves my skin soft and hydrated. I use it a couple times a week and feel like a princess when I do. Not greasy and doesn't leave marks on the pillow either. Bonus. :) [This review was collected as part of a promotion.]"
It's winter time and my heat is so dry it dries out my skin so fast. I been using this night cream and my face hasn't been dry since using it. It only takes a small amount to moisture the whole face and doesn't leave the grease feeling on the face either [This review was collected as part of a promotion.]
"I use this during my night time skin reginine and I love the way my skin looks and feels in the morning. Itsrejuvenated, moisturized and doesn't feel greasy, I would recommend this to my friends and family [This review was collected as part of a promotion.]"
"This moisturizer is very rich and creamy. My skin is oily-prone so it was a little too heavy for me to use all over my face, but I found that it was perfect for the little dry patches I have around my nose and eyebrows. When I applied it before bed, my dry spots were gone by morning! [This review was collected as part of a promotion.]"
I received the Cetaphil Rich Hydrating Night Cream with Hyaluronic Acid a couple of weeks ago. I think it's average in the moisturizing department. I have oily skin and I will say it's not near as oily in the a.m. after applying this. [This review was collected as part of a promotion.]
I used this night cream before going to bed and felt it was very soft on skin. I have a dry skin which tends to get even more dry during cold weather. This lotion kept my skin moisturized throughout the night. [This review was collected as part of a promotion.]
I got this to try for my dry winter skin and it's been great so far. Very heavy and creamy but not greasy at all. No breakouts from it and my skin is nicely moisturized. It hasn't done much for signs of aging but it's a great heavy cream at a fair price point. I definitely recommend. [This review was collected as part of a promotion.]
"I'm always hesitant of products with ""night"" in the label, as they can sometimes feel too think or oily, or like you're putting plaster on your face. Not this! It's heavy duty but once on feels perfectly normal. Great product and brand. [This review was collected as part of a promotion.]"
I recently was given the opportunity to try Cetaphil Rich Hydrating Night Cream with Hyaluronic Acid. The texture is not too thick. It doesn't have a strong fragrance. It worked well for me and hydrated my skin. [This review was collected as part of a promotion.]
I love this stuff so much. I love how luxurious this made my skin feel after application. I didn't feel like it was heavy or greasy and it absorbed fast into my skin. I will be asking the whole container and buying more when I run out. [This review was collected as part of a promotion.]
I was looking for a good night cream for me and my husband and I came across Cetaphil Rich Hydrating with Hyaluronic acid. It works great. Leaves skin hydrated and smooth. Perfect for cold weather and it is lightweight too. [This review was collected as part of a promotion.]
Keeps my skin hydrated overnight. I use this in conjunction with my other skin products. A little goes a long way and keeps my skin soft supple and hydrated. I would recommend this product for women over 40. [This review was collected as part of a promotion.]
"I really liked this night Cream. It is thick and luxurious without being greasy. It is - like all Cetaphil products - consistent with their commitment to clean ingredients and is unscented, so I know it's safe on my skin. [This review was collected as part of a promotion.]"
I love taking care of my skin and I find it hard to find products I can use because my skin is so sensitive. I am in love with this product because it is specifically for sensitive skin and I know that it won't break me out. The texture of the cream is amazing and it dissolves quickly into my skin. [This review was collected as part of a promotion.]
Night Cream is essential to keeping my skin up and smooth. It also helps keep it clear. For the price point this stuff is awesome. Although isn't great as some of the more expensive brands I have used. I would definitely say this worked well and would recommend. [This review was collected as part of a promotion.]
"This Rich Hydrating Night Cream from Cetaphil is working good so far. My skin feels so much softer and is very moisturized since I have started using this product. I have been using the product for a few weeks now in conjunction with some other Cetaphil products including the Gentle Foaming Cleanser, Daily Hydrating Lotion, and the Hydrating Eye Gel-Cream. Together, this system is great and I am glad to have added this to my daily routine. [This review was collected as part of a promotion.]"
"This night cream feels so hydrating on my skin. IT is light even though it is dense. And my skin felt great in the morning. The smell is not over powering, but good.I totally recommend it! I have super super dry skin and it's helping. [This review was collected as part of a promotion.]"
"I recieve this cream as a sample and I've gotta say, I absolutely love it. Me and my father are both using it and notice dramatic effects only 2 days after starting to use this night cream. Can't wait to buy more [This review was collected as part of a promotion.]"
"I like this night cream a lot - its very moisturizing without being greasy. My skin is super soft when i wake up the next day, and I feel like the texture of my skin is better. I would recommend this product. [This review was collected as part of a promotion.]"
