"Garnier's new Moisturizer Rescue Refreshing Gel Cream for dry skin is a lite fast absorbing face and neck cream. I have been following the suggested morning and night schedule for about 1 week now. My skin feels smoother, less tighness and pores appear smaller. A little goes a long way so, this container should last several months. So far this product is a keeper in my daily skin care regiment. [This review was collected as part of a promotion.]"
"This gel has this cooling sensation that gives a refreshing feel to my dry skin. Its very soothing at night, the scent is a light scent. I apply it all the way down my neck and it left my skin very soft, but sticky. The reason that I dont give it a 5 star rating is that this moisturizer feels sticky and doesn't absorb easily. [This review was collected as part of a promotion.]"
"I tried it for free and it has become a necessary laugh for my face. I never thought that when I tried it I would like it so much .. I put it in the morning after washing my face and it leaves me looking cool, bright .. I applied it before Of the makeup and if my skin looks a lot fresh ... I like it a lot and I recommend it [This review was collected as part of a promotion.]"
The moisturizer cream wasn't for me ... It dried out pretty fast. I'm sorry I wouldn't buy it. My face is very dry and I was hoping this was the cream for me but it's not. On a good note it smelled good. [This review was collected as part of a promotion.]
"This stuff is amazing. I have perpetually dry and sometimes flaky skin through my T-zone. And this stuff makes my skin so soft and hydrated, I don't even have to use it everyday. It smells great to me and doesn't irritate my sensitive skin. I would highly recommend to anyone. Even my sister likes it and her skin is oily. [This review was collected as part of a promotion.]"
"The gel seems a little weird for a face cream, but it is quickly absorbed with no tacky residue. I was pleasantly surprised with this product. Most moisture creams tend to leave my face feeling greasy and slick, this was not the case with this Moisturizer Rescue Refreshing Gel Cream. I like it quite a bit. [This review was collected as part of a promotion.]"
"The first thing I loved when I first saw this Garnier Moisturizer is the color! Then I opened it up and it smelled so good, like some high class. I tried this product for awhile before I wrote a review just so I could really know how it works. It made my skin less dry I think in time but it took putting it on everyday. It feels sometimes a little wet and sticky which is why one less star but it's not something that would make me not want to buy this product. [This review was collected as part of a promotion.]"
At first I wasn't very satisfied with the garnier skin active. It was too sticky and I had to reapply. But after a few days my skin adjusted and now I love it! My skin is never dry and always soft. Everyone should give it a try [This review was collected as part of a promotion.]
"My thoughts about Garnier Skin Active moisture rescue is amazing. I love how my face feels after applying it. It gives you a sensation of coolness, freshness softness, and very hydrated. I definitely will buy it. I am in love with it. I definitely recommend it. [This review was collected as part of a promotion.]"
There are many expensive moisturizers out there that I have tried and did not get the results as I did with this moisturizer. I love love love it! It goes on so smooth and the texture is one that I love. It really makes a difference when you have really dry skin and you can tell an immediate difference. I will definitely buy this from now on. [This review was collected as part of a promotion.]
"Wow, this gel has this cooling sensation that gives refreshing drink to my dry skin. Its very soothing at night, the scent is divine and light. I apply it all the way down my neck and chest and it leaves my skin very soft. The reason I dont give it a 5 star rating is that were I live is humid and during the day this moisturizer feels sticky. But if you live in a colder climate you must give this a try, I highly recommend it. [This review was collected as part of a promotion.]"
"When I applied this product after cleansing my face it felt very hydrated, refreshed and smells great but later on in the day my face felt dry but I'm going to continue with the product until I have an exact opinion on it. [This review was collected as part of a promotion.]"
The Garnier Moisturizer Rescue Refreshing Gel Cream for dry skin is exactly what I needed! I am in my mid-30s and have been paying more attention to my skin lately. I started using this product and saw results within a few days. It does not feel sticky or leave any type of residue on my face. My skin feels hydrated but not greasy. I will continue to use this. [This review was collected as part of a promotion.]
"I think this is a really good product starting with the pros it actually does what it says. My skin is smother and firmer you can feel the difference the first time you use it, it takes a few days to see the difference. There are only a few cons one it smells like hair gel not to bad just a little. Two it takes a while to dry more of a problem if you don't have the time and you want to apply make up. Three if you get caught in the rain it runs. [This review was collected as part of a promotion.]"
I think...I love Garnier products. I was searching for a good alternative but this is average for me. I really like moisturizers that are a gel consistency. This stuff is surprisingly moisturizing for being a gel and I don't have any issues using it under my makeup. I would recommended this to people who do not have extremely dry or aging skin. I'm happy with that. [This review was collected as part of a promotion.]
"I received this product a week ago and i loved it. I use it twice a day after cleansing my face, this is a very good moisturizer. It absorbs quickly, long lasting and it goes on smoothly. My face feels great and has my skin glowing! [This review was collected as part of a promotion.]"
"I have been using it about it week. It goes on wet and doesn't really seem to absorb as quickly as I'd like. I really haven't noticed a difference as far as my skin being less dry, therefore I don't see this product as a benefit for my skin. [This review was collected as part of a promotion.]"
"I tried the Garnier moisturizer gel. I liked the pink color and I liked the fragrance. However, it seemed to take longer to absorb...maybe because it's a gel? And the fragrance worried me. I don't have sensitive skin....but with the flowery fragrance I thought I might break out. I used for 2 weeks and luckily didn't break out. It was pretty good. I would recommend for anyone who does NOT have sensitive skin and doesn't mind the extra time needed to absorb. [This review was collected as part of a promotion.]"
"I have really enjoyed using this gel! It's lightweight, non-greasy and smells SO good! A little dab goes a long way. All week, my face has been hydrated, and smooth. I've received quite a few compliments from family also! I highly recommend it! [This review was collected as part of a promotion.]"
"I was excited to try this gel cream because after washing my face everyday my skin feels tight and dry. I wanted something light and has a refreshing feeling, but also a nice light scent. Since Garnier is a brand I like, I thought I would give the gel cream a try. After a week of daily use I've decided this product isn't for me. It leaves my face feeling sticky as if it didn't soak into my skin. I wasn't impressed with the smell either. [This review was collected as part of a promotion.]"
"I received this a few days ago and have been using it every morning. I don't notice much of a difference when I am wearing it. I live in a desert state and my skin is always really dry. I drink a lot of water, but still can't get moisturized. I was really excited to try this because I like the brand. I am highly disappointed that this doesn't work for me. [This review was collected as part of a promotion.]"
"I fell in love with Garnier Moisturizer Rescue Refreshing Gel Cream the first time I used it! It's light, glides easily across the skin, absorbs within seconds, and has a light floral scent that dissipates pretty quickly. I've been using it as recommended, 1-2 times daily. My skin is softer and brighter! It doesn't leave my skin feeling greasy and I don't sweat it off either. This is by far the best moisturizer I have ever tried! [This review was collected as part of a promotion.]"
So far I love how it feels once it is rubbed in. Its lighweight and a little goes a long way( seriously) this one jar will last a few months The fragance is not strong and that is a big plus. The only down side for me is the amount of rubbing.Because it is a lightweight formula it takes longer to get it absorbed in the skin. [This review was collected as part of a promotion.]
I think the Garnier Moisturizing Gel Cream works fabulous. I have extremely dry skin and have tried several moisturizing creams. None of them which have worked well at all. ... until I've tried Garnier Moisturizing Gel Cream. Garnier Moisturizing Gel seems to help tremendously with my dry skin. Not to mention it has a wonderful smell as well. [This review was collected as part of a promotion.]
"I personally have very dry skin, so when I see a new skin moisturizer, I have to try. I really like the smell of the Garnier SkinActive and the packaging is really pretty. However I gave it 4 stars instead of 5, because it seems to really do it's job, but towards the middle of the day I feel like my skin is dry again. I would recommend this product, I think it is definitely a good daily product, I just have unusually dry skin. [This review was collected as part of a promotion.]"
I really enjoyed this Garnier cream. It feels soothing and refreshing in the summer heat. It absorbed quickly and made my skin feel soft with no greasy residue. The scent is very light and pleasant. I would buy this after I finish my jar and recommend this to others. [This review was collected as part of a promotion.]
I have dry/normal skin and I love how lightweight and cool this gel feels on my skin. It doesn't leave my skin greasy at all. It is very hydrating and has had no negative side effects. It has a fresh and clean smell and absorbs in pretty quickly. I highly recommend. [This review was collected as part of a promotion.]
"It helped moisturize my skin, but I felt like after it dried i couldn't really tell that I had put moisturizer on. However, my skin is super super dry. If you have normal/combination skin, this would be good for you since it does not contain oils. As far as skin like mine(super dry), I wouldn't recommend it for you. It didn't really have a smell, but the consistency was good and it felt good going on. [This review was collected as part of a promotion.]"
"Before I even got this product I was excited. And after using it I fell in love with it. I'ts really lightweight, absorbs right away and smells great. The fact that it's so hydrating and made with antioxidant fruit water is a plus. So, if you're thinking of trying it don't hesitate. It's would make a great addition to your night time skin care routine. If you're a lover of their hair products like me. This will be a new favorite. [This review was collected as part of a promotion.]"
"Lightweight, smells great, and it's pink! This product has it all. The price point is great and so is the product. It goes on so smoothly and hydrates my dry skin. I have very sensitive skin, but this does the trick for me. Seriously, this is a game changer.. go try it!! [This review was collected as part of a promotion.]"
"I think Garnier SkinActive Moisture Relief works well on my skin. It does hydrate my skin throughout the day, and it does not irritate my skin at all. It is a refreshing cool gel that feels great going on your skin. Certainly worth the money, and giving it a try. [This review was collected as part of a promotion.]"
Garner SkinActive Moisture Rescue is a great moisturizer that locks in 24hr moisture and soothes dry skin. It is oil free and contains fruit water. I love the feeling of fresh skin and this product certainly gives you that! I even put it on my elbows and it took away that rough skin feeling. The only thing I did not like is that my face felt a little sticky for a few minutes after applying. Other than that I think this is a great product. [This review was collected as part of a promotion.]
"So far, I have tried this two days. It is very light and not heavy. It soaks in quickly, leaving my skin very soft and supple. It smells incredible but not overpowering. I love how it feels on my eyes and is a great moisturizer to prep my face for make up. [This review was collected as part of a promotion.]"
"I just tried Garnier's Moisture Resuce product. I'm overall pleased with the product. I was expecting it to feel sticky, but much to my surprise, it dried quickly and left my skin feeling hydrated. Only con I'd have to say is that it doesn't smell that great. It isn't a harsh scent nor can you smell it after you've put it on. Overall, I give it 4 out of 5 stars. [This review was collected as part of a promotion.]"
"I had already used this product about 4 years ago and I loved it at the time. However, I began to experiment with other skin moisturizers and I have to say my best experience was with this product. I generally have sensitive skin, so the gel feels fresh on my skin when I put it on, and it does not leave my skin feeling dry at all!"
"I bought this just yesterday and applied it to my face the night I did , The morning I woke up im always prone to flaky dry skin and I was so satisfied with not 1 dry spot on my face I will definitely keep using this and I recommend it to those of you with dry skin"
"I've had problems with picking my acne over the years which left me with serious hyper pigmentation. This product literally made the red marks disappear! I'd only bought this product for moisturizing purposes yet I've been pleasantly surprised with everything it has done! After using this product for a month I've had minimum breakouts and my skin is the softest it's ever been. Since there are so many different skin types out there this might/might not work for you, but I do recommend giving it a try."
"I tried this product for dry skin after suffering for years from fall thru to spring with patches of dry skin on my face. This winter I went on line to find any suggestions that might work, and this product was mentioned. By the 2nd application, I noticed significant improvement and it has only continued to improve since, to the point that I can use my regular moisturizer in the day time and use this Garnier Gel-Cream at night only. Fantastic product for me."
After all the reviews I decided to try this product. I love Clinique products but just cannot afford them. I do like gel which blends out a lot nicer than regular moisturizers. I was really disappointed immediately because of the scent. It was to strong for me. I tend to get head aches from anything to strong. I have been trying it once in a while and notice how it dries quickly and feels real thin applying it. Just not for me.
"This product is amazing. My face was extra dry and I could notice results after just one use of this stuff. It is gel-like, so you'll want to make sure you give it enough time to dry and sink in completely before putting on makeup. Great product, strongly recommend, and it smells great too!"
Great for dry skin! Makes my skin feels so soft after using it. I love the packaging too
I Love this product!i Love garnier! #garnierlove #garnier the price is perfect ! Si very los cost
This gel cream makes you feel super refreshed! Doesn't leave your face looking oily. Very gentle.
This really helps if you have dry skins. My skin was super dry and now it's moisturized
"Good for dry skin kinda pricey but not really, gotta rub it in good or it leaves your skin oily"
"Absolutely love this gel cream! Hydrated my skin and leaves it feeling soft and refreshed. Very cooling on the skin, too!"
"The scent was very nice and loved how soft my hair felt , the only down side was that with my fine hair it made it a little too oily."
This stuff is amazing for your skin! It smells amazing and it's reasonably priced. I thought it was beyond worth the money and so effective. I would definitely recommend it to someone with dry skin.
Amazing! Definitely more of a night time cream personally . When I do use it in the day time it affects my foundation so I tend to either leave it for my night time routine or wear it when I skip makeup
"Love this product! I use this product after cleansing, toning, and applying serum to my face at night! It leaves my skin feeling soft the next morning! Would definitely recommend it to others!"
"Silky Straight Smoothing Serum is a formula enriched with fruit oils. It smoothes hair to make it silky, detangles unmanageable hair and gives radiant shine."
"Fresh, felt as if it was to water based. Caused a little irritating on really dry areas around the nose. And face changed to a darker shade of red right after."
"I love this moisturizer so much!!! It makes my skin feel brand new and so clean. I've use this almost everyday and it makes my skin feel great, the price is great for the quality and amount of the product!"
"It worked but it kind off felt oily, but maybe that's the point or my skin just reacted to it in a weird way? I have only tested it for a week so I can't see so much different, but my skin is a bit softer !"
"I used this every after cleansing my face with Garnier 3 in 1 facial Wash. it really help moisturizing my skin, and it is good also for makeup base. Not sticky to face. really nice product!"
I really trust garnier in general but when it's about face skin care....I'm extra careful. Thanks goodness this moiusturizer worth a try. Pure smoothness and hydration long lasting
"Just bought this today because I have recently experienced dry, flaky skin from the cold weather and I love this product! It makes my skin soft and supple and the flakiness has seemed to immediately improve!"
Garnier skin active moisture rescue helped my dry summer skin. The scent is very fresh. This gel cream feels refreshing on my face. I like that it's not greasy and oily. [This review was collected as part of a promotion.]
"I think this product is the best of its kind, i have really dry skin, using this everyday makes a difference, even my teenage son uses it! [This review was collected as part of a promotion.]"
"I really enjoy the scent of the product, the texture is nice it's cooling and goes a long way because you only need a little bit. However I never noticed any difference in helping with my dry skin. [This review was collected as part of a promotion.]"
This product is great and has helped my skin feel hydrated and very refreshed! It makes my skin feel very soft and has taken Away that dry feeling I always have! [This review was collected as part of a promotion.]
"I bought this a month ago. I've been searching for a moisturizer for my face and this one didn't dry out my skin, didn't leave a heavy feeling on my face and it make it instantly softer. My boyfriend loves it for his face also!"
"I use this product every day. It's gentle, calming and refreshing. It makes my face feel smooth and doesn't make it oily. I love this gel-cream and it SMELLS GREAT, too!"
"My face gets really dry, especially right now since I started using Proactive. I use this once a day and it keeps my face moist and smooth for 24 hours. I like how light it is and how it feels on my skin. I would recommend this to anyone. (:"
"I think this would be a great product for many people, yet many people also have different skin types! For me this product made my face a bit too oily, although it did refreshen it and I could tell a difference in the touch and feel of my skin after a weeks use. [This review was collected as part of a promotion.]"
"I gave this a try after I couldn't find my usual moisturizer, Garnier's Radiant Moisturizing Cream. I assumed this would be similar, but boy was I wrong. I'm not crazy about the way it feels when I first apply it, but that's something I could get over. What I can't ignore is how dry and itchy my face is after it's been on for 6 to 8 hours! Plus after using it for just two days, I've started breaking out. Not sure what they were thinking with this one."
Dry skin - moisturizers - refreshed face and neck !
This Moisturising cream is great for any skin problematic areas it will do the job and make you feel and look great
I love the way it feels on my skin....cool and moisturizing. I will definitely keep purchasing this product.
The Garnier skin active moisture rescue refreshing gel cream for dry skin does work and moisturizers it
I love this product! Very light weight not oily and lasts! A little goes a long way. Very smooth on the face to the touch.
Product works as described. I was very pleased with the results. It was easy to use snd I would highly recommend it. Smells amazing!
This product smells really good and feels refreshing on my face. It is great for really dry skin and a little does go a long way.
It isn't too bad for the value to product strength. It feels good on my dry skin. Recommended for dry skin.
"This does hydrate the skin wonderfully, but all the alcohol in it irritates my skin. Any acne and rosacea I have are emphasized."
"Great. Love it. My husband had me order him a bottle. Hands, feet and any dry areas stay moisturized for 24 hours, which is why I will reorder."
"This isn't what I expected. It leaves my face noticeably shiny and I don't wear makeup, so my face looks oily. It isn't very moisturizing either. Garnier products are usually awesome and I'm very disappointed with this."
"I use this for my dry skin, keeps it moisture, refreshing, smells nice, buy from anywhere"
Bought this a couple days ago I love you it !! BUT I feel I have something heavy on my face .!
My favorite moisturizer but it's very expensive for how little you get
"This is good, it's refreshing and soothes my face a little cause I have really dry skin."
I bought this product and I absolutely love it. I wish it came in a bigger container.
I love Clinique's Moisture Rescue But Is was 50.00 and this is Just like it for 6.50.
This cream works as it said. I feel little bit burning on my face after applying.
"Works just as well as the expensive brands, there is no magic cure other than surgery!"
Great product! Leaves my skin feeling refreshed and so clean! Great price for such a high quality product!
amazing for dry skin!! makes my skin feel so smooth and moisturized. i use this in the morning and at night. the packaging is adorable as well
nice gel product. horrid smell. I liked an older formulation. This one is going in the trash.
This cream works as it said. I feel little bit burning on my face after applying.
"Works just as well as the expensive brands, there is no magic cure other than surgery!"
Great product! Leaves my skin feeling refreshed and so clean! Great price for such a high quality product!
amazing for dry skin!! makes my skin feel so smooth and moisturized. i use this in the morning and at night. the packaging is adorable as well
nice gel product. horrid smell. I liked an older formulation. This one is going in the trash.
