"This stuff is actually extremely affordable which is always an amazing start! I suffer with dry skin so I'm always looking for new products to make my face feel that little bit more moisturised and hydrated... this for succeeds at doing that! It applies great on the skin and doesn't dry you out at all, it's gentle and actually doesn't make me breakout which is a miracle in itself!"
I've been using this product for over a year and I'm starting to think I'm an addict! I have super dry skin and I apply this every morning before I leave the house as it's the only thing that stops me from looking patchy. Are you guys giving away a lifetime supply? Because I could definitely use it!
"If you have dry skin give it a try, works well under makeup too!"
I use this as my morning and daily moisturizer. It's not too thick to use before I apply my makeup and the gel consistency feels amazing on my skin in the mornings. The smell is very nice but it's not too overpowering. The only downside is how fast you go through the product. I'm almost done of my second jar.
"I have yet to try s Garnier product that I don't absolutely love! From shampoos to conditioners, to masks and creams. They smell good. They work well. They're inexpensive. Easy to find. I highly recommend Garnier products and will definitely buy again"
Love this product so much! It's my daily day/night moisturizer. I use it on top of my Korres oil and it works wonderfully. The container is thick glass which is amazing considering the product is only $8 at CVS! The product is not heavy at all which is abnormal for most dry skin creams. It glides on and immediately absorbed into the skin. It's also never clogged my pores.
"I love love love love this I use it everyday and twice a day in the winter my skin is dry an this really helps keep it hydrated an plump. It's better than a cream because it doesn't leave a heavy or greasy feel like creams, also it does not clog my pores. You need this if you have dry skin!"
This is the most amazing moisturizer ever. It's a feel and not a thick cream. I prefer a feel and this texture is perfect. It absorbs into the skin nicely and doesn't leave it feeling sticky at all. It feels like a light moisturizer but really gets the job done.
I am in love with this cream. I will buy it agAinð
"I really like the way it moisturize my skin. It makes my skin hydrated. My skin can absorb it very quickly. However, I need to reapply it every 3-4 hours when I stay in the room which use air conditioner because my skin become dry again. If you are not bothered by applying it several times, you can pick this product up."
"When I first bought this product, it worked SO well! I was very impressed and my skin looked amazing! Now that I'm half way into the container, my skin began peeling and now it's drier than I first started with this product ... I ended up having to switch back to my old moisturizer to get my skin looking normal ... Very disappointed."
"This is my third jar this year. I could not have made it thru the summer months without its cooling and moisturizing effects. I will see how it goes for the rest of the year, but for now it is my favorite. I love how light and refreshing it is and my skin just drinks it in, making my skin feel smooth, moisturized and refreshed all day."
I've been using this product for a couple of days and so far so good. It hasn't caused any breakouts and it feels very refreshing when applied.
Nice for the summer and people with more oily prone skin. Quenches skins thirst without leaving a greasy feel.
"Super soft and smooth on skin, great for those who have really dry skin especially during the summer, this is a must"
I love this product it feels great for my face and I would recommend it and It meets my expectations and I would not improve the Product
Absolutely amazing !! Lasts for a long time as well as leaving my skin feel amazing !
"I Love this, it really helps my dry skin making it feel really smooth. For the price I'd say it was definitely worth it !"
"Good for dry skin, very light and spreads well on the skin and your skin . It does not have a storng perfume smell."
Its a really good moisture and I will use it once a week after I do a face mask because my face is already oily and when I do a face mask it gets dry
The best face moisturizer for dry skin! My face is so dry my nose flakes up at the corners (gross embarrassing) this kills that with no problem!
Amazing!!! Nothing has kept my skin as moisturized as this product. I highly recommend the Garner gel creams.
I liked this cream very little I felt that it did not help me much even though it is in gel I felt my skin a bit oily
Been a fan of this for years always liked it very good for your skin not expensive always satisfied with it
my sister I always see her using her and she is very good since she has largely solved her problem of her dry skin
I have super sensitive skin and it got irritated a bit by this cream. Its quite moisturizing though and smells fresh.
It didn't work as well as I felt it should have. My face was still dry a few multiple uses. It was somewhat sticky. I would not purchase again.
I love love love this moisture gel!! It really is refreshing. It just feels soo nice on the skin & make my facial skin so supple & hydrated. I always repurchase when I run out! I cannot rave enough about this product. My absolute favorite !!
I really like this Garnier moisturizer for the whole face and neck. It's very smooth and leave sour skin feeling nice and soft. Bonus is it smells great too!
"This product is amazing, I use it as my everyday moisturizer! I wash my face with the Bioré Charcoal facial wash and use this after and it locks it in for hours! I wake up feeling refreshed!"
"I was not impressed with this at all. Not only did it not help with dry skin, but it was not even great on areas that weren't dry. I purchased it once and never again. I gave away the remaining product, it just wasn't worth using."
All time favorites I use before bed when I wake up before make up after make up! If you want to start moisturizing you're face more often this is the perfect product it's gel so it's not oily at all.
"it was a fine product, but i didn't continue to use it. it made my face look oily, which it's already like that on its own. but i've heard from friends that it works for them. probably just my skin type"
Because I have a very dry skin this cream was amazing. Refreshing the skin and I'm so thankful. I recommend this gel cream for dry skin. It's very gentle and easy to use. I'll buy again.
Garnier skinactive Moisture is just perfect not too heavy not too late with just the right amount of moisture to keep your hair looking subtle and controls flyaways and split ends
it restores moisture in your face and hydrates but i didn't like the way my face felt after applying it. my face felt almost oily. i would recommend if you're in a hurry to hydrate your face but other than that i would not recommend.
Great product! Skin was absolutely super soft when I was done with this. Product is easy to find in stores which is great price is minimal I'm not outrageous. Would definitely recommend this product
"I usually have combo skin that leans a little dry, especially in the winter months! I prefer a lighter, feel like formula for a “day time” moisturizer. This moisturizer is perfect for that! It keeps my skin hydrated even in the Minnesota winters."
I buy this in the summertime because it's a gel so it's pretty light. I have dry skin all year round so I need something that hydrates but isn't too heavy. It absorbs quickly and doesn't leave a sticky feel on my skin.
"Good moisturizer, I like to use it when my skin has broken out, it helps to calm it. However, it makes a very bad base for makeup. Makeup flakes and looks very bad."
I bought this at the store earlier & just tried it for the 1st time after washing off my makeup & it left my skin looking hydrated! Not only that but it's not as dry anymore & my skinoops & feels really smooth!
All winter I had tried to find something that would make my face feel amazing all day without it going back to dry and itchy half way through the day. This did it. It's honestly the best moisturizer I have ever used.
Very effective!
"I gave this gel cream a try because I didn't want to spend too much money on a high end product. It comes in a glass bottle, which I love. It is a pink gel, not too strong of a fresh scent, and I absolutely love this moisturizer. It goes on smoothly onto the skin, and it leaves my face feeling fresh, smooth and hydrated. I do not regret buying this, I have bought two more containers, lol."
"I LOVE this gel moisturizer. It doesn't feel thick or heavy, and glides on easily. It works perfectly for a moisture barrier before makeup, and gets semi-tacky for a smooth foundation application. This moisturizer gave my skin a lovely and natural glow and seemed to hydrate my skin all day. Highly recommend."
"This is such a great moisturizer for its price. I have super dry skin and this just make it go over. It actually absorbs into my skin, not sit on it and washes off. My skin always looks radiant when I use this. I even use it on my legs, knees, elbows and other really dry patchy areas on my body. I highly recommend this cream."
"I have sensitive, combination skin. If I treat the oily acne prone areas, the rest of my face gets super dry and flaky. I saw this on the shelf and decided to give it a try. I love how quickly it absorbs, and doesn't leave oily spots! I actually scraped out the jar before recycling it, and will be buying more. I have NEVER finished a skin care item before it expired or got old. EVER."
"First let me say, that when I first tried this, I was not really sure that I would like it. I was always so used to a face cream having a creamy consistency, so the gel surprised me. Secondly, it does not have the feel of a gel, it glides on like a gel, but absorbs quickly and without a greasy feeling at all. My skin felt great, and I must admit that I was surprised that I would like it so much. I highly recommend this to anyone. [This review was collected as part of a promotion.]"
I was looking for a new moisturizer. I tried the Garnier SkinActive Moisture Rescue. The texture of the product is more like a gel instead of a lotion. I have dry skin and it leaves my skin feeling great. I will continue to use the Garnier SkinActive Moisture Rescue. [This review was collected as part of a promotion.]
"So after using Garnier skin active moisture rescue for a week my face feels Great! I was surprised when I first put it on, it felt that it might be oily but was quite the opposite. It is refreshing to use and has a lovely scent that's not too over bearing. I love using this in the morning, because it kind of has that cooling sensation that just makes you feel rejuvenated. It's doing wonders for my face! [This review was collected as part of a promotion.]"
I liked the cooling effect that this product has. I used it on my arms and chest after sun exposure and it felt better. It was better than using sticky aloe. Overall I really liked this new product and had no reactions even though I have very sensitive skin. [This review was collected as part of a promotion.]
"I havent been using this for a long time at all, but I can already tell that I'm going to love this! I love the cool sensation it gives my skin. I have rosacea and sensitive skin and this doesn't irritate it at all! My skin has never felt better and I will definitley continue to buy this product."
"I have dry skin that is also prone to breakouts if I use too heavy of a moisturizer. This is the only cream I've used that effectively hydrates my skin without breaking me out. I've tried many other gel creams including much more expensive brands, but I keep coming back to this. Nothing works better."
I didn't like this product. The hydrated feelong doesn't last. It feels heavy and doesnt smell great. Has a platic feel and smell
Really helped my dry skin be not dry skin it was gentle on my skin and it worked effictively it also had nice packaging
life is just long enough to be able to get a couple pair of the most important thing is reminds us that pretty much.
Final step to my daily skin care routine and I wouldnt miss it! Leaves my skin feeling soft and supple
This product is wonderful! I use it in the mornings and at night. It has become one of my MUST HAVES! I Recommend it to everyone that I know.
This gel cream is great it leaves the skin feeling moisturized but not oily or greasy and makes skin looked plumped
"I love this gel moisturizer! I have sensitive skin and allergies. It is lightweight, cools skin and no heavy lingering scent"
Very refreshing and easy on the skin doesn't dry you out nor does it leave you feeling oily it's perfect for all skin types.
"Love how it's pink, and it feels silky and rich, very classy i always apply it before makeup and after i've cleanse my face!"
I highly recommend this toner. I feel like it actually works on my skin. plus it helped with some of my stubborn acne!
"This is an amazing product, this is just excellent I recommend it to everyone who wants to look magnificent"
"This definitely helps my skin, especially during the winter! Helps it feel moisturized and hydrated! I love the smell also, so that's a plus!"
I didn't find it to be as moisturizing as I would have liked. Will purchase again in summer when skin isn't so dry
"Smells amazing, looks amazing and definitely is amazing! Instant results, made my skin feel amazing!"
Found this as alternative to Clinique Moisture Surge. Nice light moisturizer for the summer though too heavily scented.
I love this moisturiser as it is incredibly cooling and refreshing. my mum has just started using it aswell and it is a great deal for the price.
This gel makes my skin feel very moist and hydrated. I have used this several times. My skin is very dry and I put this on before bedtime.
love love love this product. it does exactly what it advertises. I just wish it soaked into your akin instead of leaving it greasy
This is very Non greasy which I like but sometimes you need to feel moisturized. This evaporated quickly and hydrated but doesn't leave my skin glowy
Love how soothing this gel cream is! Soaks in deep to moisturize and has a cooling feel to it that doesn't tingle or burn.
It felt like Clinique water surge. Maybe it is good for california summer. It does not work that well fir dry winter days.
"Love this product , garnier has some great products . This product is great for my skin. Has a great texture. Very small amount needed."
"Super good one leaves my skin so soft and hydrated and good, I swear it's the best, really love them so much"
"I am currently using this. It has a cooling feeling, so I prefer to use it during the warmer months. I have re-purchased it."
This is amazing! I love the smell and how light it feels on my skin! It helps reduce redness as well!
"Great for brightening skin, I use it under my eyes when they feel dull. Can be drying sometimes so I use another moisturizer with it."
My skin gets so dry during the winter and this product helps moisturize my skin and keep it feeling soft and smooth!
I use this as a nighttime cream to help like moisture my face also want it works great as a primer before my makeup love the smell of roses
Very good! smells really good and also feels good on skin. it‘s very gentle and definitely met my expectations
"Love this! I have super dry skin and when I put this on it feels so nice, it's like a drink for my skin! Plus is smells great."
It is not what I expected.. Not completely satisfied. My skin got oily and sticky.i wouldn't use this product again.
This is been my favorite moisturizer for 2018. It works very well it smells nice and it leaves your skinFeeling refreshed and super moisturized. I feel like it's good for sensitive skin and people who struggle with eczema
Breaks me out like crazy. Clogged up my pores... I wasn't surprised though every time I use their skincare it breaks me out and it sucks to because they are very well priced :(
This moisturizer okay. I have really dry skin and i feel like it doesn't really moisturize all that much. It smells nice and the packaging is pretty though. It's gentle but I think it kinda breaks me out.
My skin is really dry from the cold weather and it's getting already better after 2 days. My skin feels soft and good. [This review was collected as part of a promotion.]
"This is the only moisturizer I can use on my dehydrated skin without breaking out, and I've literally tried everything else out there. Thank you, Garnier! Please don't ever discontinue!"
After using the product I can honestly say my skin feels much softer. My face has sun spots and damage due to me tanning in my teenage years and was always dry. Now it feels GREAT!!! [This review was collected as part of a promotion.]
I have been using the Moisture refreshing gel for months and I tried to go w/o it for a few days. I missed it. I love this product. It make my skin feel so refreshing!
I bought this 2 days ago and i can totally feel my skin more refreshing and less dry. I saw results with just the first application . It's amazing and I will definitely be getting more of these when i run out!
"This is great, especially in the warmer weather. Light and cooling, it glides on and leaves the skin feeling fresh and soft. A little goes a long way. I love it"
"I just bought this product about two weeks ago and my skin feels and looks so much better. I had very dry skin on my face, especially between the eyes and on my nose. I use this twice a day and the dry skin is a thing of the past. I LOVE it! I will never buy anything else again. Thank you so much Garnier!!"
"I loved it work so well made my face feel great and it was so refreshing, packaging was nice loved the colour, I was pleasantly surprised about how much I liked it and how good it made my face feel, good for the prize and its not to smell or too big so its great to travel with!"
This is so helpful for people with dry to normal skin! It hydrates the skin it feels so refreshing!! I have used it many times but I have kind of oily skin so didnt work so well on me but i gave it to my sister whose have a dry skin and she adore it! Her skin looks so healthy
This is one of my go to summer moisturizers. It's great in spring when your skin is still dry from winter but it's too warm out for a heavy moisturizer. This is light and so moisturizing. I have been using this and the green on for years. This is for dry skin. The green is for combo normal skin. I'll continue buying!
"I like the gel consitstency of this moisturizer, but I would like if it was a little bit more moisturizing. It's definitely good for the summer, since your skin doesn't need as much moisture, but I wouldn't recommend for the winter months. Overall it is worth the price, and very affordable!"
"I've only just began using this product, and I already love it. My skin is sensitive and dry, and this has brought so much moisture to my skin. I put it on at night and in the morning after cleansing my skin and i've noticed a huge difference. My skin is baby skin soft, and this has really exceeded my expectations. Especially for other products in the same category, you can't beat the cost for this product."
This is a skin savior in the winter time! This was the first moisturizing gel cream that was released in drug stores as far as I saw. It is cooling and refreshing. Skin absorbs the product very nicely. You feel the moisture all day long even under make up. A little goes a long way. Find at cvs or target.
"I was impressed with the color and look of the Garnier moisturizer, but when I put it on, I loved it! Absolutely love the texture! It's not oily and you can feel it soak into your skin. There's no oily, sticky residue. Great product! [This review was collected as part of a promotion.]"
"I was pleasantly surprised with the Garnier gel cream. It's consistency threw me off a bit but I loved that it was a gel and not an oily cream. I find most creams are too oily for my skin but this gel was perfect and my face felt so soft afterwards. It has a nice, soft pleasant smell to it, which diminishes after a few seconds. The container itself is very nice and feels like a fancy department brand. I plan on making this my go to moisturizer! [This review was collected as part of a promotion.]"
I've been using this everyday since I received it and I can feel and see a difference. My face is much more hydrated and softer. I've been looking for something to smooth out my skin and keep it hydrated. My only complaint (which is a minor one) is the packaging. I went on a trip and took it with and when I got to my destination the product had gotten all over the inside of the lid and it was a mess but other than that I love this stuff! [This review was collected as part of a promotion.]
"I think the cool and refreshing gel is perfect for hot and dry summer in California. The scent is refreshing but doesn't linger, which is very good with any kind of cosmetics that I apply on top of Garnier Skin Active. Skin doesn't get greasy, so it does not affect my sunscreen or foundation. This is my 3rd week since I started to use the product, and I am already thinking about buying the next one in the store soon. [This review was collected as part of a promotion.]"
"The product is in a nice jar, it looks upscale. The gel is different, kind of weird. I'm not a fan of the texture, kind of hard to describe, maybe you would say gooey. Once you put it on it feels fine on your face. It soaks in quickly. It seemed to do a good job of moisturizing. Has a nice, soft smell to it. [This review was collected as part of a promotion.]"
I have extremely dry skin. Even in the summer. So I'm always on the hunt for a great product to give me super moisture. This product does a good job. It sinks right in and my skin doesn't feel right. I actually love it as a makeup primer. My only gripe is the scent. I wish it was unscented. It's too overpowering. [This review was collected as part of a promotion.]
"I've used this brand's gel cream before, but never this one that's formulated for extra dry skin. It works wonders on my skin and gave me a healthy looking glow. I couldn't stop looking at my face. It was lightweight, hydrating, and definitely gave my skin the moisture it needed! I wear this under and in combination with my Garnier skin actives spf moisturizer and they work well together. [This review was collected as part of a promotion.]"
"The moisture cream that I've been testing for the last couple of weeks has been decent. It's not my favorite in the sense I've liked other gel moisturizers better, but this one isn't terrible especially for the price. I have terribly dry skin and though this seems to feel hydrating and doesn't make me feel greasy, but yet I feel like I needed just a little bit more of a thicker consistency for my skin to feel smooth and hydrated. [This review was collected as part of a promotion.]"
"This Moisturizer is not my favorite one. The smell is pleasant, its not strong or overpowering. The feeling is smooth, but heavy. It is tacky once on and heavy feeling. It feels like having a think gel that does not absorb well. It does moisturize very well and the next morning my skin was really soft. But I am not a fan of the feeling when you put it on. [This review was collected as part of a promotion.]"
"This product really seems to help moisturize my dry skin. Living in a dry climate, I'm always looking new ways to make sure my skin isn't dry. My only concern was that my skin is really sensitive. It did surprisingly well. [This review was collected as part of a promotion.]"
I have always struggled with dry skin on my face. I have tried several products. But they all felt like they weighed down my pores and left my face feeling greasy. When I tried the Garnier Moisture Rescue I was pleasantly surprised it left my face feeling soft and just the right amount of moisture and best part no greasy feeling. [This review was collected as part of a promotion.]
I tried this moisturizer twice a day for a week and it was marvelous! I have some bad trouble spots of dry skin on my neck and face. They were resolved within just a few days. It also has a fresh feeling and didn't leave my face shiny or oily after application. The fragrance is pleasant and not overwhelming. [This review was collected as part of a promotion.]
I think Garnier Moisture Rescue is a great product. The gel moisturizer leaves my skin feeling dewy and not sticky. It is absorbed quickly and I love the way it leaves my skin feeling. I was so excited to try this product since I love to try new products to help my dry skin. Garnier Moisture Rescue has a very light and fresh scent. I am pleased with the results I have seen to my skin since I started using this product. [This review was collected as part of a promotion.]
"I was so excited to be able to try this, as my skin is incredibly dry. It's a nice, thick, gel that smells excellent. To me, it smells fruity. It just gives a light scent. It feels cool on my skin and instantly hydrates. I especially like putting it on before bedtime, the scent is soothing to me. After using it for over a week, twice daily, I feel like my skin is softer and not as dry. I love this product! [This review was collected as part of a promotion.]"
i really liked this product. It's easy to use ( i leave it by the sofa for when im watching tv) and i feel like my face did feel softer after a couple of uses.plus it smells good. definitely going to keep using this product [This review was collected as part of a promotion.]
