4.4,"['208', '91', '32', '11', '8']"
I bought this about a week ago and I was very skeptical about it because most moisturizers leave your skin looking like a grease ball if you have dry skin or you will still have a dry patch of skin . But my skin seems to react to this very well it leaves my skin hydrated and my make up lasted longer with it too which is a double plus super happy
"I've had a lifetime of allergies and most lotions irritate my skin. This one does not. It's a cool gel, almost like aloe vera and it glides on smoothly and your skin is left soft for the whole day. Normally I'm reapplying other lotions several times throughout the day but this has rejuvenated my skin. I love it!"
"I do not have particularly dry skin but I love Garnier products so I thought I would try this moisturizer because I like Gel type products on my skin. I love how light weight it feels on my skin, and how it doesn't leave my skin feeling greasy at all. It also provides a really nice base for my foundation to go on so I have stopped using my primer. I also got a little red after being in the sun this weekend and so I applied this at night and when I woke up the redness had gone and my skin didn't feel at all tight or dry."
I love this gel-creme from Garnier. It works as well (if not better) than the department store brand I have been using that costs 3 times as much. It is fresh and clean smelling and sinks in quickly so I don't have to wait a long time before putting on makeup. It erased the redness I had from my skin being dry in just 2 applications. I'm going to use this rather than the department store brand from now on.
I was pleasantly surprised by this product. I had never used a gel cream for dry skin. I'm actually used to medium to heavy facial creams and thought that was the only way to go for soft skin. But this product has definitely changed my mind about that. It's very light and refreshing to your skin. It rubs in very quickly unlike some lotions. And it doesn't feel like it's just sitting on your skin and just making it shiny. After you rub it in you'll notice how soft your skin feels. I would definitely buy it again.
"Started using this about a year ago. Really love it, replaced ""Origins"" with this brand and very satisfied at a lot less expense. Have already told all my friends tool"
I like this moisturizer. It goes on with a refreshing cool feeling and doesn't feel like you have anything on your face after - your skin just feels smooth and moist. The only thing I didn't love was that I can't wear it under makeup during the day. It just got kind of peely when I put makeup on over. Since I do like it though I will continue to use it at night.
"My face in never hydrated and I am always changing my moisturizers out trying to find the next best thing. I was a complete skeptic when I realized that this was a gel. When you think gel, you think about drying out, not moisturizing. To my surprise, it actually does moisturize and did not dry me out. It has a tiny bit of a cooling sensation that feels good on the skin. I am looking pretty hydrated these days."
"Pros: My face felt well hydrated and not like it was covered in goop residue. Cons: This stuff looks, feels and smells just like hair gel, it felt weird spreading it all over my face. No pro-retinol or alpha-hydroxy. All in all it was just ok. Not sure I would go for it again."
"I am not used to gels, so I wasn't a huge fan of this product, I am more of a lotion user. Pro's to the product: is not greasy, cool feeling. con's: kind of sticky. Does hydrate your skin and is refreshing (which comes with a gel feeling), however gels are not for me."
Feelss grwat on the skin and doesnt feel greasy at all. I have oily skin and I dont recommend this for dry skin at all. I feel thats more of a marketing tactic. It absorbs super quick but my skin feels like it wants more
"This gel is nice upon application. It feels cool, smells nice, and it doesn't feel sticky (dries off pretty quickly). I have combination type skin, so it is pretty moisturizing on certain areas. But for some reason, towards my lower cheek areas it still feels dry and is not as hydrating as I would like."
"I thought it was a pretty good product. I tend to prefer creams rather than gels, this is more a gel than a gel-cream and it felt at first like I was putting hair gel on my face! but yes its does a good job moisturizing, not the best facial cream I've used but for the price it's great value."
"I have to say that I do not love this. It feels really great and refreshing and I like that it is not heavy on the skin, this way I can wear it at anytime. I don't however like the alcohol scent. I think it is so strong that I rub it on my hands and air it out a bit. After that, I apply it all over my face and once the alcohol scent goes away, then I can appreciate the actual scent of this moisturized. Other than that scent, I like this product and I would like to use it without having to air it out."
"I love the Gel type cream. Goes on smooth. I have perfect skin for a 73 year old, but thought it was time to start taking care of it. Never a zit before, and evidently this added too much moisture.....because I got two whiteheads. Will only used every few days from now on."
"I have combination skin, and this moisturizer has been great! The gel is light and absorbs qickly without leaving my skin feeling greasy or weighted down by products. I really enjoy using this after washing my face allowing for easy absorption and all over moisturizing. Highly recommended!"
Garnier moisture gel-cream is nice cream especially for dry skin. It is very light and spreads easily on the face so it easily goes with any makeup. Its not too greasy. After using this product for more than couple of months i feel it made my face even smoother and soft.
Perfect for getting your skin back to tip top shape! Im a repeat user and find this product so good for my skin. The price is great and the packaging is very nice
"This is a product I really liked I just wish the size was bigger because I feel like it ran out pretty quickly since I would use it morning and night. I love the scent, and because its a gel moisturizer it never felt to heavy on my skin."
I have dry skin and use moisturizer every night before bed and in the morning after I wash my face. I like this product a lot because it wasnt too heavy on my skin and I actually felt like it worked and wasnt greasy which is something I need in a moisturizer. I would recommend!
Very happy with this product after done using it your face literally glows it was my first time buying it it was super effective I loved it not disappointing at all super gentle and it would give your have a nice pull. I really loved this product 10/10 would recomendable.
"I love this product, it's the same as the clinique brand but this is so affordable!!! Very effective!! As soon as I put this on my face, my skin absorbs it right up!!! Especially on a warm day, the gel feels very nice!! Packaging is pretty. Again, it would be better if it contained sunscreen."
"I bought this cream in winter when my skin was a bit dry, it smelled amazing and I loved the packaging, usually i do really good with garners products. But for some reason this cream didn't do it for me, I had major breakouts and the cream only functioned as a layer on top of my skin it never absorbed, i was really disappointed."
I really liked this gel cream. I came with an opened mind not expecting much since most don't work but this one mett my expectations. It didn't leave a sticky residue behind. The formula had a good consistency. It also smelled very appealing. I would deffinatly recommend to others.
"This face cream feels so amazing on the skin. It immediately calms the skin and feels very hydrating. I used to use a very expensive face cream with a similar texture, but I am now able to get 3 tubs of this cream for the price of 1 of the other! it is just a lovely face cream and I highly recommend it!"
I'm an avid user of the combo/normal moisturizer but I was too dry during the winter so I decided to give this a shot. It's not as light and leaves me a little too greasy. It does not work well under makeup. I wouldn't buy this again but rather my trusty combo/normal one.
I really like this moisturizer so far. It reminds me of the Clinique moisture surge like a total dupe. My fave feels very hydrating definitely effective. I will definitely be purchasing this again highly recommend
"I have dry skin and this product was moisturizing enough to last through the day, but lightweight enough not to leave an oily residue or finish. I would recommend this product for normal to dry skin. I also love the clean and refreshing scent."
If you are looking for a cream for dry skin. Then I would recommend this. It is very light and spreads well on the skin and your skin will feel hydrated. Also it does not have a dtorng perfume rather it has a very light fruit like smell.
"This was so refreshing on my skin. Not only that, but it smelled amazing! Id have days where my dry skin needed that little extra love, and this left my skin glowing! one of my favorite affordable moisturizers."
"Product wise - this is a good product. It smells nice and feels good on face. My face was dry for few days but after two days of applying it, it starts to show good progress. Now, my skin is smooth and moist."
Good product. Easy application. Glides on really well. Handy. Met my expectations. Good packaging. Well suited my texture and tone. No improvements required. Quite gentle tooo.
"I have rosacea and this is the only moisturizer I can use that doesn't set my skin on fire. Gentle and does not make my skin oily, which it naturally is. [This review was collected as part of a promotion.]"
"very reasonable price, refreshing and effective moisturizer. use a little on larger face areas and a tad more around the eyes and lips. I can feel my skin is supple HOURS later. smells nice, it is a gel. I will be 65 and I love how it feels"
Nothing new to add that others haven't already said - a light gel that spreads well and dries fast and moisturises the facial skin well enough. Smells fresh and the scent is light - great as night cream / gel.
It's a great gel cream. It's not greasy or thick. It's quiet smooth and smells very refreshing. I use it as a moisturizing cream. It doesn't look oily and makes my face look good. I like it and worth buying it.
I love how smooth the texture of the product is. I am a person who has very dry skin so this bbn product brought oils to my face that helped me from breaking out. It is a great value it is the drug store pricess that keeps me going back to get this product
"I have a little dry skin sometimes, this cream has helped me feel hydrated all day. I've been using it for two weeks and it's really good and its packaging is nice, small and compact. Garnier SkinActive Moisture Rescue Refreshing Gel Cream for Dry Skin"
I like it so much are you ready to fight you to buy right now it's amazing amazing amazing and the really really really beautiful product and the packaging my God I really like it I really device you to buy it right now please and then amazing product
Probably one of my favorite gel moisturizers for the spring/summer. I'm not a huge fan of the packaging (jar) because it's not practical for a lazy gal like me where I use my hands for everything and can't be bothered to grab another utensil to slather the product all over my face. I wouldn't necessarily say that oily/combo people couldn't use this... you could really use either one - there's a green one meant for oily/combo skin.
"I love this product. I use it daily, two times a day. I've been using it for about 6 months, and continue to use it. I wouldn't change anything about this. The packaging is very nice and cute. It's got some weight. I will continue to buy this product!"
I really like this stuff!! A little bit goes a long way too. It feels moisturizing but it doesn't feel thick and heavy on your face. Which I really love. It's definitely gentle on your face and it's not super smelly or anything so it just feels clean and refreshing.
"I love using this moisturizer, even though I have oily/combination skin. I can get away with using a smaller amount and the gel texture doesn't clog my pores. The availability at the drugstore and the affordable price point is a huge plus too!"
"I love this product! In the winter, it helped my dry face with burning or feeling greasy or sticky. I feel like it even helped eliminate breakouts. Because it is a gel, I was skeptical but it's great! I will buy it again."
"I love this product. I received it as a gift, and continue to purchase it when I can! It leaves your feeling super energized and refreshed. I recommend it!"
"I liked this product because Ive suffered from dry skin around my forehead area for a long time, but this product really helps. You start seeing results very quickly!"
"This product was great, however I have really dry skin so i felt as though my skin dried up and absorbed the cream really fast, it was quite gentle on the skin though. Afforabke price."
What I like most about this product is it didn't leave any sticky residue on my face I would definitely recommend this to anybody who has dry skin I was not disappointed it was definitely effective and very gentle for my sensitive skin
This is the best moisturizer I've ever used. It goes on nice and cool and feels amazing. I put a little extra on and let it seep into my skin. I have oily skin and it never makes me greasy. Just a tiny bit goes a long way. Love the packaging too!
"I am 47 and my skin has started drying out. This is the best product, and I have used many brands and many types. I use a small amount and it completely covers my face. I feel hydrated all day, instantly. It isn't greasy, doesn't cause my skin to break out and I can see a difference! . My skin even feels better to the touch! [This review was collected as part of a promotion.]"
"After pregnancy my skin developed an extreme sensitivity to almost all moisturizers and lotions. I can't even us baby products or hypoallergenic products. A friend let me borrow her Moisture Rescue for a weekend and I've been hooked ever since! I can't say enough great things about this product! ZERO oiliness, NO breakouts, and it really really moisturizes my skin. Before this product I had dry scaly skin on my face and this stuff cleared it right up!"
"I've been through so many different moisturizers and this one is my absolute fav. Other moisturizers tend to break me out, but this one is super lightweight but provides the perfect amount of moisture. No lie, I've used over 10 of these and will continue to buy more."
"Bought this a few months ago because my face has always been dry, I would use it here and there and liked it, however now that it's creeping into winter my skin is very dry and I'm trying to use it every day, and I see a huge difference! I can tell when I go too long without it! Works AMAZING for the price. The only caveat is that it's not something that I think should be worn under makeup, so only use it at night or on days where I'm not planning on being out much!"
"This is my 4th day using this product for dry skin and ladies I will admit that my skin absolutely LOVES this gel-cream!!! I have extremely dry skin and it does exactly what it says it does, ""locks in moisture."" I use this gel-cream everyday both morning before applying my makeup and at night after I have cleansed my face. LOVE, LOVE, LOVE!!!"
"I love this gel so much bc I have dry skin, and my skin usually feels very greasy when I apply lotions. I love that it is light weight and actually makes my skin look healthy and radiant. The only reason why I am giving it 4 stars is bc the product does tend to run out fast."
"This product felt great at first application, light, cooling. But within 5 minutes my face felt like I had dried glue on it. I had to wash it off. I'm not sure what that is about that the face doesn't remain feeling moisturized........but I'm bringing it back. Fail."
"I absolutely love this product! Winter has been harsh on my skin but this gel has worked wonders. Personally, I think it smells great. At first it was a little weird using a gel as opposed to a lotion but after application, it dries nicely and I love the feel of it. I really can feel a difference since I first started using the product to now, and for the price, you just can't beat it. My only complaint is that it doesn't come in a bigger size."
Worked great will buy again. Loves how it helped my dry skin. The price was a good price I would say for skin care. I would like it if it was a little cheaper. It met all my expectations. The package was nice. I highly recommend it to others with dry skin.
Super soft and gentle cram for smooth and refreshed skin. It has nice packing. I used it for the first time and I will buy it again. It has good value and it's affordable. I will definitly become repeat user. i recomend it to all my friends with dry skin.
im in love with this product its just amazing like I can't even describe how effective it is I recommned this product and yes it did meet my expections its perfect I would totally. buy it again okay each one of us will love a product but try this one its amazing
This product is my all time favorite. I use it all the time. It is so effective and I love it so much. I can't live without it. It is gentle on my skin and feels so nice on my skin. It is a must have in my household. I would recommend this to all of my friends.
I do not use this product year round but I do like to use this during the dry winter months. Garnier is an affordable brand that I find to be reliable and trustworthy. I love how hydrated this makes my skin feel when it gets dry due to chilly winter weather.
I LOVE this gel cream. It is very light and refreshing. Its cool so when you put it on it makes you feel fresh and awake. My skin feels so soft after the first application. Unlike most moisturizes this one doesnt feel thick and coated. Also has a nice smell! Love and great product for the price!!
I used to use this years ago for my dry skin. I like how it felt on my skin and I would say it is effective. I stopped using it because I found an alternative. The product is gentle on the skin and I used it twice daily! I would recommend it if you have dry skin.
"don't sleep on this moisturizer, it quickly absorbs, without leaving that thin layer or product that sometimes ends up being the reason your primer/foundations ends up looking patchy. not this stuff. it's gentle on acne, just a little sting, but definitely leaves you feeling that locked in moisture!"
"its very very nice and very very light weight, if you are searching for something that is very nice to apply this is the best product for you guys its very gentle you must try this one, you will never regret that you use this kind of product from yours truly garnier"
"This is one of the absolute best creams I've ever tried. Really locks in the moisture, absorbs very quickly, weightless, my skin feels fabulous! Texture is different from creams, but I totally love it. I have extremely dry skin and usually have to keep applying cream throughout the day, not the case here, once in the morning and once at night is sufficient. One thing I am wondering thou if this has SPF, does not say it on the box (or I have not found it), that would be and improvement. I will be buying it over and over."
"My favorite, by far, off all of my moisturizers. It's not greasy, gives a fabulous non-matte look and I love the way my face feels after."
"I love this product. It is so@lightweight but moisturises so well. My skin feels really smooth when I use it, with no greasiness or stickiness."
My favourite moisturiser. I like the fact that comes as a gel and doesnt stay sticky on the skin. Leaves skin very smooth and has a nice smell.
I use this product daily - I have dry skin and this product adds so much hydrating moisture to my face.
Smells delicious and its really smooth! I love the sensation on my skin! Really effective and at a good price! I hope we can get a bigger version of this amazing gel-cream!
"I LOVE this product! It smells really good, skin feels refreshed and moisturized. Its very affordable. Definitely one of my fav moisturizers and its affordable too!!!"
"Really good affordable product, really gentle on the skin not as intense as expectations, would recommend to others with normal to combination skin, i found this product did help with dry skin"
i LOVE this product SOOOOOOO Very much!!!! I use this product ALLLL the TIME! It NEVER has let me down!!! it does the job it is supposed to!!!!!
Love this moisturizer! I find that the gel moisturizer works better for my skin and does not clog my pores like the cream moisturizer does.
Love the fresh feeling I get when I apply this creamer at night. I especially love that its not greasy. Absolutely love!!!
"This stuff smells like Rose's! Very lightweight, Jelly/serum consistancy. Feels Very gentle and absorbs quickly."
"I really like the feeling of this on my face, I got it on sale and a little goes a long way! It leaves my skin feeling nice and soft for a few hours."
this is one of my moms' favorite moisturizers! she always uses it before applying her makeup! it makes her foundation lay on her skin super smoothly
I had very dry skin this winter so some body told me to use it it is miracle love it very smooth cream
this product left my face feeling well hydrated. its comparable with clinique moisture surge in my opinion. And much much cheaper. i'll definitely buy this again :)
I love this moisturizer. I have combination acne-prone skin and this does not make my skin feel oily or cause me to breakout. The moisturizer does not feel heavy and absorbs very quickly
"Lightweight and spreads evenly. Not used to a gel, but works great as a night moisturizer. Dried pretty fast after application and did not feel oily. Gave it an average rating since it is an average moisturizer."
Just started using this product and so far Im loving it! Works well at moisturizing my face and leaving it feel smooth and fresh! No noticeable scent and a great value for at how well it works!
One of my favorites for the harsh winter months or any time my skin is feeling in need of some extra hydration. The gel is cooling on skin and leaves skin revitalized and moisturizer. The packaging is nice too as it is sturdy.
I have repurchased this product multiple times. I prefer a gel over a cream moisturizer. This has a light pleasant scent and leaves my skin feeling hydrated.
"This gel works way better than I expected. You don't need much to cover your face and neck, it absorbs nicely and my face is super soft after. I wish it lasted longer than a few hours."
"I have oily acne prone skin. This moisturizer is great for my skin type! It doesn't clog my pores or increase oil production, but it still effectively moisturizes my skin."
"Really works wonders! Makes skin soft and really moist. The gel works wonders and works for all skin types, being very gentle on skin. However, proceed with caution if using is after exfoliant or a peel. Recommend to try because it really does work!"
I did enjoy this product!! It made my skin feel very nice and soft. I don't know if this was the product or just my own skin but after I ran out my skin started to have a lot of dry patches.
I've been using this in combination with another product for about a year now. I mainly use this one at night. It makes the fine lines coming down from my eyes completely disappear. It goes on smoothly and has nearly no scent.
"IT'S GREAT! It keeps my skin moisturized. Within a week, my skin was starting to clear from my pimples. It keeps it smooth, smells nice, love the packaging. It's very gentle for the face, I have sensitive skin. Most definitely would buy more."
"I just bought this product and the difference in my skin is like night and day. I honestly would wake up with horrendous texture and flaky skin, now using this product my skin is so smooth and refreshed in the morning. Definitely worth a try!"
"Easy to open container, smelled nice, seems like it will last a long time too :) would recommend to anyone with dry skin that actually ""works"" for a living!"
"the gel is different. it has the typical garnier fresh smell, which isnt a bad thing because i HATE musky smelling moisterizers. one of the best drugstore moisterizers ive ever used. def gonna continue to use. very refreshing and instantly my face looked so much more hydrated. if you use this before makeup allow ample setting time and use a primer !"
I would need to try it more to give a completely honest review however I have normal to dry skin. Since it's currently the winter I am chronically battling the drying wind and this felt like my face was drinking a glass of water. Would love to try out more!
I looove this cream so much ! I have a sensitivity skin and dont really like thick heavy or very oily creams! This gelly texture suits my skin perfectly! It smells lovely and leaves skin really brightened and smooth! Love it ! Garnier SkinActive Moisture Rescue Refreshing Gel Cream for Dry Skin
I have very dry skin and this has worked so well for me! I love the gel consistency and it feels so cool and refreshing when you put it on. My face has become so soft with this and I've had it for about a month or so and started noticing results after like 2 weeks. Great price too.
This is my first time trying the pink moisturizer. I usually buy the green one (for oily skin). Both are excellent products with almost the same results. I got the pink one this time as my winter skin is drier. I mix with a facial oil and my skin drinks it in. Love this!
