4.6,"['275', '86', '10', '5', '12']"
I have been using this product for many years. I have normal skin but is very sensitive. It has really helped my skin tone. I have many people tell me my skin is pretty and I'm 72! So glad I found this product and I passed this along to my 3 daughters.
"I have been using this product for many years and love the Positively Radiant moisturizer with SPF 30, put it on first this every morning and need the SPF as i have very fair skin. I also loved the fact that it came tinted and therefore did not need to use make up on a daily basis. I am unhappy that there appear to be a change in the product and am not able to find it with a tint any longer. That is my only complaint and a real inconvenience. Is there a reason that the tint is no longer available? or am I just not finding it."
"I accidentally grabbed this instead of the Aveeno Positively Radiant Daily Moisturizer SPF 30, which I've used for years. This ""sheer"" version made my face way too greasy/shiny! It was awful! I'm going back to the Daily Moisturizer; please don't stop making it!"
I have used the tinted moisturizer for years and now will have to look for a similar product elsewhere. This was a great product and also very popular. Good job Aveeno sending your customers to other companies.
After 2 days using this product I had a burning sensation and a rash all over my face
"After I stopped using it. my face now is extremely dry and my skin is peeling off. As much as I love aveeno,,, this one is not for me [This review was collected as part of a promotion.]"
I love this product but an so disappointed that the tinted daily moisturizer isn't available anymore!
I love these products. I have actually had people tell me that I was glowing since I started using these products (no I'm not pregnant) without being asked or prompted.
"After moving to the desert, I was anxious to try the Aveeno Facial Moisturizer with 30 SPF ( I had been using the 15 SPF). It works just as well and continues to leave my skin looking refreshed. I have combination skin and my face never feels oily or break"
out.
"Yet another Aveeno product that works great with my skin. After a week's use, my skin looks healthy and fresh. My fine lines are becoming less noticeable and positively radiant. I like the creamy and not greasy texture, light smell, and SPF 30 factor of"
this cream. A nice side-effect is that my skin seems to shimmer with this product.
"I am so disappointed in this product. I've used Aveeno daily moisturizing lotion for years. It is the only moisturizer I can use on my fact without an allergic reaction. I was hoping this other product would work. Unfortunately after one use, my face is covered in little itching bumps."
"I LOVE it. I have really super sensitive skin and have tried many expensive products only to look like a boiled lobster. This is great! It is not sticky or greasy, just a light perfect bath of moisture for my very dry skin. It lasts all day and the sunscreen is the only one I've ever used that is soothing. T"
"I have tried this product as well as many others from Aveeno brand and LOVE THEM ALL. Very calming on sensitive skin! No heavy scent, no heavy feel after applying. Id recommend Aveeno brand to everyone!"
I love how my facial skin looks from this product because it has sunscreen and is a very reliable brand. Great moisturizer! I also apply this to the back of my hands.
"Aveeno body wash cleans & moisturizes as well as soothes itching and redness of the skin. My skin is sensitive, pale, given to blushes, blotches, rashes and itching. This wash does help ease these symptoms when they occur."
Lotion is nice as well.
I do not like that their is soy in these products. I like that they are natural . I liked the spf in the moisturizer. Soy for some people with thyroid problems is not good to have more since they already have to much soy in their lives. I also do not like that their is no scent. There are natural scents that can be used.
"Have been using Aveeno products for a long time and I love them! I tried this and had to wash my face after 15 min. The fragrance was overpowering. ""If a little is good, a lot must be better"" should not apply here. And I couldn't get away from it! So had to wash it off. Will return."
The sample was too small for me to test and determine how effective the SPF is. The moisturizer feels very nice and is easier to apply than most thick and cake SPF moisturizers. I would buy it again if it weren't for the strong odor. It's a pleasant enough odor but too strong for a facial product.
"Being a senior citizen, I don't care for moisturizers that leave my skin feeling/looking oily. That being said, Aveeno Positively Radiant Sheer Daily Moisturizer leaves my face feeling moist, light, and bright! It is a tad bit pricey, though, so I use it sparingly, but it seems to last."
Had never tried the Aveeno products previous to this sample that arrived. I am a senior and daily use a moisturizer on my skin. I liked this product so well that I ordered it after using all the sample. It is very light and felt good on my skin. It also left my skin softer after just the first few uses. Great product. Thank you Walmart.
"I used the sample that was sent to me and the next day I went to the store to purchase it! I love how soft and smooth it goes on, 2 pumps is enough to cover my face and neck. This is my new favorite daily moisturizer with sunblock. Great find in my beauty box!"
The Aveeno moisturizer is sheer just as stated which works for me. My skin is normal but someone with dry skin may need a little heavier cream. I love how it just glides on and I absolutely love that it is SPF 30. It costs a bit more than some others but well worth it to me.
"This isn't meant primarily as a sunscreen, but that's how I use it. I like to wear sunscreen every day but many are too thick and hard to apply to delicate facial skin. This product goes on very easily and has a 30 spf . Most moisturizers are only 15 spf."
"This is a really nice everyday moisturizer for a very reasonable price. It's not the most hydrating moisturizer I've ever used, but if you have normal, not-too-dry skin, it should work well for you. It's rich and thick, but it absorbs quickly, it's not greasy at all, and it's got sunscreen. That's a lot of value for the money."
"I did not have high expectations for Aveeno Positively Radiant Sheer Daily Moisturizer, but it was amazing. It made my face super soft and smelled great. Most products with SPF 30 smell horrible and make you only want to wear them when you are going to the beach, but this smelled like everyday wear, which is what it has become. I would recommend this product to anyone that is looking for a face moisturizer. [This review was collected as part of a promotion.]"
Aveeno daily radiant isn't greasy leaves your skin smooth and radiant. Has a light fragrance and works well with all makeup.
THIS IS A GREAT MOISTURIZER LEAVES MY SKIN FEELING GREAT NOT GREASY IT SETS GREAT UNDER MY MAKEUP ESPECIALLY IN THE SUMMER :)
This goes on smoothly and I like the way my face feels. I received this product in my Walmart Beauty Box. I am considering buying it when my current cream runs out.
"I've used this every day for a number of years. I get a fair amount of compliments that I look glowing. I like to think my divinity is leaking, and from pictures of my youth, I have always had glowing skin, so not sure this product"
"I bought your Radiant facial foam cream cleanser, but it seems to dry my face more than softening the skin. Do you carry a foam free cream Radiant facial cleanser?"
"Looking for a facial moisurizer that works with a bit of sunscreen in it for summer... well you found it with Aveeno. If you have sensitive skin, this is a go to..."
"I liked the Aveeno Moisturizer because it's good to use as a sunblock, but also as a facial routine. It helps to moisturize and soften skin after cleansing. I would recommend this product and purchase as well."
I love Aveeno products and this one fits right in. This moisturizer covers smoothly and leaves my skin feeling soft plus the spf 30 helps protect my skin from the sun.
Love Aveeno products and I use this product because it has SPF 30. Some moisturizers with SPF can feel heavy and thick. This feels light and comfortable. I carry a bottle in my beach bag.
This was a nice moisturizer. Being old I get very dry skin and this product worked great for keeping the moisture within my skin. I really liked the product.
The sample came in a small bottle which allows the user to try the product for several applications to determine if the product performs as advertised. Aveeno makes excellent skin care products.
Was pleasantly impressed by the quality and effectiveness of this product. It was the first Aveeno product that I have tried and I will be trying omg others from this line
I liked this lightweight lotion for daily use. It's easily applied not too thick so smooths nicely.
It's nice it has sunscreen included that doesn't stay splotchy on your face. I liked that the scent wasn't too strong.
Aveeno Positively Radiant is a wonderful moisturizer! It always leaves my skin feeling soft but not greasy which is amazing. I wanted something affordable and also had spf. Since I've been using this I noticed it gives me a fresh glow.
"I really liked how it wasn't sticky, and worked on my very dry elbows which is a problem for me in the winter. Getting older means moisturizing often and finding a good smelling, not sticky products that really works."
Sheer but rich and a sunblock too? YES PLEASE!
"I was pleased to sample this and it just confirmed my love for Aveeno. Does exactly what it says, disappears quickly into skin and no overwhelming fragrance. Loving it!"
"Dermatologist recommended me this to try for my daily SPF needs and because it is kind to sensitive, ezcema prone skin. I just finished one bottle and I will be picking up another next time I am in the store."
I received a sample size of this product and love it! The 30 SPF is better than the 15 SPF of my current daily moisturizer. Goes on smoothly and absorbs quickly. I wear under makeup.
I have been using the spf30 daily moisturizer for years and loved it. I just bought a new bottle and it is not the same product at all? It has one changed word in the description “sheer”. I am not happy to have lost the moisturizer I loved.
i like that a sheer version is available (regular is too thick). Would give it higher rating if no fragrance were added. i wish all Aveeno face products were fragrance-free (or at least not added).
"I love this Mosturizer it smells great, has a light feeling. I noticed some fading of my age spot within a week! The SPF is great for continuing to protect my skin too. I would totally recommend this."
"I buy Aveeno because it sells fine products. However, the pump broke off my latest bottle although it had not been abused. I was unable to re-attach it, rendering the pump useless. I'd like a replacement. [This review was collected as part of a promotion.]"
Aveeno Positively Radiant Daily Moisturizer Broad Spectrum SPF 30 is a new type of Aveeno. I have used various other products that they make. I don't wear makeup everyday due to respiratory issues and because of the reaction my skin has to various products.
This SPF 30 moisturizer does not burn or breakout or itch on my skin. I love the protection it gives my skin from the sun too. Thanks for making it for people like me with sensitive skin!
This sunscreen is amazing. It feels so nice to put on and works well when applying before I apply my make up. I t doesn't have a sticky or greasy feel to it and it make my skin look beautiful even when I didn't apply make up over it. [This review was collected as part of a promotion.]
Overall this is a good product. It applied easily and absorbed well into the skin. The pump has a locking mechanism which makes it good for travel. Once unlocked it took several pumps until any product came out. My skin feels smoothed clear and moisturized. It has somewhat have a bad scent but once applied I no longer smell it. [This review was collected as part of a promotion.]
The moisturizer is amazing. I have combination type skin. The moisturizer was good at taking care of my skin needs. After I put it on there was no thick greasy feeling. It made my skin feel super soft and look great. [This review was collected as part of a promotion.]
"This moisturizer is great! Initially I found it bit tricky to figure out the how much was enough for me. I have dry skin so if I didn't use enough, my skin would still feel dry but if I used too much it would get quite oily. I found that a couple pumps are just enough. This has been perfect for me this winter season. My skin has stayed moisturized even in the harsh weather and having SPF protection makes it that much more amazing. Love this stuff. [This review was collected as part of a promotion.]"
I really liked using Aveeno Positively Radiant Sheer Daily Moisturizer Broad Spectrum SPF 30. It goes on the skin smoothly and is absorbed nicely. I love that it has spf to protect my skin from the sun. I live in California so it's sunny nearly every day but with this moisturizer I don't have to worry too much. I've already recommended it to several people in my life. [This review was collected as part of a promotion.]
Great product felt the differenc in my skin the first day kept my skin soft all day noticided less dry patches in areas on my checks and it definitely makes you radiate you notice a great overall glow sparkle to your skin but is not over powering [This review was collected as part of a promotion.]
My skin felt so soft and silky. It was so light weight and absorbed into my skin right away which I loved. The scent was light so that was very nice I do not like a strong scent. Having SPF 30 was a huge plus because it was one less step to take in the morning and it gave me great protection living in Texas where its sunny most of the year. [This review was collected as part of a promotion.]
"I loved this moisturizer! It is the lightest moisturizer I have ever used that is also effective! I use two pumps and that covers my entire face and neck. It has a very light pleasant scent and doesn't smell at all light a sunscreen light almost all other moisturizers with SPF do. It moisturizes well, absorbs quickly and did not leave my skin looking or feeing greasy. [This review was collected as part of a promotion.]"
I received a free sample of Aveeno Positively Radiant Sheer Daily Moisturizer Broad Spectrum SPF 30 from the home tester club and I definitively loved it. Now my two-steps process for wearing sun screen and moistusized had been reduced to a one-step since both are combined in a single lotion. It keeps my skin moisturized all day long and I don't have to worry anymore about the sun screen. I will definitely buy it and recommend it to anyone. [This review was collected as part of a promotion.]
This is a good moisturizer but would prefer it in a higher SPF.
I like this product. It is smooth and feels great on skin.
"I've got this free for testing purposes in the Walmart Beauty Box, and it really helps my skin come my skin feels really soft, and smooth."
Would recommend highly. Easy to use and works great. Had several surgeries this past year and my skin is very dry and this really works well.
"I was happy to get this sample. I really like this stuff. Super fast to absorb, non greasy and no scent. Great for sensitive skin."
I love aveeno. Always have and hopefully always will. The scent is kind of like oatmeal. It makes my skin super soft
The great thing about this moisturizer is it is SPF 30; therefore it not only moisturizes your skin - it protects it to from the suns rays
I loved this! It's inexpensive and it works. Left my face moisturized and looking great. My skin actually glowed.
This lotion was really light and disappeared on my skin. I have very oily skin so I usually have problems finding a lotion that feels good all day.
Aveeno is one of my go to brands and I always buy a moisturizer with sunscreen. This is perfect even under concealer.
This moisturizer leaves your face feeling great and clean...would recommend to anyone who wants a valuable product for a reasonable price
Love this lotion! It goes on sheer and absorbs great into skin. It isn't greasy at all! Smells great too. Would highly recommend.
I have been using Aveeno products for many years. This moisturizer worked as well as I hoped. I love the fact that it has an SPF 30.
I have always been a fan of all products and all product lines of Aveeno. This lotion is no exception. I highly recommend it!
"This is a great product, it's weightless, non greasy and my skin absorbed it well. I love this product. I use it under make up."
"I love Aveeno positively radiant for severals reasons : works really good, not oily and ok for allergic people like me ...."
Definitely goes on nice and smooth yet also Blends in quickly. Has a nice feel to it. This is what I've been looking for when it comes to protecting my face here in Florida. Great SPF.
I loved using this product because it felt weightless &amp; non greasy. Aveeno was a childhood brand in my home &amp; I love using it as an adult! Wonderful product!
"My sister introduce this product to me, and I fall in love with it. The foundation plus the SPF30 has cover up some of my uneven skin tones. It also moisturize my face."
"I HAVE TRY THIS AND THIS CREAM WORKS REALLY GOOD ,AND IT REALLY PROTECTS YOUR SKIN FROM THE SUN ,I DEFINITELY RECOMMEND THIS PRODUCT AND I WILL BUY IT AGAIN."
I love this product I buy this all the time for my face. The moisturizer feel so smooth and soft on my face! I love that it has the sun screen in it it to protect me from any sun damage.
I love that whether I am in a lot of sun or not I am still moisturized throughtout the day and night. My skin feels so great. [This review was collected as part of a promotion.]
"Aveeno Postivelt Raduant Sheer Daily Moisturizer Spectrum SPF 30 left my face smooth, no funky residue or oilyness all while with SPF. [This review was collected as part of a promotion.]"
I love this as does my mother. We both have sensitive skin and this worked for us both very very well. [This review was collected as part of a promotion.]
"I was selected to try this product, and I liked it quite a bit. I use it every morning before going anywhere and it definitely provides sun protection. I would recommend it to my friends and family [This review was collected as part of a promotion.]"
This is the only lotion with SPF 30 that I have and I like it and would buy again because I need lotion with SPF 30. [This review was collected as part of a promotion.]
"the texture is nice. Non sticky and easy to absorb. I like the gentle smell, since I avoid products with strong fragrances. [This review was collected as part of a promotion.]"
"I was excited to try this as I had run out of my usual moisturizer, Oil of O. I have normal skin that is not oily or too dry. The first time I used it I broke out in a horrible itchy red rash! The was two days ago and I still have the rash. I have tried AloeVera and hydrocortisone but nothing is helping. Buyer beware and be careful. I have Never had an issue like this with any product before and have no known allergies."
I was excited to receive this product as a gift as I had requested it after seeing commercials.
Unfortunately it leaves my skin irritated and dry and flaky as if it has been mildly burned. The first time I used it I felt a tingling then burning sensation. I won't be using it again or recommending it.
"I bought this to use based upon sunspots and the premise it would assist. Aveeno is supposed to be for even the most sensitive skin, which mine is not. Every time I've tried it I've broken out in a horrible and itchy rash. After seeing I'm not the only one I wonder what issue is within the product. I've done various treatments on my face prior and use nothing but an AH-BA cleanser....something is not right!"
"Great for daily use and not greasy at all. I love the protection I get, it smells great and leaves skin so smooth and moisturized. The SPF 30 is just so perfect and truly works well even one application only."
Overall I love this Aveeno Positively Radiant Sheer Daily Moisturizer Broad Spectrum SPF 30 as my daily partner for protection. [This review was collected as part of a promotion.]
"Aveeno moisturizer is very soft on skin. Personally, I like how it smells. Very absorbent. Moisturizes the skin perfectly. I have dry skin after taking a shower. So, I use Aveeno and it helps me to make my skin softer. [This review was collected as part of a promotion.]"
This is a light everyday moisturizer that leaves my skin feeling soft and hydrated without that greasy feeling. It has SPF 30 so it is perfect for daytime and is light enough to ear under makeup. I love it [This review was collected as part of a promotion.]
"This moisturizer worked very well! My skin can sometimes break out when I use new products, but I didn���t with this. Goes on very smooth and weightless, and it didn't make me feel greasy. The SPF is an extra added bonus. [This review was collected as part of a promotion.]"
"I love this moisturizer and have already purchased another bottle. This product makes my skin feel clean, new, and protected. I have decided to replace my other moisturizer with this one. I highly recommend it. [This review was collected as part of a promotion.]"
"This moisturizer is absolutely positively radiant just like the name. It is a light daily moisturizer with SPF 30. It leaves skin feeling fresh and awake, and works great under makeup. It is oil free, non greasy & hypoallergenic. [This review was collected as part of a promotion.]"
I really like how lightweight and hydration this moisturizer is. It doesnt leave me skin sticky or greasey and i really like that it has spf in it. Works great under makeup and doesnt cause any redness or irriation [This review was collected as part of a promotion.]
This moisturizer becomes my favorite after using it... my skin felt hydrated for long time after using this...it protects from sun damage too...I started recommending my friends too about this... i am sure you also feels the same way like me... thank you... [This review was collected as part of a promotion.]
I absolutely love Aveeno Positively Radiant Sheer Daily Moisturizer broad spectrum SPF 30. My new favorite because it has SPF 30 and does not smell like SPF it has a gentle fresh smell to it which smells so good and it's very hydrating and looks very nice on my skin. It help fade dark spots as well. I will use this product a lot [This review was collected as part of a promotion.]
I love this product. Most moisturizers make my skin break out but not this one in happy to say. It goes on smoothly and doesn't leave behind any sticky residue. I also like that it has spf so it protects my skin. Highly recommended. [This review was collected as part of a promotion.]
"I absolutely love Aveeno products! and this Aveeno Positively Radiant Sheer Daily Moisturizer is no exception. It surely makes my skin feeling soft, smooth, and more radiant. I used this product every morning as part of my daily routine. It's creamy in touch but feel so light and non-greasy on skin. This product is so awesome that I highly recommend this to everyone. A must-have for sure. [This review was collected as part of a promotion.]"
I absolutely love this moisturizer. I have combination oily/dry skin and struggle with other moisturizers leaving my skin feeling oily and greasy. Aveeno sheer moisturizer is amazing for providing a light layer of moisture that almost instantly makes my skin feel better. I love using this product under my makeup. It helps moisturize even with makeup on! [This review was collected as part of a promotion.]
I have tried many Moisturizing products but this one by Aveeno was one of the top. The application was light which is great and hydrating for my skin. I received this product free in exchange for my honest opinion courtesy of Home Tester Club. [This review was collected as part of a promotion.]
This was so wonderful that I will be buying more when I run out! I have very dry skin and not everything I've tried has worked for me. This worked so well that I don't even have dry skin anymore! I love that it has sunblock to keep my skin from getting damaged. I use it under my makeup every day. [This review was collected as part of a promotion.]
"After treating this moisturizer for several days, I must say that I like it. It is soft for my skin, but it moisturizes it deeply. My skin looks smooth and soft. I love that has sunscreen. I have a combination skin, and some moisturizers cause acne outbreak, but I did not have that problem this time. I recommend it. [This review was collected as part of a promotion.]"
"I am a huge fan of Aveeno products, but had never tried this; I tend to find face lotions with sunscreen greasy. Aveeno Positively Radiant Sheer Daily Moisturizer Broad Spectrum SPF 30 was not greasy at all! This product feels light and I love knowing I'm wearing a form of SPF daily. It's easy to apply and the product packaging is very nice. I would recommend this! [This review was collected as part of a promotion.]"
"I liked the consistency of the mask, it was thin, non-greasy, and provided a beautiful, healthy glow. However, the scent of the product was too strong for me and I noticed the smell throughout the day. I loved the way it made my skin look and feel, but disliked the way it smelled. I would recommend this product to anyone who is not bothered too much by smells and wants a good daily moisturizer with SPF. [This review was collected as part of a promotion.]"
