"I was able to try out Aveeno Positively Radiant Daily Moisturizer for free through Home Tester in exchange for my review, and loved how it worked! I used it nightly after my showers, and my skin always felt so soft and smooth after using it! It's a big enough bottle where it will probably last me about a month - I use it on my face, neck, chest, shoulders, and back. It goes on smooth and doesn't leave you feeling greasy! [This review was collected as part of a promotion.]"
Love! LOVE! The Aveeno Positively Radiant Sheer Daily Moisturizer Broad Spectrum SPF 30 is AMAZING! It's my favorite moisturizer now. It's very easy to apply all over your face. You don't even have to use a lot. A small amount goes a long way. It helps keep my face clear especially when I'm in the sun. I use it before I put on my makeup and after I shower before I leave my house. [This review was collected as part of a promotion.]
I really like Aveeno® Positively Radiant® Sheer Daily Moisturizer. It has a nice texture and feel. It goes on very smooth and absorbs nicely. It has a pleasant fragrance as well. After using it for about 3 weeks I've started to notice an improvement in my skin texture and tone. My skin is softer and skin tone is evener. I definitely plan to continue using this moisturizer! [This review was collected as part of a promotion.]
"Overall, this is a nice moisturizer. It is a good texture (not too thick or thin; not too dry or oily) and blended in well. It had just slightly too much of a ""sunscreen"" feel to me - the scent and texture, but would be good for the summer. [This review was collected as part of a promotion.]"
Aveeno Positively Radiant Sheer Daily Moisturizer Broad Spectrum SPF 30 is very lightweight and gentle on my skin. I alway wear sunscreen on my face and the SPF 30 is higher than other brands I've used. [This review was collected as part of a promotion.]
Its light and non-greasy lotion. It has given my skin an even tone/texture and given my face the moisture/protection in the recent week with 40 degree weather which I always get dry patches on my face. I absolutely love this lotion and will continue to use and buy! [This review was collected as part of a promotion.]
"I love how it makes my skin feel while I have it on, it gives me a nice glow that I love, It makes me look healthier and less pale through these winter months. I don't have a lot of sun to worry about, but I just love how it makes my skin feel, plus.. the scent is Amazing! The only problem that I have with it, is that it did make me break out a bit. [This review was collected as part of a promotion.]"
"I use this daily. Love that it moisturizes and protects my skin from the sun. The best thing is that it absorbs quickly, never leaves my face oily, and have never had a breakout using this product. This moisturizer only takes about a minute to fully absorb. Once absorbed, I apply my foundation and the rest of my makeup. This SPF 30 truly works well and that's just with one application in the morning. [This review was collected as part of a promotion.]"
I really liked the moisturizer and especially loved it had SPF in it. It was lightweight and definitely gave a glow to my skin. It would be a great option for the beach or going out with no make-up. No greasy feeling either which is important. [This review was collected as part of a promotion.]
I really loved the scent it's citrusy but not over powering. I loved the sheer feeling of this moisturizer I really liked that it wasn't sticky and I didn't feel like I was wearing a mask. It also made my skin feel and look like it had a nice light glow [This review was collected as part of a promotion.]
I got to try the Aveeno Positively Radiant Sheer Daily Moisturizer Broad Spectrum SPF 30. The product itself is satisfactory and I do enjoy the formulation in that it's not to thick or oily but comforting and soft. I think it has a bit of a strong smell though and takes a few tries to work on dry patches. Overall though I liked it I love that it has SPF 30 in it and it helps even out skin tone overtime! [This review was collected as part of a promotion.]
I like using Aveeno Positively Radiant Sheer Daily Moisturizer everyday. It makes my skin feel soft and smooth with its moisturizing ability yet my skin doesn't feel oily at all. I am very happy with it because that is what I was always looking for in a moisturizer that I can use everyday. [This review was collected as part of a promotion.]
Aveeno® Positively Radiant® Sheer Daily Moisturizer Broad Spectrum SPF 30 is simply AMAZING! Since I've been using it everyday my skin is so much more brighter and much more soft/smooth. It isn't dry anymore like it used to be. [This review was collected as part of a promotion.]
"I have been using the Aveeno® Positively Radiant® Sheer Daily Moisturizer Broad Spectrum SPF 30 for about two weeks now and I am really liking it! It has a very light scent and also has a very light feel. It absorbs quickly and doesn't leave my face feeling greasy. I'm left with smooth, moisturized, and protected skin. I did not experience any bad side effects or reactions. I would totally recommend this product! [This review was collected as part of a promotion.]"
This is my new go to moisturizer! I have super dry skin especially in the colder weather and its hard to find a product that actually works and doesn't feel heavy on my face. This product totally takes care of my dry skin but it doesn't feel heavy or greasy! I absolutely love it and would recommend it to anyone! [This review was collected as part of a promotion.]
"I really love the scent of the Aveeno Positively Radiant Sheer Daily Moisturizer Broad Spectrum SPF 30. I also felt like my skin was very soft after using it for a few days (very similar to other Aveeno products.) However, it would be great to have more anti aging properties included. I am always looking to reduce fine lines and wrinkles. [This review was collected as part of a promotion.]"
I love this product. It really does help brighten up my dull skin and keep it protected from the Sun. I have noticed a dramatic difference in my skin since using this product. It really does help my skin in being brighter and smoother looking. I love this product and highly recommend it friends. Positively radiant really does what it says. [This review was collected as part of a promotion.]
"This is a nice moisturizer with SPF. It didn't clog my skin but it did leave it a bit oily after I had it on for a few hours. It is mostly light and has a nice light scent. I would definitely use it more in the summer while on the beach/vacation, etc. [This review was collected as part of a promotion.]"
"This moisturizer is light and smooth. A little goes a long way, which is always nice, and its one of the only moisturizers that I've used that doesn't feel oily or cause my skin to look shiny. The smell is mild but pleasant, this is definitely a great daily face lotion. [This review was collected as part of a promotion.]"
"I loved the light scent and super absorbent moisturizer I got to try out. My skin felt smooth and brighter than with other like products I have used. I used this in the morning before I applied my makeup and then again in the evenings after I washed my face. My face looked brighter and softer, and my skin didn't dry out halfway through the day. I will definitely be purchasing this after my bottle runs out. [This review was collected as part of a promotion.]"
"I found Aveeno Positively Radiant Sheer Daily Moisturizer Broad Spectrum SPF 30 to be a great daily moisturizer. My skin is very dry and prone to break outs, so I struggle to find a gentle skin lotion that doesn't leave me feeling oily. This was great. The coverage was light so I don't feel like I'm wearing anything, and it left my skin feeling refreshed. The container is tiny, but a little goes a long way. Plus, it didn't make me break out. [This review was collected as part of a promotion.]"
"I really loved the scent of this moisturizer, though it may be slightly strong for anyone who is sensitive to scents or fragrances. This moisturizer was also very light and non greasy which was a big plus for me because I hate heavy, oily lotions and it's hard to find ones with SPF that aren't greasy feeling. This didn't feel as hydrating as I'd have liked, but it was good for light hydration! [This review was collected as part of a promotion.]"
"First my experience was good the product did not make my skin feel dry or make my skin more oily then it already is. The scent was not overwhelming, it made me feel amazing would definitely recommend [This review was collected as part of a promotion.]"
"Take care and protect our skin from ultraviolet rays is very important and what better than this cream that provides a protection factor 30, has a subtle and light citrus aroma that I like, is oil-free and also protects my skin and keeps it hydrated . [This review was collected as part of a promotion.]"
The Aveeno positively radiant daily moisturizer broad spectrum SPF 30 works really well my face feels all nice and moisturized and it lasts for a really long time throughout the day it works goes on smoothly it feels really great. My skin still feels really great after using it I would definitely recommend this product [This review was collected as part of a promotion.]
I think I might prefer this over my regular face moisturizer. It doesn't leave my face looking shiny and it is lightweight. I genuinely forgot that I was even wearing it. I have somewhat sensitive skin and I didn't have any issues or irrigation with this moisturizer. It was very easy to apply and I didn't have to use much to cover my face. [This review was collected as part of a promotion.]
I love the intense moisture Aveeno has to offer. My skin feels hydrated and at the same time protected me from the suns harmful rays! I keep this moisturizer in my handbag when I go out. Amazing product great quality and gets moisture deep into my skin! [This review was collected as part of a promotion.]
This is a fantastic moisturizer! I am picky about moisturizers for my face and I am in love with this product. Doesn't feel greasy or leave a thick residue. Its been rainey and overcast so not sure how well the SPF works. [This review was collected as part of a promotion.]
"I always use aveeno products for my baby and sometimes use these baby moisturiser for myself , they are great . Now when I try this Aveeno positive radiant daily moisturiser I like it even more, it does not have sticky or oily feeling .my skin feel soft & fresh after it use. My skin look younger, After every use it make my skin more & more soft, fresh & redient. [This review was collected as part of a promotion.]"
I love this product! I haven't been using it that long and I can see results already! I like how moisturized my face is after using this product. I can also see the dark spots on my face disappearing. This is my go to moisturizer for now on . [This review was collected as part of a promotion.]
I really liked this product. It went on smooth and thinly. It did not leave my skin oily looking. It easily absorbed and felt light. I would use this as a replacement to my regular facial moisturizer in the summer. I do not feel like I need the added sunscreen in the winter for I am not out doors enough. [This review was collected as part of a promotion.]
Aveeno Positively Radiant Sheer Daily Moisturizer Broad Spectrum SPF 30 is weightless while providing moisture and sunscreen protection. I did not notice any irritation from this gentle yet effective moisturizer. [This review was collected as part of a promotion.]
Surprisingly I really loved this moisturizer! I have a really hard time finding any that doesn't make my face any more oily than it already gets. This has such a nice smell too. Not overly strong but nice and subtle. Doesn't seem to clog my pores. [This review was collected as part of a promotion.]
"I love that your skin feels silky and soft after just using it once. I use mine in the evening and the morning, I love the fact that there is SPF 30 in it and I don't feel like I am wearing sunscreen and it doesn't leave any greasy feelings. [This review was collected as part of a promotion.]"
I feel like Aveeno Positively Raadiant Sheer Daily Moisturizer Broad Spectrum SPF 30 is absolutely amazing new face product to add to my daily routine . Not only does it go on my face nice a silky smooth but it protects my skin through out the entire day leaving me stress free. I would recommend this to anybody looking for a daily moisturizer Plus SPF. [This review was collected as part of a promotion.]
I enjoyed using this product. It is sheer as promised and doesn't make my skin look greasy. It keeps my skin from getting dry and protects my skin from the sun. It has a pleasant scent and the package is convenient and easy to use
My only complaint is that my makeup flakes a little over top of the moisturizer. [This review was collected as part of a promotion.]
"Goes on light, doesn't feel super greasy. Absorbs in well so that I'm moisturized and also protected from the sun. Smell could be better but that's typical of these products. I'd still use them for the benefits. [This review was collected as part of a promotion.]"
First of all the smell is absolutely amazing!! I love how smooth and silky the moisturizer is and easily it goes on my skin. It absorbs quickly and leaves my skin looking bright and healthy. The added SPF 30 is a great added feature for me because i have sensitive skin and it's one less thing to worry about!! Thanks!! [This review was collected as part of a promotion.]
"Aveeno Positively Radiant Sheer Daily Moisturizer is lightweight and leaves your skin feeling radiant. I use it every morning , it also helps keep my makeup in place. And I never have to worry about the sun because it has SPF 30. [This review was collected as part of a promotion.]"
"The consistency of this moisturizer is perfect! It goes on light and absorbs quickly. There's no sticky feeling that sometimes I forget it's there. I also love that I get SPF 30 coverage, but I do wish it was higher. My only issue with the product was the smell. I prefer my moisturizers to be scent-free or have minimal fragrance due to my sensitive nose, but it has a smell of soap. [This review was collected as part of a promotion.]"
I was chosen to review Aveeno positively radiant sheer daily moisturizer. This moisturizer has toned and textured my skin. It has helped improve my red blotchiness and dullness. It makes my skin feel fresh and glowing. My skin definitely looks better after using this product. [This review was collected as part of a promotion.]
"I really liked it. It definitely moisturized my face and I always love a moisturizer with an S.P.F. It has a good smell. It did tend to over-moisturize my T-Zone, so I stopped using it on certain areas of my combination skin. It worked for me, and I was happy with it. [This review was collected as part of a promotion.]"
I liked the size and shape of the bottle. It was easy to use and not messy thanks to the pump. The texture was easy to apply to my face and didn't leave it feeling greasy. It moisturized my skin very good and left it feeling smooth and a nice glow to it. [This review was collected as part of a promotion.]
This moisturizer was such a pleasure to use! It is light yet offers enough moisture to keep my skin feeling soft and hydrated. It has a refreshing scent that is not too overpowering. It also offers SPF protection to keep your skin safe from the effects of the sun. The product doesn't feel too greasy on my skin & it doesn't leave a sheen like some SPF products do. I would definitely recommend this product to my friends and family. [This review was collected as part of a promotion.]
I'm so happy i got the opportunity to try Aveeno positively radiany sheer Daily moisturizer broad spectrum spf 30 because i love the brand they always have great products & they never dissapoint me. It definitely does aa described & it made my skin feel so soft & radiant. I do use it 4 times a week & felt the difference in the 1st week . [This review was collected as part of a promotion.]
I absolutely love Aveeno® Positively Radiant® Sheer Daily Moisturizer Broad Spectrum SPF 30. It has left my skin feeling super soft and smooth. I have been a long time user of oil of olay and am now switching. For the first time I have finally found a product worth switching to. I have already recommended this product to family and friends! [This review was collected as part of a promotion.]
The Aveeno Positively Radiant Sheer Daily Moisturizer Broad Spectrum SPF 30 is great. It goes on the skin smoothly and pirate ts from the sun rays. My skin has been softer and smoother since I began using this. [This review was collected as part of a promotion.]
"I live in sunny Florida so I have to be extra careful about protecting my skin. Aveeno Positively Radiant Sheer Daily Moisturizer Broad Spectrum SPF 30 nourishes my skin while protecting it so I can always look my best, especially long-term. [This review was collected as part of a promotion.]"
I love I can use it daily and is so sheer. I feel I have no moisturizer on but I do! I really like that the moisturizer already has sunscreen in it to protect my face. I will be buying another bottle after this one [This review was collected as part of a promotion.]
"This daily moisturizer left my skin feeling protected, soft and supple. It went on light and absorbed well into my skin. I use it every morning. The fragrance is light and just right for a facial moisturizer. [This review was collected as part of a promotion.]"
"Aveeno positive radiant daily is a great facial moisturizer. I like the fact that it didn't take a large amount to be effective, and that it also has SPF to help keep my skin protected from the sun daily. [This review was collected as part of a promotion.]"
I need moisturizer for my dry skin especially with the colder weather since it does a number on my face. When I tried this I could feel the difference from products I have used before. My skin was smooth and felt so hydrated and it was easy to blend into skin. It has a nice light fragrance which I like. It just feels refreshing and light. [This review was collected as part of a promotion.]
I received the AVEENO POSITIVELY RADIANT DAILY MOISTURIZER BROAD SPECTRUM SPF 30 from Home Tester Community totally for free to try it out at Home.
"I loved using the moisturizer for several days, and found my skin is now so radient and glowing. Just love my new skin so much. [This review was collected as part of a promotion.]"
"Aveeno's Positively Radiant Sheer Daily Moisturizer Broad Spectrum SPF30 is a lightweight sheer moisturizer that hydrated my skin and left it feeling soft and smooth and not greasy like I would expect a moisturizer with SPF in it would. I feel like it minimised my pores, making a great base moisturizer before applying my makeup. I really liked how it allowed my skin to breathe and didn't clog my pores or leave my face greasy. [This review was collected as part of a promotion.]"
"Love that it moisturizes and protects my skin from the sun. The best thing is that it absorbs quickly, never leaves my face oily, and have never had a breakout using this product. This moisturizer only takes about a minute to fully absorb. Once absorbed, I apply my foundation and the rest of my makeup. There has never been an issue with foundation streaks, dry spots, oily spots, etc. [This review was collected as part of a promotion.]"
The perfect daytime moisturizer. I love that it has SPF 30 in it. I used this underneath my makeup and alone. It worked great both ways. It made my skin feels so soft and moisturized. It also had a very light Scent which I love. A new staple in my skin care regimen. [This review was collected as part of a promotion.]
"I absolutely love this Aveeno Positively Radiant Sheer Daily Moisturizer Broad Spectrum SPF 30. I had a very positive experience with it, my skin felt softer, smooth, and I could feel protection from the sun. It was lightweight and didn't leave a sticky or thick residue behind, it blended in perfectly, I highly recommend this lotion. [This review was collected as part of a promotion.]"
It had a great lightweight consistency and was non irritating to the skin and smelled good. My skin felt soft and refreshed and was protected. My skin absorbed it pretty quickly and it wasn't greasy feeling. I really liked it. [This review was collected as part of a promotion.]
"i love how well it works, my skin is soft and hydrated and not oily - full balance- i love the smell it no overwhelming it is just right. Keeps my face hydrated all day especially under my eyes . love how it works [This review was collected as part of a promotion.]"
I was sincerely impressed with the performance of Aveeno POSITIVELY RADIANT SHEER DAILY MOISTURIZER BROAD SPECTRUM SPF30 in helping my skin to look more evenly toned and resilient. The application goes on velvety smooth and light which is excellent [This review was collected as part of a promotion.]
"I've been needing a moisturizer with SPF, and then I got to try this. It's a good moisturizer, it has a touch of a sunscreen smell but not really noticeable; otherwise it doesn't have a scent. I really like it, and once I use it up I'll definitely be getting another. [This review was collected as part of a promotion.]"
"This is a great moisturizer! It is lightweight, but hydrates my skin deeply. It has a very pleasant scent and texture. I look forward to putting it on in the morning! I love that it has a built-in SPF of 30 so I don't have to worry about sun damage on my face. It is easy to put make up on over this product. After using this product for about a week, my skin feels and looks great! [This review was collected as part of a promotion.]"
I LIKE AVEENO POSITIVELY RADIENT SHEER DAILY MOISTURIZER BROAD SPECTRUM SPF 30 BECAUSE IT COVERS WELL AND DOESN'T DRIP. I ALSO LIKE THAT IT ALREADY HAS AN SPF IN IT AND I DON'T HAVE TO APPLY ONE TOO. [This review was collected as part of a promotion.]
"Never had heard of this product before but I'm so glad I tried this! It's very light weight on skin, it hydrates my skin, it's a very trustworthy brand, nice packaging, I love Aveeno products but this one over tops it. I like that it's lightweight and has just the right amount of SPF in it. Definitely recommend!! [This review was collected as part of a promotion.]"
i tried Aveeno Positively Radiant Sheer Daily Moisturizer Broad Spectrum SPF 30 and i loved it. it is so light yet so mosturizing on skin and smells good too. and the best of all its spf30 without that oily look on my skin that i usually get with other sun blocks [This review was collected as part of a promotion.]
"I love Aveeno Positively Radiant Sheer Daily Moisturizer Broad Spectrum SPF 30! It is a very light moisturizer so it doesn't feel like you are applying a thick lotion to your face, and it has a pleasant smell. I like that it is a moisturizer and sunscreen in one, so I don't have to add so many products to my skin. [This review was collected as part of a promotion.]"
"The first thing I notice when I started using this product was the amazing scent! It reminded me of a beautiful sunny day. The next things that made me happy were how easy it was to spread on my skin - it's not too thick or thin. It really did leave my skin looking radiant, which shocked me - I thought it was just a marketing claim. The moisture is long-lasting, too. [This review was collected as part of a promotion.]"
"I really like how fast it absorbed and how soft it left my face feeling, it was easy to use and didn't make my sensitive skin break out. The moisturizer really does it's job and my skin definetly looks better than it did before I was using it, I only have to use it once a day and it usually leaves me feeling moisturized all day [This review was collected as part of a promotion.]"
The Aveeno Positively Radiant moisturizer is a great addition to my facial routine. I like that it has a sunscreen in it. The best part is that its light on my face meaning its not heavy or greasy. The scent is very pleasant also [This review was collected as part of a promotion.]
I've used the spf 15 regular version of this and I enjoy this version as well.It sinks into my face and makes my face look brighter.There wasn't a strong scent and I noticed no white cast.I experienced no greasiness either I like that it is lightweight but is also more hydrating which is great for colder weather. [This review was collected as part of a promotion.]
"I only received this sample a couple of days ago but so far, I absolutely love it! I'm a huge advocate for using SPF every day and this is a lightweight lotion that still provides good moisture penetration before I put my makeup on. Highly recommend! [This review was collected as part of a promotion.]"
I absolutely loved this daily moisturizer it deeply hydrates my dry skin without leaving my face looking too greasy. It gets absorbed by skin very well and leaves me a bright shiny and hydrated face. I also like the pump and release bottle very convenient. [This review was collected as part of a promotion.]
I love the Aveeno Positively Radiant Sheer Daily Moisturizer. The scent is so light and refreshing! I love that it is SPF 30 so I can protect my skin while moisturizing. Feels so great and leaves your skin feeling refreshed. [This review was collected as part of a promotion.]
"Lotion has nice feel. Relieves itchy skin from sunburn, allergy"
or dry skin.
It worked okay probably not something I would use on a regular basis
Is my all time products. I had a family get together & gave all the ladies in our family
It goes on so smooth & no greasy feel at all. Smells super great & would highly recommend this.
