"Effective,gentle moisturizer with sunscreen that isn't greasy and without white residue."
I love this moisturizer. It leaves no greasy feel. Light and easy application.
I love Aveeno products and excited to try new ones!
My face feels so soft and this product is so light it's justamazing
Will buy when I finish the old stuff. This much better. Light
Did not feel oil on my skin & my face felt soft for .
Another home run for Aveeno. For the price their products are the best things on the market.
"i bought the larger size of this , really nice smell and soft on skin"
Loved the lightness and the scent. Left my skin soft.
This is a good product. I never thought this product would work for me. It does.
Does what it says it does and makes the skin feel great. Easy to use.
"such a great product, i love it and i will totally buy it again"
"I have oily skin so it made my skin a little oily, but not bad."
Love this lotion...Spreads evenly and holds throughout day
Anything Aveeno makes is great!You can always count on them!
Wow! the perfect lotion! the smell is perfect. the texture is perfect! I love it!
I like the way this product made my skin feel. It was soft and luxurious.
I like my moisturizers lightweight. This one is a nice lightweight moisturizer.
Love this lotion! Doesn't feel greasy and makes my skin feel soft and smooth.
This facial moisturizer is awesome! It's light and doesn't cause breakouts. I highly recommend it!
We loved this. I bought it for both my daughter and I!
"Great product! SPF is hard to remember to wear in the Winter, but this takes care of it."
I love that this moisturizer has SPF 30! Goes on smooth and feels great.
I liked this product. It was light and felt nice on my face.
It works great and leaves my skin feeling amazing! [This review was collected as part of a promotion.]
"Great moisturizer, wasnt greasy or heavy feeling. Id use this product all the time. [This review was collected as part of a promotion.]"
"I've tried a fair number of face creams, some are too greasy, some don't seem to help at all... Aveeno Positively Radiant Daily Moisturizer with Broad Spectrum SPF 30 is Great! It's moisturizing and not greasy, Love Aveeno!"
"The product is smooth and blends evenly without leaving greasy feeling which is great. However, i start having breakouts. I have been using Aveeno scrub for years and my face is clean, now covered with breakouts."
I've been looking for a lightweight moisturizer to use and Aveeno positively radiant works great. I have combination skin and aveeno leaves my face feeling soft and light.
another wonderful product by aveeno i love this and it makes my skin look good and it feels great on your skin and it makes your skin feel mosit because i have very dry skin
This product is non greasy. feels lightweight and has a pleasant scent. Dries quickly and doesn't leave my face looking shiny. I would recommend [This review was collected as part of a promotion.]
"It was light weight and felt great on my skin. doesnt cost a whole lot either, would recommend to family and friends [This review was collected as part of a promotion.]"
"I liked the feel and the scent of this moisturizer. It felt light and non greasy. I prefered it when I didn' twear makeup, it didn't sit well under foundations [This review was collected as part of a promotion.]"
I love how lightweight this feels on my face. With winter here my face gets so dry and this made it so moisturized with out the greasy shiny after effect. [This review was collected as part of a promotion.]
Definitely one of my favorite products. Huge plus is that it comes in a small compact size. Great for traveling [This review was collected as part of a promotion.]
"Aveeno positively radiant sheer daily moisturizer broad spectrum SPF 30 is not oily, the texture is creamy, it feels smooth and nice on your face, it has a light scent. My skin feels protected [This review was collected as part of a promotion.]"
I would definitely recommend Aveeno positively radiant because it works really well and left no dry skin at all [This review was collected as part of a promotion.]
This has been amazing for my skin because it gets really dry with the weather change. I love how it doesn't make my skin feel oily and still provides adequate moisture with SPF. [This review was collected as part of a promotion.]
Aveeno positively radiant daily moisturizer broad spectrum spf 30 works great. Leaves my skin super moisturized while being protected from the harmful sun rays. [This review was collected as part of a promotion.]
This moisturizer is great and smells good. It's lightweight on my skin. It's blends in really well and keeps my ace moisturized. [This review was collected as part of a promotion.]
I really enjoyed this Aveeno positively radiant sheer moisturizer.. I have seen it bit never got a chance to try it until now dont regret trying it at all.. My face felt amazing [This review was collected as part of a promotion.]
I like texture and the protection from it. I like to use it when I head outside. I would recommend this product. [This review was collected as part of a promotion.]
This product was amazing. I loved the way it felt on my skin. The scent was good. I love Aveeno so I will def be buying this! [This review was collected as part of a promotion.]
My skin feels so smooth after using this for just a week. Overall this is a great product that I would definitely buy over and over again. [This review was collected as part of a promotion.]
"Aveeno is the best brand to the skin. Its amazing this moisturizer , I don't feel my face greasy. I recommended 100% [This review was collected as part of a promotion.]"
I loved the Aveeno Positively Radiant Sheer Daily Moisturizer. i loved the fact that it kept my face moisturized without feely greasy. This is definitely my new go to moisturizer. [This review was collected as part of a promotion.]
"At first I thought I was allergic to it because my face kept itching, but after a few says the itching on my face is gone. I like this product. [This review was collected as part of a promotion.]"
"I love how it made my face feel after I used it, it made it feel soft and not oily and it didn't feel heavy like others do [This review was collected as part of a promotion.]"
"This Aveen Positively Radiant Moisturizer with sunscreen is great for summer! only thing is, if you like matte skin then this is not for you my friend. [This review was collected as part of a promotion.]"
I truly love this moisturizer. It is super light and doesn't feel greasy at all. My skin looks and feels so much better. [This review was collected as part of a promotion.]
This moisturizers my skin without leaving my skin feeling greasy. It absorbs quickly leaving my skin feeling soft and smooth while giving my skin protection with spf. [This review was collected as part of a promotion.]
"This moisturizer worked amazingly with my skincare routine! After using the Aveeno gel cleanser, this moisturizer really helped my skin look clear and bright and feel soft and smooth! [This review was collected as part of a promotion.]"
"This is a great moisturizer! It's super lightweight and feels like nothing is on your skin. And I love that it's spf 30, gotta keep those rays off the beautiful skin! [This review was collected as part of a promotion.]"
"I really wasn't a fan of aveeno before I received this to try. It smells amazing,absorbs without the greasy lotion feel, left my face smooth and I do believe it's helping with my breakouts. [This review was collected as part of a promotion.]"
Great long lasting effects. A little definitely goes a long way and spreads so nice and smooth. Nice lighter feeling with not left over oilyness like some other brands. [This review was collected as part of a promotion.]
"I really loved using the Aveeno Positively Radiant Sheer Daily Moisturizer Broad Spectrum SPF 30. It goes on smoothly, is lightweight and feels fresh and clean on your skin! [This review was collected as part of a promotion.]"
Left my skin feeling clean and lightly moisturized. No greasy heavy feel. Left me with a subtle glow too. Loved the fact that it had spf too. [This review was collected as part of a promotion.]
Not greasy at all and it absorbs really well into my skin. Moisturizes and softens skin without clogging pores. [This review was collected as part of a promotion.]
I really like this lotion. It's light for daily use and moisturizes really well. I love that is has an spf of 30. I will definitely use this daily and continually buy this product [This review was collected as part of a promotion.]
"I love this it is SPF 30. It is clinically shown to improve tone, texture, dullness, blotchiness and brown spots. It leaves your skin looking fresh, awake and luminous. [This review was collected as part of a promotion.]"
It definitely hydrated my skin and made it feel super smooth. I love that it has sunscreen in it too. Perfect for summer! [This review was collected as part of a promotion.]
Really made my skin really soft and smooth really felt moisturized good to use when I put on my acne medication so it doesn't dry my face out. [This review was collected as part of a promotion.]
Non greasy and very hydrating. Didn't leave any oily spots and has a soft scent. The pump top gave just enough with one pump to use on my entire face. [This review was collected as part of a promotion.]
"on the first daya I felt the differncde on my cheeks, I no longter felt the roughness that I had before the serum. [This review was collected as part of a promotion.]"
Overall it was fine and absorb good in my skin. It didn't break me out or feel greasy when i put it on. [This review was collected as part of a promotion.]
Everyone needs spf so this is great! The scent is very clean and moisturizer nice and light. Skin feels splendid after use. [This review was collected as part of a promotion.]
I've never used a better product it was great...nice fragrance light on my skin ..and sunscreen so I know my skin is protected in the sun from aging..I'm looking forward to use it everyday [This review was collected as part of a promotion.]
"This moisturizer is amazing! It's light weight, protects your skin, and smells amazing! I usually get an spf or lightweight in my facial moisturizer, so it's so great to have both in this bottle! [This review was collected as part of a promotion.]"
Great product with quick working effects. Protects well against effects from the sun and adds moisture at the same time. [This review was collected as part of a promotion.]
I like the reel on my face. It have no scent to me. It don't break me out. Yes it have a positive radiant sheer to my skin. [This review was collected as part of a promotion.]
I really like how Aveeno Positively Radiant Sheer Daily moisturizer makes my skin feel. I really like how it doesn't make my face feel like it stretches or itches. I will definitely buy it. [This review was collected as part of a promotion.]
Aveeno Positively Radiant Sheer Daily Moisturizer is amazing it went on smoothly. My face felt refreshed after using. [This review was collected as part of a promotion.]
I received a his free to try and I loved it. It made my skin soft and nice. It had a very mild scent that was relaxing. I would definitely but this again and recommended it. [This review was collected as part of a promotion.]
The aveeno moisterizer is wonderful! ! It doesnt feel sticky oily or heavy on your skin plus is spf 30 great product total recommend it! [This review was collected as part of a promotion.]
"It is not greasy, its smooth and light feeling. Its great and can use it everyday. Keeps skin hydrated [This review was collected as part of a promotion.]"
I got to test the aveeno positively radiant sheer daily moisturizer broad spectrum spf 30 it was great for my sensitive skin and works great will be buying soon [This review was collected as part of a promotion.]
I am in love with the smell of it. It makes me feel very fresh in the morning as preparing for a very good day [This review was collected as part of a promotion.]
This face lotion was really nice i loved how even with spf In it the lotion was not greasy it absorbed right away and left my skin feeling smoother and softer [This review was collected as part of a promotion.]
It is so great it has done my face such a miracle positive thing and it protecrs my face from the sun. [This review was collected as part of a promotion.]
I like that it is very smooth goes on easy and not greasy.it worked perfect on my sensitive skin no pain or redness. [This review was collected as part of a promotion.]
I really liked this product and how gentle and light it is on my face. So sheer and not a strong scent [This review was collected as part of a promotion.]
I love everything about this Aveeno daily moisturizer especially how easy it is to apply and how great my skin looks and feels after each use. [This review was collected as part of a promotion.]
The moisturizer is so light weight that it I forget I have it on...It's GREAT for wearing the under makeup. [This review was collected as part of a promotion.]
The size is great to have to travel around. Makes my skin feels great and gives that comfort as well. It is true to description. [This review was collected as part of a promotion.]
Gives me just the right amount of moisture without going overboard. It also doesn't cause breakouts like a lot of other products do. [This review was collected as part of a promotion.]
It's something that I would differently buy. It positively help my skin stay moist. My skin stop being flaky and ashy. [This review was collected as part of a promotion.]
Wow this Aveeno is smooth soft and no fragrance. Aveeno moisturizer is great in the south where I live with lots of sun. Moisturizer my skin all day no reapply. [This review was collected as part of a promotion.]
I really enjoyed this product on how it made my skin nice and refreshing it smells wonderful. I love how it made my skin soft too. [This review was collected as part of a promotion.]
This moisturizer was light and not greasy went on my face without causing any issues never had an outbreak in the fact that it has an SPF in it was just a bonus [This review was collected as part of a promotion.]
i love this product! it spreads on evenly and has great coverage. it is very lightweight and improves the look of my skin while hydrating it. definitely buying again [This review was collected as part of a promotion.]
I loved how lightweight this moisturizer was! It was easy to apply and didn't feel tacky once applied. I would definitely use this product on a daily basis! [This review was collected as part of a promotion.]
I like that it keeps my skin feeling soft and no more dry. I like that it is not greasy. I like using aveeno products. [This review was collected as part of a promotion.]
"I really love this daily moisturizer, it feels really light on my skin. It also applies smoothly and smells great! I love that it absorbs rather quickly but doesn't leave my face feeling oily. [This review was collected as part of a promotion.]"
I loved this moisturized it smelled amazing and left my face so foft. i also liked that it has spf 30. I noticed a diffence in the look of my face right away after useing it. [This review was collected as part of a promotion.]
This moisturizer seems to work very well. I like that is contains SPF. My only complaint would be that the bottle is a bit on the small side. [This review was collected as part of a promotion.]
I really like the Aveeno facial moisturizing lotion and use it every day
"I really liked how it left my skin, already recommended it [This review was collected as part of a promotion.]"
I really liked how it felt on my skin! Super lightweight and smooth! [This review was collected as part of a promotion.]
"It really help even out my skin for sure, and made it so much more smooth. [This review was collected as part of a promotion.]"
"Left my face feeling smooth, while the spf 30 protected my skin from getting sunburnt [This review was collected as part of a promotion.]"
"Very good moisturizer. Smooth, silky and not greasy. [This review was collected as part of a promotion.]"
It works amazing and leaves my skin refreshed and smooth [This review was collected as part of a promotion.]
This stuff is amazing!!! Doesn't leave your face greasy and it left my face feeling great! [This review was collected as part of a promotion.]
This is a fantastic product. It works as described and works perfectly under my makeup. [This review was collected as part of a promotion.]
Very light feel no greasy residue after using I would definitely recommend this product [This review was collected as part of a promotion.]
It very light and non oily! Leaves my face feel fresh. [This review was collected as part of a promotion.]
"It moistures really well, no harmful ingredients It makes your skin look and feel nice [This review was collected as part of a promotion.]"
Gentle moisturizing for sensitive skin. Love the spf protection. Lovely scent. [This review was collected as part of a promotion.]
I love the way it made my skin feel. It was non-greasy and lightweight. It made my skin so soft. [This review was collected as part of a promotion.]
Lightweight moisturizer that hydrates my skin without feeling heavy [This review was collected as part of a promotion.]
"I really liked this moisturizer, it left my face feeling smooth and hydrated! [This review was collected as part of a promotion.]"
I loved it!It was a great prpduct!I recommend it to anyone. [This review was collected as part of a promotion.]
Love it! Left skin moisturized and soft!! Works well under makeup too! [This review was collected as part of a promotion.]
i love it. it help me with the moisturizer from sun and cold! [This review was collected as part of a promotion.]
"I love the smell, is soft and dont look grease. Great package. Your face feel great. [This review was collected as part of a promotion.]"
I especially love the smell of it is great and also I know my sister and mom would love to try it [This review was collected as part of a promotion.]
Awesome best product ever I can't wait to tell my family and friends about this product [This review was collected as part of a promotion.]
Aveeno Positively Radiant Moisture does a great job of moisturizing my face. [This review was collected as part of a promotion.]
Awesome awesome awesome awesome awesome awesome awesome [This review was collected as part of a promotion.]
"I have sensitive skin and it commented my skin type with a protect ,smooth feeling. [This review was collected as part of a promotion.]"
Its easy to wear and feel lite on the skin. Its non greasy and has a nice soft scent to it. [This review was collected as part of a promotion.]
It's lightweight and really works it gos on smooth and doesn't clump. I recommend this [This review was collected as part of a promotion.]
This works great cause it can protect my face from the sun. I liked that alot. [This review was collected as part of a promotion.]
I love Aveeno Positively Radiant Moisturize on my face. [This review was collected as part of a promotion.]
It works well! My face was super hydrated after only a few times using it [This review was collected as part of a promotion.]
After using it my skins been feeling really soft and rejuvenated. [This review was collected as part of a promotion.]
I like the texture and it gives a subtle sheen it has no odor [This review was collected as part of a promotion.]
Smooth but thick cream that absorbs quickly. Smells good the feels good on the skin [This review was collected as part of a promotion.]
This product was spot on it kept me protected and lasted all day [This review was collected as part of a promotion.]
"Perfect moisturizer, very creamy and smooth. I loved the Aveeno moisturizer a lot. [This review was collected as part of a promotion.]"
This sheer aveeno face cream provided by hometester was amazing it made my skin look radiant [This review was collected as part of a promotion.]
Left skin feeling very smooth and weightless. Very refreshing. [This review was collected as part of a promotion.]
it went on very light and didn't weigh down my skin. [This review was collected as part of a promotion.]
I Have Horrible Skin & This Helped With The Dryness [This review was collected as part of a promotion.]
A sheer soft lotion that smooths on easily and leaves my skin moist. [This review was collected as part of a promotion.]
Good product I would buy again nice product and the smooth of the product [This review was collected as part of a promotion.]
I love this product. Its non greasy and thick. It feels amazing and moisturizing. [This review was collected as part of a promotion.]
My skin is no longer cracked and dry but hydrated and smooth. I love it❤️. [This review was collected as part of a promotion.]
"I have dry skin so this moisturizer is for me, lightweight lotion that cares all day [This review was collected as part of a promotion.]"
I love it so much. Aveeno is the best!!! Will buy this again and again! [This review was collected as part of a promotion.]
LOVE ONLY HAVING TO APPLY ONE THING SINCE THE SUNBLOCK IS ALREADY IN THE MOISTURIZER. [This review was collected as part of a promotion.]
This is such a great moisturizer. I loved the smell and it worked great without being greasy. [This review was collected as part of a promotion.]
Nice product very moisturizing I will purchase in the future. Thank you Home tester club! [This review was collected as part of a promotion.]
I loved it deffinatley moisturizes my skin! I'm glad I got to try this. [This review was collected as part of a promotion.]
Hello there this is a question. Can I use this product with Retin-A Micro?
