"I received the Honey Balmin my Influenster box to review and this product is just amazing! I love how well it hydrates my dry skin and that I can use it anywhere on my body. And it has a wonderful, light fragrance, not a heavy perfume that will make my headache. I'll definitely repurchase! [This review was collected as part of a promotion.]"
Incredible! I have the most sensitive skin and there is only a handful of products I can use without breaking out everywhere. I LOVE this product! NO mineral oil!!! I used it for a week on my neck and cleavage ~ amazing hydration! [This review was collected as part of a promotion.]
I really like the balm I can use so many places I really loved on my neck the most. I have never had a product for my neck and other uses. Feels tightening to me love the free product I received from Influenster. [This review was collected as part of a promotion.]
"I love this balm! I'm always looking for something to use on my neck and chest and I've found it! I use it on my hands, too, as the cold weather batters them! This balm leaves them feeling soft and hydrated. I received this product for free in exchange for an honest review. [This review was collected as part of a promotion.]"
I received this sample from influenster and absolutely loved it. I used it over the moisturizer since my t zone is very dry and needed extra hydration. The texture was creamy and not greasy or oily. It definitely hydrated my skin leaving my skin extremely soft. I would definitely purchase [This review was collected as part of a promotion.]
"I've been using this for the last ten days on the skin in the back of my hands. It's frigid January and it's keeping my skin moisturized and keeping the dry, flakey and wrinkled skin away. it has a light pleasant fragrance and disks right into my skin without feeling greasy. The honey adds a level of moisture to my skin that heavier creams miss. It's a very nurturing balm. I was given this product from Influenster to give an honest review. [This review was collected as part of a promotion.]"
Received in Influenster box and I have used for the part week and a half. Skin feels so soft and I do see a visible difference in the fine lines on my neck and chest.
Love this and will continue to use. [This review was collected as part of a promotion.]
"I have been using this product primarily on my neck. A small bit goes a long way. It leaves my skin feeling soft. The product has a very interesting texture, it is definitely not sticky but also not necessarily too creamy. It has a light feeling. I got this product complementary from Influenster. [This review was collected as part of a promotion.]"
I received this product in a complimentary box from influenster. This is a nice product. It works well on your chest and neck area. It is only very lightly fragrances and the moisture lasts for hours. I also use it on the back of my hands. It makes my hands look younger. It's been especially nice in the cold weather. It's not greasy and seems to lock the moisture in. I wish they made this is a larger size! I've enjoyed testing this product. Would purchase. [This review was collected as part of a promotion.]
My hands have been especially dry and chapped this winter and this balm has been a savior! It's not sticky or greasy and is so hydrating! I love it!
I received this product free of charge for testing purposes from Influenster. [This review was collected as part of a promotion.]
"I was given this to try as part of Influenster. I absolutely love it. Love the smell, feel and texture. I have used it on my hands and neck. I am 52 and am obsessed with skin care. I would definitely purchase this. The moisture is incredible. [This review was collected as part of a promotion.]"
I received this L'Oreal age perfect Hydra nutrition honey bomb from voxbox and I'm very excited to try it. It makes your hands feel very smooth and soft I've used it on my neck and chess also. Would recommend this product two friends and family. [This review was collected as part of a promotion.]
"This balm is really nice. It is a little too heavy for my face but I loved it on my chest, hands and elbows. Great for dry winter skin. It sinks right in to skin with no stickiness. Not crazy about the scent but it dissipates really quickly. I received this complimentary sample from Influenster in exchange for my honest opinion. [This review was collected as part of a promotion.]"
"In love with the ingredient of this All-Over-Balm. with Manuka Honey. I have extremely dry skin in the neck and chest area. The formula didn't leave my skin feeling greasy or sticky at all. I used the balm twice daily on my face, neck, chest, and hands. I noticed that it absorbs quickly. It now goes with me everywhere I go. I received this product complimentary for testing. [This review was collected as part of a promotion.]"
I received this for reviewing from Influenster and I am so thankful. I'm 53 and its beginning to show on my hands. This was so moisturizing on my hands and elbows. I loved the scent and the lightweight formula. I will definitely be restocking when I use up what I received. Great product! [This review was collected as part of a promotion.]
"I received this just over a week ago and it is quite a lightweight body cream. It is non greasy, has a slight scent and quite hydrating. I think the honey helps and it contains Shea butter. I'm not sure this would be of much help in the winter but I think it is a wonderful no greasy body cream. [This review was collected as part of a promotion.]"
"I received this product complimentary for testing from Influenster and I must say, I was pleasantly surprised. I have used it on my hands, my arms, my chest and neck area and I love the subtle honey scent. It has a dewy, slightly golden, afterglow which looks amazing in the sun. I would highly recommend this to everyone! [This review was collected as part of a promotion.]"
I am an oily skin gal so this isn't something I would use on my face. HOWEVER on my hands...wow! My hands are dry and cracking due to the winter weather and this balm is a life saver. I received this as a complementary product to test but without a doubt I would purchase this for continued use. [This review was collected as part of a promotion.]
I received the LOREAL - Age Perfect Hydra Nutrition Manuka Honey All Over Balm - Face/Neck/Chest/Hands complementary from Influenster. It is a perfect add on moisturizer for dry winter skin! Feels great! [This review was collected as part of a promotion.]
"I love this lotion. The smell of honey is sooo good. I'm sensitive to smells close to my face but this one did very well. I mostly used on my neck, chest, and hands but I'll be using all over this next week. My hands often dry out quickly after using lotion but I felt this one had longer staying power. i also like the tube it comes in. I would urge people to give this one a try. I believe I'll be purchasing! [This review was collected as part of a promotion.]"
What a great product. I received a full size product from Influenster to try and must say I'm very impressed. So many uses for this on different parts of my body. Leaves my skin silky soft and moisturized. Highly recommend. [This review was collected as part of a promotion.]
I received this from Influenster to try. I Have very dry thin skin on my over worked hands. As soon as I put this on my skin was plumper and smoother! My hands feel so soft and hydrated. I would definitely use this every day. [This review was collected as part of a promotion.]
I received this product compliments of influenster and I love it!! I love honey based products because they work and there is no chemicals. I have excessively dry elbows and dry skin in general and I have to say that this product was the remedy. Love it and will be purchasing when this runs out! [This review was collected as part of a promotion.]
"I received this product in an Influenster voxbox for free to try. I am super pleased with this product. Softens, moisturises, and makes my skin feel great."
If looking for a great all around moisturizer this is the one. [This review was collected as part of a promotion.]
I received this complimentary product for testing purpose from Influenster. I am in love with this product i have used it on my neck and it did not feel sticky and seem ro help with a little sagging of my skin. [This review was collected as part of a promotion.]
"I received this product complimentary from Influenster for testing purposes."" I am someone that suffers from extremely dry hands in the winter. I used this 2 times a day on my hands and found I have used much less lotion this winter compared to past. This is so creamy and smells wonderful. Will most definitely purchase more!! I have also recieved complements on how my hands look since using this. [This review was collected as part of a promotion.]"
"I've been on a hunt for a non-greasy balm for face, neck and hands that truly moisturizes. Other brands are all so sticky or oily. This gem is a keeper!! I really love it. It blends in well with no residue and gives me no breakouts or irritation. I sometimes apply it over hand cream or neck cream for an extra boost too. You have to try this! Perfection! It was complimentary for testing. I will never be without this product in the future. [This review was collected as part of a promotion.]"
"I received my full size complimentary tube with the Rosy Tone Moisturizer and Mask. This balm is simply amazing! You have to try it to believe it. It has transformed the skin on my hands in two weeks. I have been working to finish building my dream home, so my hands have taken a beating. Two weeks and they are smooth again. I have used it on my neck, face and chest with awesome results. I will be a return customer when this tube is gone! Thanks a million. [This review was collected as part of a promotion.]"
I'm reviewing this as part of an influencer vox box. I loved the Age Perfect Hydra-Nutrition All oOer Honey Balm. It is suitable to use anywhere from face to hands. It softened my hands and treated my very dry skin and not a hint of stickiness. [This review was collected as part of a promotion.]
At first I wasn't sure exactly how to best use this product but after some trial and error I found that I like it best for my hands and my neck area. It leaves my skin silky smooth and smells great. I received this product free to test and review [This review was collected as part of a promotion.]
"Wow, Im so thrilled with the effects of this product! I used it on my hands and neck and am so very impressed by tue visible difference it left on my skin. It left my skin feeling so soft and smooth!"
I recieved this complimetry product for free to try and review! [This review was collected as part of a promotion.]
"This is in my bag at all times now!!! I used this on my face, chest, neck and hands. Felt so smooth and heavenly going on. This is my new go to for extra moisture WITHOUT feeling heavy or too thick. Thank you L'oreal!!! I received this product complimentary for testing and WILL buy it when I run out!!!! [This review was collected as part of a promotion.]"
This balm feels so good on the skin. It work well under makeup if you have extremely dry skin like me. It is a awedome moisturizer for hand and rough elbows. It help my elbows in just one application. I recommend this balm if its in your budget. I will purchase one when this tube is out [This review was collected as part of a promotion.]
"I've been a fan of honey-based products for a while now and I'm happy to see a new contender! Delicate aroma and smooth texture, I applied this before bed and my skin felt just as great in the morning. I plan to try other products in this line. Full disclosure: I received this balm as a complimentary review unit. [This review was collected as part of a promotion.]"
I received this in my complimentary Vox-box from #influenster for testing purposes. I like the way it makes my skin feel soft and smooth great to go with the rosey tone moisturizer. Thank you #influenster for the free products. [This review was collected as part of a promotion.]
"This balm is perfect for those times when your skin is feeling dry and parched. I have dry skin and, in the winter, the indoor heat excacerbates my dry skin. Manuka Honey has antibacterial properties and is moisturizing. So it's great for your skin. I am thrilled to find a skincare product that uses Manuka honey! [This review was collected as part of a promotion.]"
"I have very dry skin overall and decided to initially use this on my hands...I fell in love immediately! First, the smell is amazing and my hands felt soft but not greasy. I plan on keeping this product in my routine and trying it on my chest. [This review was collected as part of a promotion.]"
"When they say immediate results, they're not joking around! I've dealt with dry skin in a number of places for a long time. Applying this to my neck, I saw increased moisture right away. It soothes the skin and made it look great! [This review was collected as part of a promotion.]"
"Soft, smooth, creamy, not oily or leave an oily heavy feel to your face. My face, hands, neck, and chest feel well lovely. I love this product Age Perfect Hydra- Nutrition All Over Honey Balm. And yes the price is within my budget. Thank you. [This review was collected as part of a promotion.]"
I started using this product a week ago. I love it!!! I normally do not like the smell of honey so I was really worried about trying this out. My skin is really dry because of my chemo. I could see an immediate result with this product. My hands and face were softer and there is no greasy feeling.
DISCLOSURE: I received this product free to test and review. [This review was collected as part of a promotion.]
"I was given this gorgeous full sized sample from Influenster and find it perfect for this cold season! It absorbs into my skin completely giving it a smooth appearance. I'm not sure of the scent, though my daughter said I smelled like an expensive flower shop! I'd recommend it! [This review was collected as part of a promotion.]"
"This is fantastic! It is definitely my new favorite body cream and hand cream. No overpowering scent, absorbs quickly with no oily or greasy residue, and it softens my skin so nicely. I used it on my neck, chest, hands and my feet and I really love the feel of it. Will definitely be buying more! I received this product for free to use and review from Influenster. [This review was collected as part of a promotion.]"
The honey balm isn't sticky like the title..is gives a smooth feeling wherever it is used..it doesn't feel waxy..my skin is dry and aged..but with this product it feels tighter and smoother...the formulation is perfect for my skin..I will use this with my other beauty products for sure!! I'm totally sold on these L'oreal skincare products. [This review was collected as part of a promotion.]
"I received mine as a sampler from Influenster. I wasn't as excited about this part of the regimen. It's a little thicker than my taste but also doesn't compliment the other Loreal products for skincare as I feel it should. I also feel it would be a great additive if it had wrinkle reducer since its supposed to be good for the neck and hands. Overall, I can say there's no bad odor and it does go on smoothly. [This review was collected as part of a promotion.]"
I received this as a complimentary sample. I like it as a hand cream quite a bit. Haven't used for my face or body. the light scent is appealing. Cream absorbs quickly. hands feel great but not greasy. The packaging is easy on the eyes. [This review was collected as part of a promotion.]
"I received this product complimentary for testing purposes and I was amazed at its moisturizing properties. It is not sticky at all. It feels very light on your skin, but softens it perfectly. The smell is great too. I would definitely recommend this product. [This review was collected as part of a promotion.]"
"I just received this wonderful balm from Influenster. This balm goes on smooth, it is not greasy, and it has a light, pleasant scent. My fingertips tend to get dry and cracked, and now they are nice and smooth, without leaving traces of the balm all over as some other products do. I recommend this product and will be purchasing it in the future. [This review was collected as part of a promotion.]"
"I received this goodie complimentary from Influenster and I am hooked! It's my last step when getting ready for bed. I rub it into my hands, neck, and a bit on my face. The smell is heavenly. It's not greasy, and makes my skin so soft. [This review was collected as part of a promotion.]"
"Recieved this new all over honey balm from Influenster! I loved and adore Loreal and Honey products. Its a great cream for all over the body. I felt like I needed something a little more moisturizing for my face because I am dry. I loved the smell and the texture of the cream it was very easily absorbed into my skin, leaving everything soft and supple. I would definetly recommend this to my close friends! [This review was collected as part of a promotion.]"
"I tried this product and my skin felt lighter, softer, smoother. It did not feel greesy at all after I applied it which is what I was looking for. I did receive these products as complimentary for testing purposes but they are exactly what I have been searching for. The fomulas are amazing. I just can't get over how nice my skin feels! [This review was collected as part of a promotion.]"
I love that this cream has the benefits of Manuka honey. The cream went on smooth and did a great job of making the pores and fine lines less visable. I just wished that it did not have a perfumy scent. I received a complementary sample. [This review was collected as part of a promotion.]
I received this product complimentary from Inflenster for review purposes. I really loved how this felt. I have been looking for a good hand cream as I was my hands several times a day due to my profession. This product is great. Leaves my hands feeling smooth and hydrated without feeling greasy. [This review was collected as part of a promotion.]
"I love the way this feels on my skin. It Is light and yet hydrating at the same time. I used it on my neck and hands also. I received this for complimentary testing, but will buy this product again. [This review was collected as part of a promotion.]"
"I received this item as a complimentary gift, to test and offer my honest review. I have been using this balm on my hands during the day and before bed. I love the light scent, and the fact that it absorbs easily and is non-sticky. I think that it has made a difference in my dry hands, as I wash them often. This is a great formula! [This review was collected as part of a promotion.]"
"Ive been using this for about a week and I adore everything about it! From its honey scent,to it's lightweight yet effective formula! I recently broke my leg and was in a cast for months. Needless to say,my leg skin was in awful shape and nothing helped until I started using this on it! Now the skin is finally getting back to the prebreak shape! I love how it feels on all my dry winter skin! Thank you Influenster,for sending me this in my L'Oreal Vox Box! Yoy guys rock! [This review was collected as part of a promotion.]"
"Out of all the products, this had to be my favorite!! I had a rough patch on my hand for months and used a prescription, but what I used this, it went away in a matter of days. This stuff really works, I definitely saw and felt the difference in my skin!! When available this will be my new hand cream!!! It has a soft fragrance not overpowering. This was complimentary for testing."
"I really like how this product made my hands, neck feel. It smells great Andrés my skin feel smooth and soft. I received this product as a free trail. I'm glad I did. I will be buying this product again. [This review was collected as part of a promotion.]"
I was really bad to my skin growing up and received sunburns that caused a lot of damage to my chest area. I used this product on my chest and hands and can see a difference. My skin is smoother and some of the spots have faded. Fine lines seem to be disappearing too. I would recommend to family and friends. I received this product complimentary/free for testing purposes.
"I received the Manuka Honey All Over Balm in my Influenster Vox Box and I am soooo glad I got to try it. First of all this stuff smells amazing! I have used it on my face, neck, elbows and hands. It's incredibly rich and emollient but leaves no greasy feeling on my skin. I love that it is in a convenient tube do I can toss it in my purse too. I will definitely be keeping this in my beauty arsenal! [This review was collected as part of a promotion.]"
"I received a complimentary tube of this product to try and I was impressed. When I saw that it contains honey I was worried that it would feel heavy and sticky, but it doesn't. I use this at night and especially like it on my neck and chest. Also has a nice scent. [This review was collected as part of a promotion.]"
"I really like this. The smell is very pleasing, it goes on like silk. It leaves my skin feeling soft and moisturized with out feeling oily or over moisturized I received this product complimentary for review purposes. [This review was collected as part of a promotion.]"
Love this balm. I can use it as a moisturizer on my face and neck or my hands. I carry it in my bag when I'm out to apply to my hands in this cold winter weather. I received this complimentary from Influenster to review. [This review was collected as part of a promotion.]
"This lotion feels great on my skin. I use it in my face, neck and back of hands. The only drawback is that it has a scent which I don't care for. I received this product free through Influenster for an honest review. [This review was collected as part of a promotion.]"
"The all-over honey balm is a paraben and mineral oil free, non-sticky moisturizer for mature very dry skin. That being said, mature I am but very dry on my face I'm not. I enjoyed using this on my hands since I wash them multiple times a day and need a good cream that will work to hold in moisture. This fits the bill, it does have a light fragrance that dissipates quickly. I received this from influenster in exchange for my honest review. [This review was collected as part of a promotion.]"
I received this product complimentary for testing purposes. I have used it for a week now on my hands. It is very silky and smooth on my hands. Especially see a difference in the feel of the top of my hands. They are very soft. I love the packaging too. The squeezable tube makes easy application without waste. I would definitely recommend this product. [This review was collected as part of a promotion.]
I received this product complimentary from Influenster. I applied this product only at night over my moisturizer and I must say that I'm in love. They hydration is awesome for my face and worked great on my hands as well. Will repurchase and continue to use. [This review was collected as part of a promotion.]
I like the smooth feel of this balm. I found it to be a good product for dry skin. I use it on my hands neck and face. It absorbs well but the fragrance was a touch strong for me. Having said that I will continue to use it especially on my hands. I would love to see a fragrance free version. Thanks to L'oreal and Influenster for the complimentary test product. [This review was collected as part of a promotion.]
Received this from @influenster My skin is super dry nothing I've tried never has worked this honey balm works no more dry skin. Love it!!! Gentle on your skin. My face stays hydrated all day. #complimentary #contest from @influenster [This review was collected as part of a promotion.]
I received this product from Influenster to use and provide an honest review. I've been using a week and it has provided a good moisture barrier against the winter elements. I use over by face moisturizer. I like the product. It reminds me of Drunk Elephant daily moisturizer. Good product but not the absolute best I've tried. Does the job. [This review was collected as part of a promotion.]
I thought this was going to be heavy especially after using ON TOP OF the moisturizer. I was pleasantly surprised that it was leightweight and didn't leave my face feeling greasy and heavy. I received this from Influenster for review purposes. [This review was collected as part of a promotion.]
"I love this balm a lot!! I was very pleased the way it moisturized my face and neck. It also has a very nice, light scent to it. I would highly recommend this product to anyone with dry skin. I received this product complimentary. [This review was collected as part of a promotion.]"
I seem to do more cleaning this time of year and my hands are taking the brunt of it; to the point of tiny cracks/ bleeding. I used the balm on the cracks and it's helped to soothe them. I received this product complimentary for testing purposes [This review was collected as part of a promotion.]
I got this for testing purposes from Influenster/voxbox but the opinions are mine.
"Dry winter hands, always. In water every day, drier and drier. From the first time I used this my hands immediately felt smoother and softer! Even after all day of my hands being in and out of water they still feel hydrated! This is one of those products I'll have to buy. Im so loving it!! [This review was collected as part of a promotion.]"
I just received this product in my influenster box. I immediately smothered my body from head to toe. It is such a nice thicker creamy texture and goes on smooth. It feels very rich like my high end creams. The only reason I don't rate it 5 stars is the heavy fragrance. [This review was collected as part of a promotion.]
