"I received a full size tube of this from Influenster and it works great on my neck! I had just started getting a crepey decolletage and since I've been using this every day it seems to be disappearing, at least it's not getting worse! I love the feel and smell too, I'll buy this again! [This review was collected as part of a promotion.]"
"I received my complimentary L'Oreal Paris Age Perfect Hydra Nutrition Manuka Honey All Over Balm from Influenster!! LOVE IT!!! I have mainly been using it on my neck and chest. I have noticed quite a difference! My skin is much tighter, smoother, and softer.I will definitely continue to use my L'Oreal Paris Age Perfect Hydra Nutrition Manuka Honey All Over Balm!! [This review was collected as part of a promotion.]"
I like way it feels going on my skin and I believe that I can see an immediate difference in the moisture level of my very dry skin. I will definitely continue using it and am glad to have been given the opportunity by Influenster's VoxBox program. I received this product complimentary for review purposes. [This review was collected as part of a promotion.]
I was given this product to review in an Influenster Box. I'm completely thrilled with the amount of moisture when I apply it to my neck and upper chest area. I find it keeps my skin smooth and supple with a wonderful fragrance. [This review was collected as part of a promotion.]
This moisturizer is absolutely fantastic! I cannot day enough good things about it! It feels so good on my skin! Not sticky at all. It's smooth and glides on! It has made a huge difference in the way my skin looks and feels especially in this cold winter weather with the dry heat going in the house. I love love love this honey moisturizer! I received this product free from Influenster and the opinions are my own. [This review was collected as part of a promotion.]
"I recieved this for free to try #influenster #l'Oréal for my honest opinion, and I used it on my hands and as dry as they were, it made them soft again, better that most lotions I used, it smeels great, not too greasy feeling. [This review was collected as part of a promotion.]"
I love this Age Perfect Hydra Nutrition Manuka Honey All Over Balm. It's part of my daily routine. I use after the Rosy Tone moisturizer and love the way my skin feels. I received this product complimentary from Influenster for testing purposes and so glad I did! I will definitely purchase I the future. [This review was collected as part of a promotion.]
This All-over Balm is a game changer! My skin loves this silky balm! It absorbs quickly and feels great! It has really helped my face and hands through the cold winter months!
* I received this product for free for testing purposes. [This review was collected as part of a promotion.]
I received this complimentary product from Influenster to review. I must say I'm very impressed. I've been using this every day under my makeup and it feels truly wonderful!! I love that it feels light and luxurious on my skin!! I was using another popular name brand moisturizer but have switched to THIS!! What a difference in how my skin feels!! I love it!! I recommend this product to my family and friends!! [This review was collected as part of a promotion.]
I tried the Age perfect Hydra Nutrition Manuka Honey all over balm on my hands and neck and I love how it makes my skin feel. I have very dry skin but this left it feeling soft and smooth. It has a nice light scent also. I received a free sample from Influenster to facilitate my review but the opinions expressed are solely my own. [This review was collected as part of a promotion.]
"I loved the Loreal Hydra Nutrition Manuka Honey All Over Balm. I used it on my hands, neck, and chest. My hands usually are so dry in the winter, but I used this honey balm on them and my hands have felt smoother than they ever have. My neck and chest feel smoother also. Thanks Influenster for the chance to try these amazing products. [This review was collected as part of a promotion.]"
"I received this product complimentary from Influenster for review and I'm so glad I did! This balm is so moisturizing and smells divine. My skin is usually quite dry, but since I've been using this all over, my skin looks and feels AMAZING! Definitely a product I will continue to buy on my own."
I use this on my chest area which has some sun damage and I saw a difference in appearance after a few days. It is not greasy or oily feeling. I received this product for testing purposes. @Influenster [This review was collected as part of a promotion.]
I received this product complimentary and was not expecting much since I have been a devoted fan of a different brand that is much more expensive for 30 years. I was very pleasantly surprised at the quality and am still in shock at the value. This product leaves my skin feeling so soft and hydrated. Which is huge since I just moved back to Wisconsin fom Florida after 11 years. Winters here are harsh and my skin is sensitive. Great product for any age! [This review was collected as part of a promotion.]
"Received this as a complimentary gift. I used this on my neck and hands. I enjoyed the smell and texture. It's a wonderful product. However, the entire tube lasted 16 days. It's a great product that makes my skin genuinely look so much better but I cannot afford it. Sigh. [This review was collected as part of a promotion.]"
"This is a luxurious, thick moisturising cream. I use it mainly on my hands and it feels so nice! The scent is great as week, just a little strong for me. I received this for review purposes complimentary of #Influentser [This review was collected as part of a promotion.]"
"L'OREAL PARIS Age Perfect Hydra-Nutrition All-Over Honey Balm Soothe & Rescue Dry Face, Neck, Chest, Hands came to rescue my hands from a dry appearance. In its first application I felt immediately as the softness took hold of the skin of my hands and my neck. I felt my skin moisturized. I received this product in # l'orealparis #voxbox #influenster #ageperfecthydranutrition # all-overhoneybalm [This review was collected as part of a promotion.]"
I thought this product would be far too thick and sticky but was pleasantly surprised at how smoothing and hydrating. I mainly used it on face but hope for great results on neck and chest areas. I received this product complimentary for testing purposes. [This review was collected as part of a promotion.]
I recieved a complementary jar of age perfect hydra nutrition manuka honey all over balm to try from influenster.
I use it on my neck chest and shoulders. It went in silky and soft. It was none greasy and my skin felt revived and refreshed [This review was collected as part of a promotion.]
"I loved the Honey all over balm. Made my face, neck and hands feel silky smooth without any greasy residue. The scent is a bit strong but the results are fabulous. I received this as a trial product test from Influenster. Awesome! [This review was collected as part of a promotion.]"
"I've been using this product for several weeks now and It's not heavy or greasy feeling. I use it at night and feel like it gives my skin the perfect amount of moisturizer. I love you can use it on your hands too, my fingers/cuticle area get very dry and it works bueatufully. I received this product complimentary via Influenster for testing purposes. [This review was collected as part of a promotion.]"
I received this balm for free from Influenster. I like because it hydrates without being greasy. It has a pleasant fragrance- but the fragrance is strong. It plumps up my skin and makes the wrinkles on the top of my hands less noticeable. I'm not sure if it's worth the high price. [This review was collected as part of a promotion.]
"So I must say this stuff is the bomb... first thing I noticed is the fragrance. Not overly bearing but pleasant. I loved how it felt on my skin..no heavy oil feeling, very light but intense moisture. It lasted for several hours, however when combined with moisturizer it lasted the entire day, which was unexpected since I have mature dry skin oh and it did leave my face glowing. MUST TRY... I did receive this complimentary but my review is 100% honest. [This review was collected as part of a promotion.]"
This L'OREAL Paris Age Perfect Cell Renewal goes on thick and creamy. It leaves my skin feeling moisturized and smooth. I like the way it feels when applying and after being applied. I received this product complimentary for review purposes. [This review was collected as part of a promotion.]
"I received this product complimentary for testing from Influenster. I loved how this cream makes my skin feel soft and moisturized With no greasy feeling, it absorbs nicely with a very suddel scent I had no problems wearing this under my makeup. Also works wonders for your neck,chest and hands. [This review was collected as part of a promotion.]"
"Could I get a family-size? I'm Honey and I'm into everything honey. But this product exceeds even my penchant for everything about bees. It goes on smooth and leaves my skin feeling silky and nourished. I received it as a complimentary product in an Influenster Voxbox, but I'd buy it myself. [This review was collected as part of a promotion.]"
"This is my FAVORITE. Seriously. I have a fetish for lotions, lipbalms, handcream, etc--and I am beyond thrilled with this one!! I love the smell (it's yummy!) I love that it's actually *designed* for skin on both face and body. The tube is super--no ""over-dispensing"" by accident, and the texture of the balm is wonderful. I have awful winter hands & this balm is just magical. Quite possibly the best product I've ever gotten sent to review from #voxbox & #Influenster! [This review was collected as part of a promotion.]"
"I received a full size item in my influenster voxbox and I couldn't be happier. It's not overly fragrant, it sinks in quickly, leaves your skin feeling very soft and hydrated. I just wish that feeling would last longer. Seems within a few hours, or halfway through the day, that feeling of softness and hydration is gone. However I do enjoy this lotion and I keep it on my desk and use it everyday. I do not like overly fragrance items on my hands, and this is not like that at all."
I have been using this for about 20 days and Ilove it. I work with cardboard and money amd my hands tend to stay dry. A little bit of this stuff on my hands and they are moisturized my entire shift. It smells grest and is light weight. Price is right. I received this complimentary from Influenster for reviewing. Thank you Influenster. #influenster
I received this item for free from Influenster for testing purposes. I have been using this for over 2 weeks now and I LOVE it!!! I use it daily on my face before I apply my makeup and it is so moisturizing and leaves my skin silky and soft. I use it at bed time too. Lately I've been using it on my hands because they have been super dry and this has helped so much. I will definitely be purchasing this product again!!! [This review was collected as part of a promotion.]
Then this is the best multi functional balm for you. I received this for free From influenster in exchange for a review. I have been using this for two weeks on my hands and I have noticed a huge difference in the look and feel on the tops of my hands. I have crocodile skin and this balm does what it says it does. I'd apply it to my neck but I can't get past the scent. [This review was collected as part of a promotion.]
I used this product on my hands. You only need a little bit to rub on. After applying it to my clean hands it left them feeling refreshed and soft and smooth. It was like my hands were drinking it in that's what it felt like after applying it to my hands. It has a pleasant smell to it a light smell you can tell there is honey in this product. I received a complimentary example for testing purposes from Influenster. [This review was collected as part of a promotion.]
"I received this product in exchange for my honest review. I absolutely love, love this all over balm. It's not like lotion and makes your skin feel like silk or butter I don't know, but it's truly wonderful. Turned my dry Ohio skin into something soft and supple. [This review was collected as part of a promotion.]"
I absolutely love Age Perfect Hydra Nutrition Manuka Honey Face/Neck/Chest/Hands Balm. It smells amazing and feels even better.
I love the way it softens my hands without leaving a greasy feeling. Just amazing softness. [This review was collected as part of a promotion.]
"I've been experiencing dry winter skin and have found Age Perfect Hydra Nutrition Manuka Honey All Over Balm to be wonderful hydration for my face, neck, chest and hands. It feels really good after using. My skin was very thankful to receive the healing hydration and I will definitely be using this product often. I recieved a complimentary full size sample from Influenster. [This review was collected as part of a promotion.]"
"I have received this from inflencster for a truthful review for free.The all over balm is amazing , as an older woman my skin dries out quick and this just absolutely puts a stop to it. It's smooth and the scent is amazing. It's thick enough that you can put it on once before bed and it still feels good in the morning. [This review was collected as part of a promotion.]"
"I received these products complimentary for testing purposes.The Age Perfect Hydra Nutrition Manuka Honey ALL OVER BALM has my neck,chest,face,@hands feeling 30 years old again.The smell is perfect.the daily use on my skin glows.i love it!!!!! [This review was collected as part of a promotion.]"
Thank You so much Influenster!! I love the L'Oréal skin care. In the short time using the skin care I've felt and seen a big difference in my skin. Makes my skin so soft and seem to been great with my wrinkles. I love the quality of the products and the smell is amazing. Thank you so much Influenster!! [This review was collected as part of a promotion.]
"I received this product complimentary from Influenster and I have to say, it's pretty good. A little goes a long way due to it being a thick consistency. My skin feels very healthy and supple after using. I do not like to use it if I am not going to wear makeup, however, because as time goes on it feels a little greasy. So I just wear it when wearing makeup and it does very well!! [This review was collected as part of a promotion.]"
This is a light and creamy balm that I've been using mostly on my hands and neck. It has improved my severe dryness on my hands with application several times per day. Best part is the scent. Light but you definitely smell the honey. I did receive the complimentary for testing purposes. [This review was collected as part of a promotion.]
This product was sent to me as a complimentary sample from influenster to try and review I was excited to try this as I had heard great things about it and I wasn't disappointed. The Age Perfect Hydra Nutrition Manuka Honey All Over Balm - Face/Neck/Chest/Hands smelled amazing and it left my skin soft and extremely moisturized. I will continue to use this and will repurchase. [This review was collected as part of a promotion.]
"Received this product from #Instagram to try out for free ... so glad I was chosen for this campaign! Since turning 50 a few years ago, I have been experiencing dry, flaky skin on my nose, as well as very dry skin on my hands. Not anymore!!! This silky, hydrating balm absorbs quickly leaving my once dry skin softer and more supple. It has even minimized the tiny lines under my left eye after only a few days use! Love this product!! [This review was collected as part of a promotion.]"
"I received this product from Influenster for testing and review purposes. I've been using this balm for a few weeks mostly around my eyes, on my chest, and on my hands. At first the scent was a little much for me, but I actually like it now. My skin feels softer and the lines around my eyes look better! I would definitely buy this product! [This review was collected as part of a promotion.]"
"I use this on my face, hands, arms, basically everywhere because it is so nice. Nice fragrance, very light, and it moisturizes without leaving a greasy film. I especially like it on my face before I put on my makeup because I have very dry, aging skin and this seems to help hydrate my face quite well. I did get this free from Influenster for testing purposes and I am thrilled with the product! [This review was collected as part of a promotion.]"
I received this to try for 30 days. When I first opened it and tried it I was immediately in love with the scent. I live in a very dry climate and constantly battle dry skin on my face and hands. I use this at night right before bed and after only a couple of days I noticed a difference. I'm starting to use on on my elbows and it's working on them as well. Very happy with this lotion and between the smell and results I will purchase again.My only problem is that I will run out soon! [This review was collected as part of a promotion.]
I need the extra moisture in the neck area. I love that it contains honey. Honey is said to be very good for skin and healing properties. I haven't had the product for long so I can't speak of continued use. So far I'm liking it and using daily! [This review was collected as part of a promotion.]
I was given a full sized sample tube of the lotion and fell in love after using it one time. 2 days after using it my hands were still silky soft and I have very dry skin.
It also smells wonderful fresh and clean. [This review was collected as part of a promotion.]
"I received a complimentary box of L'oreal products. This balm has replaced the hand cream I've always kept in my purse and on my desk. It has a sweet, light fragrance and doesn't leave your skin oily or sticky. [This review was collected as part of a promotion.]"
"i love it.... nice smell, goes on smooth, accents the rose moisturizer greatly.... i put it on hands, neck, face.... best thing no side effects... i break out easily, and this has not done any damage..... [This review was collected as part of a promotion.]"
I received this from Influenster to test and review. I love love love the scent! I used it on my hands and elbows. It absorbed quickly and left my hands feeling silky smooth. The only negative is that I wish it came in a bigger size. [This review was collected as part of a promotion.]
"This smells amazing! Not overpowering, just a light, sweet scent. I use it every morning on my hands as part of my makeup routine, after finishing up my face. I think it is a bit pricey for the product, but would also like to try it as a light facial moisturizer, as I do have drier skin, and my face appreciates any kind of moisturizer. I received this product complimentary for testing purposes from #influenster. [This review was collected as part of a promotion.]"
I received this as a sample review from Influenster. This is one of my favorite face and skin products that I have used lately. It leaves my face moisturized and silky smooth without that oily feeling. [This review was collected as part of a promotion.]
"I received a complimentary tube of this and I absolutely LOVE it! It makes my skin so soft. It can be used on your hands, face and neck. While it says you can use over your moisturizer, I found it's almost too much. It is easily used alone. I often use it at bedtime as a night time moisturizer. [This review was collected as part of a promotion.]"
I've used this for over 2 weeks. It smells wonderful. The moisture result is soft and dewy. Can be used anywhere on your body. Feels amazing on your feet and elbows. A little goes a long way. Slightly pricey in my opinion.
Received this complimentary for an honest review. [This review was collected as part of a promotion.]
"Love this!!! I've been using this faithfully for over 2 weeks on my neck and chest areas, it makes sad to say) aging skin look so much better!! Have already purchased another one as a back up. I'm an ER nurse and on the move for 12 hr shifts and this stays strong through my shift!!! [This review was collected as part of a promotion.]"
This applies nicely not greasy and has a light scent. My helps relieves my dry hands. I sometimes forget my neck when moisturizing and have noticed my skin looks better. I received this product complimentary for testing [This review was collected as part of a promotion.]
"This product is amazing. I used it on my hands, face, neck, and upper chest. It left my skin looking plumper and so smooth, I honestly couldn't believe how good it works, this is by far my favorite moisturizing balm I have ever used. [This review was collected as part of a promotion.]"
"I received this from Influenster for testing purposes and I love this balm! It does have a pretty strong fragrance of the manuka honey, but I really enjoy it. It is very moisturizing and melts into the skin. I use it on my hands, neck and chest and it moisturizes without being heavy. There is no greasy feeling, just smooth skin. I will repurchase for sure. [This review was collected as part of a promotion.]"
"Used twice a day. I'm not a fan of scented moisturizer, but it was a very light floral scent so I didn't mind too much although I prefer unscented. Made my face and neck so soft. I liked the feel off my skin after use. #free product for trial purpose. [This review was collected as part of a promotion.]"
I received this to write a review. For me this product is ok. I used it on my hands. It does have a slight fragrance. I work on a ranch so my hands are dry. I applied a small amount of product on my hands I would say smaller than a dime. It initially felt greasy. As I rubbed it in some of the greasiness went away. My hands feel slightly moisturized. Due to my face having oilier skin I only used about a pea size amount. It was slightly heavy but not as bad as I thought it would be. [This review was collected as part of a promotion.]
"I received a full-size sample to review for Influenster and I'm in Love. I use this on my hands during the day and at night, I apply it to under eye and neck. It is non-greasy and absorbs immediately. [This review was collected as part of a promotion.]"
I received this as a complimentary product to try. I love it! This is a product i will continue to use. I have super dry skin and this all over balm is amazing my skin looks and feels smooth and hydrated. It contains msnuka honey and nurturing oils to give your skin a a soft refreshing glow. Im no longer embarrassed by my dry skin. I am definitely making this part of my daily routine. [This review was collected as part of a promotion.]
I received my the Review for Age Perfect Hydra Nutrition Manuka Honey All Over Balm - Face/Neck/Chest/Hands to try from my Influenster box this month and let me tell yathis smells ah-mazing yes plus my skin feels more hydrated and firm. Would I by this Yes will I yes! [This review was collected as part of a promotion.]
"This feels amazing on my skin. I was actually surprised how unbelievable my skin felt the first night I used it. I woke up to plumper, hydrated, rosy skin. This is definitely a keeper. Easy to use. After washing face and toner I used as my final step. I received the product free from Influenster.. [This review was collected as part of a promotion.]"
"I received this product from Influenster as a complimentary sample. This All Over Balm is exactly what my poor skin needed! Whether it's summer or winter, my hands and face are always dry. I've tried many, many products that promise the moon, but this product truly lived up to its claims. I'm a believer now! [This review was collected as part of a promotion.]"
"I received a complimentary tube of age perfect hydra-nutrition all over honey balm. I was amazed at how my hands felt in the midst of winter. The hydra nutrition takes care of dry skin, while leaving my skin very soft and smelling great. I would recommend. [This review was collected as part of a promotion.]"
"I have very dry skin every winter and I noticed such a difference from the very first use. I use it on face, neck and chest but my favorite place is my hands. They get so dry, dull and chapped in the winter and we're even so soft and supple the next day after many many hand washings. I will definitely keep using this in the future. I received this complimentary from Influenster for testing purposes. I do plan to buy more. [This review was collected as part of a promotion.]"
"I received this product complimentary to review. I have used this on my hands for the last two weeks during these dry winter months. It does a good job moisturizing, but my hands still feel that way in the morning. I feel like it doesn't last long enough to be truly moisturizing and worth the price range they are putting it in. [This review was collected as part of a promotion.]"
"I received this product from #influenster. My skin is starting to show the signs of aging at 52. I have tried so many products trying to find something that worked. My search ended here. This is amazing, it made my skin feel and look soft and smooth. It wasn't at all heavy or greasy feeling. I would definitely recommend this to everyone. [This review was collected as part of a promotion.]"
Yes I really like this eye cream as stated previously in my other review. I put it on underneath a very heavy concealer and it made my eyes look like the areas was airbrushed. I will definitely be buying this again. I received this in a VOX BOX from INFLUENCER. THANK YOU L'OREAL [This review was collected as part of a promotion.]
