4.8,"['306', '61', '6', '2', '1']"
I used L'ORÉAL age perfect hydra nutrition and I absolutely love it! I am 50 yrs old and this product made my skin feel like I was in my 30s again! I can't wait to start adding it to my skincare routine. [This review was collected as part of a promotion.]
It's non- greasy very moisturizing for my dry hands. I don't use it on my face because it's too heavy but great for your neck and décolletage. It absorbs er quickly and has a nice scent. I received this product complimentary for testing purposes. I really enjoyed this product. [This review was collected as part of a promotion.]
I received this product from Influenster to used and reviewed. I'm one of those people who have to see to believe.and I'm a believer. First time I used this on my neck I knew I will see visible results. My neck was so soft but at the same time it was firm again but not tight.my face my neck feels more soft and smooth..
I will definitely recommend and buy this again . [This review was collected as part of a promotion.]
"I received this free from Influenster to try and I absolutely live it! I used it on my face, neck and hands and wish it came in a vat so I can I mmerse my whole body in it! It made my skin so much softer and added the needed moistire for this desert dweller. It had a nice scent and you can even pick up the subtle honey undertone. Of the three products I received to try, this was my favorite by far! [This review was collected as part of a promotion.]"
"L'Oréal's All-Over Honey Balm is made to be used anywhere and everywhere. Winter has given me dry toes, dry knuckles. Etc and this product is what the doctor ordered! The scent is a sweet honey, which I actually like quite a bit. It's a good size for slipping into my purse or overnight bag."
I received this product free of charge in exchange for my review. Thank you L'Oréal and Influenster! [This review was collected as part of a promotion.]
This was provided to me as a courtesy for testing purposes. I've been using it on my hands. They're definitely smoother. A little greasy going on but absorbs quickly. Has a nice light smell. I would definitely buy this in the future [This review was collected as part of a promotion.]
"I got this in a full-size trial kit through Influenster & of the 3 products in my box, this was by far my favorite product. It's so lush, thick yet smooth as you spread it on your skin. I am using on my face & neck. The neck area has recently begun to get a “crepe-y” appearance that I do not like! My skin seems to just drink in this moisture formula & looks healthier, smoother since I began! Check it out for yourself. I think you'll love it too! [This review was collected as part of a promotion.]"
Oh this moisturizer is soooo nice! It has an ever so light scent of honey which I love. It more of a lotion than a cream but it's not thin or watery. It's smooth and silky and just glides on. I love how it sinks into my skin leaving it very soft. A little bit goes a long way too. I've been using this as my evening moisturizer and I'm very pleased with it. Thank you to Influenster and LOreal Paris for this free sample in exchange for my honest review. [This review was collected as part of a promotion.]
"This balm is amazing. You can use it on your hands and still open bottles (I usually have to wipe my hands off or I can't open the shampoo). Feels silky soft and smells beautiful. I got this product free in order to test it, and I'd buy it in a heartbeat. New fave! [This review was collected as part of a promotion.]"
I am on week 3 of using the All Over Balm and am so pleased with the results. After use my skin feels soft and smooth without feeling sticky. I had no idea the difference Manuka Honey could make. This has become part of my daily skincare routine. So glad I came across it! [This review was collected as part of a promotion.]
Many diverse uses. It can be used all over your face and that really important delicate I area and for my sensitive throat and neck and even my hands to prevent them getting rough in cold weather very enjoyable received as part of an influencester campaign. [This review was collected as part of a promotion.]
"I received a complimentary full-size sample of this all over honey balm. I'm over 50 and I have very dry skin. I used it twice-daily after cleansing my face for several weeks and I immediately noticed a difference. My skin was smoother, softer and felt like it did 20 years ago. If you're considering trying it, do it you'll like it too. [This review was collected as part of a promotion.]"
I was given this product complimentary to review and I'm so happy! I love using this on my hands and heels and other dry areas! It really does give you that extra boost of hydration you need for rough areas! [This review was collected as part of a promotion.]
I received a free sample of this product from Influenster. I tried using it but I couldn't get past the string honey odor of the product. Usually I like that scents L'Oreal puts in their products but this one wasn't for me. [This review was collected as part of a promotion.]
The Age Perfect All Over Honey Balm is just right when you are on the go and want silky moisturizing without heavy oils. It smells edible and feels like silk on the skin. I think I will have to keep this Balm around!
*I received this product free in my #VoxBox from @Influenster for my unbiased review. [This review was collected as part of a promotion.]
Loreal Paris Age Perfect Hydra Nutrition Manuka Honey All Over Balm is wonderful. I use it on my face neck and hands. It has a fresh light scent. It is non greasy and leaves my skin smooth and soft. I received this complimentry from Influenster. [This review was collected as part of a promotion.]
I received this product about two weeks ago via #influenster. What a great addition to my daily routine. Age perfect hydra – nutrition all over bomb makes my skin feel soft and smooth My normally dry and dull skin feels wonderful today. I have even started to use it on my neck and it I have seen a smoother softer effect. Thanks L'Oréal and #voxbox
For allowing me to find a new product that I love [This review was collected as part of a promotion.]
I received this unique product complimentary in return for my honest review from influenster! The concept completely intrigued me and I was a bit concerned about an all over body care concept however I was pleasantly surprised as this product was moisturizing without a greasy feeling! Nice light scent as well! [This review was collected as part of a promotion.]
I have never found a product that is as good as this to relieve dry skin on my face neck and chest. It has this silky feeling that feels so good for my severe dry skin. I received this product complimentary however I will be purchasing my own because of the great quality. [This review was collected as part of a promotion.]
"I really like the Age Perfect All Over Honey Balm for my hands, neck and anywhere that's a bit extra dry. It's not greasy but seems protective and soaks in nicely. Not super crazy about the scent, it's not horrible but could be lighter for my liking. I would recommend this if you want to give your skin some extra TLC. This product was provided to me complimentary in exchange for an unbiased review. [This review was collected as part of a promotion.]"
"I received this product free for testing purposes. This is my honest and unbiased opinion. My hands are always dry and rough looking. I have my hands in water a lot and it is hard to keep them moisturized. I noticed a huge difference as soon as I applied this product to my hands. My hands felt softer and had a younger appearance. I love that L'Oreal lets you know on the box what to expect after one day, end of the day, and one month. [This review was collected as part of a promotion.]"
"I received the all over honey balm free from Influenster and I will buy this product over and over. Super light weight but moisturizes so well. I used it on my chest, face, and hands. The smell is heavenly. I used it by itself but it does say to apply over your daily moisturizer but I felt it was enough moisture by itself. [This review was collected as part of a promotion.]"
"Wow! I've never had a moisturizer that felt so good! I used it on my neck, face, and hands as suggested. It made them feel like a baby's bottom. I wish I had more since my husband loved it too! The fragrance of it was soft and a little goes a long way! So soft and smooth! I recieved this complementry. [This review was collected as part of a promotion.]"
"I received this full-size product as a sample from Influenster to try out. It was a total surprise, 1 of 3 L'oreal products. The product says it's a ""honey balm"", but thankfully it is creamy and not sticky like real honey. It's recommended for the face, chest, hands and neck. I tried it on my neck, chest and hands. Love it!! It goes on smooth, has a faint scent and a little goes a long way. No greasy feeling. I will continue to use this product. Thanks Influenster!!!! [This review was collected as part of a promotion.]"
"I just received my VoxBox with this product and I love the way it makes my face feel. With all three products Age Perfect Hydra-Nutrition, Age Perfect Cell Renewal time mask and Age Perfect tone cream my face feels fresh, clean and hydrated. I just love the way it makes my face feel and how great it looks. I can't wait to see the results after using it for a month. What a wonderful complimentary gift. Thanks!"
"I received this as a complimentary product from Influenster and was shocked it was a full size product. I have extremely dry skin and have not been able to find a product that will keep my hands from getting flaky. This is it! You can use on hands, face, neck, chest. [This review was collected as part of a promotion.]"
"Great product, light-weight formula not grease, easily absorbed. Leave your skin feel soft and fresh not sticky or heavy on the skin. It's beautifully scented, nothing to strong. Just a gentle fresh scent, very appealing. Truly enjoy using it. Thank you Loreal for sending to me free ro try, I will definitely purchase this when I all out. [This review was collected as part of a promotion.]"
loreal Age Perfect Hidra Nutrition is a smooth cream that help with the dryness of the skin on the face neck chest and hands is foft to touch and the skin instantly absorb leaving the well moisturized and soft and shine time i like this cream very much because it is not greasy i recommend it iam very pleased and i willcontinue using it [This review was collected as part of a promotion.]
I love it. I feel like a celebrity when I use it. Because it is luxurious. It goes on easy and evenly. As they say it's not sticky. I received a complimentary tube and I was not disappointed. [This review was collected as part of a promotion.]
I was sent this product for free from Influenster to use and review. I really love this stuff! My skin feels softer and fine lines are less noticeable. I would buy this product. [This review was collected as part of a promotion.]
I was sent this sample for review and I just Love it. My skin is soft and moisturized feels younger than I already look! Thank You! [This review was collected as part of a promotion.]
"I received the Honey allover Balm Complimentary of @L'Oréal I just love this Balm it has the best hydration for your face down to your hands, sooo soft and slikly great for your cuticles also!"
I received this product complimentary from Influenster to try and review. I am in love with this product! It's amazing. It feels wonderful going on the skin. It keeps my skin moisturized for hours. The smell is amazing as well!
"I absolutely love this product because it makes my hands feel really soft. I love the smell, the easy to twist off cap. [This review was collected as part of a promotion.]"
This is a great . I used on my neck daily and it smoothed out all the lines and wrinkles in my neck . Thank you L'oreal and voxbox for sending this product to me to try for free [This review was collected as part of a promotion.]
"I really like this balm. It is good for dry skin on your face, neck, chest and hands. I like the smell and the way it hydrates my skin. I received this complimentary for test purposes. [This review was collected as part of a promotion.]"
"I am using this product on my face, but primarily on my neck and hands. I love it. It is thick and moisturizing, but not greasy at all. I received this complimentary from Influenster for my review. [This review was collected as part of a promotion.]"
"L'Oreal All over Honey Balm works great leaving your skin feeling hydrated again . Great for dry hands , neck and face . Leaving skin feeling smooth and not greasy . [This review was collected as part of a promotion.]"
Oh my!! I LOVE this Age Perfect Hydra-Nutrition All Over Honey Balm! I received this is a complimentary gift to try. I have especially dry skin in the winter months. This balm works so well! [This review was collected as part of a promotion.]
This product was sent to me for free by Influenster. This “honey balm” as I call it is amazing. The scent is light and fresh and is not at all greasy. I love the feel of it on my hands and then I usually go up my neck with the leftover on my hands. I would like on by my bed and at my office! [This review was collected as part of a promotion.]
I received this complementary to try from Influsenter. [This review was collected as part of a promotion.]
"I received a sample of Age Perfect Hydra Nutrition Manuka Honey All Over Balm for Face, Neck, Chest, and Hands. When I opened the sample and got a good amount, I absolutely fell in love with it. I love the scent. I love how it is meant for more than my face. My neck, my chest, and my hands thanks Loreal Paris for this wonderful product! [This review was collected as part of a promotion.]"
"This is a nice, rich cream that really moisturizes your skin nicely. The moisture lasts a long time too. I will buy this cream. I received this item free in an influenster voxbox for testing purposes. #voxbox #lorealparis #loreal #complementary #influenster [This review was collected as part of a promotion.]"
"This product is royalty!!! It makes my face, chest, neck and hands extremely hydrated without leaving a greasy feel. It also is a protection for my skin from the cold humid weather that we have been experiencing lately in NOLA. I will definitely keep this in my stash and recommend it to my friends and family."
I received this product Complimentary to test from Influenster. Love it!!!! [This review was collected as part of a promotion.]
"I received this as part of a survey group, and I have to say this is by far my favorite lotion. It is light and not greasy. Winter is always rough on my skin. I love that this is small and light enough to toss in my purse, and it not only works for my face, but hands and elbows as well. I will continue to purchase this...a little goes a long way! [This review was collected as part of a promotion.]"
I received this product complimentary in exchange for an honest review. I love this product. It feels so good on my skin and is nongreasy. My skin looks and feels good since using this product. Very happy with it! I received this product complimentary for review purposes. [This review was collected as part of a promotion.]
I received this product complementary from L'Oréal to try out. I have combination skin and my first use was on my face and neck. The product was creamy upon initial touch but it seemed a little heavier than I expected. Although it immediately soaked into my skin it left my face with a tacky feeling. After a few minutes I went ahead and added an additional moisturizer on top of this one. Although this one is not good for me it could very well be good for someone else. [This review was collected as part of a promotion.]
"I may be overly-particular in my skin-care routines. I got frustrated and began making most of my own; however. There are products I find to meet my standards. Manure honey IS an excellent addition to May products, but not this one. I found it to smell like shampoo and to be slightly sticky. I didn't feel anymore hydrated or moisturized. All bark, no bite."
"This Balm is extremely moisturizing & doesn't leave a residue. I use it on my hands, neck & chest at night & toss it in my purse for hands during the day. Love that it contains antioxidants & manuka honey! A little goes a long way. Will continue to use & I would repurchase. I received this complimentary for testing. All opinions are my own. [This review was collected as part of a promotion.]"
This is an okay moisturizer but maybe a little overpriced. It smells nice and it doesn't sting on sensitive areas. I received a complimentary sample for testing. [This review was collected as part of a promotion.]
"I've bedn using this product for a few weeks and it works wonders on rough, dry skin, especially my hands and knuckles. Feels silky and luxurious. [This review was collected as part of a promotion.]"
I found that this product is great for moisturizing the tops of my hands. Especially in this cold weather. [This review was collected as part of a promotion.]
I was given this sample complimentary by Influenster and love how it makes my skin feel and look. My skin is more supple and doesn't look or feel dry anymore! [This review was collected as part of a promotion.]
I received this product complimentary for Influenster to review. I have used this product every day since receiving. I love that it isn't greasy or oily and leaves my skin feeling great. [This review was collected as part of a promotion.]
"I have never been big on taking care of my skin but ever since I received sample from Influenster, I have been using this daily. Love the scent and just the way it makes me feel. [This review was collected as part of a promotion.]"
"I received this product free from Influenster for testing purposes. L'Oreal Paris Age Perfect Hydra- Nutrition All-Honey Balm is a good product. I love the smell, it is very light not overwhelming. I mainly used it for my hands and neck. It does work well hydrating the hands. Only negative side if using for hand cream only has 1.7 ounces. I do recommend this product. [This review was collected as part of a promotion.]"
"Age Perfect Hydra Nutrition Manuka Honey All Over Ball is amazing! It has a very nice, light smell to it. It doesn't feel greasy at all when I put it on and it leaves my face, neck and chest feeling and looking awesome! I really like that it can be used alone or with the Rosy Tone Cream. It's definitely a keeper!! I received this product complimentary for testing purposes. [This review was collected as part of a promotion.]"
This is the most luxurious balm I have ever used. It didn't take a lot of product and I love that. It smell wonderful and isn't greasy or sticky! I received this product for free from Influenster for my honest opinion and review. [This review was collected as part of a promotion.]
"I received this free complimentary product from Influenster! Let me just say, “I love this product!” Seriously, it feels so amazing on your face, decaltae, neck and hands!!! It's creamy, light, smells wonderful and just makes your skin look and feel beautiful!! This cream will also continue to be part of my daily regimen. Lastly, it never caused me to breakout, nor is it greasy. You won't be disappointed. [This review was collected as part of a promotion.]"
"This product needs to come in gallon size. I love this product! It is not greasy, sticky, or oily. It has a very hydrating result without leaving your skin too shiny. It is great for your face too. The scent is pleasant and not overwhelming. I received this product complimentary. [This review was collected as part of a promotion.]"
"I tried this product on my face because I had some dry and irritated patches. After one use I noticed a big difference and after only a few days the patches were gone. This product is soothing and you only need a small amount. I am going to use on my hands, neck and chest too. This product needs to be made for whole body use and needs to come in a larger size. I received this product in a complimentary vox box for testing from Influenster. [This review was collected as part of a promotion.]"
I was scared about the color of this product so I used it on my hands and wow it really worked! I received this product from Influenster to try and I will buy this product since it is so good. I wish it came in a bigger size for my entire body. [This review was collected as part of a promotion.]
"I am on constant alert for an effective moisturizer that doesn't feel heavy and greasy; this one did not disappoint. I also enjoy the slight sheen it leaves after absorption. Good job, L'Oréal!"
This product was complimentary. [This review was collected as part of a promotion.]
"The L'Oréal Paris Age Perfect Hydra Nutrition All Over Honey Balm is a great product!! The packaging is nice and convenient to carry in my purse or gym bag for moisturizing on the go. The fragrance is nice, but not overpowering. After using the Honey Balm, my skin immediately feels super hydrated. This moisturized feeling lasts throughout the day. I received this product from Influenster in exchange for a product review. [This review was collected as part of a promotion.]"
"This is an interesting product. It is designed to be used wherever you need it. No more worrying about one cream for your face, a separate one for your chest, etc. I primarily used this on my aging chest. I was remiss in using sunscreen regularly and have some crepe like skin on my chest. This balm has been great at making that skin look much better. It looks healthy and much smoother. I'm so glad I got to try this out free thanks to Influenster. [This review was collected as part of a promotion.]"
I was chosen to receive a free sample of L'Oreal All Over Honey Balm. I received this product complimentary for review purposes.
I love the fact that I can use this product not just on my face but also on my neck and hands. My skin feels softer and smoother. Not greasy at all. [This review was collected as part of a promotion.]
"Age Perfect Hydra Nutrition Manuka Honey All Over Balm is amazing. I've been using it on my hands, neck and chest and I'm addicted! It absorbs quickly and immediately moisturizes, soothes and improves my skin's appearance. It feels nice and smells good too. I love it."
"Thank you, L'Oreal for sending me this product complimentary. I appreciate the opportunity to try it for free. [This review was collected as part of a promotion.]"
What a great idea! Honey smell is something we all associate with healthy and natural. I loved the smell of this product. I used it mainly on my chest and neck. Areas that have suffered from sun exposure over the years. It went on easily and completely absorbed into the skin leaving no film. I received this complimentary from Influenster for testing purposes. [This review was collected as part of a promotion.]
"I received this product from Influenster. I never put moisturizer on my face only bb cream and sunscreen. This definitely felt too heavy for me but it smelled great! I did also try it on my hands and it left them soft all day. I wouldn't spend the money just for my hands but it's not a bad product, just not for me. Thank you L'Oréal and Influenster for the free product [This review was collected as part of a promotion.]"
I received this product compimentary from Influencer for testing purposes. I cannot describe how much i love the scent it is devine! The lotion is smooth and easy to apply but ater i applied and touched my face my skin felt a bit tacky but i had no problem applying my makeup over it so it was not an issue. I will definitely continue to use this product if only for the scent alone. [This review was collected as part of a promotion.]
This has been a miracle worker for me. I have very dry under eyes and cuticles and this balm has made such a huge difference in my dry skin. It is very creamy and absorbs quickly. I received this product complimentary for review [This review was collected as part of a promotion.]
"So, I decided to use this product on my hands and it was much needed considering I have my hands in water so much. After about two weeks of use my hands feel very soft and supple and we'll-moisturized. And I love the fragrance. Although I received this product compliments of Influenster the opinion is solely mine and I would gladly pay for it. [This review was collected as part of a promotion.]"
"I have been using this product for about 3 weeks on my hands, neck and chest. The scent is pleasant and mild. The balm absorbs quickly and is not greasy at all. My skin was extremely dry with the cold weather and this balm has helped hydrate my skin. my skin feels softer and smoother in just 3 weeks! I would highly recommend this product and I would purchase it again. [This review was collected as part of a promotion.]"
Age Perfect Hydra Nutrition Manuka Honey All Over Balm is the perfect all over lotion. Thia lotion is luxiously smooth and not sticky. Thanks to Influencers for allowing me to try and sample for my honest review. [This review was collected as part of a promotion.]
My skin gets very dry patches during the winter and this balm helped immensely. I saw results after 2 applications. My favorite way to use this is on my hands! What a difference on my rough dry cuticles. The directions say to use twice daily but I would only do that if skin is extremely dry. I received this product for free for reviewing purposes.
