"I struggle to find a good lotion especially for my hands. This product has a silky smooth feel and a small amount of fragrance, not overpowering. I received this product complimentary for testing, and really like it. [This review was collected as part of a promotion.]"
I used this over my Rosy Moisturizer and my skin feels like heaven. Made a huge difference on my neck and chest and my crow's feet..softened these areas so much. A must have! I received this complimentary product from Influenster for testing and will never be without it again! [This review was collected as part of a promotion.]
Got this along with the rosy tone mask and moisturiser in my influenster box and have to say this is my favorite of the three. If I just bathe in this I'd be fine. My winter skin is so dry it's actually painful at times. This made it feel better and when adding to the rosy tone moisturizer my face stayed hydrated all day. [This review was collected as part of a promotion.]
I received this a few days ago and have used to a couple of times. This is just great. It applies easily and soaks in fast. Doesn't make my face feel greasy at all. It smells so good. I like the feel of the balm. It hasn't bother my eyes at all. I have really sensitive skin and it hasn't bother me. As far as results from using it i will have to write another review for that. I received this for complimentary testing. [This review was collected as part of a promotion.]
I received this complimentary. I first tried this on my hands and was very impressed with the results. The light fragrance is wonderful. Instantly soothes dry skin. I have very sensitive skin and have had zero breakouts or irritation. I will definitely be purchasing this as part of my daily routine. [This review was collected as part of a promotion.]
"I received this in a complimentary Vox box, what a pleasant surprise! It's perfect for nourishment everywhere - face, hands, neck! It isn't gooey, it goes on smooth & absorbs quickly. Lasting moisture & a wonderful effect! [This review was collected as part of a promotion.]"
I just got this today in my box! I just got finished trying the product for the first time! This feels amazing and it's not sticky at all! I will come back for more reviews after i've tried it for a wk! [This review was collected as part of a promotion.]
"L'Oreal's Age Perfect Hydra-Nutrition All-Over Honey Balm is absolutely amazing! I tried the balm on my dry hands and elbows. I also have a stubborn dry spot on my cheek, the balm helped to smooth. This balm has made me skin feel more supply and hydrated without any greasiness. Try this balm, you will not be disappointed. I received this complimentary product for testing purposes. [This review was collected as part of a promotion.]"
"Love love love! I use this all over..hands, feet, neck, arms. Really great balm! Going to keep this in my handbag. Received a sample to try. [This review was collected as part of a promotion.]"
I didn't like using this on my face it was too much for my skin but I did like it for my chest arms and hands. Left them feeling moisturized but not greasy. I keep it in my purse for my hands. I received this product for review from Influenster
I loved the scent of this and found it to be super smooth on application. My skin feels silly after 2 weeks. Thanks Influencer for the sample! [This review was collected as part of a promotion.]
I was surprised at the pleasant smell and the the way it leaves my skin feeling smooth. I can tell a difference since the 2 weeks I have been using it. Influenster sent me this free amazing full size product to try. So glad they did!
"Feels a little heavy on my skin to me, no over bearing scent, but leaves my skin feeling good. I received this product complimentary for review purposes. [This review was collected as part of a promotion.]"
My skin is never dry and feels so soft. I use it along with a few other L'Oréal products and I'm looking and feeling great. [This review was collected as part of a promotion.]
"I received this product complimentary from #influentster to use and review, and i have used this in my hands my face and neck even my lips and its a wonderful product [This review was collected as part of a promotion.]"
Moisturizes hands and face fabulously. Smells divine. Received product in exchange for unbiased review [This review was collected as part of a promotion.]
I got a free sample from Influenster to try this product. I can say that my hands were cracked and peeling. After trying this out my hands are finally healing. Finally a product that works. [This review was collected as part of a promotion.]
"I love this product, not just for my face, but for my hands and neck too. This product is clean , not sticky, dries right away, it's light. I reviewed this product for testing from influenster. [This review was collected as part of a promotion.]"
"I gave been using this hand cream for the last 2 week and it has been a life saver! I usually gave dry, cracked winter hands but, now my hands are so soft!!! [This review was collected as part of a promotion.]"
"I received this product a few weeks ago and have been using it on my hands, arms and chest. I love the way it feels! My hands feel more moisturized and there's no “greasy” feeling after applying. [This review was collected as part of a promotion.]"
"I received this as a complimentary sample to try. I liked it because I made my skin feel soft, even in the rough areas. It also made crepe skin look better. [This review was collected as part of a promotion.]"
"I received this product free for testing purposes and just love it. Ive only been using it for a couple weeks but it's grrat on the neck, hands or any dry spot you want to moisturize. [This review was collected as part of a promotion.]"
"This was also apart of my complimentary package. This product is a great alternative instead of regular lotion. Non greasy, light, and rubs in easy. It also has a light, fresh, fragrance. [This review was collected as part of a promotion.]"
I received this free for testing. I used it on my face which was a little too much for my skin but worked well on hands and anywhere else that was super dry. [This review was collected as part of a promotion.]
"I received this as a sample from Influenster and simply love it. It smells so good, goes on smooth and not greasy. I will definately buy this in the future. [This review was collected as part of a promotion.]"
"Loved this product the most of the 3 I received. Nice clean feel applying. Not sticky and leaves skin feeling fresh, younger and moisturized [This review was collected as part of a promotion.]"
Love the smell of this product! goes on nicely and makes my skin feel great. Love the fact that it is not oily. [This review was collected as part of a promotion.]
I received this to try for free. Im so glad i got to try. This is the first loshion that is not greasy r that fells like u put on a glove every were. It leaves u soft an leaves no mess. [This review was collected as part of a promotion.]
This is a great lotion that absorbs easily into the skin. I also love the subtle scent. Loreal always makes a great product and this one is definitely one that I will add to my beauty routine. [This review was collected as part of a promotion.]
"I love this product! Received it free via Influenster. After only a couple of uses I could tell the difference in my skin. It shrunk my pores, gave my skin a soft and silky and made it look better. Gave it a rosy tone too!"
I love this multi-purpose product! It ramps up my moisturizer - perfect for the brutal cold months. I like that I can thrown it in my purse too. [This review was collected as part of a promotion.]
"I received this from influester, I've been using it for 2 weeks now and I love it, makes my face feel soft and smooth [This review was collected as part of a promotion.]"
I got it free from Influenster. This product works great on your scars. I have been using it daily on one on my face. It looks better! Thank you Loreal honey balm. [This review was collected as part of a promotion.]
So rich...I used it on my lips too. I noticed that it smoothed the fine line on my chest. The texture is thick and creamy...love this! [This review was collected as part of a promotion.]
"A small amount of this balm worked wonders on my dry hands! Now that I've tried it, I will never be without it. I'm thankful that L'Oreal and Influenster allowed me to try this product for free. [This review was collected as part of a promotion.]"
I have only tried this a few times but love how silky it feels . It made my hands feel soft . Hoping it takes some age off of them . I received this sample from Influenster to try complimentary [This review was collected as part of a promotion.]
"I got this a couple weeks ago complimentary to try out and I have to tell you, rhis stuff goes on and stays for the whole day and my skin doesn't feel dry at all. [This review was collected as part of a promotion.]"
This products has a nice light scent that I love . Skin looks smooth and dry but it has a little bit of a sticky feeling that goes away after dry. [This review was collected as part of a promotion.]
Received one to test from Influencer/Vox Box. I love the moisturizer -
"but since I use it several times a day, I do wish it was a larger size [This review was collected as part of a promotion.]"
"I received a complimentary full size sample of this product from Influenster. It smells really good, it goes on smooth and leaves your skin feeling smooth. [This review was collected as part of a promotion.]"
Great all-purpose moisturizer! I use it on neck/chest and hands. Smells amazing and does a great job of soothing dry skin. [This review was collected as part of a promotion.]
Received full size product from Infleunster absolutely love the way it soaks into my skin. Works great and smells great too [This review was collected as part of a promotion.]
I received this product from Influenster complimentary to sample. I loved this cream! I've only used it on my face and neck. This is a wonderful product. Not greasy or oily . Love it ! [This review was collected as part of a promotion.]
I have been using this on my crepey neck skin and it has made a HUGE difference in it. This is not heavy yet very hydrating. I also use it at night on dry patches on my face and it feels great. I received this complimentary for my honest review.
"I was gifted this thru Infuenster. This stuff is so rich and moisturizing. Worked wonders on my ""winter"" hands and elbows. Would recommend!!!! [This review was collected as part of a promotion.]"
"I love this Honey Balm! This balm is so moisturizing! My hands especially loves this. With being in my 50's comes crepey skin, Loreal has come up with a great formula! [This review was collected as part of a promotion.]"
"I received this product in an Influenster voxbox for free to try. I really like this product. A little goes a long ways. I would definitely recommend this product. It's a great, non greasy lotion. [This review was collected as part of a promotion.]"
"I received this product in a voxbox for a review. This product is incredible and definitely makes my skin....hands, neck, chest feel wonderful and moisturized. I love an all in one product."
I received this product as a free sample from Influenster and I like it! It does not leave my skin feeling sticky or leave a heavy film on my neck! [This review was collected as part of a promotion.]
I received a sample voxbox and I love this stuff. It moisturizes with very little product and it doesn't leave my skin feeling greasy [This review was collected as part of a promotion.]
"I love this product. It is perfect for my face & neck, hands. Its formula is non greasy yet very softening. The scent is fragrant & lovely. I would recommend this product. [This review was collected as part of a promotion.]"
"I love this product! I have dry skin. It is really dry in the winter. I used it on my face, neck and hands. I highly recommend this product. I love this product more for my hands than anything. [This review was collected as part of a promotion.]"
This has a nice honey-like scent and is really moisturizing. I've been mostly using it on my neck and face at night. Winter makes my skin very dry. I was given this product free to try. [This review was collected as part of a promotion.]
"I have been looking for a great general moisturizer for the back of my hands. This stuff is great! It is not greasy, absorbs beautifully and does not have a heavy scent. [This review was collected as part of a promotion.]"
I received this product as a review sample and plan on purchasing again. It's non greasy with a nice smell that doesn't interfere with other products I am wearing. My hands are soft and protected. [This review was collected as part of a promotion.]
I recieved this free sample a couple of weeks ago and I couldn't be happier with the results. The deep lines on my forehead are barely noticeable. The scent is also amazing. [This review was collected as part of a promotion.]
Loreal Age Perfect Hydra Nutrition Manuka Honey All Over Balm. Face/Neck/Chest/Hands is a superior line of skin care products that's very effective and easy to use absorbs quickly non greasy [This review was collected as part of a promotion.]
I only used this product once so do not have a solid review yet. I am not sure I like the way my hands felt after use. Have not tried on my face yet. Will like to review fully after a week. [This review was collected as part of a promotion.]
 I received this in a vox-box from #influnster to try. Out of the items I received this was definitely the cream of the crop! Smells nice and left my skin soft and supple! Easy to apply. [This review was collected as part of a promotion.]
I love this product. I've been using it as a hand moisturizer and it's fantastic! It makes my hands soft without feeling greasy. [This review was collected as part of a promotion.]
I sampled this product and it only requires very little. It's not too greasy and i see lines starting to fade after only one week! I recommend this product! [This review was collected as part of a promotion.]
I got this free for a honest review from Influenster. I absolutely love it. I use it at night before I go to bed and it leaves my face feeling amazing. [This review was collected as part of a promotion.]
Received this on Influenster and absolutely love. I use it over my daily moisturizer and it doesn't feel greasy or heavy - skin feels great [This review was collected as part of a promotion.]
I got this free from influenster to try and I love using it daily. My skin is supple and smooth and clean [This review was collected as part of a promotion.]
Love this product. It leaves my skin so soft and supple. I recurved it complimentary and was doubtful but I was pleasantly surprised and will buy in the future! [This review was collected as part of a promotion.]
I received this complimentary product from Influenster for testing and am in love with it. I use it over my rosy moisturizer and my skin feels amazing! Will definitely be buying this! [This review was collected as part of a promotion.]
I received this product complimentary for testing purposes.
I actually used it on my hands! What a difference!!!! Butter soft! Smells yummy too! Definitely try it! [This review was collected as part of a promotion.]
"I received this product from Influenster to try and give my opinion, it works great, used it on my hands, face, neck, my skin is very dry and this balm lasted for hours and kept my skin soft [This review was collected as part of a promotion.]"
This is by far the best balm I have ever used. It leaves your skin feeling fully nourished with a healthy glow. I received this complimentary from Influenster. [This review was collected as part of a promotion.]
I received Loreals All Over Honey Balm from Influenster and I could not be happier. Literal has come out with another great product. My skin looks and feels great. I would recommend this for anybody.
"I received this product free from Influenster to review! This moisturizer is rich and leave skin feeling smooth and moisturized with a light scent of honey. Use it twice a day, definitely! [This review was collected as part of a promotion.]"
This Balm is amazing. I have never had my skin feel so soft. Very light sweet smell. Goes on so smooth. Works great with other products. I'm in love. [This review was collected as part of a promotion.]
Thick - kinda between a lotion and a cream. Excellent moisturizer and great smell! [This review was collected as part of a promotion.]
Free full sample. Smooth. Light fragrance. Hint of manuka scent. [This review was collected as part of a promotion.]
I received this in my Vox box. It was the gem of the box! Definitely did as promised! [This review was collected as part of a promotion.]
I received this a month ago. I use it mainly on my hands and arms. My hands look younger already. [This review was collected as part of a promotion.]
I received this product free for testing purposes. Excellent product [This review was collected as part of a promotion.]
Feels great on hands and face. Not to heavy and not over power fragrance to it [This review was collected as part of a promotion.]
I hAve very dry skin. This is perfect for my face. Love how my skin feels [This review was collected as part of a promotion.]
"This cream moistens a lot with a little product, absorbs and leaves no greasy sensation [This review was collected as part of a promotion.]"
Got this to review. Love it. Smooth. Last a long time. [This review was collected as part of a promotion.]
"I received this today from influenster and so far I am so impressed, feels exactly as it states. [This review was collected as part of a promotion.]"
Love the balm.
Smells great and not greasy.
Soaks right in my skin leaving it hydrated [This review was collected as part of a promotion.]
Absolutely love this so much very impressed by this product [This review was collected as part of a promotion.]
I RECEIVED THIS COMPLEMENTARY FROM INFLUNSTER AND LOVE THE FEEL OF IT. [This review was collected as part of a promotion.]
Great product. Moisturizes well and smells great. I will definately keep using.
I us3 this everyday it Smells so good i almost want to eat it!
