4.4,"['237', '112', '30', '14', '10']"
I love with moisturizer especially now that it has an SPF of 30 in it. I've been using the Regenerist line for years and will continue to do so. I'm 58 and look like I'm in my 40's thanks to using the right kind of skin care.
"I have been using Olay regular daily moisturizer with SPF 15 and it is good, but a little thick with that sunscreen feel. Not this Olay daily moisturizer, goes on much smoother and love the higher SPF 30, great product."
It doesn't make my skin ashy and doesn't smell like sun screen. A winner!Great under make up!
It makes my face smooth and tight and youthful a must have for your face health.
Really works to make my skin stay smooth and bright tone.
Bought this coz I watched positive reviews of this product and I thought it's the best moisturizer for my skin..
"I absolutely love this moisturizer! I've been using it for 3 years now. I love that this doesn't break me out, and it has SPF to protect my skin from sun damage and skin cancer. It is my go-to moisturizer before I put on my make up everyday. I'm 28, and I had some fine wrinkles. This cream has turned back time and my skin is absolutely radiant. So thankful I started using this in my 20s! Worth every penny."
This product has two benefits: sunscreen and wrinkle control. I love it.
I love that this moisturizer has SPF 30 especially in Texas when the temps go as high as in the 100s. I purchased this because of its sculpting power and so far I love it! #contest #influenster
Love the product
First I must say I'm a huge Olay fan. I love that this has SPF 30 so I can wear it in the daytime. The only wrinkles on my face are smile lines around my eyes. I've been using this cream for about 2 weeks and I feel like I see a slight difference. I have dry skin and I apply two pumps of this and my face feels moisturized all day. This cream didn't break me out or irritate my skin. *I recieved this product free from Influenster.com for testing and review purposes. All opinions are 100% my own.*
"My face feels tighter ,baby smooth and i have noticed a slight decrease in my fine lines and wrinkles, it's not greasy smells great and has a broad spectrum Spf 30, it so convenient to slip into your bag not bulky like other sunscreens and the pump works great no clogging . I suffer from Lupus so more skin care with spf works for me I am pleasantly surprised and will continue to use this in my day to day skin care regimen .I was able to try this out for free but this review is my honest opinion."
Great product - good to have the sunscreen - use it every day around my eyes and forehead - seems to be holding off wrinkles nicely :)
"I use this every morning. It's the first product containing sun protection that doesn't break me out! Super convenient that I'm getting my sun protection and moisturizer in one product. Has a pleasant smell and leaves my skin feeling nice, not greasy. I'll definitely be repurchasing! #contest"
"I do love this cream a lot! but i have a question about it....Please if somebody knows informe me... is this product non-comedogenic and oil-free? it is not stated in the description and i have sensitive skin, I've been using it for a while but occasionally i have tiny pimples and I'm trying to fnd out the cause...Help!"
"I have been using Olay Regenerist Microsculpting Cream for about 6 weeks now and the improvement to my skin has been remarkable. My face always feels hydrated and the fine lines seem to be diminishing. And as a further benefit, the SPF 30 makes this product perfect!"
"The first time I used this product I did see a clarity that was not there the day before, I've seen a difference after a week of using this moisturizer. Definitely a certain brightness and ""waking up"" of my skin. It seems as though a dewiness in on my face now. I love my skin care routine now and look forward to applying my moisturizers every morning and every evening."
"I have been using this since it was reformulated. I couldn't use the original version, it was too heavy, and it made my eyes water. This version is perfect for me! It goes on so smoothly, leaving a gentle dewy glow. Not tacky at all. I apply this over the Micro-Sculpting Serum. Usually SPF products, even SPF15, irritates my skin, leaving it red and itchy. This does not irritate my skin in the least. I love this product so much, please don't stop making it!"
"I have been using Olay in the past 30 years and I absolutely love its products, especially the line of regenerist. This product is extremely effective. But compared to the last version of regenerist SPF protection moisturizer, I found it a bit dry in the winter."
"This product DID NOT soak into my skin! Dried to a weird consistency, almost like a hard film, after putting it on and my face looked puffy after using it. I really wanted to like this product but think it's awful! Info: I am a woman, am 51, and have dry skin."
"I bought this thinking I was buying the true Regenerist Microsculpting Cream with sunscreen added. Instead this is basically sunscreen, minus some of the key ingredients found in the true Micrsosculpting Cream, like hyaluronic acid. I don't dislike the product; if you are looking for a good sunscreen for your face, this works. I needed the real anti-aging stuff, though, and feel a little duped by this packaging."
I am very confused about this product. Is it meant as a sunscreen with multiple applications required throughout the day? I was looking for an all-day moisturizer with an anti-aging component that I could wear under makeup. The instructions say to reapply after sun exposure and the feel is so light and dry that I am not sure I am moisturizing my skin. Can anyone help??
"I've been using OLAY products since i was 30, now i'm 55 & recently had a basil cell removed from my face. The Doctor recommended that i use a 30 or more SPF on face & body. When i told her i use OLAY products she was very Happy & so was I. I moved up to the Regenerist Products now & LOVE ALL MY OLAY PRODUCTS!! [This review was collected as part of a promotion.]"
"This product really works on my skin. I am planning to try the fragrance-free version with no spf, and the ingredients for both products vary. Putting aside sunscreen factor, would I have difference experience in term of combating aging? *since there are both micro sculpting moisturizers, the other one with no spf and fragrance-fre"
"I love Olay products in general but can only use fragrance free. When I saw this product contained sunscreen I was delighted and bought it immediately. I was shocked when I applied it as to how fragranced it is. Yuk! Why would I possibly want to apply this much perfume to my face? I was horribly dissapointed and unable to use it. Please Olay, skip the fragrance, it's so unacceptable these days!"
"This is my favorite face spf-love the niacinamide and light texture! But wish there was a fragrance free option because I've gotten it on my lips and it tastes like licking a perfume. I'm also concerned that the avobenzone in this is unstable since there is no octocrylene to stabilize the avobenzone/octinoxate. Love it otherwise, though!"
This stuff is AMAZING. Even on the second day I was noticing a difference with my skin and it is not greasy at all. Big pros for it actually working and having a high spf. Only con is the scent. I personally do not like the smell but its not a huge deal breaker. Will definitely be buying this once I'm finished the bottle. (This review was collected as part of a promotion.)
"I'm loving Olay Regenerist Micro-Sculpting Cream with Sunscreen Broad Spectrum SPF 30. Even though I think I'm fairly young its never too early to start using SPF. This summer with all the swimming and fun in the sun, Olay Regenerist kept my skin moisturized and hydrated. My face didn't feel tight at all. I don't have wrinkles or fine lines but I can tell by the way my face feels that it is also a preventive measure in reducing them from the future. (This review was collected as part of a promotion.)"
"I loved using the olay regenerist cream. It felt great, and because I have very sensitive skin I was even more excited that it did not cause drying or a rash. I would reccommend this product to family and friends (This review was collected as part of a promotion.)"
"Texture feels creamy, but doesn't leave skin feeling hydrated. Felt an oily top fee on surface of skin as if the product doesn't fully absorb. SPF didn't seem to be a problem, did not encounter any burning or tans. Didn't really notice any major differences in the appearance of my complexion (This review was collected as part of a promotion.)"
"This cream had the perfect consistency. It goes on light so you don't feel like you're being weighed down. It absorbs quickly and I can put my make up over it almost right away. My face feels moisturized, less dry! (This review was collected as part of a promotion.)"
My skin glowed with this new skin cream. It smells great and you don't have to use a lot! I really enjoyed trying it and it will become part of my new routine! My friends noticed my skin too and how good it looked! My skin is so soft and smooth! (This review was collected as part of a promotion.)
This is the 3rd type of facial moisturizer I have tried in recent years that contains an SPF and the first available at regular retailers. I must say that I am impressed. There was very little greasy residue and I could apply make up almost instantly! No clogged pores or breakouts and the benefits or an anti aging compound to boot! I will definitely be purchasing this product in the future! (This review was collected as part of a promotion.)
I really liked that this product did not make my skin oily. I have really bad combination skin and most anti aging products leave me with acne. I'm not sure if I'm expecting to much from a cream but I have seen a minor change in the texture of my skin but definitely liked the moisture in it (This review was collected as part of a promotion.)
I love a facial moisturizer they makes your dry face feel hydrated but also feel like you have no product on. I didn't have many wrinkles to begin with but the moisturizer seems to help hid them a bit. (This review was collected as part of a promotion.)
"Firstly Okay is a great brand! However this cream was nothing special. It was nice and creamy and smelled lightly fragrant and was easily applied. But it left a film on my face, and if I would rub my face, the film would roll and ball and stick to my finger. I didn't use alot, I didn't rub hard, and this was after a couple hours of putting the lotion on. (This review was collected as part of a promotion.)"
I put the cream near my toothbrush and was usuing it for a while dag by day. Skin feels fresh and silky. Even with the make up foundation. I didnt get any red spots on my face or the dry skin. I love it! (This review was collected as part of a promotion.)
I tried the Olay Sculpting cream. Went on very well and I enjoyed the smell of the cream. I liked how the pump with the bottle gave just enough cream no excess. I personally didn't see the results and made my skin more oily. I quite liked how it have sunscreen so I can be used in the summer out side without dry skin. (This review was collected as part of a promotion.)
"I used the Regenerist Micro-Sculpting cream for a week and it started giving me pimples. I stopped using it for a few days and the pimples went away. I used it again to see if it was the cream, and the pimples came back. I found it very thick to apply. It felt more like an actual sunscreen than a moisturizing cream. It did moisturize, but it clogged my pores. I wasn't able to see if it reduced my wrinkles as fast as they mention. I had to interrupt my usage of the cream. (This review was collected as part of a promotion.)"
"More than impressed with the Micro-Sculpting cream, definitely have noticed a more youthful tone to my skin, I use this product daily and even co-workers have asked what I am doing different as my skin looks so good. (This review was collected as part of a promotion.)"
I have tried the Olay Regenerist Micro-sculpting cream. And other then being a pricy moisturizer I saw no change in my skin while using it. For me as a 1 income house there are more cost effective ways to spend money. I will not but this product. I love Olay I just don't love this product. (This review was collected as part of a promotion.)
"I have been using Olay Regenerist Micro-Sculpting Cream since I have received the item from BzzAgent. I have heard of Olay before, but I haven't heard of this cream before. I love that it has SPF 30. This cream is light and did not affect my skin, which sometimes gets sensitive to new products. It was easy to use and is something that I can consider buying in the future. Thank you, BzzAgent, for another great product to try! (This review was collected as part of a promotion.)"
"I recently had the opportunity to try Olay Regenerist Micro-Sculpting Cream, SPF 30 free, through BzzAgent. I honestly didn't notice a difference in my skin. And there was a very fine line between too little to spread, and too much that my skin felt greasy. I will continue to use this bottle until it's, but I won't be buying it. (This review was collected as part of a promotion.)"
I haven't done any facials for the last two years but when I used the Olay Regenerist Micro-Sculpting Cream. I've noticed within just the first two uses my face looks radiant and clear. Very light weight and has a non greasy and non sticky feeling perfect for any day time use. Penetrates the face quickly so you can put make up right away specially if you are a woman that's always on the go. (This review was collected as part of a promotion.)
"not a fan of Olay (except deodorants) and would have never bought this product. dry and sensitive skin which i don't find olay suitable for. however, i did like the feeling of this cream for the hot and humid summer days we had. smells nice, feels good. probably won't be using in dryer/colder times, but found it pleasant for the summer and would use again. (This review was collected as part of a promotion.)"
"I love the Olay Regenerist Micro-sculpting cream! It has a light, pretty scent and a smooth creamy texture. As someone with dry skin in some areas and oily skin in others, I really felt that it worked for both. My skin looked more hydrated, refreshed and youthful after just a few uses. My skins texture seemed to improve as well. My favorite feature of all though is that it is SPF 30! (This review was collected as part of a promotion.)"
I've been using the Olay Regenerist SPF 30 moisturizer for a couple weeks now. It's a very nice cream. Goes on a bit slick but absorbs pretty quickly. The smell is not overpowering like some other creams. I like that they added the sun protection since it seems we need it everyday no matter the weather. It does the job well and I would recommend this moisturizer to everyone! (This review was collected as part of a promotion.)
"I really wanted to like this cream but couldn't. The plan was to try it for a week and then compare my day 1 and day 7 results. The cream was nice and thick and I only needed one pump to cover my entire face. It didn't feel thick on my skin and it smelled pleasant. The downside, within a few hours I broke out along my forehead, chin, and nose. I would not recommend this to anyone with sensitive skin. (This review was collected as part of a promotion.)"
"I've tried the Olay Regenerist Micro-Sculpting Cream with SPF 30. After a week or so of use, I can already see big improvement on my skin...it feels smoother and softer. The lines seem less visible and I feel younger. I highly recommend this product. (This review was collected as part of a promotion.)"
"Initially when it first came out of the bottle, I was worried that it would be very thick an heavy. Surprisingly, it was very spreadable and actually very light. The scent was not overwhelming and subtle. It left my skin felt soft and smooth after. Overall, it is a nice product that I will try again in the future. (This review was collected as part of a promotion.)"
On day one I loved it! By day 3...not so much. Although I could see improvements in my face ... I always felt heavy with it on. I never used much - 1/2 of a pea size amount at most but always felt that it was 'caked on'. It is not a product I will be continuing to use. (This review was collected as part of a promotion.)
"I wasn't sure what I was going to think about this product but it pleasantly surprised me. It was a bit heavy for my skin, but absorbed well and left my skin feeling quite soft although a little bit greasy. The product smells absolutely heavenly. I didn't notice a huge difference in my skin, but I also don't have too many wrinkles... yet. I think I would definitely buy it in the future. (This review was collected as part of a promotion.)"
"I've been trying out Olay's Micro-Sculpting Cream for the past few weeks and I'm impressed! It moisturizes my skin, doesn't irritate or cause breakouts (which I'm prone to) and protects me from the sun! It has a pleasant, non-overbearing scent and it works really well under makeup! What more could you want... I haven't noticed any improvement in wrinkles etc yet, but mind you, I'm 26 and don't have a lot of wrinkles to minimize. I'd recommend/repurchase this product! (This review was collected as part of a promotion.)"
This is a great product ..I get compliments on my skin all the time just after a few days i really noticed a difference! It always makes my face feel very smooth and soft. It is not super heavy or greasy at all. (This review was collected as part of a promotion.)
Unfortunately I was really looking forward to this product but I couldn't use it as it made my skin break-out with red spots and itchiness. I do have sensitive skin so I tend to use Olay products as they are usually really good. This one just wasn't for me. (This review was collected as part of a promotion.)
"I really enjoyed trying this product. I know that I should be using SPF in my cream everyday, but this makes it super easy. It doesn't have that typical strong 'SPF' smell which I like. My skin is nice and smooth no, so it's been a good change from my usual cream. I like that it's a product I can buy easily, and it isn't a specialty trip like my usual cream is. I will be adding this to my list for when I run out! (This review was collected as part of a promotion.)"
"Both products are amazing, I like that the hairspray still leaves your hair soft and manageable! I noticed a big difference in my skin after about 10 days of using the cream. Skin appeared and little tighter and healthier! Definitely recommend both products!! (This review was collected as part of a promotion.)"
"I would definitely use this again. The cream has a soft floral scent and I am told that it deeply hydrates, leaves skin dewy, and improves tone and texture over time. I will have to keep using it to see if I notice a difference. (This review was collected as part of a promotion.)"
"I really like the way my skin feels when I apply Olay Regenerist micro sculpting cream , it feels smooth and moisturized but I don't really see any difference in the fine lines. I was working outside quite a bit and thought it offered really good sun protection. I use it morning and evening and do like the way my skin feels after applying it, not oily at all. (This review was collected as part of a promotion.)"
I think this product is really great. I started using Olay Regenerist micro-sculpting cream with sunscreen 2 weeks ago and I notice a difference already. The fine lines around my mouth have much less noticeable. I love the fact that this moisturizer contains SPF 30. One less product to apply. I highly recommend this product and will be purchasing it when this container is depleted. (This review was collected as part of a promotion.)
"This is a great moisturizer. I haven't noticed a HUGE difference in wrinkles, although to be honest, I wasn't expecting to. It's a lovely, lightweight cream that absorbs really easily and makes my skin feel hydrated. Love the fact that it has sunscreen added and that I can combine two steps into one in the morning. Be careful not to get it in your eyes though - it feels exactly like getting sunscreen in them.... which I suppose it is. Overall, a great product and I will continue to use it. (This review was collected as part of a promotion.)"
"Great product. I've been using for 2 weeks now and am seeing the benefits. My skin looks smoother and brighter. It feels tighter. At my work there's a device to test skin hydration and over the last week I've seen an improvement on the hydration levels. The product has the classic Olay smell I love. Only 2 small pumps covers my face and neck, so that's a bonus. (This review was collected as part of a promotion.)"
"Love how well this spreads and dries. My first thought was I'd be through the tiny bottle in a week but just a little amount covers my entire face well, smelling lovely and drying quickly, without any greasy feel. Haven't noticed any visible changes despite using it every morning for the last 3 weeks before putting on make-up, but I'll finish the bottle for no other reasons than that it smells good, has SPF, and feels fancy :) (This review was collected as part of a promotion.)"
"SMOOTHER SKIN NEARLY INSTANTLY This product did everything it claimed to do. Instantly I noticed a smoother complexion. Very quickly there were reduced lines and a more plump, yet firm appearance. Definitely quickly absorbed and a non-greasy feel. I really like that it has a SPF built in. Best Part was #GOTITFREE due to Bzz, Olay! (This review was collected as part of a promotion.)"
I love this stuff especially that it has the 30 SPF. I put in on and was out for 3hrs in 30degree weather and my face did'nt get burnt a bit. And i love how it makes my face feel and look. I will definetly be buying this again. (This review was collected as part of a promotion.)
So I'm not a fan of makeup so I'm all about good lotion and spf all the way So first I'm a mom and I run a dayhome meaning no point in makeup lol this cream is wonderful my face feels amazing and soft not greasy or to thick just a beautiful light cream I'm not sure what it's scluped much but my skin does feel firmer I told my mom and friends. About it and they have also had great feed back loving this product (This review was collected as part of a promotion.)
"I liked the claims this product had and in general I love olay products. This one felt cosmetically inelegant and didn't really absorb well into my skin. It felt oily like regular face sunscreen and left a sheen even half an hour after application. I didn't notice any difference in my fine lines. On the plus side, I did feel line it kept my skin moisturized. (This review was collected as part of a promotion.)"
"I don't have sensitive skin, but this moisturizer made me break out like crazy! It's also very drying, probably due to the copious amounts of alcohol in this product. I only used for a few days before discontinuing to allow my skin to clear up. Two thumbs down! (This review was collected as part of a promotion.)"
"I have been using the product for a few days. I do like the smell and SPF, and it is a good moisturizer. It doesn't feel greasy (yay!) but I haven'T noticed any wrinkle-reduction or changes in the appearance of my skin otherwise. I'm in my early 30s, so perhaps the difference just isn't noticeable, so I will keep using it to see if anything changes. Even so, I'm not sure that it's worth the price it retails for (though I'm happy to have it as a free sample to try!) (This review was collected as part of a promotion.)"
I've been using Olay products for years but I had never tried the Olay Regenerist Advanced Anti-Aging cream before. It's been 2 weeks and my skin feels so soft! I love that it has sunscreen with SPF 30 so my face is always protected. My skin feels moisturized! The cream has a nice light scent and doesn't feel greasy. 5 Stars for this product! (This review was collected as part of a promotion.)
"I really enjoyed trying the Olay Regenerist Micro-Sculpting Cream. After only a week I could see that my skin looked firmer and smoother. After 2 weeks, wrinkles showed a little less. The SPF 30 helped to avoid sun burns while going out this summer. I even helped me survive an improvised day at the beach! The only downside for me would the strong scent of the cream. The fragrance is really present but it smells nice. Overall I would recommend it! (This review was collected as part of a promotion.)"
I am still loving this product. I have been using it for over two weeks and my skin feels soft and silky. I love the smell! Although I don't know if it is doing anything for my wrinkles ( not that I have many!) I guess only time will tell :) I will keep on using this product. #GotItFree (This review was collected as part of a promotion.)
"Pretty great sculpting cream. I think at first I was put off because I was expecting a moisturizer.. which would be lighter than this. It felt a little thick and clay like at first. Once I got past that, I enjoyed using the cream. Huge added bonus that it has SPF 30 sunscreen in it, so you don't have to put on multiple products. Makes my skin feel soft and smooth, and protected! (This review was collected as part of a promotion.)"
"I find this very nice and smooth going on, feels light and absorbs quickly. I have tried lots of products over the years and normally break out badly in a rash with anything with sunscreen in it. I haven't broken out at all with this product. It has made my skin softer and more resilient in a short time. The scent is OK, not fabulous. While I am enjoying the product I am unsure as to whether I'd pay the price for it at the store. (This review was collected as part of a promotion.)"
