"I tried this product as I am very fair skinned with dry skin so I needed something that hydrates my skin while protecting. This was absolutely great. It was creamy, felt so amazing going on and really did a good job. I feel it could definitely be lower priced so it can be affordable for all income brackets. Overall though, I do recommend this product especially if you have dry and fair skin like myself. I did try this product free but all my opinions are my own."
"I love this cream!!! it's not too harsh on my skin but my wrinkles are already diminishing after just a week of use!!! My only complaint is that my skin is oily and there is no oil-control in it. Otherwise, I love this cream!!! I tested this Olay product for free, but all opinions are my own."
"I haven't used Olay products in quite some time, I was apprehensive about this product because I naturally have oily skin, however, this left my skin feeling fresh and looking radiant! Plus the added bonus of SPF!! Yes! *I tested this product for free, but all opinions and reviews are my own."
"I really like this product and I feel that I noticed a difference after a few days of use. My skin just seemed plumper and less saggy around my neck and on my face. I like that I can use it as a moisturizer and apply product over it. I also like that it contains sunscreen, even though they say to reapply every 2 hours. I really like the smell and feel on my skin and it isn't greasy at all. I received this product for free to review, but all of the opinions are my own."
"Unlike other SPF blended moisturizers, this one doesn't make my face shiny so I don't worry about looking like an oil slick as the day goes on. My face stays well moisturized and it wears well under makeup. The moisturizer smells amazing! I haven't been using it long enough to see if it helps with my fine lines but I really enjoy it so far if only for the fact that it has kept my face from drying out throughout the day! I tried this product for free in exchange for my review."
"OLAY REGENERIST MICRO-SCULPTING CREAM WITH SPF made my skin feel so refreshed! A long weekend with little sleep left my skin feeling dry, but this product gave me the hydration it needed to go back out into the sun again. A great light formula with SPF as a bonus! Please note I received this product complimentary for testing purposes."
Let me start out by saying I would buy this cream just because it smells so great! It's also a huge bonus that this product contains sunscreen and helps with aging. This will be my everyday facial moisturizer this summer. I am very grateful that I have found a lotion that smells so good and doesn't clog or grease up my face! I received this product free for review.
"Anti aging and sunscreen are my two key must haves at the beginning of every spring. We aren't getting any younger ladies! I love the feel of this product, not too heavy or oily, and it's a fantastic value. This product could easily cost 3x more from a high end brand. Highly recommend adding this moisturizer to your daily routine!"
"Received this product for free in return for an honest review. This product is honestly fantastic!!! It makes my face feel incredibly soft and smooth. I'm prone to sunburn across my nose and cheeks, and this has prevented it without the oily feeling of a sunblock."
"I got this in exchange for an honest review. To be honest I don't care for it at all. Its supposed to be lifting/ firming, but it left my skin feeling oily and greasy. I normally like Olay products and they are fairly effective, but not this. It just left my skin looking gross. SO THIS IS A PASS FOR ME."
"First thing i noticed about this product was the nice packaging and bottle, the cream itself has a very nice scent and is easy to apply. It goes on smooth and even, and it doesnt make my skin oily or shiney. Its sme is very refreshing, a great addition r o my morning routine. * I recieved this product as a sample for in exchange for an honest review. This revies is my own personal opinion after using thus procuct"
"Perfect formula for sun protection! I'm always looking for great skin care products with strong spf. This fits the bill for sure. Goes on smoothly (not like some lotions with sunscreen) and absorbs quickly. My skin felt tighter and well moisturized. One negative I found is the smell....it's very strong. Otherwise, this is a good product! I received this product free to test, but all opinions are my own."
"This week I received a free sample of it and I loved it! I usually use facial moisturizer with spf and let me tell you that this one is the best that I've tried. I pump it twice for my face and neck. It doesn't feel sticky or greasy at all and smells fruity, unlike the usual sunscreen smell you get with solar protection moisturizers. The smell lingers for a while and it doesn't bother me, I actually like it. I use it under my makeup and when I have none I reapply the cream every 2-3 hours."
At 1st glance I was very surprised with the slim bottle and amazing smell. I've been using it and have definitely noticed a difference in my skin. It's super soft and feels firmer. My skin doesn't feel oily which I was a little worried about trying free from Influenster for testing purposes .I will definitely be purchasing once I'm out of this.
"Excellent feel and weight, love the softness of my skin, I apply it everyday the first thing in the morning and it lasts all day, I really love the scent and the SPF30 is a big plus! Also, the pump dispenses just the right amount of lotion. I'm in love with it! ""I received this product complimentary from Influenster for testing purposes, but all opinions are my own! """
I absolutely love this product. It smells amazing and feels great on my skin. It goes on very easy and a little goes a long way. It is also a very good size and one bottle will last you awhile. I was able to try this for free but I will definitely be buying this when I run out!
i wasnt sure at first..the price was a bit high but i got it free from influenster to test and review ....i tried it before bed and woke up with much firmer skin. and pores were minimal too...i have been using for 3 days and totally in love with instant results!
"This is a silky smooth cream that sinks into your skin making the skin firmer and smoother and it's added sunscreen is a major plus! Great start your day step in moisturizing the most important part of your body, your beautiful face! Keeping it beautiful with Olay is where it's at! I received this cream free of charge for testing purposes and all opinions are my very, very own! Awesome product as always!"
Worked how it was supposed to. Felt great going on. But by then end of the day it kinda felt heavy on my skin. Oily heavy. It could also just be bad timing of the month and hormones. But it did what it was supposed it. Malden my skin feel great after I washed it again.
This product is fantastic. I use it every morning before i head to work. It is a great moisturizer and it will even help protect your face from sun exposure. Not to mention I love that it is an Anti-aging moisturizer that hydrates your skin as well. The best part is it doesn't leave your skin feeling oily. It smells amazing. Not to over powering just a nice fresh clean smell. I did test this product for free but these are my own opinions.
"For someone like me who doesn't use a sun screen , this product is perfect because it not only moisturizes and firms the face but it also has SPF 30 . After just one use i loved how my skin felt. Already recommended this to my mom. Although I got this product for free the opinions are my own."
"This moisturizer is really light and I love that it has the wrinkle prevention and SPF30. Watch out if your skin is sensitive or you use other products as it can sting a little bit. It goes away and didn't irritate my skin but the products within it must be strong. I will continue to use it and see if my skin gets used to it. The scent is very light and fresh. I tested this Olay product for free, but all opinions are my own!"
"I am so incredibly in love with the cream and the feel of this product.The product itself is light and creamy, it blends in smoothly and effortlessly in my skin. I have seen a reduction in the circles under my eyes!! Thank you Olay for this wonderful product. I received this product to test for free, but the above information is all my own personal opinions. I hope they help potential buyers!"
I received this product from Influenster in exchange for an honest review. This particular moisturizer is very good. I haven't noticed huge differences in any repair...yet. But I do love the non-greasy moisturizing effects and I'm happy that it now has SPF 30 in it. I will continue to use it in the hopes it will be effective. I also have to wonder if I need the complete system for this product to be effective.
"I love this product as a moisturizer-it hydrates, lays well under makeup, and doesn't leave my skin feeling greasy. I've used it under makeup and as a night cream, and it works both ways. The price is a little steep, but worth it for something that moisturizes and has SPF. (I received this product for testing, and although free, I was in no way compensated for my review. My thoughts are my own.)"
"Most sunscreens that I've used tend to leave my skin shiny and greasy looking. This product does not leave my skin shiny at all. In fact, after applying this cream, my skin looked fresh and very matte. My foundation was easy to apply and looked great."
"Prefer this serum over the cream, and it definitely works well on the fine wrinkles when applied."
Been using it for years. Makes my skin feel hydrated and protects from the sun
It smells good.
I have been using this product for years. I am almost 60 and no one ever guesses my age most people guess my age to be 10 to 15 years younger than I am. Combine this with some retinol products and it's a win-win.
"A great daily moisturezer to use after facial serum. The SPF is good enough for me during the winter months. During the summer, I would add a separate sunscreen."
I love everything that Olay makes they are a great company and know what their doing when it comes to skin care ! [This review was collected as part of a promotion.]
but a good friend of mine use thisfjrom the first day until now .and she love it I saw the result it really works and her skin really soft and made a different..so I'm gonna try this one day..im wondering if its good for an Asian brown skin like me?
This Olay Regenerists is the bang for your buck! It's smooth and non greasy. Perfect for all skin types and has the SPF that we all need. [This review was collected as part of a promotion.]
"Olay makes amazing products! This moisturizer is really good to my skin. It keeps it hydrated, doesn't become oily or dry. It's perfect. Smells good and feels good! [This review was collected as part of a promotion.]"
"I was pleased with how the Olay Regenerist .Micro-Sculpting Cream made my normally dry skin feels silky and smooth. It has the added bonus of SPF 30, and made my skin feel great! (This review was collected as part of a promotion.)"
This product was easy to apply and didnt leave my face looking greasy. I also loved the smell and found that it wasnt too strong (This review was collected as part of a promotion.)
I really enjoyed using the Olay micro sculpting cream with spf. Normally I do not enjoy the way sunscreen feels on my skin but this product t was light and moisturizing. (This review was collected as part of a promotion.)
Since I've tried Olay's regenerist my skin is much more smoother and rinkles free. I feel much more confident! Thank you Olay!! (This review was collected as part of a promotion.)
My skin had a pretty extreme reaction. Doesn't happen to me very often and I try a lot of products. Very disappointing. (This review was collected as part of a promotion.)
I don't usually use any face moisturizers but I will now. This Olay moisturizer is now part of my daily routine and with the SPF 30 I much prefer this over any sunscreen on my face! (This review was collected as part of a promotion.)
My Skin has lost red spots and feels tighter. You do not need much at all and the pump is a great idea. It made a difference in a very short time and would definitely continue to use. (This review was collected as part of a promotion.)
The product went on very smoothly. I loved the feel of my skin with it on. I wore it on several bright sunny days with no burn or tan. (This review was collected as part of a promotion.)
The smell its too strong. Left my skin feeling and looking good with no greasy after feeling. I would recommend. (This review was collected as part of a promotion.)
Loved the smell and how light and moisturizing it felt without feeling oily or making me break out. Will definitely buy again (This review was collected as part of a promotion.)
"I loved the smell and feel of this moisturizer on my skin, but I didn`t see any significant reduction in the wrinkles around my eyes. (This review was collected as part of a promotion.)"
"Found out that i was allergic to the cream, sadly my sensitive skin did not agree with the cream. i was really looking forward to using it. Oh well better luck next time! (This review was collected as part of a promotion.)"
"After using over than a week, i can find some fine lines on my forehead unclearly. And i feel my skin is firmer. Overall, it is pretty good, and i think i will buy it next time. (This review was collected as part of a promotion.)"
My face and neck were so smooth and soft. By the end of the day my face didn't feel oily and gross. I have a lot of redness on my cheeks and forehead and this really did help with that. (This review was collected as part of a promotion.)
This cream is amazing!!!! My skin feels and looks softer and firmer only after a couple of days using it. I highly recommend trying this product!!!! (This review was collected as part of a promotion.)
I love it. It works so well. It's only been a couple of weeks and I can see less fine lines on my face. Everyone needs to give it a try. You won't regret it that's fore sure (This review was collected as part of a promotion.)
Does a good job as a sunscreen. I don't really notice lines on my face yet so I can't rightly say if improves lines thus far. Nice that I don't feel too oily when I apply it. (This review was collected as part of a promotion.)
"I have been using this for over a week now and love it, will become part of my daily routine. Does not leave your face feeling greasy. (This review was collected as part of a promotion.)"
"I love the smell, it goes on wonderfully. No greasy feel. Haven't been using that long but did notice a little difference. Will definitely keep using this product. (This review was collected as part of a promotion.)"
Oil of Olay products are the only products I use. I saw my grandma use them growing up and she looked so young and she didn't even have the products Oil of Olay provide for us today
I love this new product because it has a higher SPF that will protect me all day. This product makes my skin look radiant and it has a great fresh smell. [This review was collected as part of a promotion.]
I have been using the regenerist micro sculpt fir about a month now and my face looks better and better every day! [This review was collected as part of a promotion.]
I like sun protection with Spf30 for my face. This excellent cream for me that I use every day. I like spf30 for my face spot. [This review was collected as part of a promotion.]
"I have used the micro-sculpting cream, first the 15, and now the spf30 for years. It works amazing well and my skin continues to be protected all day. [This review was collected as part of a promotion.]"
"Even better than the regenerating lotion with SPF, I love this light weight moisturizer with the SPF protection I desire and also leaves my skin feeling non-greasy during the day. [This review was collected as part of a promotion.]"
"Dermotologist recommended Sunscreen PF30 and I am thrilled that Olay carries this product. It goes on smoothly and, actually, gives you a luminous glow. Love it! [This review was collected as part of a promotion.]"
"At age 73, I get compliments on how young I look. I have tried other face creams, and I go back to the Regenerest Micro-Sculpting Cream. The difference is noticeable within a week. [This review was collected as part of a promotion.]"
This product helps with laugh lines and protects my skin from major sun damage since I'm fair skinned. It also helps moisturize my face and leaves it smelling great. [This review was collected as part of a promotion.]
"When I first saw this product, I had to try it. Combining the protection from the sun along with the benefits of anti aging, how can you go wrong. [This review was collected as part of a promotion.]"
Love this product! Lightweight non greasy formula works great under makeup. Love that it has the spf. [This review was collected as part of a promotion.]
"The SPF version of the Microsculpting cream really exceeded my expectations. Moisturizes just as well, and it doesn't feel like a sunscreen. Just wish you offered a fragrance free version : ) [This review was collected as part of a promotion.]"
I've been using this product for at least 5 years and really see a difference in my skin. I also like the fact that it has the SPF30 because I feel an SPF is totally necessary every day. [This review was collected as part of a promotion.]
Love that I get the long term benefits of Regenerist with a higher sun screen level than 15. Goes on well under make up or alone. It would be wonderful if I could find it unscented! [This review was collected as part of a promotion.]
I love the complements I receive on my skin and I do it with Olay while I am defending against the number one enemy! The Sun! Thank you Oil of Olay my Mothers defender! [This review was collected as part of a promotion.]
"I love this product, light weight but gets the job done. I have seen great improvement on the appearance of my skin. [This review was collected as part of a promotion.]"
"Absolutely love this cream. goes on easy, never greasy and keeps my face looking younger and fresher [This review was collected as part of a promotion.]"
I find this comparable to clarins for 80% cheaper!! Live in Florida and spf30 is important to me!! I bought this n my travel since. Didn't want to spend more $$$ so I met Olay regenerate love it!! [This review was collected as part of a promotion.]
I've only been using for about a week and so far its working good. I have sensitive skin so there is a little redness as my skin gets used to this but nothing too bad [This review was collected as part of a promotion.]
I have used this for a while now and it is great. Makes my face look and feel awesome. I always use Oil of Olay. They are rated high in consumer reports [This review was collected as part of a promotion.]
I've been using this product for about 3 weeks and there really is a difference. My skin looks great. I olay products on a daily basis but this is my new favorite. [This review was collected as part of a promotion.]
"The texture of this product is so creamy, I was afraid it would be too heavy for daytime use, but it went on smoothly and my makeup does not cake or feel heavy throughout the day. [This review was collected as part of a promotion.]"
"light as a feather, visible difference in 30 days! one product for all my daytime needs.. in love! [This review was collected as part of a promotion.]"
"I love this moisturizer. It feels good going on, light and absorbs well. I have tried many and this is my favorite. [This review was collected as part of a promotion.]"
Love the micro-sculpting cream. I've used it for 10 years and am told I look much younger than my age. [This review was collected as part of a promotion.]
This product makes my skin feel much softer and smoother. I can tell a difference in the firmness as well. [This review was collected as part of a promotion.]
"I been use this item for pass10 years.,looking good my skin for 60 years old lady.had been many people ask me why I use for my skin.just been trying with spf30 this year,good I like just same, [This review was collected as part of a promotion.]"
Have been using this product for about 10 years. I am approaching 70 and have been complimented on my smooth skin numerous times. Love it. [This review was collected as part of a promotion.]
"I use this product. I am 81 years old, but people constantly tell me I look at least 10 years younger than that. [This review was collected as part of a promotion.]"
"Feels great on my face and I love that it contains SPF because I don't have to wear an additional sunscreen too. I tested my Olay product for free, but all opinions are my own."
I let my mom try this and she likes it. She lives using sunscreen to help prevent hyperpigmentation. I got this for free to try for review through influenster.
"I really like using this product because it makes my face feel soft, doesn't cause breakouts or my skin to be oily, and protects my face from the sun. However, I have seen no difference in my skin since using it."
"I love everything about this product. I like how it makes my skin feel, how it looks and I love the smell. If you don't like facial products with a strong scent, this is not for you. But if you do, buy it."
"I love love love the Olay Regenerist line in general (try the eye cream also!) and this was a welcome addition. I will always go back to this line! I tested my Olay product for free, but all opinions are my own."
I've been struggling with oiliness and this cream helped with that! And my skin feels more firm and supple. I received it for free from influenster for reviewing purposes and these opinions are my own.
"I love this product! It is light, effective and didn't clog my pores. I am outside a lot, so I like knowing that my skin is protected without sacrificing my skin. I received this product for free from Influenster for testing purposes."
It smells very nice . It goes on very creamy. I feel it's not very expensive either . I liked how it had an easy pump. I havnt had it too long but I did notice result. My skin feels super moisturized and it's nice that it has an SPF
"I love this day cream for several reasons - it goes on smooth, works well as base before makeup, it provides SPF 30, it's not irritating and doesn't have an overwhelming strong scent. What more can you ask for!?"
I was surprised how amazingly well this product works. With Olay Regenerist Micro-Sculpting Cream with Sunscreen Broad Spectrum SPF 30 you can get results within one day. I recieved this for free to review and is 100% my own opinion.
I received this product for free to review although all opinions are my own. I can't tell a difference in the wrinkle department but it definitely leaves my face feeling fresh and moisturized! I use this product usually once or twice per day.
This is a really nice moisturizer from Olay! It makes my skin look great and it has SPF 30 which is a must for the daytime! I definitely recommend! I received this product for free but the opinions are all my own.
I love using this product when I want to go outside. It's a nice anti aging product that protects your skin. It's not greasey like most sunscreens. Very light weight and smooth.
Hydrates very well and the smell is very pleasant I purchase this for the SPF. The texture is light and absorb quickly. Really love this
It really rejuvenate your skin and leaves you feeling better younger [This review was collected as part of a promotion.]
Because are soft for the skin... I have a sensitive skin and I use olay scrub is perfect for my skin and is more hydrated than others scrub
"I really liked this product, I felt like I noticed changes in my skin in about a week. [This review was collected as part of a promotion.]"
I have very dry skin living in Arizona so o need a good moisturizing Creme with sunscreen. [This review was collected as part of a promotion.]
"Works great. Feels light on skin when applied, not geasy. Love that it already has spf [This review was collected as part of a promotion.]"
Product make skin soft and help fine line on the face. Like SPF30 for day cream [This review was collected as part of a promotion.]
"does not smell, its not heavy, feels good, last all day, no need for make-up plus sunscreen [This review was collected as part of a promotion.]"
"I need a good lotions with SPF, since I'm out doors a lot. This is excellent [This review was collected as part of a promotion.]"
Smooth and soft with no greasy feeling. I use it when I am not wearing any foundation. [This review was collected as part of a promotion.]
"This new product is almost perfect, but I returned it because the scent is just too strong. Please create an unscented version!"
It is a light non greasy product with the added benefit of a sunscreen with an SPF of 30 [This review was collected as part of a promotion.]
I had been dying to try this product because I already use the face wash and now i love this product. leaves my face smooth clear.
"I Really like the feel of this product and the way it makes my skin feel. I really like the,fact thathat also protects my skin from sun."
"Love the fact that it has SPF 15 but also moisturizes my skin. I tested this Olay product for free, but all opinions are your own."
I can see the results after 1 week. Hydrates my skin and reduces the wrinkles. [This review was collected as part of a promotion.]
"I really like this cream, it goes on smooth and last all day."
Love this product. It makes my face feel so soft and smooth. It's not greasy and it works all day.
"great product, for all to use, easy to apply and it feels good on you."
I love it best thing I have used I was given this product for free to test all opinions are my own
"I've been using this brand for years, and I love it."
